Review ID,Review Content,Review Score,Review Time
803348924,"Thank u jpark, we had a great stay 💓",10.0,2024-05-09T08:29:00+07:00
803332108,"Everything was perfect. From the moment we arrive and upon checking until checking out, staff were very friendly and helpful. Facilities were amazing. Our little boy enjoyed the pool and the beach.",10.0,2024-05-09T03:50:00+07:00
802256120,"Stayed for 4 nights- couple with 3 young kids(ages 7-9) 

The good:
- Waterpark is great fun for the kids,
- Location is ideal - in the center of town - many shops and experiences around,
- AC in the room was at a steady 18C Hooray!!,
- They offer several water activities,
- Breakfast and dinner buffet are good,
- Staff is lovely,
- Drinks are delicious,
- The Coral restaurant is special - live music and good food and drinks,
- 4 restaurants to choose from or you can experience the restaurants right outside of the hotel
- The “beach” is rocky,  the kids spent a lot of time snorkeling.

The not so good:
- Room had a bit of funky smell,
- Found other’s people hair all over the room,
- Mattress was hard and pillows too soft and uncomfortable,
- Stayed in a large suite and no sofa bed in the living room area - had to pay extra $ per night for the extra bed,
- Water pressure is very weak and water suddenly stops when showering,
- AC keeps room cool but is extremely loud,- kept being awaken by the loud sounds, 
- There is a rooster in the neighborhood that woke us up from our already poor night sleep at 5:00am everyday,
- No kids club. They offer some sort of one on one babysitting for $75 per two hour session. 
- US prices for everything. Dollars are very much loved there. 

I say - Go if you have kids. They will love it. ",8.4,2024-05-04T02:28:00+07:00
801365149,"The waterpark is dated . Despite follow up for room cleaning, no one came to clean the room on the 2nd day. Beach is not your usual sandy shore. 

While staff is friendly., they don’t seem to know what to do. Requested for room extension up to 2pm to allow our children to tale a nap before our Pororo park schedule at 3pm.  Request was denied despite not having a lot of guests on Monday. ",6.8,2024-05-03T11:40:00+07:00
799093380,"""bitin"" is a term in Tagalog used when we feel like there are still so much more to enjoy but we just could not stay any longer. This is exactly how I describe our trip. Since it was an overnight stay only, there were so many more amenities we were not able to see and enjoy, especially the kids. Looking forward to our next stay, so we can time our stay better and make sure we get most of the experience we can have from this place. thanks",8.4,2024-04-30T01:21:00+07:00
798198428,"The Hotel is one of the better in the Philippines, absolute! But it is so much overpriced... We booked with 67% Discount, and still 13K a night (including a good breakfast Buffet). The Hotel is made for ""Stay Inside"". You have 5 (or more) Restaurants inside, a giant Poolside with 3 pools (one behind the J Tower). But also the pools... 1/4 of the poolside smells for diesel (because of the nightly fire show), 2/4 of the pools smells for septic tank...
But the most nagging is their Greediness! 30K for a night regular rate, and you are charged for extra 100 Pesos for using the wall plug in the business center!! 2.500 Pesos for a average Diner buffet, but you are charged for 100 Pesos extra for the Beer Tap. And at the end it is a philippino hotel: Faucets are ""flexible"", toilets out of order, seals of the bath tub let the showering water rinse down to the next flor... Overpriced. I think they don't want other Customers than Koreans, i think 90% of the guests are koreans, very nice, best hotel guests you can spend time with. And 90% of this are families with kids... sometimes loud kids. Multiply it with 100...",7.6,2024-04-29T01:03:00+07:00
791834709,I love the experience I had with Jpark! We really had fun and memorable time! Til our next visit!😍,10.0,2024-04-15T08:34:00+07:00
791731800,The place is huge with lots of amazing things to do,9.2,2024-04-14T08:05:00+07:00
791568421,Room is spacious but design is kinda dull. TVs LCD is kinda fading and difficult to watch.  Bathroom is low ceiling. Kids enjoys their amenities anyway. Breakfast were great but only few tables. You need to wait.,7.6,2024-04-12T06:29:00+07:00
791154583,Great Facilities and very good customer service! Make sure you check for promos before you book. Call or email to book the private villas!  I appreciate how most people are so modest with their swimwear being mostly fully covered up as this is a family resort. I do wish they provided more filipino food options in their bar menu as the Philippines does do filipino food best! This place has everything so you don't need to leave :) We were granted a free family photoshoot which I highly recommend! Fire dancing and live entertainment every night was fantastic.So grateful for the great hospitality 😊🙏,9.6,2024-04-06T11:03:00+07:00
789794983,"Stayed here for 4 nights and experience was awesome. Staff were friendly and warm and ensured that we had all we needed.

Rooms were big, clean, and comfortable.

Facilities inside were great and there were enough activities inside to make us happy. The beach was awesome and my 5 year old son and my wife enjoyed snorkeling near the shore. Water activities were available too inside the resort and priced reasonably. 

Easy transfer to and from the airport via Grab. Same with going to Cebu City via the new expressway.

Only thing we didn't like was the food. It was just okay. There are options outside the hotel though.

Will come back again for sure. ",10.0,2024-04-03T12:29:00+07:00
790319618,Very nice and the kids enjoyed it,10.0,2024-04-03T08:16:00+07:00
783069327,Very nice place,9.6,2024-03-30T08:00:00+07:00
782730802,"i am korean mynpeople
good resort
very very nice",10.0,2024-03-27T01:56:00+07:00
782467689,Everything is perfect with Jpark,10.0,2024-03-24T07:32:00+07:00
782423615,"In terms of value for money, Jpark Hotel truly delivered. The level of luxury, comfort, and service provided justified the premium price, and I felt that every peso spent was well worth it.",8.4,2024-03-23T01:59:00+07:00
782253308,"We book here every time we come to Cebu. The property is great and this time, we tried the pool villa, which houses a private pool per unit. They also have jacuzzi villas, so enjoy the variety. I have also stayed at their regular hotel rooms, which were also good, Excellent location and the breakfast is wonderful. Will keep returning.",10.0,2024-03-21T04:59:00+07:00
778903678,Avoid at all cost ,2.8,2024-03-03T03:51:00+07:00
778903719,Horrible staff service ,2.8,2024-03-03T03:51:00+07:00
778329299,Very excited trip!!,10.0,2024-03-02T10:23:00+07:00
776508373,"We loved our stay at Jpark resort.. Kids loved the different options of pools, water slides and food options!",9.6,2024-02-25T09:27:00+07:00
776295863,"Aside from the perfect amenities the resort have, I highly recommend Jpark Island Resort and Waterpark because of the exceptional services of their staff (especially the housekeeping). I unfortunately left valuable items (my wedding and engagement rings) in my room when we checked out. We flew already back to Gensan after checking out when I realized my rings were left. I immediately called the hotel, and I was informed that the housekeeping staff turned over my rings. I truly admire the honesty that the housekeeping staff showed, and I highly commend their services. We look forward to staying again on the resort in the next couple of months. ",8.4,2024-02-25T06:16:00+07:00
775805823,"I have to wait until 4pm for my check in and no other arraignment, just wait!",4.4,2024-02-20T11:47:00+07:00
773339628,"Poor water heater function. We were provided 2 sets of towels and toiletries while my booking is for 4 persons. We have to call for the service repeatedly in order to resolve the problem. We spend all afternoon waiting for their response when we asked for room transfer. They dont have the initiative to serve the need of the costumer, intead you have to tell them what the room needs.  Old room , stains on the bathtub. Overall did not fit for a 5-star value experience.",3.2,2024-02-18T12:33:00+07:00
772801877,"Had lots of fun here with my kids.  Lots of facilities but most are paid. Water park is fun. But a lot of guests put their beach towels on the beach or pool chairs before the pools are opened! And suppose the staff should monitor if chairs are unattended for an hour, but I didn't see this happening. I saw two men holding 9 towels placing one each on the chairs and left for 1.5 hours. 

Food at restaurants (we tried Korean and Japanese and coral seaside one) are expensive and so so only. I suggest you go out to grab food.",8.8,2024-02-17T10:18:00+07:00
770939907,Thanks!,9.2,2024-02-11T01:18:00+07:00
770839707,"When I booked the room on Agoda, I clearly inputted 2 adults and 2 kits, the room is obviously too small to us. I had to pay on my arrival and upgraded the room to accommodate us. That's bad.",8.4,2024-02-09T11:30:00+07:00
766303184,Nice for famvacay,10.0,2024-01-26T12:10:00+07:00
765693373,"It’s a 700+ rooms property. But after you pay for the room ,you have to pay extra for almost everything else on the premises, except b/f ( as that’s mostly included in all their room offers ) , swimming pool & access to a small swimming beach !!

They have a huge frontage to sea but it’s very rocky.  
",8.8,2024-01-20T01:17:00+07:00
763975658,Worth it!,8.0,2024-01-18T01:25:00+07:00
761622579,Nice resort with lots of activities for kids ,8.4,2024-01-12T10:58:00+07:00
757689612,"I gave 5 star to the crew of the Receptions crew, Bars, Restaurant and activity area. (Swimming pool, slide attendant )
3 star to the housekeeping they go inside the from without permission, we don't lost any personal belongings but unacceptable that someone will go inside your room without permission.  



",9.2,2024-01-05T02:29:00+07:00
755108435,"Staff was great very helpful,Food buffets was excellent,front desk people very helpful and rooms was huge!!definitely will stay here again..Thank you for the amazing!!welcome..",10.0,2023-12-28T09:57:00+07:00
754718248,The room has an old carpet smell.,6.8,2023-12-26T05:57:00+07:00
753417692,My kids and I loved our stay at Jpark.. it's absolutely for kids.. The pools we loved it. Pororo Park was so much fun as well!! Will definitely go back some other time.. 😍😍😍,9.6,2023-12-23T10:04:00+07:00
753132223,"Amazing staff ,foods was great!front desk  ladies was so helpful with reservations.I definitely coming back to  this hotel and recommend it to all travelers as a Chef I am very perfectionist when it becomes with the taste,presentations of the foods..It was the best foods and worth every pennies..Thank You for the wonderful service I feel so at home.",10.0,2023-12-21T11:15:00+07:00
751928995,Great experience with me ang family.. we enjoyed the facilities a lot,10.0,2023-12-19T07:32:00+07:00
750511697,"고령에 첫번째 세부지역 자유여행인데도 아고다지원의 세심한 배려와 친절로 불편없이 즐거운 여행을 하였습니다 .
아고다측에 감사드립니다.",10.0,2023-12-14T08:38:00+07:00
748722751,"Had an enjoyable time at Jpark. Conveniently located, clean, many food options available, nice waterpark. 1 night is definitely not enough, and we will be back for sure. 

The only downside is due to the huge capacity, the service request to the room was rather delayed. Other than that, everything was superb. ",9.6,2023-12-09T12:16:00+07:00
733103410,Only stayed here for 1 night but it felt like longer because there were a lot of activities for families. The room was spacious and very clean. All staff were friendly and approachable. Breakfast and lunch buffet at Abalone restaurant served  a wide variety of sumptuous dishes. Will definitely come back on our next Cebu vacation. ,10.0,2023-10-30T07:17:00+07:00
729528975,"A Hotel with 800 Rooms. Over Crowded. Rooms was old. Breakfast was over crowded, waiting area was at a mess during peak hour. Check In was very crowded, and lobby was not big enough to cater for such a big crowd...water park was not really fantastic, and the price was not really worth it. ",6.0,2023-10-21T02:40:00+07:00
725972253,facility is fantastic. worth the money,10.0,2023-10-11T04:23:00+07:00
719953456,We upgraded our Mactan Suite to a Pororo Suite and my kids were ecstatic. The room was clean and staff were very accommodating. The food were all delicious! I highly recommend this resort to my friends and family! ,10.0,2023-09-28T12:42:00+07:00
707145106,Amazing stay. I ‘ll be back and bring my family next time.💕,9.2,2023-09-06T04:46:00+07:00
701803055,Recommended 👍👍👍,10.0,2023-08-27T06:33:00+07:00
691229448,we had a great time and the breakfast at Abalone was majestic,8.8,2023-08-12T10:24:00+07:00
676561602,None,10.0,2023-07-13T11:49:00+07:00
676395787,세부에 총 5번 방문 했지만 역시 제이파크는 여전히 최고의 숙소라고 자부합니다. 다른호텔에 비해 가격이 좀 비싸지만 아이들을 동반한 여행객이라면 반드시 예약해야 합니다.,10.0,2023-07-11T04:43:00+07:00
676395881,말이 필요없습니다. 단연 최고의 호텔입니다.,10.0,2023-07-11T04:43:00+07:00
672215525,Beautiful and amazing place to go on a vacation.. ,10.0,2023-07-02T11:03:00+07:00
662209913,Had a lovely holiday. Thanks Jpark!,10.0,2023-06-10T07:22:00+07:00
659382010,They have lots of activities for children. Had so much fun! ,10.0,2023-06-04T02:05:00+07:00
658004277,"Overall stay was fun, relax and kid friendly only that their shower area is clogged that’s why the floor area has molds. ",8.4,2023-06-01T04:29:00+07:00
657486243,Thank you for your service. Indeed one of a memorable birthday weekend🫶🏻,10.0,2023-05-31T01:55:00+07:00
638696250,Expensive but worth it,10.0,2023-04-25T09:27:00+07:00
638854554,"We had the ocean view Mactan suite and it was perfect! The Waterpark was really made for kids but with adults in mind, there was numerous pool bar which serves both food and drinks. The room service was 24hrs and the breakfast buffet was great. There was a lot of entertainment throughout the day and we loved the Amigos group with their fire dances. We were so mesmerized and pleased we get to make memories like this with our 4 year old. ",10.0,2023-04-25T01:37:00+07:00
630935674,very nice pool for swimming,9.2,2023-04-14T04:06:00+07:00
630875956,love our stay in here,8.8,2023-04-13T06:38:00+07:00
629526952,Good,10.0,2023-04-10T02:30:00+07:00
628935299,"Excellent staff, beautiful place, kids loved every moment, only downfall for me was the kids pool needs some tlc and for the floors to be repainted and it’s coming apart  and was a little bit rough when walking.",9.2,2023-04-08T04:36:00+07:00
626315205,Room need to be upgrade especially the bathroom. Carpet are dusty ,7.6,2023-04-02T02:37:00+07:00
626000866,everything is good,10.0,2023-03-29T04:56:00+07:00
625164913,Never disappointed. ,10.0,2023-03-26T07:18:00+07:00
607863892,Staff service were prompt and efficient. Except when the weekends came and the resort got really crowded. Great place for a family trip where there is something for everyone to do. Suite Room was really spacious as well. ,8.0,2023-03-12T01:59:00+07:00
602719139,"The room interior is outdated, needs a little bit of modern retouch to it. Biggest turn-off was the water closet not having a bidet. Pool and waterpark facilities are nice especially for kids. ",8.4,2023-03-06T11:05:00+07:00
598432616,"Visit 4time.
Very good and nice staff.
",10.0,2023-02-24T11:52:00+07:00
595845054,When in Cebu I  book this hotel for the service AND their sumptuous breakfast and great dinner.  Excellent amenities for family with young children.,10.0,2023-02-17T02:12:00+07:00
595688692,great value for money,9.6,2023-02-15T08:18:00+07:00
595641448,"Booked mactan suite, outdated. Loud, poor service, decent breakfast buffet. Good location if you want to be hustled every time you stepped outside. Not even close to 5 star resort. I traveled all over the world and I give this resort a 3 1/5 star.",7.6,2023-02-14T10:18:00+07:00
595623845,"It was a trip with my mom and dad who have two sons in 7th grade and 5th grade. If you have a little older children, I recommend canning or hopping tours more than activities in your accommodation. For elementary school children, the use of the swimming pool in the accommodation can be enough rest. I made friends of similar age and it was a fun trip.",9.2,2023-02-14T03:30:00+07:00
595124274,If i want my Kid to enjoy Pororo Park we always overnight here at JPark. A lot of activites for the kids.,9.2,2023-02-05T07:44:00+07:00
595062343,Good 👍 👍 👍 ,10.0,2023-02-04T05:57:00+07:00
595017924,"good location!
kindness!
",10.0,2023-02-03T10:11:00+07:00
594148232,Such a nice place,10.0,2023-01-31T10:13:00+07:00
594042252,"NO ANSWER  FOR ROOM SERVICE EVEN THE TIME STILL EARLY.   ASK FOR EXTRA CHARGE 2000 PSL PER DAY FOR MY DAUGHTER BUT ALL THE AMENITIES INCLUDING TOWEL , WATER , BATHROBE PROVIDED ONLY TWO SETS  DURING OUR STAY.   
FOR THE FIRST DAY , THE BREAKFAST RESTAURENT REALLY CROWDED AND THE RECEPTION PPL SAID THEY GOT ANOTHER KOREAN RESTAURENT ALSO SERVE SAME FOOD AND NO NEED TO WAIT BUT WE FOUND THE FOOD WAS DIFFERENT ON OUR SECOND DAY SO IT'S NOT OK TO FOOL CUSTOMER LIKE THIS. ",8.8,2023-01-31T07:31:00+07:00
593184983,"If you’re vegetarian or vegan, then better not take this hotel. I sense foul smell on dining area in afternoon. Staffs are friendly. Boat activities are pricey. More options available for kids to play around.",6.0,2023-01-28T07:46:00+07:00
592480203,"Kind, Delicious,  Convenient  all satisfied! Strong recommendations place to stay !",10.0,2023-01-26T07:44:00+07:00
591883608,"The staffs are so nice, accomodating. Celebrated my daughters birthday during our check in and she reay had fun specially in pororo",10.0,2023-01-21T02:14:00+07:00
591729408,Everything in our honeymoon trip is amazing! We had so much fun!,10.0,2023-01-20T11:41:00+07:00
589429395,Everything was good. Gonna visit again,10.0,2023-01-17T12:01:00+07:00
589747044,We had a great weekend with superb food!,10.0,2023-01-17T11:32:00+07:00
588321755,Kids will enjoy here.,9.2,2023-01-16T03:09:00+07:00
586759268,"Where the whole family can enjoy. Clean rooms, friendly and helpful staff. Buffet breakfast. Waterpark for kids and adults. ",10.0,2023-01-14T08:56:00+07:00
587112477,Loved the place!!!,10.0,2023-01-14T04:23:00+07:00
585628345,My family and my inlaws went to Jpark and really enjoyed the amenities especially my two kids. Although it is quite expensive for the day use customers ,8.0,2023-01-13T09:20:00+07:00
582128339,This place is a nice place to spend for families with children. There are many activities to do even without going out of the resort. The facility can be updated with a bit of maintenance as there are signs of wear within the facility.,8.8,2023-01-09T12:55:00+07:00
581333151,"Love the view from our room, love the slides, the mini golf and the cart ride!
Definitely will come back!",9.6,2023-01-08T01:57:00+07:00
581693772,Good  good,8.0,2023-01-08T01:54:00+07:00
579022217,Many slides and facilities for juniors and children,7.6,2023-01-02T10:10:00+07:00
579017857,verygood,10.0,2023-01-02T09:05:00+07:00
578872714,"Overall had an amazing time at JPark. It’s a kids wonderland and seeing the joy on my kids faces was worth the money spent here. 

1) Room- mactan ocean view suite was large and roomy and had an amazing view. 2 bathrooms and a separate living area and bedroom area- much needed for a family of 4 for a week’s stay.  Note: for the very first night, we booked a deluxe room (cheaper) since we arrived at 3:30am. The deluxe room was not 5 star. The bathrooms looked dingy and the caulking was horrid. Hopefully all the deluxe rooms do not look like this. We were so happy to move to our mactan suite. 

2) spa - 5 star spa. I went twice to try two different packages. Highly recommend shynn. Her hands were magical. I left fully relaxed and highly recommend this spa. Gabby at front desk was also very nice and professional. 

3) food- abalone breakfast buffet- 5 star all the way. A multicultural breakfast buffet of Filipino, Korean, American, Japanese and a full pastry section. Only thing I’d recommend is to maybe have the expresso section be able to customize drinks. They make the most amazing lattes but don’t have the stuff to customize like caramel or chocolate :) special shout out to Jonathan for his amazing service.

note: we tried the coral,  Korean, Chinese, Japanese and all the pool bar food. Never had a bad experience. 

Housekeeping: very good 

Pororo cafe: nice but pricey for what it is. For the price we are paying per night, would be nice to have one free play time. 

d-thrones: the mini scooter car rentals for kids . 300 pesos for 30 minutes. So fun and worth it.

Babysitting: there are babysitters who offer care at the pool area while parents can relax. They all seem to offer different rates but it’s very affordable. Tip them well. They do a great job to actually give the parents a relaxing vacation as well . It seemed about 50 percent of the guests were aware of this service and used babysitters. 500 pesos is paid to the hotel to host them for the day at the resor",8.4,2022-12-31T02:21:00+07:00
578770995,There is always something to do both for young and older children! ,8.0,2022-12-29T08:40:00+07:00
578656147,Just book it now.,10.0,2022-12-27T12:11:00+07:00
578379243,Very good,10.0,2022-12-23T05:36:00+07:00
578250596,"my room type is mactansuit.
view is wall.
If u use room I recommend upper 4flower.
tower supply very poor.
big 2 small 1.",6.8,2022-12-20T05:43:00+07:00
578141384,Nice place for pleasure.,7.6,2022-12-19T02:09:00+07:00
578102681,My family and I had fun. Staff are very warm and accommodating. Facilities are clean and I love all the pools and waterpark. Highly recommended!,10.0,2022-12-18T09:54:00+07:00
578053244,We stayed two nights at this resort. We had the two room suite. It was very spacious for our family. The aircon in the main bedroom wasn’t cool enough. The resort facility were beautiful with several pools to choose for swimming. Food at restaurants were good. ,8.8,2022-12-17T10:28:00+07:00
577933226,Best hotel for Kids! You do not have to go anywhere for DAYS!,10.0,2022-12-15T02:54:00+07:00
577933172,c,10.0,2022-12-15T02:53:00+07:00
577744591,"Our overall experience was great. Food is a little bit pricey so this hotel is not for those who are on a tight budget traveller. There are restaurants nearby though. Pororo park was a great experience for our young one. Although in my opinion, 1500 is too much for just two hours of playing. It would be nice to make it free for those who are staying the property. Overall, the waterpark is great and the food is superb. They have all kinds of dishes and all are delicious.

JPark is one of a must try hotel if you're visiting cebu and if you have children and want to give them a great Cebu experience.

Thank you to everyone for your hospitality!

- Jim

Traveling with my wife and daughter",9.2,2022-12-13T03:33:00+07:00
577100196,I wanted to book at Agoda a villa room but only Mactan Suite room is available so I needed to upgrade when I check in and good thing that there's available villa. There's a lot you can do here which is worth your money. Maybe this only applies to me but my only concern was that the villa (not sure if other rooms as well) and public restrooms doesn't have a bidet so I needed to request for pail and dipper but they only got dipper and still a bit useless since there no faucet near the toilet (We'll be back again once I got a portable bidet).,10.0,2022-12-12T11:04:00+07:00
577242032,Great ammenities!!,10.0,2022-12-12T03:38:00+07:00
576830498,gooddddd,10.0,2022-12-12T01:28:00+07:00
571573416,"We celebrated my daughter's birthday here and we really enjoyed our stay, She enjoyed the pool so much, the breakfast selection was great and all the staff were approachable. looking forward to coming back next year! 😊",8.8,2022-12-06T04:10:00+07:00
570510989,The best resort,10.0,2022-12-05T12:21:00+07:00
570865796,Staffs are super friendly and accommodating. They are all attentive to customer’s needs. Please launch more online promotions to attract more customers to come often. ,10.0,2022-12-05T10:25:00+07:00
568141463,"They hosted our wedding there and the experience was absolutely amazing , the hospitality and service second to none . Will be back there every chance we get . 

THANK YOU !!!!!!!!!!!!!!!!!¡!",10.0,2022-12-01T03:54:00+07:00
