Review ID,Review Content,Review Score,Review Time
485195499,The parks facilities are okay. The food is over priced but its a resort. The biggest issues is the manager at the front had no knowledge how to get a Taxi for guest. First remark was its because we have our own car service and we dont use cell phones up here. Well that was a lie I looked on the desk and everyone had a cell phone sitting at the desk. They just want to make money by ripping u off on their high rate for car service. They acted like their was no way to get a taxi unless by chance they were dropping another guest off. I have stayed several hotels in close proximity of this resort and never had this issue. One they are liars two they almost force u to utilize their car service. The individual we spoke to the day before said their were no shuttles we can utilize the following day its funny be cause the day i left they said it had to be booked in advance. Staff is not trained and I find the experience stresful. I would not stay here again. ,3.6,2022-03-15T00:56:00+07:00
485195507,I have stayed at multiple resorts in the same location and have had great trips. The over all facility is nice. My issue is they hold you hostage to utilize their car for transportation. They act as if they do not have numbers to reach any of the local taxi companies. I find that odd because I stayed at two other resorts the past weeks and they all were able to easily book a taxi for me. They just kept saying they dont have that option because they have their own cars. I felt like a hostage. I would never stay in this hotel again based off that experience. ,4.4,2022-03-15T00:51:00+07:00
485186719,"the hotel staffs were friendly and helpful, place was superb and food was delicious. overall we had a great time spent in the resort",10.0,2022-03-14T16:26:00+07:00
485177606,One of the best hotels in Lapu Lapu City!,9.6,2022-03-14T09:38:00+07:00
485166842,It's the most bestest resort in cubu,10.0,2022-03-13T22:39:00+07:00
485154737,will definitely book this place again,10.0,2022-03-13T14:50:00+07:00
485113054,the staff are the best! breakfast is topnotch! will come back again soon,10.0,2022-03-11T14:21:00+07:00
485109132,"Friendly staff, great ambiance, love the pool, clean hotel. Until our next vacation! Thank you JPark, thank you Agoda. 😍",10.0,2022-03-11T08:19:00+07:00
485098961,breakfast buffet is not something to look forward to. Site and some facilities are a bit dated but given the condition after Typhoon Rai everthing still looks great. ,8.0,2022-03-10T23:10:00+07:00
485095654,"Hope you let your big slides will be open on weekdays as well, as a healthcare worker we rarely have weekends off it usually falls on a week day,.hope you’ll reconsider….thanks🥰",10.0,2022-03-10T19:02:00+07:00
485078072,Worth it,10.0,2022-03-10T06:15:00+07:00
484995003,Not maintained well. Flooring on the lazy river entrances were very sharp. A/C control not working properly. No TV on the 2nd day. Didn't bother to complain anymore. Safety deposit box had dead batteries. No bidet spray. Hard to open balcony sliding door,5.6,2022-03-06T18:01:00+07:00
484986916,It was superb,10.0,2022-03-06T14:56:00+07:00
484983862,This is my kids' happy place,9.6,2022-03-06T11:03:00+07:00
484711850,Worth the money. Suite rooms (Mactan Suite) are huge and comfortable.,9.6,2022-03-03T07:48:00+07:00
483601887,"I arrived 2:30pm with luggages and people blocking the lobby. I managed to filter my way through when I was directed to the front desk. The front desk was like a bus station, with several lines zig zagging around sofas. 

I queued for almost 2 hours. When I eventually got to the desk dehydrated and tired. No water, no welcome drinks. Just a long line to greet me. When I tried to check in, even though I paid upfront a few weeks ago. They advised me to wait for my room to be ready. I asked for the manager, they said maybe I can speak to the duty manager at 7pm! 

I eventually got my room, which was nice. Just shame the management seems oblivious about the first impressions of guests as he/she is missing from the action. 

I encountered other incidences such as no towels at 9am by the pool and told to come back in an hours time. And having to pay cash for facilities IN the hotel. 

The front line staff were pleasant but overwhelmed with the people. 

I would recommend not checking in on time if you do choose here. And carry cash around. ",8.0,2022-02-27T18:54:00+07:00
483578108,One of the best birthday celebration i had! They may have not given me a bday cake but they have upgraded our room instead! The kids loved the place! Will be back soon! Thank you much! ❤️❤️❤️,10.0,2022-02-27T17:45:00+07:00
483474315,"Staff are not customer friendly , they are still a long way to go. Shangrila customer service is still the 5 star standard",7.2,2022-02-27T08:17:00+07:00
483394372,We had a blast. Our kids enjoyed the pool for kids.,8.8,2022-02-26T22:42:00+07:00
483394392,We enjoyed the hotel because of its facilities.,8.8,2022-02-26T22:40:00+07:00
483394475,Wonderful staycation because of the amenities.,8.8,2022-02-26T22:39:00+07:00
483394460,Amazing facilities. We enjoyed our stay because of the pool.,8.4,2022-02-26T22:38:00+07:00
483394347,We had a blast in this hotel. We enjoyed the facilities.,8.8,2022-02-26T22:36:00+07:00
483394369,Hotel is for vacation. Pools are huge and very nice.,8.4,2022-02-26T22:34:00+07:00
482656709,The place was awesome. The kids was enjoyed a lot. Will be back again soon. Thank you Jpark!,3.2,2022-02-24T17:29:00+07:00
481915214,Lots of activities for kids! Perfect resort for families. Staff are very friendly and accommodating ,9.6,2022-02-19T16:32:00+07:00
481654522,Nice place despite Odette. Excellent Service,10.0,2022-02-18T02:16:00+07:00
481574272,Keep it up!,8.0,2022-02-17T16:52:00+07:00
481568287,We wanted to just bring the kids to the beach. We didn't realize we booked the beach on the wrong dates! But the staff at Jpark and Agoda helped us fix everything we had an amazing stay with my wife and kids!,8.4,2022-02-17T15:31:00+07:00
481452473,So welcoming and kid-friendly..,8.8,2022-02-15T14:26:00+07:00
481211710,J park is highly recommendable..we really enjoy our stay here practicing health protocol,9.2,2022-02-14T19:30:00+07:00
481109784,We're able to enjoy the weekend. Ayos!,10.0,2022-02-13T14:30:00+07:00
480882064,"Perfect for families with young kids. Tasty food, nice stuff nearby",10.0,2022-02-10T21:03:00+07:00
479902989,Nice,10.0,2022-02-06T17:55:00+07:00
476152159,"Everything was great, the park, the amenities, the food and the staff very efficient, courteous and attentive to the needs of the guest.",10.0,2022-01-21T13:14:00+07:00
475879884,I had a good time there! The beach was really good and the pool was fun even though the long slide and the amazon river was closed,10.0,2022-01-20T13:47:00+07:00
475514388,They rejected our Agoda Booking ID since they failed in validating the info. No initiative and no compassion to the guests and clients. ,2.0,2022-01-18T15:51:00+07:00
475189288,This hotel is perfect for anyone travelling with kids. The water park is super amazing and the kids love it. The staff are super courteous and attentive to our needs. I couldn't recommend less than choose JPark!,10.0,2022-01-17T13:52:00+07:00
475166474,the resort is fantastic thu other facilities were not yet available because of the aftermath of the typhoon odette but other facilities were exceptional and the kids love it. surely we will go back there next time. ,10.0,2022-01-17T10:57:00+07:00
474517379,"Superb!!but unfortunately the slides, the amazon river and the wave pool is not available due to the aftermath of typhoon but all is well.",10.0,2022-01-12T16:33:00+07:00
473839901,Nice stay,8.8,2022-01-07T14:47:00+07:00
