Opinion,Classification
"My fiance and I stayed here for our Prenuptial Photoshoot.
I was looking online for a good place to have our pictures taken and nothing seemed to be the right one. Till I remembered Shangri-la Mactan, I've stayed there 2 times before with my family and all I can say is that it is great!
The beach is great, though I heard it is man made. The rooms are great. The food is great and the staff are great.
Upon reaching the hotel, I asked if they could upgrade our room. Of course, I knew it was a long shot but I was happy to find out that they agreed!
They upgraded our room for free!
The room was great, nice bathroom too!
When we needed new towels, it was just a call away.
When we went to the beach, the staff immediately brought us water and beach towels. They set up the beach chairs as well without us asking for them.
The buffet of course was just perfect, but this is always expected at Shangri-la.
If you want to find cheaper food options, you can simply take a short walk outside the resort and a lot of Korean restaurants are there, we tried one and my fiance who is a Korean said it was good. There is also a shuttle to and from the SM Mall. There was a fee though but very minimal.
Even if our stay was a third time for me, I still had a lot of fun and still really loved my stay.
The price may be a bit higher than other resort hotels but I must say that it is well worth it!",Food:Comfort & Facilities:Staff
"You will feel it in the fluffiness of their towels, in the care for detail. I stayed in an ocean wing room and for the extra US$50 a night, the view was well worth it. Each room has a veranda where one could just stay soaking at the view and smoking an expensive cigar. The room amenities are great, the bed is large and relaxing, the toiletries are first class but not branded (branded as Shangrila), and there are towels everywhere (blue for relaxing in the beach, brown for the swimming pools, white for the room. You get free mangoes every morning, and a free small pitcher of mango juice once when you check-in.

Try the snorkeling. While there is a limit to how far you can snorkel, the fish is amazing, albeit there might be an occasional jellyfish or two. You can get in the water in full battle gear, flippers, snorkel, and life vest and it will just be a breeze even if you cannot swim. The swimming pools are of average 4.8 feet depth and there is one that goes to 9 feet. There is a children's playground, some video games, PS3's, two pool tables, many restaurants, some shops. Truly you wont need to leave the resort for three days if you need the vacation.

Went there towards the end of June when there was flooding rain in manila. But it was hot and humid in Cebu, perfect for soaking in the swimming pool.",Comfort & Facilities:Location
"We only had a couple of days to escape from a business meeting in Hong Kong, so we picked the Shang Mectan and it was no mistake.

We used transportation arranged by the hotel so it was just a breeze after arrival. Checking in was efficient. The hotel was such a beautiful property, though the room was a bit tired.

We stayed in the Ocean Club room and the service was professional yet personable. They provided mangoes every day and we just loved the smell of the tropics. The Club lounge had everything we needed and bit more.

The intimate beach was really something. Fish swim up to your feet and I didnâ€™t even need my snorkels. The one attendant who was there had the power to read your mind and offered services at the right time. My wife still raves about the mango smoothie that was out of the world... and the food at the buffet was above average.

My wife is talking about going there for a family reunion, soon.",Food:Comfort & Facilities:Staff
"We stayed at the Ocean Club room for 2 nights. Would have preferred a family room but it was full. Service was generally good. Breakfast was good. Adventure Zone was excellent - an indoor play area with massive slides and obstacles for the children. Best thing was the beach - with shallow, clear water going all the way out. My sons swam in the sea, saw fish and corals. Also did the mini-golf, swimming pool slide, jet ski and kayak. There is also para-sailing facility but we didn't have time for that. It's a haven for those who wish to learn to scuba dive with lessons for children too - this we did not do. All in all there is enough to keep you entertained for a few days.

Downside:
(1) When we were there over a weekend (Fri to Sun), it was packed! There were many tourists and some locals. Children require swimming rings before being allowed down the water slide (contradicts the sign board which read no swimming aid allowed!). The hotel provides this (but you can bring your own) and they ran out of rings. Some guests were hoarding the rings despite not using them for the water slide. There should be a system to fish the rings off those who have come off the water slide and pass them back to the next load of children queueing for the slide.
(2) We couldn't get any indoor restaurant booking for seating between 7 to 8 p.m. as they were full so had to settle for 6:30 p.m.
(3) The jet skis were quickly booked up.

Bear in mind many of the rooms are under renovation at the moment. If these rooms are renovated and filled, I don't know how the hotel is able to cope at full capacity. Resources will be very stretched. The beach is lovely but small for the sheer size of the hotel.

Avoid going on weekends and peak holiday period.",Comfort & Facilities:Food
"If anyone would ask me where to stay in Cebu I would recommend this hotel. Amenities, fixtures are top notch. We stayed in the newer building that's facing the sea. Nice pools plus a small but beautiful white sand beach in front of the hotel. Their spa is one of the best I've seen in the Philippines. Food although a bit pricey was good. This is no doubt one of the best in Cebu.",Comfort & Facilities:Food
"I am a regular at his property and this place is as you would always expect. The property is very well maintained, as expected; the rooms are superb, as expected; and the food is great, as expected. The pool and beach are clean and nice, as expected; the service is top-notched, as expected and the business center is efficient, as expected. Truly, this Shangrila property in Cebu, Philippines is as always, as you would expect from a Shangrila.
Keep up the good work.",Cleanliness:Staff:Food
"Just minutes away from from Cebu's Mactan International Airport is Shangri-la's Mactan Resort and Spa. You'll be mesmerized with the Island's natural sand, sea and sky and man-made attractions of various proportions: the captivating beach with fine-looking fishes that wade with you along the shore, the diverse exotic structures around the island that induce relaxation and festive mood, the charming room with a scenic view.
There's a wondrous venue for every recreation you may desire, a spa, a banquet, a sport recreation, a convention, a concert. All this within the hotel's expanse. You can indulge in a wide array of scrumptious dishes, served in buffet at The Tides. Complementary airport shuttles are also available for transfers to and from the airport and/or for downtown mall visits. Enjoy the sun here from March to May.",Location:Comfort & Facilities:Food
"Perfect weekend getaway from Hong Kong. The resort caters to your every need and our need was to get away from the cold Hong Kong winter during Chinese New Year (yes, I've taken quite some time to write this review!!).
The prices are hiked very high during this time, but it was so worth it. The resort is only 10 minutes away from the airport. We got in at 5am and without being an elite member, they let us check into our room...they really went out of their way to make us feel comfortable during this extremely busy time!
I am really loving the Shang's in Asia...they know how to treat their customers right and of course the Free WiFi throughout the resort is a major bonus in my book!
The breakfast area was always riddled with screaming children and a complete disaster, a tip would be to eat outside without the aircon. Most parents with kids sit inside...so if you want some peace while you eat and drink your coffee, I would suggest this.
This place really caters to families, with so many activities for the kids and even a game room! My husband and I tried our game at airhockey and pool...had some good times!
The resort has it's own Under water Marine Park, which is just fabulous. A diving platform for you to swim to and rest on. A sunken ship lies deep below for those of you diving. We saw a sea snake as well as a giant jellyfish the size of a beachball, they were both so beautiful!
The resort is so huge you really don't ever have to leave!
We did have to go stake our claim every morning for beach chairs at 7am, that's the only hassle...but otherwise, everything is perfect. The food, the service, the staff, the grounds...everything is excellent. I highly recommend this hotel to everyone.",Comfort & Facilities:Food:Staff
"Shangrila's Mactan Resort and Spa is world reknowned for its excellent facilities and service. The restaurants serve excellent food and their in-house spa will not disappoint the most discriminating world traveller. The staff greet guests with a big smile making one feel at home and much relaxed. What is less known is that their beach front has been declared a marine preserve. No fishing is allowed within the 5 hectare oceanfront marked clearly with white spherical buoys and patrolled by the hotel life guards. Fish and corals grow well. During high tides, snorkeling is so much fun because of plentiful fish swimming and much new growth of soft corals visible in the clear waters. My wife enjoy watching the fish go about their business. We spend hours snorkeling and swimming with the hundreds of fish some longer than 10 inches.",Food:Staff:Comfort & Facilities
"Moved to Shangri-La Resort from a nearby resort for last day/night in Cebu. Had dinner at Cowrie Grill - a bit pricey but great food and service. New games and activities at the beach are great for kids. However, Breeze Beach Bar's F&B and wait staff were inattentive and spent more time chatting among themselves! Hotel management may also need to provide multi-cutural training to service and front desk staff.
Overall, an enjoyable experience.",Staff:Food
"My family and I went for a short holiday to Cebu and decided on the Shangri-La. We arrived and were directed to our room. We had a bad damp smell - not gagging terrible, but bad enough to smell constantly. We called reception and they sent someone up to spray the room. After a while the smell returned and they immediately switched our rooms for us 9in a peak season when they were at capacity).

We then went down to the pool and the hotel and pool area looks like it was built in the early 80's with a refresh about mid 90's so it was definitely clean, but dated. the slide was absolutely hopeless - it was so flat my kids had to scoot half the way down!

We went to the little beach and that was excellent. With three small kids you can get into the surf with a ""guide"" and the current drags you slowly around a couple hundred metres. there are some small corals with lots of fish which the kids loved!. the service down at the beach was excellent too. the only issue (as with all resorts) is that people come down before breakfast and put a scarf or similar down on the seats and expect that to be a mark for their seat. All hotels so do a better job of policing this so it doesn't happen.

with small kids we ate relatively early and the restaurants would actually ask the chef and get us in before opening time. if they were completely booked they would let us in on the basis we would leave before the first booking and i can't tell you how much easier this made it for us.

We didn't go into Cebu and really just hung out at the beach so I can't tell you about that. If you want to hang out in a place with a decent beach with no surf a some small coral (eg, you have young kids over 2) then I would highly recommend a few days here especially during the week when it is less crowded. We really enjoyed it. if they upgraded the facilities then I would definitely head back.",Comfort & Facilities:Staff
"My wife, my son and daughter, and I stayed for three nights. My son had a business to tranact in the city, and we had planned a family vacation in the resort. I thought the staffs, among others, deserve some compliments; all those I encountered were actively helpful and kind. They carried towels and prepared couches on the beach, and were eager to help. With this attitude on top of the superb nature, I think I will choose this place again in similar occasions in future.",Staff
"Booked at the Shangri-La last December through a promo by Banco de Oro for its platinum card holders. Upon booking we were told by Shangri-La's Manila office that the regular beach front rooms were no longer available even though it was currently available on line. We were offered a slightly more expensive room which we accepted and we received confirmation of the promo discount that would apply. Upon check in, we were told that the discount will not apply. Apparently, despite the confirmation, we were told that the officer who booked our rooms was new. We showed the Banco de Oro flyer where it states the promo details including the duration period (which included our December travel dates ) and we were told that the promo does not apply for the month of December because it was peak season. Why then did the promo dates include December? They had no answer apart from the promo will not be apply. We thought this was unacceptable as we were already in Cebu! Every morning was spent at the front desk debating. On the last day we were told that the discount will be applied 'only because you are requesting it'. How infuriating. They do not honor their word and they say this. And because they were applying the discount we could no longer avail of the Banco de Oro discount on food & beverages.

Separately, we bumped into friends who booked (direct) much later than we did and got the regular beach front rooms at lower rates. When we asked the front desk why we were told at booking there were no more regular beach front rooms we were told that our friend's room was a different type. Our friends had the same room, directly on top of ours. We were then told that our friends booked as local residents. Banco de Oro is a local bank and they assume that its card holders are non locals? Our friends were also able to use their Banco de Oro discount on food & beverage while we were told not to.

Upon check out when asked how our stay was we briefly mentioned the incident and another lady at the front desk said that the Manila office was right, the promo applies. They tell us this the day we are leaving. We were invited to join the membership club but will need another trip to a Shangri-La hotel for the rewards to begin ... ummm another stressful vacation? We were also asked to complete an on line survey. It asks if you wish for them to contact you regarding a particular incident. I clicked yes. I have never heard from them.

It is disappointing as this was not our first stay at the resort. Apart from the booking office and front desk, the rest at the resort are very accommodating but the trouble the front desk will put you through defeats the objective of a relaxing vacation.",Staff:Value for money:Food
"we wanted to experience the first class accommodation we've been reading in this survey so we booked this hotel after our plantation bay stay.. and they delivered.

we were given mango juices when we arrived, the check in was a breeze.. they even gave us 3 card keys without us even asking for them....they anticipate our needs and we felt pampered by the staff...

my son found their food just right to his taste, however, i don't share the same sentiment as i find the buffet food at the Tides a little boring and bland...We had lunch at the tea of spring, their food was A deliciouso although servings are small and the price is quite on the expensive side...we were not able to try the open air Cowrie Grill , since lots of winged ants were all over me, even if i used insect repellant...so we dined ala carte inside the Tides. and i didn't like what i ordered, adobo chicken, it was too sour for my taste.. the amiable waiter probably wondered why i didn't seem to touch my dinner, and so he offered to give us fruit platter for free as our dessert...

they have ample pool, lounging area...game room, gym, massage spots in different parts of the garden.. overall, if price is not a problem with you, shang more than delivers, it pampers,,,",Food:Staff:Value for money
"Travelled with hubby and two toddler kids. This is definitely a kid friendly place. They have decent sized kiddie pool where kids can splash around to their hearts content. Resort has an amazing Adventure zone, an indoor padded playground for kids. Kids would have to be in socks, long pants and long sleeved shirt to use this facility so I suggest you pack this along to avoid the unnecessary purchase. Service is amazing. My kids loved it so much that they requested that we come back again. When asked to choose between HK Disneyland or Shangrila Cebu for a family vacation, they chose Shangrila Cebu!",Comfort & Facilities:Staff
"We thoroughly enjoyed our stay in the Shangri-la because of the rate, the amenities and service. The beach may not be the best in the country but the snorkeling (with lots of lovely fish) more than make up for it.

I am impressed with the service. Rooms are great. The pool is fantastic. What more can you ask for?",Staff
"Shangri-La Mactan was one of the best run big resort we have ever been to. When we had no children we used to love going to tours and excursions while on vacation. However, 2 kids later our vacation style changed. We wanted a vacation where we could stay and not move too much yet still entertaining for kids. This hotel delivered!

Service was truly warm and excellent. They have one of the best kids' play center / area we have ever seen with a huge slide. Pool is also nice but the water slide was for older kids (above 5? I think) so ours could not enjoy so we hang out at the beach every day. The water was calm and we saw lots of fish. But be sure to reserve your beach chairs early in the morning during the peak season as we had many silent chair reservation battles with other guests.

Food was also of high quality, but when we were there during the peak season all the restaurants were very crowded.

Rooms are rather on small side and a bit dated. We wanted to upgrade so we saw couple of suites but they were not worth the extra money at all. We opted to spend a lot of time outside of the room instead.

All in all very enjoyable vacation spot for families.",Comfort & Facilities
"What can I say? Fine hotel - a little frayed around the edges (e.g. the TV-screen in our room had a large blue manufacturing error). But who's to quibble: it's wonderful all around. Beautiful expansive grounds with a small golf course; very long beach. The gardens are extremely well-kept and beautifully colorful. Fantastic restaurants (among which Acqua and Cowrie Cove are absolutely tops with the finest foods and meticulous service). Tides, the breakfast place, has an incredible spread!
Our deluxe room with sea-view was spacious and comfortable; the turn-down and cleaning service was efficient and thorough. Good darkening curtains; roomy balcony. Comfortable beds.
Service by all the staff is great and helpful and informative.",Comfort & Facilities:Staff:Food
"We were a family of 5 adults staying in 2 connecting rooms & we totally enjoyed our three night stay. This is the second year in a row that my wife & I have stayed here. The hotel is located in a quiet secluded part of Lapu-lapu, close enough to the airport (about twenty minutes), yet far enough to avoid all the noise. The breakfast buffet (included) was tremendous, lots of selection, from Asian cuisine (Chinese, Japanese, Korean, Filipino) to continental fare. The beach is small but very private & very well maintained. Seaweeds washed ashore were quickly picked up by the grounds crew who worked tirelessly under the blazing sun. Overall, the Mactan Shang deserves all the accolades that they receive. the only discomfort we experienced was that the pool temperature was a little too warm, but that's just nitpicking.",Location:Food:Comfort & Facilities
"The Shangri La Mactan is truly a resort for a perfect getaway for a long weekend. The resort offers something for everyone , right from toddlers to young children to adults. The swimming pools and other leisure facilities are excellent. They have a good beach , though it may appear smaller one for those who are expecting a Phuket/Boracay kind of beach stretch . As in most of the Shangri La hotels , the restuarants offer great food and the comfort of trying different cuisines without getting out of the resort .",Comfort & Facilities:Location:Food
"Overall, the resort is very nice. It is close to the airport and is the largest in Cebu. Nice swimming pool and good restaurants. The beach is nice and offers a relaxing view. Since I was there for a business meeting, did not get see a whole lot more but I would definitely recommend it for someone looking for a nice resort to stay at.",Location:Food:Comfort & Facilities
"Brought my parents, sister and kids, and partner to this wonderful place. Our first time in Cebu and I think we picked the right place to stay. The location was great - only 15 minutes from the airport. The service was excellent, rooms and facilities clean and nicely decorated, pools and beach areas are accessible and well maintained, and security will make you feel very safe. My parents tried the Chi Spa and they mentioned how relaxing and unforgettable the experience was. The resort have daily activities for kids and baby sitting services which came in very handy. The only thing that we were unhappy with was the unavailability of strollers.",Comfort & Facilities:Staff:Location
"We finally decided to back here. It was a bit more crowded this time but with the number of pools, one could still find a place to stay and not be disturbed.

The rooms were the same with little sign of wear and tear.

The children enjoyed all the ""zones"" .

Chi spa was still an excellent experience.",Comfort & Facilities
"Fantastic resort with the best snorkeling ive ever done in my life. the beach is so clean and wide and the water is transparent like in a fake photograph. The best thing about the resort is the beach, the food and the employees who are a true reflection of what filipinos are like.Kind and skilled people! The only thing is that the rooms need updating as not really up to Shangri La standards. The other thing is that there are toooo many children!!! 80 % of the population is young couples with babies. I have to say though, they were all well behaved Korean kids and uber cute, so not that bad!
Apart from that, book this place if you want the best views and snorkel whilst having the most gorgeous food at affordable prices.",Location
I booked our stay for our wedding anniversary. I used our mileage from asiamiles for our hotel room. I called in my reservation and it was reservation from Malaysia who booked us in. After I got a confirmation online and viewing the rooms I decided to upgrade our room so I called again the reservation officer from Malaysia and he was so very helpful. He told me he has to call Shangrila Cebu first if I can upgrade and will let me know. I got an email confirming my upgrade and I will just have to pay the difference from standard room to family room. During our check-in I was a bit late and my husband was ahead of me as I was still packing up for our trip to Leyte after we check out. The receptionists were so helpful and accomodating to my husband. They helped him even if I was not there yet. The room was registered under my name. They suggested to us if we want to upgrade to an access to executive lounge with just an additional amount and we were glad we did. For our 2 days stay with food and upgrade to executive lounge and family room we only paid around $300. The staff are so very nice and a cake with a greetings for our wedding anniversary was delivered to our room complimentary from the executive lounge staff. We had an awesome dinner buffet by the beach. My kids really enjoyed it and we are planning to go back again next year. My husband loves it there and he used to always like to stay in Plantation Bay and now he likes Shangrila best.,Staff:Value for money
"My husband and I had our wedding celebration at the Shangri-la hotel, and were so glad we did. Having to plan a wedding is stressful enough, but we were planning one halfway around the world! Coleen, the events planner, was a gem, really taking care of our needs and putting us in touch with the right people to pull our plans together. We didn't hire a wedding coordinator since she took on a lot of the responsibility. Our guests who stayed at the hotel for the first time were very impressed by the level of service. They commented that every hotel employee they met greeted them and were quick to answer questions or help. Some of our guests booked return stays before they left.

Our wedding package included two nights in one of the Ocean Wing suites and a two-hour spa treatment. That spa treatment was the best I've experienced so far. A body scrub, milk bath and massage was definitely what we needed. Me and Mr. S had our own private villa and the most relaxing experience after months of worry and stress over how everything would come together.",Staff:Comfort & Facilities
