Opinion,Classification
"First time in Manila on a short business trip and I felt right at home. With a perfect location, great ambience, awesome food and friendly staff I think I've got my go-to place to stay while in Manila.

Food: Tons of restaurants within walking distance from the side doors. Great breakfast in the hotel with lots of options.

Gym: 2 floors of workout space. One of the best gyms I've worked out in. Very well maintained.

Rooms: Clean, spacious, clean.. well equipped, clean.. ok you get it.

Location: A stroll to the office and to the nearby Makati area. If you need to travel elsewhere then plan early in the day as the peak hour traffic is brutal.

Overall, a great place to stay!",Location:Food:Comfort & Facilities
"Attended a conference yesterday. They had a special check in room for the delegates. Arrived at around 1 pm and finally got a room just before 4 pm. Others had to wait much longer. To make up for the check in fiasco, the management has allowed us late check out.
The room was nice and they provided us with lots of free bottled water.
Breakfast, however, was another nightmare. The line was so long that it reached the middle of the lobby. Inside the dining area, you had to be resourceful to get a plate or a bowl as these kept running out. Choices for breakfast was plentiful, you just had to wait for new plates to come out before you can get hold of the food.",Food:Staff:Comfort & Facilities
"I'll start with the experience of entering the hotel. First you need to go through metal detectors. This is a bit of a pain.

The next thing that strikes you is the smell. It's wonderful.

The open reception is opulent with a huge hanging chandelier.

The staff are friendly and approachable. If you're like me and like to do things yourself they can sometimes a bit too friendly.

The rooms are brilliant with amazing views.

The Raging Bull bar is great with some amazing cocktails mixed by an expert.

They gym and leisure facilities are amazing. Two floors of gym equipment, tennis and basketball courts. Two pools.

If you're staying in Manila Metro, this is the place to stay.",Comfort & Facilities:Staff:Location
"Stayed in the Shangri-La at the Fort Manila in December 2017 for 5 nights. The rooms are huge and luxurious, there are 4 new bottles of water provided daily as well as very high quality spa products. Furthermore the hotel as a nice pool (4 feet) and a good selection of restaurants. Lunch buffet is fantastic and should be tried by every seafood lover.",Food:Comfort & Facilities:Location
We booked this hotel because of the location. It is in the center of BGC. So we could explore the surrounding as much ad we want. It turned out that we stayed most of our time in the hotel and explored what the hotel could offer. Just because we love this hotel!! The spa is amazing! The swimming pool is great. The cocktail is divine. The buffet is one the highlight that we canâ€™t miss. The staffs are very friendly. Everything is in a right balance.,Food:Staff:Comfort & Facilities
"This is a first class hotel located in a really nice area for site seeing and shopping. Great restaurants located everywhere. Check-in was smooth, polite and efficient. We never touched our luggage as everything was taken care of and delivered to our room. The room itself was on the 19th room and on a corner, so we have two large windows to see the views. The room was large with plenty of space and light and the bathroom was located around the corner from where the main bed and floor area was, so it made it feel like you had an apartment, minus the kitchen! Our room rate included daily breakfast which was fantastic with a great selection of food. Service was also why above par. If you are in a rush and want to skip a sit down breakfast then they have the option of ""grab and go"", where you can load up on fresh fruit, pastries, and sandwiches. We opted for this once and it was very handy. In room dining has good selection of food and we were very pleased with the quality and taste. We ordered a noodle dish and it was excellent. The hotel property is very large with connecting high end shops and separate sports/pool and workout areas. Large indeed. Shopping and restaurants are all within walking distance, basically right out the hotel. The area is clean and safe. Would certainly what to go back again!!",Food:Location:Comfort & Facilities
"These are always dependable high quality hotels offering exemplary service , high quality accommodation and reasonable location.
The main feature I liked about this hotel was the dining . Breakfast is superb with an excellent variety and they offer a superb buffet . I invited my business partner and his family and they ate like they were starving !
The food was a mixture of Philippino , Asian and international cuisine . Service was reasonable . Prices are not cheap , but worth the experience.",Food:Value for money
"Stayed here for a family celebration. It is located in the middle of BGC, Manila's most premiere financial and commercial center. The complex is massive and very top of the line with all the high end shops and food establishments surrounding it. Service is also top notch,all the people from the security guards and the front desk staff were very nice and accomodating. The rooms were very well appointed and beds were comfy. Breakfast buffet was the best with a very generous spread of breakfast staples, pastries and deserts. (though i hoped they refilled the bacon more often). The fitness center is a destination by itself with an expansive two storey space. Also worth noting is the kids play area, although a little pricey but is very well appointed and entertaining for big kids as well. The pool area is also very relaxing and soothing but water is quite frigid. All in all this is the ultimate dream destination for vacationers, businessmen and traveling workers. It is an all in one destination and you do not even need to leave the hotel. Hope someday I could come back.",Food:Location:Comfort & Facilities
"This is my 3rd night here and all I can say is the rooms are luxurious and relaxing!

I had a king sized bed with 4 giant pillows. The bathroom was well appointed with shower and bathtub, and the L'Occitane Jasmin & Bergamot toiletries smelled divine!
It was also a nice touch that they feature our worldclass chocolates and dried fruit from Davao to welcome a guest in the room.
Breakfast at High Street Cafe had a good international selection. I also liked the hip uniforms of the waitstaff.
I also enjoyed the beautiful 3-D art installations in the lobby and elsewhere.
As always, all the staff were accommdating.
Even though I stayed for business, I leave relaxed and recharged.",Food:Comfort & Facilities
"This was our first time to stay here for a business event. We were looking forward to staying here since we are regular patrons of EDSA Shangri-La. Also have been to Makati Shangri-La and Shangri-La Rasa Sentosa and they are all charming. At first glance the place is very opulent, almost intimidating. Our baggage was swiftly handled by a very kind and friendly staff, i wish i asked his name so i could mention it here! While we were checking in I think he could tell our son was getting impatient so he started chatting him up and keeping him preoccupied, it may not seem like much but i REALLY appreciated his effort. I also asked him where the pool and adventure zone was located and he was very knowledgeable and all smiles.
The room was spacious, very clean and well lit. We were on the 34th floor and it offered a spectacular view of the city. The bathroom was spotless and had Lâ€™occitane toiletries. Lovely! Breakfast and dinner were fantastic, as expected from Shangri-La. We didnâ€™t have lunch there though.

We checked out the gym it is amazing! Very well equipped. The pool is gorgeous. The only comment i have is the adventure zone. Why do they charge 600 for hotel guests isnâ€™t that supposed to be free??? If i read it correctly i think it said 600 for 5 hours or something like that. That is actually very reasonable but still, why charge for guests that are checked in? Also we only had about an hour and a half left before checking out so I wasnâ€™t going to fork out that amout for such a short amount of time.

Other than that, this hotel is truly fabulous. As expected from Shangri-La hotels.",Staff:Food
"Managed to stay at the Shangri-la the Fort and the experience crom start to end was just indulgent and with class. The front desk staff specially Kenneth were just truly friendly, hospitable and delightfully affable. The room was truly indulgent in every sense. Sparkling clean, bed and pillows so comfy, the view was encompassing, hall way was sound proofed and the aroma of the entire hotel was just relaxing.
Truly a place on its own, to visit again.",Food
"This is just a bit late but i can't let my appreciation just pass by. We were busy these past few days and it took me several days to make this review. My family celebrated the 21st birthday of my youngest daughter and our 28th wedding anniversary last Jan.13, 2018 at your hotel and we had dinner served. I was amazed and really thankful for the services rendered by your Restaurant crew at the High Street Cafe particulary Noel, Lois and Erica. The food were superb but the services of these three crews made our night a memorable one. If i would recommend to my peers and relatives where's the perfect place to celebrate such an important event, i would suggest HS Cafe not only because of the food but importantly the services that they will receive from the crew. Ever accommodating and friendly. And these three deserves my commendation. Thank you guys! Till our next visit. Thanks also to Shangrila the Fort. God bless your place and the people working in it.",Staff:Food
"Stayed at the residences of Shangri-La at the Fort Manila, in a 2 bedroom suite complete w/ kitchen, dining area and washer/dryer. Great location, walking distance to restaurants and Mango store. Great staff and customer service. The Kerry gym was fantastic! But beware...amenities in bathroom like shampoo n conditioner as well as the coffee and tea packets will only be replenished for a fee! Luckily I bring my own toiletries, but for the price i paid for me and my 4 other family members, these should be included. The breakfast buffet at the High Street Cafe was delish w/ so much variety. Altho, if u go in close to the end, they run out of the more popular items like fresh mangoes. Overall, an enjoyable stay but Iâ€™ll probably look into less expensive residence type hotels next time.",Food:Location:Value for money
Had the pleasure of staying here for one night on January 4th on a layover and experienced the warmest and most genuine service from every member of staff I met. Some high end hotels provide the utmost professionalism but lack real connection and human emotions when interacting with their guests but this hotel was both efficient and professional with the great addition of a really non judgemental and sincerely caring and gracious staff. Very beautiful hotel with amazing facilities like the Kerry Sports Center and not one but two pools. The breakfast buffet is also top class. Would love to be back!,Staff:Comfort & Facilities:Food
"After the terrible budget hotel behaviours of the Hudson new York (see separate review) the Shangri La came as a wonderful antidote. The rooms were not massive, but beautifully appointed, bathrooms were excellent and the buffet breakfast magnificent. The staff were super helpful, when I realized that I had forgotten my cufflinks for an important presentation they lent me some ( the staff at the Hudson when asked for a travel adaptor offered to sell me one). The gym and spa were excellent and the car service to and from the airport efficient. For a business hotel it was near faultless.",Staff:Food:Location
"We throughly enjoyed our stay at Shangri-La the Fort, the service from check in to check out was wonderful. The hotel is very well located, the rooms well appointed as well as having an excellent swimming pool and gym.

No USB charging points would be the only thing lacking in the rooms.

Some of the dining choices in the restaurant leave a lot to be desired, but given the location of the hotel there are many choices in the area so not an issue.",Location:Food
"I had a one night stay at the hotel before heading back to London and I think the hotel is amazing. Beautiful inside and out. The service was outstanding and I love the comfortable bed and the L'occitane toiletries too.

Unfortunately, there was a dead spot for wifi internet in the swimming pool area. I queried about this and apparently, hotel staff have been made aware of this from other guests but they did nothing. I wasn't impressed. How hard was it to get a wifi extender? I don't think it costs that much and I don't think owner Robert Kuok would be very happy either when existing hotel amenities issues are not being resolved swiftly!

I would have given 5 stars if it wasn't due to the wifi issues. I hope this gets sorted out asap.

PS: Amazing breakfast. You'll be spoilt for choice!",Internet:Comfort & Facilities:Staff
"We arrived after 28 hours of travel and felt well cared for by Vanessa at the front desk. She escorted us to our room and sent our luggage up quickly. The room was perfect; well appointed and comfortable with an amazing city view. From there we enjoyed nearly every outlet in one way or another but by far our favorite spot was the breakfast restaurant. What a wonderful way to start each morning. The staff is super friendly and the food is amazing, both by choice and quality. RJ and Dave made sure we tried every specialty and sent us off with almost more smiles than we could handle. We also enjoyed the pool and the 24-hour gym. The proximity to High Street and Serendra and the central location in BGC make this an ideal place from which to see and experience so much. Highly recommend! You will not be sorry!",Staff:Location:Food
"Enjoyed my stay in particular the club lounge at the top of the hotel as well as the steakhouse. The room was spacious and comfortable, I had a slight problem with the air conditioning unit which was quickly resolved. The staff are all very helpful and nothing is too much trouble. The gym is amazing so much space. If you got to the Steakhouse have the smoked steak it's an experience.",Comfort & Facilities:Food:Staff
"This is my 2nd review in one calendar year. I usually donâ€™t do this , but I have to thank a certain number of people, and I hope management recognise them in the near future . First , I had a successful staging of my daughterâ€™s 18th birthday celebration at the Bonifacio Hall . Spearheaded by event supervising head miss Divina, and mr Angelo , it was a well coordinated activity. With their staff , from Realyn , Winston , Jay and Angelyn it was quite astonishing how these people seem to handle more than 80 guests with good precision.
Another memorable experience was those in the Horizon Club at the topmost floor. Never mind that they donâ€™t serve afternoon tea , I hardly noticed it with the way their staff made my stay their memorable most of the time with their friendly and attentive service . I want to recommend all of them . Iâ€™m sorry I canâ€™t get all of their names but I would like to specify Kathryn who made the initiative to reserve a private room for my toddler, and because my daughter spoke highly of during her brief stay with her friends . And Gael , who was the only one on duty during late night but managed to anticipate my needs for some extra snacks while I was having coffee.
Staying at the Premiere suite was another memorable one. Very huge , spacious, elegant and functional. Splurging once in a while, I wonâ€™t mind if I am staying in a beautiful abode .
Congratulations Shangri-La at the Fort ,it has never cease to amaze me. Even though I own a condo unit in One Serendra, I wonâ€™t hesitate staying in this exemplary hotel. Till next time .",Staff:Food
"Prior to this visit was an event that I prganized and gave a 5 star for the treatment, this time it was a family holiday stay-cation and it was indeed a fantastic place to stay. Upon our arrival, they have this 24 hour email from their Guest Service Office which allow personalize request for the convenience of those who are staying. Having kids, request like in-room dining and breakfast were facilitated ahead. The Bellman and concierge (Xandro Pincaro and James Segismundo) were very helpful, nice and pleasant. I love the energy of Joy Pascua from High Street Cafe and the service given by Tony Molon. Made sure I got their full name correct because I know Iâ€™ll be making another review here and it was another fantastic experience. Options of 2 swimming pools is good because the one near Samba has more people and if you want a more private one then you can go at 6th floor at Kerrys Sports. It was nice to see Joey of Kerry Sports. Whatâ€™s another good thing thing about the hotel is that itâ€™s very near to BGC High Street and Mind Museum. Raging Bull Burger is the best and you should try it! Over all, itâ€™s another 5 star!!!",Location:Food:Staff
"We enjoyed our New Year's weekend here. First, we are thankful to Shang for having a New Year's mass held at the hotel.
Second, this must be the most baby-friendly hotel in Manila. From the moment they opened our car doors, everyone from Shang was genuinely warm not just to us adults but to our 2 little boys as well. Every area at the hotel is stroller-friendly, and we moved about with so much ease.
Third, there's so much to do here for everyone. The recreational areas and facilities are really unparalled. The indoor basketball court is really impressive! The fitness center has 2 floors! There's even a very large indoor playground for the kids.
Fourth, the food is good -- buffet breakfast had a huge selection. Both Raging Bull Chophouse and Raging Bull Burgers have great-tasting and fresh food.
Our family really enjoyed our stay here, and we'll definitely be back.",Food:Comfort & Facilities:Location
This hotel is very well located next Bonifacio Global City Highstreet for great shopping and restaurants. The staff is 5-Star and the room is large with premium amenities. It has one of the best gyms of any hotel I have stayed at and everything is in walking distance. I would be tempted to stay in Manila longer just for the hotel. This will definitely be where I will stay again when back in Manila.,Location
"We treated ourselves to two nights here. 22+23 dec17. The staff were so friendly and welcoming. Could not do enough for us. The room had aircon which we could adjust. A lovely comfy bed ,spotless linens.spacious bathroom with bath and shower. I now want a better bathroom at home.agreat feature was the nightlight switch beside the bed, enabling me to softly light my way ( lights under bed and bathroom sink). The included buffet breakfast sets a very high standard. Even coming down at 9.30 when it finishes at 10 there was masses of choices. We also used the lounge to meet up with friends. Gracious space with art works and a stunning hanging glass installation. The afternoon tea looked good but we were still full from breakfast. A pianist played some classical and contemporary pieces. Son in law used the gym which he said was well equipped. A good location with quite a few restaurants around the outer perimeter. We dined in at the Raging Bull which was superb. The second night we used room service- choosing kids meals as yet again the breakfast had been substantial. These were tasty and a good size.",Comfort & Facilities:Food:Staff
"I stayed here for a month. Since my stay was for 30 days, they gave me the residence which is basically a one bedroom luxury apartment. I loved it.

Pros:
The staff were extremely polite, helpful and courteous.
The bed and pillows were ultimately comfortable and they gave me like 8 to 9 pillows with various types.
Both living room and the bedroom had large LED smart TVs that were connected to the internet.
Definitely value for money.
The gym and swimming pool were amazing. The gym was so huge, I've never seen such a huge gym with variety of equipment.

Cons:
The internet was reasonable fast (got around 4 Mbps) during weekdays however during weekends it was terrible, I was getting around 700 Kbps.
In room dining menu had very limited options.
Breakfast buffet was really good but the options were limited",Comfort & Facilities:Value for money
"I have stayed regularly at the Shangri-La In other Asian cities but this hotel tops them all off. The rooms are beautifully designed with amble luxury in bedclothes, pillows and washroom products. The breakfast room is spacious with the usual terrific buffet options. The gym is on two levels with a basket ball court, squash courts and 25m outdoor pool and all the necessary weights and aerobic equipment.
The lounge bar is beautiful if not a bit too dark. There is no bar at all just waiter service so I feel it lacks a certain atmosphere that is needed in a hotel. That said everything else was top class.",Comfort & Facilities:Food
"Best hotel at the fort area, clean and outstanding service. Near to everything you need! Suite was nice and bathroom was very comfy. Nice pool for kids. The only problem they donâ€™t have kids blanket for baby crib. Thanks a lot to Shangri-La team.",Comfort & Facilities:Cleanliness:Staff
"The place is nice but the people makes it extra special. JC from the check-in counter was very accommodating, so is Princess from the Horizon lounge. She made us great cocktails and made sure that we were comfortable. Cherry and Em were also very nice and the security lady that always greets ""welcome home"" when we go in the hotel.

If there is something to improve on is probably, put a bidet in your bathrooms ;-) but overall it was a very pleasant stay.",Staff:Comfort & Facilities:Food
"I love this hotel - general ambience is very relaxed. My room is very spacious and quite, bed's super comfy. L'Occitane products in bathroom are a nice touch.
Great selection of food but the thing that impressed me most is the staff and the service. They can't do enough for you and they're all so lovely, especially Justin the sushi chef and the very aptly named Joy who bounces around the breakfast room like a ray of sunshine putting a smile on everyone's face who has the privilege to interact with her. There's not too many like her and the hotel is lucky to have her on staff.",Staff:Comfort & Facilities:Food
"This hotel is very new and you can tell. The room was beautiful and the view towards Makati from the 25th floor was amazing. One of the best rooms I have been in. Room service for breakfast was prompt and delicious. Great spot too - easy walking up Bonifacio High St for many shopping and dining options.
The pool area was nice although the weather turned and I didnâ€™t experience it much (and I was there for work). The gym was awesome - 2 storied, plenty of weights, treadmills and other machines. And in the menâ€™s change room was a spa, plunge pool, steam room and sauna. I assume the womanâ€™s had all that too. Great place to chill for a bit especially if it was raining outside.
Security was strict as it is all over Manila, but it made you feel safe and didnâ€™t seem intrusive.",Comfort & Facilities:Food:Location
"It was our first time to stay here and I am very glad we did. We love checking in at hotels and I wonder why I did not know of this place before. My problem was the parking. I find it kinda far and there is an area with stairs without ramp. We don't always ask for help for our luggage but we had to this time. I also read that guests can enjoy Adventure Zone for free, but sadly it's not. I find the fee a lil expensive. Maybe we'll just avail of the membership. Love the kiddie pool, my toddler enjoyed splashing under the sun. I'll be torn where to stay next time because we love Sofitel also. It's more expensive here, though. :)",Comfort & Facilities:Staff:Value for money
"I stayed here with my colleague as we were hosting an event at the hotel, and it was a real treat. The rooms are so comfortable and well appointed (and their wifi so strong). I especially liked the large bathrooms which even had a bath. And who knew a seat in the shower was such a treat. The leisure facilities are awesome too, particularly the pool.

The real highlight though is the staff, who go out of their way to assist you. I foolishly left my one pair of heels in a taxi, and one of the Shangri-La team escorted me to the nearest shops where I could find another pair. Definitely above and beyond service.

If you're looking to host an event here, the event facilities and staff are excellent too.

The downstairs lounge is a great place for informal meetings, although the service there can be a bit slow so just be prepared for that.

All in all an excellent stay. I'd definitely come back here if my travel budget allowed.",Comfort & Facilities:Staff:Food
"Perfect place for business trips! Everything you need you can find here - perfect and professional service ( believe me- I communicated with all of them 24/7) they really do great job! All questions was solved fast and in full amount. There is really one the best gyms I've seen in hotels. And it's open 24 hours ) rooms are big and nice (whole hotel is decorated very good btw - pay special attention to the lightning). Room service also good. Nice swimming pool with small bar and comfortable sun beds. Very good breakfast included local cousine (European style breakfast also served). Lots of juices, smoosie, fruits. There is a nice lounge zone with panaramic view. Security is on a highest level ). I had really great 10 days there.",Comfort & Facilities:Food:Staff
