Opinion,Classification
"Stayed two times already and would never go to another hotel in Manila. It's like a resort in the middle of the city. The food is amazing - the buffet exceeds the best buffets I had so far in the top 2-3 hotels in Vegas and similar to a 3star Michelin restaurant, the gym is one of the best I've used in a hotel, big and very cosy rooms, awsome green pool area, polite and smiling staff, quick an punctual room service, linked to a nice shopping center, etc.",Comfort & Facilities:Food:Location
"LAST DECEMBER, ME AND my highschool friends had a fantastic time at the pool side of edsa shangri-la hotel. we had kare kare, crispy pata and salmon sa miso with new york cheesse cake and matcha donut.",Food:Location
"Still with the friendly staff.

Stayed in the TOWER WING with 2 double beds. The rooms are well kept and clean, has enough room to move around. The bathroom is big enough and clean, no water marks on the sink and neither are there molds on the corners. The water temperature is easy to set.

FREE INTERNET! No difficult log ins, no need for usernames and passwords. Speed was ok enough for video streaming, although the WIFI connections disappeared at around 12MN together with the cable.

Speaking of cable TV. It's the only disappointing part. Considering it's a SHANGRI-LA, the shows are mostly STANDARD DEFINITION. I do hope that they eventually upgrade the resolution of their shows to HD at the very least.

Valet service is available at a flat rate of Php150.00 for checked-in guests.

The pool is clean.

The breakfast at the HEAT has a good variety of choices.

OVERALL I will always recommend Shangri-la EDSA as a place to stay in, although the location is starting to be difficult to reach being in ORTIGAS. But it's never boring because there are two great malls on either side.",Comfort & Facilities:Internet
"It would be better if during the check in process the front desk will explain everything to you such as the amenities and activities that are complimentary during your stay. It is also nice if someone will assist you to your room and explain briefly about the room amenities. I've been to Raffles and I was expecting the same service since both are luxury hotels. If I didn't ask about the activities, I wouldn't be included on the scheduled fitness class. When I got up to the room, I have to open every drawer just to find the room amenities. I gave a 3 star rating because of the wonderful service provided from the health club and chi spa. Otherwise, I'd rate it with 2 stars.",Staff:Comfort & Facilities:Value for money
"Got a good deal, spent my birthday weekend. When the front desk Kevin knew that it was my bday, offered a good deal of meals and late check out with a minimum fee, although I politely decline since we have to leave next day early too and had dinner plans already. Was also surprised of sending me a cute bday cake inside the room. Spent the afternoon at the pool area, kids enjoyed. Will definitely go back.",Food:Staff:Value for money
"I have stayed at this hotel many times over the past years and still generally enjoy the facility. The pool and fitness center are great and the breakfast is very good as long as one can include that in one's rate. The rooms are not large and mine was a bit musty this time, but not horrible. However, on this visit management put in an overzealous security procedure. They will only allow people to enter OR exit from one driveway to the main entrance. For pedestrians, this triples the distance to the main road, where one would catch a taxi or return from the mall. In this hot and rainy season this is a significant inconvenience and seems add little to security. They have also placed a second x-ray check for pedestrians at the mouth of the entrance of the drive way, further adding to inconvenience without any clear value to security. Compounding the problem is the rude attitude of the young men who can barely speak English who man these ""check points."" One feels more like a prisoner than a guest.
Thus I have given the hotel a lower rating that I would have otherwise. This system is inappropriate. I have worked in security for decades and this process adds nothing to security but surely angers guests. Some common sense is needed.",Comfort & Facilities:Staff
"Checked in for a stress-free weekend, and it did just that! Although the staffs are a bit snobbish and pretentious, especially the waitresses at the lounge and bar.

Gave it 4.5 stars just because of my biggest bathroom pet peeve, which is no bidet! Forget about jacuzzis and hot tubs, bidet matters most!",Comfort & Facilities:Staff:Cleanliness
"The location is great and big pool on the ground. Evening chilling is not a challenge because the bar and restaurant just ground floor of Edsa Shangrila. Oh.. for ADB folk, you may like this place. Good food or jolibee is not far.",Food:Location:Comfort & Facilities
"Pros:

+ Great location for SM Megamall (lots of eating options there, including Din Tai Fung, Tim Ho Wan and Ipuddo

+ Great family pool (better than Shangri-La at the Fort that I also stayed at)

+ Good security (not that I was worried in the first place)

Negatives

- Rooms extremely dated, and actually a little disappointing. Certainly not what I expected for a ""5*"" hotel. Shangri-La at the Fort was a lot more modern.

- Restaurants quite expensive. I ended up mostly eating at SM Megamall instead.

- Could have been more generous with the complimentary water and toiletries.

Overall, I would stay at this hotel again. If I was on business, would stay at Shangri-La at the Fort. If I was with my family, I would stay here at the EDSA Shangri-La, as the pool area is a lot more child-friendly and family orientated.

Check out 'RosscoAbroad' channel for my video review of the EDSA Shangri-La.",Location:Food:Comfort & Facilities
"Swanky lobby with amazing interiors is what you get as a first impression of this hotel. Rooms are very spacious and both views are good (city and pool view). It has 6 restaurants within and a very nice bakery. The cakes and sweets are amazingly tasty.
The gym is exceptionally good and has all amenities including Jacuzzi, steam and sauna.
My overall experience at this hotel was fantastic. It gives a free wifi and quick service too.
It has a fancy mall right below with all high end brands.
Being a high end shangri-la, it is bound to be costly.",Food:Comfort & Facilities
"We stayed at the Shangri-la Edsa as part of our honeymoon in the Philippines.

Great service all round really, they lost our booking for about 30mins while we were checking in which caused some panic as they said they were fully booked. All resolved they managed to find it and a room.

Great location close and air bridged to the shopping centre.

One downside is transport from. We tried to organsie with the front desk on the day we were set to leave and it was a nightmare we had to hire a car in the end from Avis, for more than 3 times the amount that it cost a taxi to get there...so I'd recommend pre booking something else.

We missed our free grande breakfast because the restaurant was too busy with a medical conference. They did warn when we checked in but still not ideal.

Room was great and security is high. I feel their main market is rich Filipinos- hence the offer of a limo to the airport.

Great place it just has some pitfalls",Staff:Value for money:Food
"I stayed here on business for 3 weeks. The hotel lives up to its 5-star rating. Service is excellent, good security, and the premier room in the tower wing looks even better than in the picture featured on the hotel website. It's clean and spacious with a king-size bed, couch, desk, TV, plenty of storage, and shower stall and separate bathtub. There's a good breakfast selection in the morning (Western, Indian, Filipino, pastries, breads, jams, cereals, even ice cream and sushi) although it rarely changes so after the first week it starts to get somewhat old.

The best part of the hotel is that long-term stays get a choice between a car & driver to take you to/from the office everyday, OR complimentary breakfast and laundry service. I chose the latter, and was pleased to find dry cleaning was also included. Also, the hotel will organize an event once a month for long-term stays such as pizza & beer nights, movie nights, etc.

The hotel is connected to the Shangri-La Plaza Mall. It's also a 10 minute walk from SM Light Mall, which is even larger with an ice skating rink, bowling alley, movie theater, more restaurants, etc.

Other amenities: nice pool with a water slide for kids (no adults allowed on the slide), decent spa although a bit overpriced for what you get (I do not recommend the luxury hammam treatment which ended up being over $100 for what was essentially a basic body scrub),

Some minor issues: The breakfast gets crowded between 8-9am. Although I've never waited in line longer than 10 minutes, I usually get seated at one of the tables that have been tightly packed together so that you're nearly rubbing shoulders with people sitting next to you. The hotel has tried to address this by opening up the restaurant at the mezzanine level for breakfast service during busy times.

The room service is sub-par and overpriced -- the three times I ordered food it came lukewarm and tasted bland.

The concierge can order a Grab car for you if you don't have the app, but they only have one tablet they can use. So if it's already being used for another guest, then you'll need to wait until their ride is finished. Why the hotel doesn't just buy several tablets for the concierge to fix this problem is beyond me.

The hotel car service is expensive and not worth it. Use Grab instead if you can.

Conclusion: I would definitely stay in the hotel again if I ever come back to Manila, but would do a few things differently like use Grab more often and avoid room service and the spa.",Food:Comfort & Facilities:Value for money
"Most of the guests of this hotel, and those who write reviews of it, seem to be wealthy Filipinos. Being a European, I provide a somewhat different perspective.

I spent eight nights at this hotel in March. I chose it because it is close to a government office where I was doing a project, because it is five star, and because of its outdoor pool and tropical garden. Although I have been many times in diverse tropical countries, I still appreciate a hotel with a piece of tropical nature. EDSA Shangri La did not disappoint me. The pool and garden are not huge but they are nice and well-kept.

Service was excellent, as everywhere else in Southeast Asia. To a European, Filipinos seem almost excessively polite. In Europe it is hard to find a hotel (except perhaps a horribly overpriced one) where somebody will open doors for you and wish you a nice day, but this is the standard in nice hotels in Southeast Asia, including EDSA Shangri La.

I also love Asian food and the selection at breakfast did dot disappoint me: not only Filipino (which is great), but also Japanese, Chinese, and Indian. If you prefer European or US food, they have cheeses, bacon and eggs, croissants, oats, etc. They also have some (not too many) local fruits: pine apple, melon, water melon, sometimes dragon fruit and papaya. If you prefer a short life, there is plenty of fried bacon and sausages, too.

My room was large and nice, with a very comfortable bed.

The location of the hotel is also fine. The neighborhood looks nice. There is an urban train (metro) nearby that takes you downtown. There is an absolutely huge mall with nice restaurants and two large food stores.

Now, a couple of issues. Main issue: If you go to breakfast after 8:00, you may have to wait for 20 minutes, or even longer, to get a table. I have been at four and five star hotels all over the world and I have never seen such long lines outside a breakfast hall. I have read many complaints about this but they do not seem to be doing anything about it. Having to wait for half an hour to be seated is absolutely unacceptable for a five star hotel. I heard that part of the problem comes from the fact that the breakfast restaurant is open to people who are not hotel guests but I have no idea how much that contributes.

Then, come 8:00 AM, the breakfast restaurant gets so tightly packed that you may be assigned to a long table, like in a medieval European castle, where you would literally be rubbing shoulders with your neighbors. Also, navigating around the table and avoiding collisions with other guest becomes a problem. The lines in front of the popular dishes may also be exasperating. In sum, avoid rush hours for breakfast unless you don't mind waiting for a long time.

Even more irritatingly, one Friday night there was very loud music somewhere downstairs that made its way all the way to the fifth floor where I was staying. It went on after midnight. When I complained at reception the next day, they admitted that they had had some kind of party. Again, totally unacceptable for a five-star hotel to have such loud parties going on until so late and being heard five floors up!

I hardly ever consume anything between meals, but other people do, so be warned that everything at this hotel is priced like in a restaurant in central London or Amsterdam, exceeding prices at the nearby mall by at least a factor of two.

Despite these issues, I will be staying again at this hotel, for another eight or nine days, in July, and then perhaps once more in November. I hope some of the issues that I mention here will have been resolved.",Food:Location:Comfort & Facilities
"Me and my husband are frequent visitor of this hotel, everytime we’re stress and need some unwinding, we just packed our bags and stay here for overnight, it’s always a place in manila to relax and unwind. Upon check in, the receptionist is exeptionally nice and accommodating than the usual we experienced, i love how she converse and chit chat with us, very warm. But in general all the staff from the moment you enter up to the housekeeping they’re all nice. Our Heat breakfast is as always as great, superb variety of food, fast service and warm staff. This will always be our favorite hotel around the metro.",Staff:Food:Comfort & Facilities
"A great hotel with a good surrounding, clean and well laid out rooms. Very comfortable bed, excellent and wide array of food in the buffet. With proximate to two of the bet malls, it is also very conveniently located and satisfies the shopaholics dram! Overall, great stay!",Location:Food:Comfort & Facilities
"Stayed here for a 10 days for a business trip and the hotel was beautiful.
Staff are really friendly and nothing is ever too much for them.
The buffet food was nice but got boring very quickly.
They have a really nice gym, outdoor pool and a shopping mall attached to the hotel so you don’t even need to leave the grounds.

Room service was really good and food was lovely. Getting hotel cars arranged was really easy as there is a desk outside the front of the hotel.

I’d definitely recommend this hotel to others as it definitely won’t disappoint!",Food:Staff:Comfort & Facilities
"I celebrated Mother’s Day at Shangrila Edsa. My hubby surprised me a staycation and I was excited just at the thought of staying in a luxuriousl hotel. Well, my excitement easily faded when we got there but I never said a word coz I don’t want to hurt hubby’s feeling.

Remarks:

The hotel’s Pool & Lounge area was kind of small considering the number of rooms they have. Pool has nylon rope as division to accommodate those practicing a lap or something...Seriously??? Why on earth they practice in that small Pool where hotel guests should enjoy. If they are Athlete or into competition I suggest to do it in a Big Pool.

Hotel room was a bit ok, though I don’t understand why the two Double beds were almost side by side as in there’s no partition or an aisle between those two beds. Bathroom has no bath tub! For a price we paid I guess we deserved a bit.

Television reception was not good too. Has very few cable channels to choose from. Our home TV has better reception, it is much clearer.

Food was a bit pricey too.

Over all review, disappointing! I’m sorry but We are a frequent at hotels and I guess Shangrila should live to it’s name coz that name has become the basis of your price too. Sad to say Shang needs an upgrade now to be at par from it’s competitor or lower your price to avoid high expectations and disappointments.

I will not reccommend Shang, if you have a budget GO to Solaire and if you are looking for affordable but good you can GO to The Bay leaf (Gen. Trias Cavite & Aquamira Tanza Cavite) you will be surprised to see these two provincial hotels to be that good.",Comfort & Facilities:Value for money:Food
"We had attended a Seminar / workshop here and stayed in their rooms. It’s just one of the good high end hotels in the middle of the city. The room was clean and dainty, carpet looks clean and freshly shampooed. Bed and comforter is also comfortable with lovely bathroom. The hotel is about a 1hour- drive from NAIA airport with no traffic and 1.5 to 2.5 hours’ drive with traffic on a weekday. The hotel is beside two shopping malls, the Shangri-La mall that the hotel connects to via walkway, and the SM Megamall.

You must also try the Gym, Sauna, Jacuzzi are relaxing. The pool is very crowded when we get there and the other side was under maintenance, thou towels were quickly brought to us by the staff.

Overall, a positive, happy experience!",Comfort & Facilities:Location:Cleanliness
"Always been curious about the SHANGRI-LA EXPERIENCE.

This review is long over due....

SHANGRI-LA EXPERIENCE is:

1. Great service from security to staff, especially the front desk.
2. Great food.... a lot of selection.
3. Great ambiance.... nature feel with in the metro.
4. Great freebies.... free coffee and banana cake early in the morning for people on the go.

SHANGRI-LA EXPERIENCE is a must...",Food:Staff
"We enjoyed every bit of our family staycation in Edsa Shangri-La. The hotel is very accessible and is situated near two adjacent shopping mall, the Shangri-La Plaza and SM Megamall, there is also a connection to the train (MRT). We arrived at past 12 in the afternoon and we're immediately allowed to check-in, kudos to the Front Desk who handles the check-in process efficiently. The hotel rooms were renovated and is definitely a big improvement compared to our previous stay in 2013. The resort type pool area is a big plus for the hotel, my daughter specially enjoyed the water park area. The hotel has a complete line of activities for the kids (like cooking, gardening, feeding the fish, and arts & crafts) to keep them busy while us parents take time to relax in the pool area and enjoy the sunset. Indeed a perfect staycation for us. We will definitely come back:-)",Food:Location:Staff
"We booked this hotel to have a staycation themed as a Netflix Night. We’ve been looking forward to this and planning it. Problem is the smart TV in the room was not functioning. They took half an hour and several
follow up calls before someone showed up—who disn’t understand the problem and thought all we wanted was a new remote. Then after another 20 minutes someone came from housekeeping who also didn’t know how to solve it. After 10 minutes someone from IT came who ended up calling someone from Engineering. They took up more than 2 hours trying to fix it but it wasn’t fixed. Ultimately they blamed the manufacturer. Samsung apparently sold smart tv’s that didn’t function as such.

This is a small deal. But this is the kind of small deal that ruins a weekend and stains a five star reputation.

Other adisappointments- Mini bar was barely stocked, carpet needed vacumming, the room smelled stale until we turned on the AC. So not value for money. What a disappointment Edsa Shang.",Comfort & Facilities:Value for money:Staff
The place is so nice and neat. I love how they are very close to malls and some other restaurants to choose from. The place is very clean and well maintained. The staff are very friendly and accommodating. We enjoyed the pool area. 5 star for this hotel.,Staff:Comfort & Facilities:Food
One can really tell through the rooms that the hotel has been around for many years. The room is average size with the usual amenities of a hotel room. The mini bar was empty though. It was clean but the furniture and the bathroom tiles/sink are obviously old already. The hallway going to the rooms and the carpet are dark and a little eerie.,Comfort & Facilities:Cleanliness
"The decor in this place is absolutely gorgeous. Better yet, the food was both unique and exquisite. To top it all off, the service was superb. All around a great experience and one that I would highly recommend to all!",Food
If you have business in this area I think it's a super place to stay. The lifts do get crowded in the evening and the room furnishings need some work. The lobby bar is always buzzing and the service all over is quite good. Room service is prompt and this is the first place I have stayed in where they offer in room massages to 3AM. If you are a smoker do remember there are no smoking rooms in the Philippines and in this hotel to smoking area is quite a long walk. Good incentive to quit ;-),Comfort & Facilities:Cleanliness:Food
"The Edsa Shangri-La is not the newest hotel in Manila and its location isn’t prime, but it offers the perfect place for a staycation with a literal oasis of the swimming pool and trees amongst the hustle and bustle of Ortigas. I have stayed in this hotel more times than I count and have never had a bad experience, although only just got around to reviewing it now.

If you are flying into Manila and are staying at the Edsa Shangri-La then chances are you either know someone in the area or you are coming on business. The hotel is about a 30-minute drive from NAIA airport with no traffic and closer to a 1 hour 30-minute drive with traffic on a rainy Friday night. The hotel is flanked by two malls; the Shangri-La mall that the hotel connects to via walkway, and the SM MegaMall a short 3 minute walk from the hotel lobby. Outside of the two malls there really isn’t a lot in the area with Ortigas being the old business district with most modern businesses and hotels being in the Makati and Manila bay area.

Hotel check-in is usually very swift, I don’t seem to recall a time when I have had to wait more than a minute or two to have my details taken. Of course, the check-in staff process everything very quickly and you will have your room key before you know it.

The hotel reception is very grand, nice and open with large chandeliers hanging from the ceiling with the 24hour hotel bar stretching across the back of the reception building. There are two wings to the hotel but after being refurbished a year or two ago there isn’t too much difference between the rooms.

The rooms themselves are an ok size. Far from the largest that the most recently built Manila hotels are now offering, but certainly not small enough to complain about. Despite the hotel being fairly old the rooms have had a refresh and for the most part are in good condition and don’t look overly tired.

The absolute gem at this hotel for me, and why it is perfect for a staycation, is the pool area. Which in my opinion is the best hotel pool in Manila besides the sprawling Sofitel at the bay. The pool is nice and large with an entirely separate kids pool off to the far side so that those with families don’t bother those without. The pool bar has ample seating and some TVs which makes it perfect to just chill out and have a beer but be warned that they close infuriatingly early at around 10pm on a weekday and 11pm on a weekend. The staff will, thankfully, allow you to order some drinks and sit out after the bar has closed should you wish to chill to the early hours of the morning. The pool bar menu is as you would expect and also offering a selection of pizza’s that are cooked in the oven right there in front of you in the pizza oven. What also makes this pool area feel like a real oasis is the plant life and trees which are so very welcomed in this concrete grey area of town, but that also comes with a lot of mosquitos! Be very sure you bring mosquito repellent with you if you plan to sit outside after dark.

The hotel houses four restaurants excluding the pool bar. Chinese, Japanese, Italian, and the standard hotel buffet restaurant are all present, if memory serves me correctly. As you would well expect from a Shangri-La the service is impeccable and the quality of food no matter your choice of cuisine is high.

Check-out is usually fairly straight forward but be sure to pre-book a hotel car if you are travelling back to the airport as the local taxis don’t come into the hotel lobby too often and even if they do you’d probably not want to take one all that distance.

If they just opened the bar area a little later each evening, then I don’t think I would ever leave.",Food:Comfort & Facilities:Location
"Pick up service at the airport should be improved. Guests are expected to look for them instead of the other way. Unclear email direction. Instruction directed the guest to meet before gate 4 but they were standing at gate 5. At least good 5-10 mins wasted trying to search for them and waiting for the transport to arrive.

Other than that, Shangri-La never fail to meet my expectations. Check in service was seamless, gym facilities, pool and room are great.",Staff:Comfort & Facilities
