Opinion,Classification
"Our stay was very pleasant and superb. From the time I made reservations via phone for my Mom's birthday, to the time we checked in and the time weg checked out. Everyone was very accommodating and nice!",Staff
"I stayed at Shangrila EDSA. I know it's one of the best hotels but did not know how the staff would be or how they would react to my request of opening the gym for my use at 0500 hours. To my liking and surprise, the Reception Desk Staff radioed the Security on duty and asked to open the gym. Just like that!!!
I wished I had gotten the names of the staff but I was so excited each morning I was using the gym that I forgot to jot down their names. I had stayed in various hotels in the Philippines with gyms and they adhere to the 0600 opening! With a tight and hectic schedule, it is important for these hotels to do just that.....cater to guest's request!!!
I would like to thank the Reception and Security Staff for honoring my request each morning (five days)!!! More power to you people and you just proved that ""It's More Fun in the Philippines""",Staff
"Coming to this hotel is like coming back home. Some hotel staff have stayed there for a number of years and this gives a feeling of familiarity every time I check in. The hotel take feedback very seriously and one time I gave a negative feedback on their coffee and the next time I had breakfast at the Heat, the restaurant manager approached me and asked how I like my coffee. The hotel is undergoing some renovations right now but I was never disturbed during my stay. The hotel lobby has this wonderful scent and I really appreciate this. The hotel is connected to a high end shopping mall, Shangri-La Plaza and in front is another huge mall, SM Megamall. There are many restaurants in these two malls. The hotel itself has some nice restaurant and I specially like the Japanese and the Italian ones. The buffet restaurant boasts one of the best selection of food: Filipino, Western, Japanese, Indian, Chinese. It is not Halal. The guy preparing the eggs actually recognizes the regular customers.",Food
"From the time I was picked up from NIAA to the time I sadly left, the service was first rate, and that didn't matter who you were dealing with.

Restaurants, Bar Staff, Reception, Horizon Lounge, Lobby Lounge, E Bar, Italian, Chinese, Japanese, Heat, all a great experience, and moods to suit everyone from busy friendly Heat, where people come to celebrate events, to classy quiet Italian, good food, good service, and a great atmosphere.

Rooms are well furnished, and parts of the hotel are going through Aircon upgrades, with disruption kept to a minimum.

Nothing is too difficult for the Team here, even if they are busy, they are pleased to stop what they are doing, and assist you, their focus is you, when you need it, and not when they are ready.

Plenty of shopping nearby from high end department stores Rustans, fashion, sports, jewellery, if you want to be swamped by a huge Mall, then a 2 minute walk will take you along to Mega Mall, and yes the name says it all, then you have Podium (High End) and a little further along, there's Galleria.

Plenty of local and major chain restaurants nearby, so if you're there for business or vacation, plenty to see and do, and the hotel has its own vast swimming pool, waterslide, and next door it has a super spa.

I cant wait to get back there again, even if its just for coffee!!

The staff in the Horizon Lounge on ALL 3 shifts are brilliant!!!!!!!!!!!!!!!!",Food:Location:Comfort & Facilities
"They have everything that you will ever want for breakfast! What a choice!!! And all yummy!

The Executive room is impressive as it is on the higher floor and just recently renovated.
Very very clean.

The hotel is undergoing refurbishment when we were there - - - but we did not hear any noise!!!",Comfort & Facilities
"I don't think I've ever gotten such a great service as I got in this hotel. Everybody was so nice and helpful!

The hotel is beautiful with a grand entrance. My room was well...roomy with very comfortable beds. I arrived at 4am after a 20 hr. flight - btw...a driver from the hotel picked me up and the service was wonderful...he immediately offered me a bottle of water which I really needed! Anyways, once I arrived at the hotel, I decided to stay up so I could have breakfast. And what a breakfast buffet it was! It had all sorts of different types of cuisines (Indian, Filipino, Japanese, Chinese and lots more), delicious fruits (I ate like a pound of mango every day), eggs in various styles, the usual breakfast meats (bacon, sausage, etc.) cereals, breads, juices. That buffet was great and except for one lunch which I enjoyed in one of the cafeterias in the hotel (it was just OK), I had all my meals there (dinner in the buffet was another extravaganza of foods and flavors.)

I stayed 4 nights and worked US hours (night in Manila) so I didn't get to see much of the area around the hotel, but what I saw wasn't as nice as the hotel. Guards would check every car that came in front of the hotel with dogs (looking for bombs, drugs or weapons, who knows.) Not sure if this standard for every hotel of this type in Manila or if it was just during this time but everybody was official about it. After the initial surprise, I got used to it.

I made time for one of the city tours but it wasn't worthy. Traffic in Manila is horrible so getting to Intramuros took most of the time and we didn't even stay too long. So basically you spend all your time trapped in traffic with the driver pointing out a few buildings here and there. I wished I spent the time at the Spa instead.

The hotel is completely recommended though!",Food:Location
"Piece of Shangrila

The last time I stayed at Edsa Shangrila was in 2005, and going back for a convention indeed stirred good memories and happy ones too. It was all too familiar, since I have stayed and visited since 1992, remembering Harlequin Disco. The checkin was a breeze, the staff was courteous and they greet you everytime unlike before. I would have loved to be billeted in the Garden Wing, and the room I was assigned was the old one destined for renovation. Despite this since I would be in the convention during the working hours of the construction was a fine arrangement with me.So they do need to renovate, as the room should be updated with regards to decor, the old furnishing appeared outdated because of the amount of space it occupies. The corridors could alo be jazzed up with a new coat of paint. The bathroom needs fixing too,but they dont scrimp on the toilettries. I""ve had a very excellent stay despite the "" old room"" and had a restful sleep. The new bridgeways connecting to the malls was also very helpful. I would still highly recommend to my friends to stay at Edsa Shang.",Comfort & Facilities:Staff
"This hotel has a convenient location in the center of Metro Manila and gives value for money. Good service and interesting food outlets, one of which has one of the most extensive buffet selections in the city",Food:Location:Value for money
"I am a business traveller. Nothing better than a great perk of having a fabulous breakfast on the company. The Edsa-Shang without a doubt has the best buffet in Asia. There is everything on this buffet from fruit to Indian curries to Chinese noodle soup.
I am a business traveller but the hotel is very family friendly and a nice swimming pool.
When reserving definitely stay in the Garden Wing on the Horizon Club levels as these are the best rooms for not much more.",Food:Location
"Best hotel in Manila. Very comfortable. Guest services are very well done. Good food, multi cuisine and warm service provided by hotel. You must try the gym as well. Nice spa and massage center. Definite recommend.",Food:Staff:Comfort & Facilities
"I just completed a two week stay at Edsa Shangri-La on a business trip, and must say it was a pleasant experience. The hotel is undergoing a renovation, as was explained to me upon check in, and I was given one of the already renovated rooms. The downside to this renovation work is the noise generated. This normally wouldn't be such an issue; however, working nights in Manila in order to match daytime hours in the US requires days for sleeping. Fortunately the staff does a good job at minimizing any disruption, and this was only an issue on two different days. The room itself was quite comfortable, and the blackout drapes worked wonderfully! The bedding is definitely some of the most comfortable I have encountered anywhere. The renovated bathroom had a large walk-in shower with seat and both handheld sprayer and rain shower shower head above with simple controls for each, as well as a bidet-enhanced seat on the commode. Check in and check out were both handled efficiently, and front desk staff were courteous and attentive. Currency exchange (albeit at lower exchange rates) were also offered at check in. General hotel staff (bellman, porters, concierge) were all outstanding, and I don't believe I opened a door, carried a bag, or called an elevator once. US hotels could stand to take a page out of this book!

As for services within the hotel, my review is a tad more mixed. Staff at the food establishments within the hotel offered a mixed bag of service. The woman who seemed to almost single-handedly run the small bakeshop in the lobby was wonderful. She was attentive, polite, and extremely helpful. The attendants at the pool were amazing, even proactively remembering who the members of a group were, and setting up lounge chairs as additional members walked towards the pool area.

The staff at the pool-side lounge / bar, while extremely polite and friendly, seem to have difficulty with the correct preparation of orders. On several occasions (at least 5 during the stay of 14 days) they made glaring mistakes in orders (as an example, serving a ""Hurricane"" that was only orange juice and crushed ice, completely omitting even the alcohol, or a tequila sunrise that ended up being tequila, grenadine and Sprite). This is probably the one area in which the biggest improvement could be made.

The hotel's buffet restaurant, HEAT, had a good selection on the breakfast buffet; however, the staff often seemed disorganized, requiring several reminders for various drink orders (coffees, lattes, etc.). Also, a bit more variety in the actual offerings could be useful. Since I believe room service is also provided through HEAT, I will include it here as well. There could definitely be some improvements in this arena as it relates to accuracy. Steak salad ordered was missing the dressing, and even when asked about this, the server said it was on the salad already (it wasn't and was extremely dry just by sight).

Overall, outside of the few exceptions mentioned, the Edsa Shangri-La was a fantastic experience, and still outshines many of its counterparts in other parts of the world. I would definitely recommend it, and will stay here again on my next trip to Manila.",Staff:Comfort & Facilities:Food
"An absolute pleasure to be in this hotel. The lobby is breathtaking and the spa experience unique. Its not inexpensive, but well worth it--the spa is truly impressive. My room was in the Garden wing on the fifth floor in front of a yoga studio; extremely peaceful. Beautiful room.
I played tennis with the hotel coach and had a very pleasurable experience: cold towels and cold tea mid way through the game. Ball-boy, of course!
I had heard of the buffet breakfast and it did not disappoint: wide, wide variety and excellent service.",Comfort & Facilities:Food
"Edsa is located as an oasis around two bustling malls: one mall linked directly to the hotel with a walkway. The huge hotel had a lot of personalized service which deserves special mention. I am a vegetarian and twice the chefs (at Heat) went out of their way to prepare a vegetarian dish (even suited to the Indian palate). The room was fairly large, very comfortable and stylish, with a modern chair and desk fitted to ergonomics; and lots of storage space. There was even a small stationary supply in the drawers, very impressive detail. The check in and check out was a breeze at the Garden Wing reception area, the other area being very busy. Impressive standards being such a huge hotel. Would recommend.",Comfort & Facilities:Food:Staff
"I stay at the EDSA Shangri-LA twice a year for 2 weeks at a time. The rooms, service and dining have always been fabulous. The gym is great, but it does not always open on time in the morning. The connection to the mall is safe and easy to locate and manage. I appreciate the staff and their welcoming attitude. I always feel safe inside the hotel. I agree with others about the 2nd cup of coffee....order well before you need or just ask for a large carafe.

Generally, I wish they had a good way to deliver a large carafe of coffee in the morning, every morning at a specified time.

Will definately stay again.",Staff:Comfort & Facilities:Food
"A great hotel in Manila. Although checkin and checkout is cumbersome (as some other guests with us found- the staff gets distracted in their own conversations); it has great lounges, a very nice gym/sauna area; and an excellent dinner and breakfast buffet at ""Heat"". I am not a buffet fan, but all the food is prepared in front of you, super fresh and what a variety! You can also do a wine buffet- variety of reds, whites and champagnes, with your meal.
The Horizon Lounge is very nice for meetings and evening cocktails.
The staff in the business center is extremley helpful- thanks Christina for all your assistance.",Food:Staff
"Service has gone down, staff rather chat away in the coffee house rather than serve the customer during breakfast, my green tea never came after asking twice...i just finished m breakfast without any drink.",Food:Staff
"This Shangri-La hotel is my favorite among their ""branches"". It's the most spacious, with really nice and clean rooms, and the best service ever. Their room service is always great, and the staff are always eager to please and will go out of their way to help you even if they are on something as well.

The food is so-so in quality, similar to what other hotels have (like the Makati Shangri-La or The Peninsula etc.), with a smaller spread compared to others. The rooms though, while being clean and nicely furnished, are a bit on the old side, and don't look as stylish or modern. The function rooms are great though, since they have many, depending on how many guests you have.",Comfort & Facilities:Cleanliness:Staff
"I had the frustrating pleasure of spending two months at the Shangri-La for work. If you are one of the many people going to Manila to work nights. Save yourself the aggravation and stay at the Oakwood where they specialize in day sleepers. If you are a night sleeper or a tourist, you will love the hustle and bustle and beauty that is the Shang. The staff are lovely, really the kindest anywhere. Food service is slow, ask for your second cup of coffee long before you want it. If you are a long term guest they treat you to socializing events to help meet others. Beautiful pool but again, if you are exhausted, there is no energy to get into it! The sauna was broke the whole time I was there but the steam room was lovely. The spa is the best in the world. If you use Avis, watch your bill carefully.",Comfort & Facilities:Staff:Food
"The hotel ensures that all the Managers and key staff know your profile and are attentive to details from the time you check in to the time you leave the hotel. The hotel is efficient and business like, but also very friendly and goes out of its way to attend to all your needs, however small and insignificant they might be. The Hotel is located around Edsa and this provides a lot of shopping and restaurant options in its vicinity. The rooms are nice and the amenities offered are of good quality. The hotel's General Manager Mr.Patrick Schaub is an excellent host as are his managers Joy Reyes, Maricar Ocampo and Joyce Pascual and their respective teams.",Staff:Food
"absolutely beautiful place. first class service, food, drinks. we were treated to this by a family member so I don't know the expense. the staff were in blue livery. if you have the means to afford this, I highly recommend the Shangri-La.",Staff:Food:Value for money
"Arranged for a hotel limo pickup from the airport and though it was a Toyota, they provided wifi in the car, which was cool. Reached the hotel in 30min and had the check-in in the hotel room. Passed by the grand lobby and it was typical shangri-la with the lobby bar overlooking a garden and waterfall/fountain. Check-in was ok and I also requested for the limo to the airport upon check-out

The king bed room I requested for ""wasn't available"" and i got the ""newly renovated"" room with twin beds instead. The room was ok, with my required flat screen tv and shower stall. On closer inspection, I found a giant tear/hole in the lounge chair. New room but old chair? The corridor also has the annoying smell of carpenter glue from the renovation. The wifi however was free and available throughout the hotel

Probably had a large tour group at breakfast on the 1st morning and guests actually had to queue up to get in! Not an experience you'd want if it's the shangri-la and you paid 10,000 pesos per night for. The 2nd morning was better but the tea and newspaper I asked for never came. Hmm

The gym front desk was friendly and gave individualized sets of water and towel. The gym itself was ok and the equipment was old. The male trainer on the 1st day was unfriendly and the female ones on the 2nd day were better. The staff in the sauna was also friendlier than the male trainer

The gym had a nice garden design and the staff were friendly

I went to the Japanese restaurant with high expectations as it was the Shang after all. The front desk was not manned and I waited. Stepped into the restaurant and waited. Finally caught someone's attention and got a seat at the sushi counter. The chefs were local and friendly. Had their training locally and found out some of the fish was imported from Japan and the rest local. Ordered a sushi set and was disappointed. The quality was just not there for a premium hotel

The next night i naturally skipped the Japanese and decided on room service. Excited about the laksa noodles as it was listed as a menu special and it's one of my favs. Oops wrong decision again, it turned out to be blah and not authentic tasting

The lobby bar in the evening had a singer with a pianist and it was pleasant , if not mundane

1 morning i called for laundry pickup. 30 mins later and nothing and I called again. Another 30mins later and nothing again . I called for the 3rd time and tell them I was leaving for a meeting and hoped they will take care of it while I'm gone. Luckily they did

Remember the limo I ordered to go to the airport? I didn't take any chances and called concierge the night before to confirm. and guess what, they didn't have my reservation. Double hmm

So overall, there are flashes of brilliance but their missteps far outweigh what they're trying to achieve. The shangri-las in shanghai, Singapore and hongkong are miles ahead and truly represent the brand. I'll be back in November and hopefully my 2nd stay will be better",Staff:Food:Comfort & Facilities
"Stayed for two weeks during a business trip. Everything was absolutely top-notch. Service was unbelievable, room was awesome, amenities were perfect, pool was great, and the breakfast each morning was the best I've ever seen. I just can't think of anything bad to say about this place. I wish I could stay there forever!",Comfort & Facilities:Food
"The staff are soo kind and attentive. There was an incident wherein when we requested for room transfer my son left his wallet in our previous room, immediately the housekeeping staff turned it over to us upon discovery of my son's wallet.

I love the fresh smell, especially the grandiose Lobby area wherein you will see fresh beautifully arranged flowers.

There are a lot of food choices in Heat Restaurant. Indeed an EXECELLENT HOTEL !!!",Staff:Food:Cleanliness
"spent three nights at Edsa Shangri-La while travelling to Manila on business in the past week. I was met at the Airport by the Hotel staff and taken to their lounge right outside arrivals area at Terminal 1 and sent off on the Hotel Transfer within 5 minutes. Upon arriving in the hotel, A staff met me at the entrance of the hotel and directly proceeded to the room and all the check-in formalities were conducted in the room itself. The whole process was so efficient that I was actually in the Hotel Room within an hour of landing in Manila.

I was provided with a newly renovated room on the 17th floor. It was extremely comfortable and offered all the necessary amenities for a very comfortable stay. The bathroom was definitely small in size in respect to hotels today. All the staff around the hotel were very accommodating and extremely courteous.

I had breakfast at Heat each morning and also had dinner at Summer Palace. The Buffet Breakfast is what you would expect from a Shang!! Very diverse and catering to a large spread of choices. The Dinner at Summer Palace was extremely good and my business associates and myself totally enjoyed the experience. However, for some reason, the waiters were taking an awfully long time to deliver any beverages that were being ordered through dinner.

I plan to definitely stay at Edsa Shangri-La for all my future stays in Manila. Definintely a top-notch Hotel!!!",Food:Comfort & Facilities
"I travel to Manila 4 or 5 times a year and always try and stay at the Edsa Shangri La as it is close to my office and away from the tourist area of Makati.

The pool area is very nice and spacious, with a nice bar area and you can order bar food - I recommend the club sandwich !

The staff are incredibly friendly and will do anything for you.

Rooms are spacious and kept clean, with the aircon working efficiently and the curtains and blackout shade allowing you sleep during the day if working European or US hours (i.e. during the Filipino night-time)

My one and only ""complaint"" as such, is that if I am working European or US hours and taking breakfast in the afternoon, you cannot order anything from the breakfast menu and the lunch menu has nothing on it that you could call breakfast. So I usually grab a couple of croissants from the coffee shop or hit a local Starbucks.",Food:Comfort & Facilities:Location
"This was my first trip to the Philippines (On Business) and this hotel was recommended to me as a 'must stay' when in Manila and it certainly didn't disappoint.
I arrived at the airport and was met and shown to an awaiting hotel car. First impressions are so important and I thought that they had really hit the mark as I soaked up the air con and free wifi driving in comfort.
When I arrived at the hotel I was a little concerned by the building being constructed next door but my fears soon evaporated as I stepped out of the car and was warmly greeted by one after another of the smartly uniformed hotel staff. Before I knew it my bags had been collected, the door was opened for me and then I was being escorted by one of the check in staff to the reception area. Reception was a breeze and moments later I was in my room with bags arriving shortly after. (Not once during my stay did I hear any construction noise).
Breakfast the following morning was outstanding offering a huge selection in a very nice setting. Next stop was the gym. I'm usually very critical when it comes to hotel gyms as they usually consist of a few treadmills, a cross trainer or two and a couple of multi purpose machines but this gym was something else. It was big and had something for everyone including a great range of free weights. Then there was the service. From the towel and bottled water on arrival to the personal trainers who were so very helpful. Going to the gym just hasn't been the same since I left.
I found the location excellent with two malls just across the road providing great shopping, entertainment and plenty of places to eat. Travelling anywhere in Manila is difficult in the crazy traffic but for me the location was perfect.
The pool area was very nice and again the service was outstanding. I had no sooner walked out the door when I was being shown to a lounger on which towels were being placed and my drink order taken.
The inside of the hotel is very grand with lots of marble, an impressive entrance and wide open hallways. The room and bathroom was great with everything you need. It was clean and the beds very comfortable. To be honest the room wasn't really my style as I prefer modern decor tending toward the minimalist look but at this hotel I didn't really care. I was just happy to be there because the service was so good. Don't get me wrong this is not a complaint. The decor is very nice - just not my style.
As part of the package I had booked I received complimentary airport transfers, breakfast and unlimited laundry and dry cleaning. It was a great deal. The only negative that I could find was that on check out I had been charged for transfers and laundry. It was 5am so I was a little slow but when I pointed it out to the clerk he was very apologetic and removed the charge immediately. I always take time to check my bill on check out as many hotels get it wrong so it wasn't a problem for me. Once sorted I jumped in the hotel car with the packed breakfast they had prepared for me and headed for home looking forward to the day that I could return with my family so that they could experience this exceptional hotel too.",Comfort & Facilities:Staff:Food
