Opinion,Classification
"Can't really comment on the rooms as we just held an event here. From our experience, everything was on point except the service. The wait staff were nice, but poorly trained. Service took unusually long, which is definitely not something you want when you're hosting a business forum.",Staff
"Horizon Club spoiled our stay.

Booked a club access floor and discovered restrictive policies on dress code and prohition on children during cocktail hours.

Lack of alternatives and initiative to present these made it worse.

Staff seem ""entitled"" to something. Appeal to some sort of target market.

Horrible experience over-all. Not recommending to families.

""Weekend treat"" offer did not match expectations of a relaxing weekend.",Staff:Food:Comfort & Facilities
"The hotel lobby is not so impressive compare to the other two Shangai-la in Manila , but the accommodation is really the best you can get in Manila.
The amenities in the rooms are great definitely I will be back .
The staff are really very friendly and attentive to any details.",Comfort & Facilities:Staff
"this is a really high-end 5 star resort hotel in a very central location in Manila. The room was incredibly spacious and luxurious, and had everything we needed. The sports facilities are truly epic - three floors including multiple pools, squash, tennis and basketball courts and a huge gym. The breakfast and evening buffets were really very good too. Highly recommended!",Comfort & Facilities:Value for money:Food
"Shangri-La never disappoints, whether here in Manila or in other Asian cities.

Their newest offering at the Fort is perfect for families, where kids can spend an entire afternoon just playing at the pools (three in all).

Its location also offers close proximity to several dining options within the building, or along nearby High Street.

The rooms are spacious and elegantly decorated, with its muted beige and neutral colors.

The only critique I have is the underwhelming lobby. This was my niece's first comment when we first entered to check in. It isn't as grand as the lobbies of its predecessors (Makati and EDSA).",Location:Comfort & Facilities
"I had a standard room which was decorated in a calming, relaxing way, with plenty of space.

The staff gave a very warm welcome throughout the hotel - reception, concierge, bellboy, wait-staff, security, housekeeping, etc

Security was a bit over the top. I know it is fairly standard in this city for your car to be stopped before entering the hotel grounds to be checked by a small troop of security guards and dogs. That happened. And then when I was out of the car I also had to put all my luggage through an xray machine and walk through a metal detector. Well, when I say all of my luggage, my suitcase was too big (despite being a fairly standard medium sized suitcase) to fit through the aperture of their xray machine so they had to take a risk and let me in with it without it being xray'd.

The pool area has cabanas and sun loungers. It isn't exactly a secluded spot though as it is overlooked by several neighbouring office buildings. These buildings also provide shade from the sun so not ideal for those seeking a bit of sun exposure.

On check-out I was asked if I wanted a car. Knowing the hotel has its own car service providing superior cars for a vastly superior fee I politely declined and asked the concierge to order me a regular taxi. It was at a time of day and with weather conditions that conducive to taxis being readily available. .....and in Manila it doesn't matter what car you are in, if there is traffic en route to the airport you will be stuck in it!

The block on which the Shangri-La sits is still a building site. The hotel side is ostensibly complete although some shops/restaurants outside are still to open. The other half is still very much under construction.

It is a good location though. On a good day, you are perhaps just 15 minutes drive from T3 of NAIA. You are a short walk from Bonifacio High Street with all its shops, restaurants, cinema and random events on one side. On the other side of the hotel is the Mind Museum and then Burgos Circle, another area for restaurants. It is also just a short walk from St Lukes Medical Centre, one of the better hospitals in the country.",Comfort & Facilities:Location:Staff
"The Shangri-La at the Fort is another strong addition to Shangri-La's portfolio of hotel in the Philippines.The hotel is quite new and is in excellent physical condition. The staff is amazingly attentive, friendly, and service orientated. The rooms and facilities are luxurious.

I was only able to eat in the main restaurant (High Street Cafe), the associated lounge (High Street Lounge), and the gym. All three were quite good. The main buffet (in HS Cafe) is perhaps smaller than in other Shangri-La, but is very high quality. I did not try out the three specialized restaurants-- they are pricey but seem promising.

But as a new hotel, it is still working out a few minor edges. The room service menu is relatively limited compared to the food available in the main restaurant; with time, this will improve. Likewise, some service requests were a bit slow, such as requests for ice. Others, such as printing out documents, were remarkably efficient.

The location is excellent, in easy walking distance to a number of restaurants and stores. It is generally easy to a call a car from Uber or Grab and there are also a lot of taxis available on the street. Market Market and SM Aura are within walking distance.

I stayed here for almost three weeks and I would not hesitate to stay here again.",Food:Location:Comfort & Facilities
"I would have rated this hotel 5 stars without hesitation but for two incidents. I stayed at a one bedroom suite at the Residences for 9 nights. The room was beautiful and designed for the comfort of the guests. However, the a/c broke down during the middle of the night and it took a whole day to fix it. I had a few guests that day and unfortunately, we were perspiring during our meeting. The following night, I found a cockroach in the bathroom. The staff came to clean immediately but J believe that a 5-star hotel of this quality and price should ensure that these things don't happen. Lots of apologies were given by the staff with a bottle of wine and chocolate cookies. Not sure I can get over the cockroach experience as it was pretty disgusting!",Staff:Cleanliness:Value for money
"Great rooms, lovely hotel, drinks in the lobby are amazing. Had a smashing stay! If you stay in Manila stay at the Fort. The swimming pool area at Samba is gorgeous. There is some building work around however that can't be helped.",Comfort & Facilities:Food
Finished three days at this hotel. Excellent choice for being in the middle of conveniences. So fast to and from airport. Suggest their car service. It is beside a ton of restaurants and bars. One of the best fitness clubs in the world as part of the hotel called kerry sports. And the cutest little spa hidden away on same floor where i had an amazing treatment. Will definitely book here again for all of my meetings.,Location:Comfort & Facilities:Staff
"Natural, genuine, caring staff. Great rooms. Very clean. Good location in the BGC - close to multiple restaurants and very quiet. The area is safe (you actually walk through a security scanner when you enter the hotel). The bed was MASSIVE and really comfortable. Would definitely go back.",Location:Cleanliness:Comfort & Facilities
"My family enjoyed our stay here. We had two adjoining rooms. The highlights included the following:

1. It was central to the places that we wanted to see.
2. There are numerous eateries in walking distance, such as our favorite global dim sum restaurant, Din Tai Fung, which is situated across the street. Lots of shopping is also nearby on High St.
3. 24 hour access to a fantastic gym called Kerry Sports, which includes a full indoor basketball court that my family enjoyed.
4. The buffet breakfast in the High Street Cafe was delicious. The quality is what you would expect at other Shangri-la properties.",Location:Food
"This hotel is fine if you have money to waste but if your looking to get your money's worth Ascott across the road looks nice I haven't stayed there yet but Shangri-La is trying to sell a fake 5 star experience lol it's like a business hotel but with bells and whistle no one has no idea on what they are doing or how to manage a hotel.
Hotel deco- clean and plain no real character no feeling kinda like walking into a shopping mall.
The location is nice it's in the middle of the fort close drive to makati and you can walk around the city to restaurants.
Service - rubbish
Food - it's ok, the high tea is no good, cocktails average, buffet is ok.
The rooms - clean and modern quiet relaxing i heard ppl complaining about construction noise I didn't hear anything.
The gym - this is the only thing worth stay the gym is amazing it has a basketball court and all the only annoying thing is they have off premise customers so a lot of the machines will be full or the basketball court will be booked which means it's not really for the customers but it's worth checking out.
Overall I am going to check out the ascott next time if your here for business it's fine but I feel sorry for anyone on vacation I would be really annoyed with the lack of professionalism.",Comfort & Facilities:Location:Food
The hotel is new and beautiful. I am assuming once it has been open a bit longer the negatives can be polished and the hotel can reach the standard it has the potential to be. I stayed for 14 days for a business trip-working evenings. The hotel ask at check-in what time you would like the room cleaned. I do not know why they even bothered because almost everyday they came in the middle of the afternoon. I had to make sure I kept the do not disturb light on. They certainly did not pay any attention to my request or my other co-workers. The mini-bar was not kept stocked even when I would call down to request. I had to change rooms due to banging from construction. You would think if I had advised I had to sleep in the day they would not put me in a room that had construction going on in the room beside and above me. For that matter if you are staying at this hotel who wants to be subject to that noise anyway? I came to my room one day and my window had been opened. I had to call to have one shut it because it required some type of tool. Unsure why they would open a window on the 29th floor. Our first night at the hotel we went to the Café Lounge for a cocktail. We were welcomed by a mouse that was running around the floor. I know there are rodents in the city however I do not think it is ridiculous not to expect to see them in the lounge. The food was very good. My only disappointment would be in a high end hotel and they are preparing something at a buffet and it will not be ready for 10 minutes. I think it is very rude for you to be asked to come back. It should have been delivered to the table. I also think the same about the omelet bar once ordered it should be delivered you should not be expected to stand around and wait.,Comfort & Facilities:Food:Value for money
"We had a good time for our family staycation at Shangri-La at the Fort. Upon check-in, the staff are all attentive and ready to assist. Checking-in and out was a breeze, the reservation was accurate and as requested we had an adjoining room.

The grandness of the hotel is already visible upon entry. The wide spaces and grand chandelier is there for everyone to feast their eyes on. The modern elegance of the hotel can be felt from its service down to its people. The rooms are spacious and amenities are complete, the basics are covered. Though I was hoping that all rooms would have better coffee (like a Nespresso or equivalent machine). One minor hiccup on the room is that since the units are still fairly new there may be a certain sting to your eyes when you enter in it but it eventually lessens and fades after some time. To hasten it, you can ask for an ionizer from housekeeping.

Location here is excellent. Just a walk away is Central Square (a small mall) for your retail therapy and food offering is abundant at Bonifacio High Street. It is very convenient if you are just looking to roam around the area.",Comfort & Facilities:Staff:Food
"Stayed for a week on business. Beautiful hew hotel with a fantastic gym; one of the best I've seen. Food is expensive even if it's going to be claimed back on expenses. The staff are great. But the hotel lacks soul and it urgently needs a proper bar, as opposed to the High Street lounge or the Raging Bull.",Food:Value for money
My very first time staying at a Shangrila hotel chain. It happens to be one of the newer hotels by Shangrila located at the fort in Bonifacio Global City. My main reason for the stay is to attend my cousins wedding. This was her venue for her reception. The location of the hotel is in a very convenient area where shopping stores and restaurants are just across the street. My room was excellent and the view was amazing. I enjoyed the breakfast the most due their wide variety of food choices. I looked forward to that every single morning. I also got a chance to check out their pool area which is overlooking the city. It was very nice and relaxing. The staff were very friendly and always accommodating. I would definitely come back here again.,Location:Staff:Food
"New and more modern than Shangril Makati. However I think the lobby is much bigger and the buffet breakfast has a wider spread in Shangrila Makati. Service as expected is excellent. Also if you need to be in BGC than better to book here since traffic in Manila is terrible. A 3km drive would take about 45 minutes!

Also the view is bad even if my room was on the 36th floor. Try to get a room facing BGC and not the other side.",Food:Location:Comfort & Facilities
"The car service from the airport to the hotel is awesome. It is easy to spot the Shangri-la team with their red jackets. The car/SUV we had was beautiful and well equipped. Our driver was service oriented and great. The hotel is just beautiful. Every little detail was well thought out. The rooms are beautiful and large. The bathroom is all marble with an awesome rain shower head in the shower - best shower I've had. There is also a large soaking tub. The bed is luxurious. A la carte restaurant has great options, and the buffet is divine with such a large selection of food. Service is a little slow. The sitting area has great service and nice options for casual drinks and dining. Shopping is right around the corner. Really liked the hotel and would stay again.",Comfort & Facilities:Food
Hotel did not live upto a 5 star hotel experience where the staff would go the extra mile for its guests. Left a lot to be desired. Guests Feedback was not acted upon. Did not get the attention that guests expect from such a hotel and the price tag for its rooms,Staff:Value for money
"We enjoyed our overnight stay at this lovely hotel. All the staff were very attentive and friendly. Tried their afternoon tea at High Street lounge too and we loved it! Our room was spacious and luxurious from ceiling to their flooring. This hotel has the biggest gym (2 floors) complete with basketball court, swimming pool etc..we also tried their club lounge (adults only) during cocktail hour and skyline view was gorgeous! Food selection were very good. They sent to our room a personalized greeting card and cake for our wedding anniversary that night. Really appreciated it! Another plus of the hotel is that central square mall is just behind it.",Comfort & Facilities:Food:Location
"I had an amazing stay in this hotel, especially that almost all of my expectations were met. Staying during one of the holidays, I expected a longer processing time for check-in as the queue was quite long. But, it only took me around 10 minutes from queuing to receiving my room key. Not to mention, that the receptionist was friendly and very accommodating to my requests.
Being one of the newest hotels in the area, the twin-bedroom that we stayed in was on its almost-perfect state - very clean, well kept, sufficiently lighted and ventilated, had comfortable sheets and pillow. The toilet was spacious too.
Aside from having a great location, good service, and best meals, Shangri-la at the Fort even has the best amenities that a hotel could have: high-end equipment at Kerry Gym, pools with great views, indoor basketball court, tennis court, to name a few.

I really had a memorable stay and would definitely come back.",Comfort & Facilities:Location:Staff
"This is my preferred hotel for business stays in Manila. It's beautiful, new and luxurious. Staff are friendly and rooms have everything you need. Love that I can walk to my office 2 blocks down and so many food options around. Always a great stay and the Shang at the Fort.",Location:Staff:Comfort & Facilities
"Tried out the 'new' Shangri-la hotel after hearing many good things about it. The service was efficient and the staff were very accommodating and personable. Only got to try the High Street lounge and cafe for midnight snacks and buffet breakfast respectively. The food and service again is as expected for a hotel of this stature. The location is a plus, for those who would rather avoid the hassle of staying in the main CBD.",Food:Staff:Location
"It was a great great experience! The hotel's features and facilities were world class! Amazing! The staff were very accomodating, pleasant and hospitable especially Albert of front office. He was knowledgeable of the features of the room i got and encouraged me to try their club on my next visit. And will definitely go back for that.",Staff:Comfort & Facilities
"Stayed here to celebrate the new year for a couple of days with my husband. We reserved for two rooms since we were with another couple. The other room had welcome fruits when they entered while our room didn't even have any. I reserved for a king bed but they had annextra bed in the room.
The shower door was not closing properly so the water leaked out during showers.
They told us that breakfast is served until 10am only on January 2. When we got there at 9 am, there was a line and you had to wait for an hour at least just to get a table. Its the first time I had to fall in line in a buffet breakfast especially in a five star hotel. I don't understand why they didn't open the other venues for breakfast just to accomodate the influx of people. Yesterday, January 1, they opened a whole ballroom for breakfast and that was very convenient for everyone. With the number of hotel guests, they should have properly made things convenient but i guess this hotel's service to customers is not their utmost priority.",Comfort & Facilities:Food
"Sadly the Shangri-La at the Fort failed to live up to the standard of other Shangri-La hotels I have had the pleasure of staying at over the last 25 years in Asia. From check-in at 2pm when one of our rooms was ready and the other not ready for an hour or so later, to failing to set up the spare bed that was booked until midnight, having requested it three times, once at check in as per our booking, once before dinner and once when we got back from dinner. Breakfast at High Street Cafe on the 24th December was basically good, on the 25th breakfast was moved to the ballroom. The choice of food was restricted and the set up so spread out it was like a zoo. Some basic things like one egg station with one person working on it for hundreds of guests is a recipe for long queues and unhappy guests (there were both). The following day High Street Cafe couldn't cope with the volume of guests and again disgruntled guests. The main swimming pool was closed but the one at Kerry Club was open. The only highlight of the stay was a good family dinner in Samba. I would certainly return for a relaxed informal family dinner. Overall the experience at the hotel fell short of expectations and I would not return to stay with the family.",Food
"Nothing can go wrong with the Shangri-La brand. Still on the process of perfection in terms of ""personalized service"" and attention to details, i hope soon it can be achieved. Nonetheless, they are on the right track.
Guestrooms: Superb!
Gym: Excellent and incomparable!
Breakfast: Above average
Dining: Veru good",Staff:Comfort & Facilities
"Service - Service was excellent as expected!

Amenities, grounds - very aesthetically pleasing interiors! I got this feminine vibe in this hotel, this would be perfect if you want to treat your gf/wife/mom/etc :) The hotel has two pools - the Kerry Sports pool and the other one which wasn't open yet (we stayed July 2016). There was another pool which is for residents only. Hotel has some restaurants, a bar, and a few shops on the first floor, and a park beside it. It was also near malls, restaurants, and night life. Their fitness center is a very large sports facility, it is a brand in itself, as it is Kerry Sports Manila.

Food - Shangri-la has always been known for their buffets, the High Street Cafe buffet breakfast did not disappoint! Loads of variety, perfect for people on extended stays.

What we didn't like: the toilet didn't have a bidet, and the rooms were small, though the space was efficiently used, and the aesthetics made up for the size. Some lights didn't work, and if you look closely, some finishing touches were not neatly done (Sorry, I should have taken pictures), which was a let down because this is one of the newest and priciest hotels in the city.",Comfort & Facilities:Food
"from checking in, going to the room, the room, the bed, the bathroom, the amenities, the awesome pool and gym, the incredible breakfast buffet...i loved every moment of my stay. the location is also a winner!",Comfort & Facilities
"The Fort Shangri La is the latest addition to the portfolio of hotels in Southeast Asia. It is built to high standards and you are not going to be disappointed. The location in the Fort is very accessible, easy walk to the main shopping street of the Fort. I can highly recommend the Steakhouse on Level 3. The sports club is one of the best in Asia - it has any possible type of equipment imaginable - including NBA sized basketball court, 2 covered tennis courts, squash, swimming pool and a big variety of sports equipment plus daily classes. Wi-fi in the hotel is excellent - strong coverage and good speeds.",Location:Food
"Cities tend to be busy on holidays. Its a nice treat for the family to just relax but still be in the city. Shang at the fort provided us with just what we wanted. The facilities are great and exactly what we needed for a staycation. The facilities are awesome, from the pool area to the gym area. Rooms were great as well.",Comfort & Facilities
"Gosh, manila has changed since my last visit. The clunkily named Bonifacio Global City is a burgeoning district of hotels, offices, restaurants and bars giving Singapore a run for its money. Gone are the constant traffic jams and the pockets of poverty, replaced by craft beer outlets , swanky shops and Harley-Davidson outlets.
This hotel is a show- stopper, the decor pretty much no-expanse-spared. We gazed at the 3500 pieces that make up the crystal chandelier while crossing the lobby. Its a very shiny jewel-box kind of place. Our room is beautifully appointed with bathrooms comfort-filled with fluffy robes and plenty of L'Occitane toiletries. Its got my tick of approval. The femme just flops on the bed and vows to stay for the entire stay... Eating- in comes in meat choices, steak, burgers, churrasco and choices of cantonese and Huaiyang cuisines",Location:Food:Comfort & Facilities
"We organised a small conference at this hotel and were delighted how well it went! This is a new hotel with some surrounding works still going on, (that did not detract however) The hotel staff tried, and succeeded to make our event a great one. The meeting rooms were comfortable and well equipped and when we needed help or assistance it was immediately available. The bedrooms as expected were very well equipped and the bed comfortable and with great quality linen etc.
We used the Club lounge on the 40th floor quite often and the service and helpfulness there were as good as it gets! Well done to the team.",Comfort & Facilities:Staff
"This is a new hotel in the trendy Bonifacio area of Manila. The rooms are good size, comfortable beds, calming muted hues decor. You get an excellent view from the upper floors. I stayed on the 39th floor and had access to the 40th floor Club serving breakfast and a delicious cocktails/canapes soiree every evening (included in room price).
There is a small shopping mall opposite the hotel, and the High Street on the doorstep, with a good choice of restaurants and bars.",Comfort & Facilities:Food:Location
"A client cancelled for a meeting and re-scheduled for a later time, I was trying to look for a place to crash and found myself in this ""they say"" a new hotel (I'm not from the area so I didn't know). It was around noon so I had to go for the buffet #1 to kill time and #2 was frustrated with the last minute changes, so I deserve a very good meal, so needless to say food was awesome and service was fairly quick, if my memory serves me right it was Cris who was quick to respond with just a quick glance. Coffee too bad was not included though when I needed to kill more time, but it was all worth it overall.",Staff:Food:Value for money
