Opinion,Classification
"I stayed in the Shangri-la Mactan back in April 2009 (i've procrastinated over writing this review for long enough, haha)

Me and my wife stayed here on our honeymoon after we got married in Iloilo a few days previous. I had done the booking through email and was dealling with a girl named Maricar in the reservations who I could not fault. She always replied promtply and answered all my questions. Because it was our honeymoon we ended up going for the room upgrade to an Ocean Club room in the Ocean Wing and added on transfers between airport and hotel return also. We also added on a couples spa treatment for ourselves (again it was our honeymoon so we wanted to treat ourselves).

When we arrived at Cebu airport and got to the baggage claim there was a hotel rep there alreday waiting for us so no problem finding him or our transfer. When we had our bags he took us outside and a hotel car pulled up beside side, no waiting. Both the rep and driver had good english and very friendly.

The drive from the airport to the hotel was short, 15-20mins, perhaps it might have been cheaper to just get a taxi at the airport (although comparing the cost of the hotel pick-up to taxis back in Ireland I still felt like I was saving money anyway).

Check-in went smoothly, we arrived at reception around 10am, hotel staff took our bags and we were taken imediately up to our room and did the check-in privately in our room, this is cause we were in the Ocean Club, and our bags arrived a few mins later.

The room was really nice, big king bed, very comfortable, nice and spacious and clean with a little sofa, table with fruit and another desk with stationary in the drawers (for the business traveller), TV wasn't a flat screen so a bit old maybe, to stay more modern they might consider upgrading those, but not a deal breaker. Bathroom was smaller than expected, not tiny small, there was still lots of space, just having been in two previous shangri-la's in Muscat & Abu Dhabi which both had large bothrooms with walk-in showers and seperate bath I was expecting the same here, but there was no walk-in shower. Wasn't a big deal to us and certainly didn't effect our stay but thought it best to mention as I know some people reading this might like to know what's there. All amienties you'd expect from a 5 star were there also so no worries if you forgot your own toothbrush or toiletries.

I should also mention that the view we had from the balconey of our room was fantasitic, full seaview.

Hotel staff were all friendly, room cleaning staff even greeted us by name on our first meeting without introduction when we passed them on the way to the elevator from our room. Either they quickly learn whose in which room or maybe they had extra heads up cause we were on Honeymoon?

Hotel grounds were huge, get a good walk in going round the place. two swimming pools both really nice. One of which was an infinity pool in front of the beach. Hotel has it's own private beach, not the biggest of beach, but it was nice and lots of fish just swimming around. I got a snorkle set and just floated in the water looking at all the different fish swimming past. The gym had a nice selection of equipment if you're looking to work out. There is a games room with a small arcade and pool tables aswell as free internet stations. Aswell as may other activities. The spa treatment we had was well worth it, very relaxing and the spa area has it's own private pool too. After treatment your also given a fruit platter and juices to help further cleanse the body.

We ate our first dinner at the Tea of Spring chinese restaurant which was nice... only thing though was there was no duck on the menu which I found odd for a chinese restaurant (and it's my favourite), but I had chicken instead which was still very good. 2nd night we had a buffet dinner at the Buko Bar which also had a cultural show on that night. You have to reserve a table to get a good view of the stage, we didn't as we were out in the city that day and weren't sure if we'd be back in time but we were. Even though I didn't reserve a table once I gave our room number we were given a table right in front of the stage... not sure if it was cause of the Ocean Club room...or maybe the honeymoon but it was really good either way. 3rd night we just took advantage of our Ocean Club status and ate in the Club Lounge free snacks and cakes for our dinner haha.

Being in the Ocean Club also gives you free drinks in the Ocean club lounge. This was good though I do think they should at least extend this to include at least one free drink with your dinner at any of the restaurants as you'll likely end up paying more for drinks than the food. Overall that is really the biggest bad thing I could say about the hotel...and the reason I marked ""Value"" down. You also get free use of non-motorised water equipment at the beach which is certainly handy.

For breakfast there's a few choices of restuarants I recommend the Acqua we had the best breakfasts there, even if you're in the Ocean Club with the private breakfast buffet in the Club Lounge, selection there is small compared to Acqua, lots of choice and great cooking.

While the hotel is a good 40mins from the centre of the city it still makes a good base if you're planning on going into the city for a tour. While there are other hotels nearby once you're in the grounds of the Shangri-la you wouldn't know it.

We really enjoyed our stay at Shangri-La Cebu and would certainly return if we go back to Cebu. Please check out attached pictures and you can also see some video of the hotel on my youtube account at MokongX3M under the ""Holiday 2009"" playlist.",Food:Comfort & Facilities:Value for money
"Perfect for family vacation.. We booked two adjoining rooms because I had my 3 kids with me, ages 10, 6 and 10 months.. we even brought with us our nanny. The place had everything we needed.. beach, water sports activities, pool, indoor games for the kids, and a variety of restaurants. The hotel staff were pleasant and accommodating. They even helped us in traveling to and from the hotel and around Cebu island. Highly recommended to all who plans to go to Cebu with their family.",Staff:Comfort & Facilities:Food
"We stayed on the club level which is well worth the extra expense, even for just experiencing the private dinning level. Although here on business we enjoyed the beach and the beach restaurant, although we found food extremely pricey. To be honest i could not recommend this hotel for a vacation as Mactan Island is tatty and overated. However, considering the choices the hotel is comfortable. The Panoramic room we had was superb with L'Occitane amenities etc. We had a dinner at the nearby Abaca boutique hotel. The food was superb, however I am glad we did not stay here as it has no beach and although beautifully designed the entire property is wedged up against an eight or so story building which overwhelms the site.",Food:Comfort & Facilities:Value for money
"I had high expectations. Its Shangri-la, a 5-star hotel.

We stayed there with my 7 and 5 year old children. I was quite irritated by the security staff, when we arrived, she asked me if I was a hotel guest, and again asked if all of us were hotel guests. There was not even a greeting. I find that quite rude. It ruined my vacation.

Another was the waiters bickering at each other. I would have understood these if the rate of the hotel is not expensive. This is an expensive hotel, you pay for everything. I felt I was not staying at a 5 star hotel. Maybe because we are local tourist that we are treated differently from the foreign tourists. I was disappointed.",Staff:Value for money
"The hotel is as expected from a Shangri-la , organised , well run , good facilities and v . large. We were disappointed with the panoramic view room allocated as part of the view was of a large hole where another building had once stood , but we were moved quickly and without fuss.
The hotel was full - BUT mainly with conference guests which meant easy access during day for pool and other amenities (not sure how good that would be in a peak holiday time) .
Spa as usual excellent , club floor very good and well run by Mr Terence , water sports centre very efficient and well run. Beaches clean and lots of towels at the pool sides.
We had prebooked various things direct by email with hotel and the response was always prompt and with all necessary detail we could wish for.
Food outlets - would recommend the Italian restaurant , Acqua, as the food and service there was some of the best we have ever had in any hotel , Gianluca the executive chef is a star ! Not too happy with the Cowrie Cove - food a bit of a disappointment and piped loud music from a beach party spoiled an otherwise romantic setting , Tea of Spring Asian restaurant was o.k.
Trips to golf courses nearby organised efficiently and with car / drivers ( recommend Alta Vista )
Hotel staff ALL say hello as you pass by and genuine in their willingness to help if you are lost or need assistance .
Why have I rated only very good ? Probably overall the price is on the high side and some of the immediate hotel surrounds are not so pretty ( such as the large hole which is visible from many windows ) and the disappontment of Cowrie Cove .
But saying that we would most likely go again - chosing a quiet time of year , would perhaps like to see the hotel do more to get visitors to see outside of the hotel to give back to the poorer neighbourhoods( we went off on our own to buy things in local shops ) as it is definitely a rarified atmosphere along with the other large hotels in the area .",Food:Comfort & Facilities:Location
Beautiful and amazing! We loved this resort. They went above and beyond to accomodate us. There were lots of fun things for the kids to do so mom & dad could have some time for themselves. They even had beach parties for the kids. The pools and the beach was beautiful. The staff was incredibly kind.,Staff:Comfort & Facilities
"My family of 5 took a break from frigid Beijing at the Shangri-La Mactan in February. We were not disappointed.

I suppose there is no point going over what everyone expects from a Shangri-La: it's all there. The quality of the overall resort, rooms, food... And the staff is amazingly friendly, as is often the case in the Philippines. So I'll focus on what stood out and what did not...

First of all, activities for kids. This is a very strong point. There are endless things to do for the kids. There is of course the pool and beach, but also all the activities surrounding them (diving, kayaking, etc.). There are also two great playrooms and day activities for kids of all ages - our 3 and 6 year olds were busy all the time.

The spa also stands out. Though expensive (it is the Shangri-La...), everything about it is top-notch: the premises, the staff and the actual treatments. It is a special treat to go there.

On the down side, I would say that the pool and beach tend to be very crowded. If you don't get up at 7AM to plop your towel down on a recliner, you can forget about getting a spot for the rest of the day. This is not something I enjoy doing: I think it is quite rude to reserve your recliner two hours before you intend to use it, but unfortunately you are forced into doing just that or you are left out.

Also, the pools - including the kiddy one - has no spot in the shade. So, you have to smear your children with sun cream and repeat very often, because they will always be swimming in the sun...

Finally, a comment on the beach. Though it looks wonderful, the sand quality is very rough. So rough that I got friction burns on my knees from just kneeling down four or five times to take pictures of my kids! My children also got allergic reactions from it. Now, I suppose it all depends on your skin quality, but we were not very happy with that and ended up not going to the beach much. One should however say that the sand seems different close to the water (within 5 meters): much smoother. So, if your kids stay close to the sea to make sand castles, they should be OK.

All in all, a very enjoyable stay, despite the few items I mentioned. Would we go again? Maybe, maybe not. There are other great resorts in the Philippines and elsewhere in the region, and the fact that this Shangri-La was crowded and that the beach was not suitable for us would make us think twice.",Comfort & Facilities:Location
"Having stayed at this resort over a decade ago and indulging at Chi Spa in 2007 made me want to come back and share the Shangri-La Mactan experience with my partner. From the Shangri-La lounge at the airport to the shuttle to the resort and everything else afterwards, we experienced expert hospitality and professional service. It was quite difficult to leave the resort since the weather and the convenience of all the trappings of a perfect vacation is all within reach. Our de luxe sea view room on the 6th level gave us a great view of the sea, main pool and gardens. With a PhP1,000 daily credit on F&B, it was easy to order away in any of the outlets in the property. After check out, we took the free shuttle to Ayala Center Cebu. During our ride, we realized that we had lost an earring. So after contacting the front desk, they were able to find the earring and return it back once we returned. For a guaranteed resort style vacation, Shangri-La's Mactan Resort & Spa has matured beautifully to its advantage of knowing how to take care of its guests and visitors.",Staff:Comfort & Facilities
"A friend and I decided to do a short girls trip to Cebu, Philippines and we ended up staying at the Shangri-la based on the advice or friends who had previously travelled to Cebu. Overall, it was a very nice experience and I would recommend it to travelers who are willing to spend a little more for a more luxurious vacation experience.

Pros:
-Spa is fab. My friend and I booked a package the morning of our first full day. With a spa treatment you receive access to the adult only pool area which was nice. No kids running around and you can order wine/food to eat right on your lounge while sunning by the pool. Once we got ourselves to the treatment room they started off by giving us a foot scrub and letting us soak in an outdoor Jacuzzi tub with flower petals, fruit & cold drinks. We also ordered a bottle of Champy just to get our vacay started off on the right foot. The massages were great but I wouldnâ€™t recommend getting a facial or any other technical treatments. Also I HIGHLY recommend setting up your appointment for the morning vs. the evening. The later in the day the more backed up they tend to get and the more frazzled/tired the staff becomes. We scheduled another treatment for around the evening and that experience was a mess!
-Ocean Club is a must. We booked ourselves in an Ocean Wing room with access to the Ocean Club. Having breakfast in a quieter less crazy area, having access to free cold drinks/beer/snacks all day & a place to hang out while we were waiting for our late night flight back home was definitely worth the extra cost. With the Ocean Club you also get access to the adult only pool area in the spa. My friend says the two favorite things of this vacation as the Spa & the Ocean Club!
-Staff is extremely friendly. They went out of their way to be helpful (taping up my poor quart size ziplock for liquids that burst & giving me takeout containers so I could make sandwiches for later during breakfast). I saw many other visitors acting poorly to the staff and taking out random frustrations on them but the staff took their tantrums like pros and never acted unprofessional.
-Beach is swimming friendly. I would get up every morning and take a lazy swim around the protected beach area. The water is clear and beautiful and warm enough to swim in without any issues in October. They offer day old bread to parents with kids so the kids can feed the fish. I was not a fan of this as they tended to swarm around whomever was feeding them, but I could see why the kids would love it.

Cons:
-General pool & eating areas are really crowded and noisy. I highly recommend splurging on the Ocean Club so you can have somewhere quiet and relaxing to hang out other than your room.
-Restaurants were disappointing. We were disappointed with all the restaurants in the resort. The dishes were not that tasty and seemed over-priced for the quality of what we received. And Iâ€™m not particularly price sensitive about vacation dining out.
-Spa in the afternoon or evening is a bad idea. We went a second time but this time scheduled it for the evening before our flight. The whole experience was a disaster. They were 40 mins late getting us for our massage, they put us in separate rooms when we had asked to be given our massages in the same room when we made our reservations, and the masseuses were tired by that point so the massages were sub-par.
-Nightlife seemed non-existent. We aren't big night life folks so that was fine with us, but if you like going out at night then it might be a bit boring for you.",Food:Staff:Comfort & Facilities
"I must admit that I was dreading our first visit to this hotel during the
""festive season"" fearing an overcrowded resort teeming with screaming children.

Instead we found a very service-oriented situation with an abundance of cheerful
staff that almost always anticipated our needs before we had the chance to ask.

The ocean wing club floor (headed by mgr terence perez and his amazingly
attentive staff) is absolutely worth the extra cost, which was easily offset by
choosing the value vacation rate which included so many extras including
complimentary buffet breakfast and dinner each day AND worth it for the
unlimited laundry service alone which minimizes your packing needs especially if
your visit is part of a longer trip as it was in our case.

Even though we were visiting during xmas season the whole resort is designed in
such a clever way that we never for a moment felt the resort to be over-crowded
or even remotely full for that matter!

It was quite pleasant to see well behaved happy children, enjoying the well
thought out activities and play areas, chaperoned by dedicated hotel staff.

Our primary reason to visit was to scuba dive each day with
Scotty's Dive Center. Mgr johann along with his extraordinary and plentiful
staff, runs one of the most relaxed, organized, and knowledgeable dive
operations to be found anywhere in the world (from my experience).

Yann, our dive master / instructor was fantastic above and below the sea and
helped raise our confidence during many hour-long dives over several days.

The dive sites were spectacular, close by, and felt like we were swimming in an
aquarium!

And for non divers, snorkeling just off the resort beach in the marine sanctuary
is great too!

Once again, despite the 100% occupancy we barely ran in to other guests at the
dive center or at the Chi Spa which is a must visit - check out the seemingly
private pool. The Chi Spa is easily accessible by golf cart if you're too lazy
to walk 5 mins)

Despite our initial trepidation, the para-sailing (a first for us!) was so much
fun and easy that it should be on the ""must do"" list for everyone visiting this
resort.
The only fault i found and my only suggestion is that the hotel upgrade the wired internet access to WIRELESS internet throughout in each guest room- or at the very least in ALL ocean club guest rooms not just the lounge

We have already planned a return visit! Many thanks to all...",Staff:Food:Comfort & Facilities
"We stayed just one night at the Shangri-la to get a break from some heavy work, and it was what one would expect of a Shangri-la - high-end hotel experience. One gets a bit tired always saying hello or good morning to the army of staff around the resort but one doesn't come to the resort to get away from people and rather overcared for than ignored.

We mostly wanted to get some snorkeling in without having to do any island-hopping since we did not have much time. The hotel has a protected reef which one can snorkel over straight from the beach - the coral is not that great compared to Moalboal or even compared to Olangapo Island across the strait - and while the reef is protected there is not much education of the guests on how to look after coral). However, there is a good variety of fish, some of them large size (often hard to see in the Philippines with the overfishing) and friendly (a fair amount of fish-feeding goes on from the guests). Enough to keep us happy for a day or two.",Staff:Food:Location
"We woke up the Friday of Thanksgiving and decided we HAD to leave town for the weekend -- so quick as a bunny, I called Cathay and found they had seats on an afternoon flight to Cebu. I called the Shangri-La, a hotel we have stayed in about 6 times since it opened in the early '90's to see if they had rooms and we were in luck. By 6:30, we were in our bathing suits and floating in a tranquil stretch of beautiful seawater with the stars overhead. A lovely dinner outside on the patio of the Italian restaurant followed and we all happily went back upstairs to our rooms, knowing it is the quick and the decisive that have the most fun!!

This is a hotel that is ideal for a family with small children and was one we took full advantage of when our 4 boys were little. There is a lovely baby pool situated right next to the exit of the waterslide and next to a grassy area with swings. Ideal when we had the competing demands of an 8 and 6 year old (sliders), a 4 year old and and 18 month old (baby poolers)-- by sitting back to back, we could keep an eye on them all and actually have a conversation. The beach is a lovely small spit of white white sand with tame fish who come for bread in the early morning. There has always been a nice kids' club, staffed by lovely kid friendly ladies. My boys never protested when we put them in their pajamas, ordered their meal to be delivered to the kids' club while we went off to a quiet. meal. The downside to the hotel was always the food and the fact it catered to large groups, but the upside was that it was less than a 3 hour flight from Hong Kong and a mere 15 minutes from the airport to the hotel. The restaurants have improved, we know the ropes and staked out shaded lounges on the beach by 8 am and the reef off the shore has been at least partially rejuvenated (wonderful snorkling) so those downsides have happily been rectified.

In recent years we had ""graduated"" to other locales with 4 teenaged boys. But I thought of this hotel again ""in extremis"" because it was close, easy and do-able for a weekend. So far it was a choice I will happily make again now that our tastes have gone from the merely convenient and clean to the finer points to vacationing in style. However, this is not a long stay vacation option with older kids -- we would go crazy if staying much longer as there is little if anything to do outside of the hotel.

The Shangri-La has a ""club"" arrangement to the hotel that has a seperate entrance and a lovely lounge. This made checking in a breeze -- we arrived and were whisked right up to our rooms to complete the formalities. We have, I think, one of the best rooms in the hotel -- a ""panorama"" club suite -- Room 7001 and the boys had the room next door 7003. The rooms are fine, but not top notch. The living room of the suite is oddly shaped and the furniture cheap and not all that comfortable. That goes for the mattress in the bedroom, which is way too hard. The bathroom has a nice big shower, a lovely sea view and L'Occitaine toiletries, but lacks a decent sized bath. The room smells badly of mildew. The boys room, however, did not. The suite has a double terrace that looks out to sea, which is lovely and the boys' connecting room also has a big terrace with comfortable chairs and a full seaview.

The service has been very very good in all areas of the hotel. It has been a lovely stay so far and well worth the price and the effort of getting here.",Comfort & Facilities:Food
"Had the Panaroma suite for 6 nights and lved every moment of it. I would say the standard of service there was amazing, if not made by a few special people who would run to and fro across the beach to attend to yor everyneeds, thegreat but overpriced (for the philippines) CHI spa. I recommend taking a boat out to island hop, other then that, the suite had a great ocean view and huge balcony. Great location to the airport too and the resort has excellent security. I broght my gf there but had at least 30 friends around the place for an event as well. Great place for friends to chill but an even better mplace for couples to re-discover love. =)",Comfort & Facilities:Location:Staff
"Typical Shangri La. Go the extra mile and stay in the new wing with the sea view, its worth it. Staff, as always make the hotel, got a bit fed up of being ""Sir"" so I had my own badge made, huge amusement! Tips on eating, use the specialist restaurants, choose your dishes and you will be surprised how reasonable the prices are as opposed to the full buffet every night, along with a couple of glasses of the house red, which is more than acceptable. Vist the Spa and get a massage, they may only be little but boy do those girls have strong hands!
The diving school is also first class, with some of the dives only a 10 min boat ride away and quite good. Yes it was a long way, but we had a great time, and once again, all the staff are just so.
Mike and Tracey",Food:Staff:Comfort & Facilities
