Opinion,Classification
"I was privileged enough to be one of the first customers at this fine hotel. It's a given that everything in a Shangri-La hotel will be upscale and amazing. This one doesn't disappoint. But what I found to be the best feature of the hotel was the hospitality and service which was better than other Shangri-La's that I have stayed in (granted, I stayed there the first day it was open). I stayed there to celebrate an anniversary with my wife and planed to surprise her by decorating the room into which we checked into. I told the staff of my plan and they all helped me with it, whether it was to make it seem like they didn't know me, to offering to decorate my room with me, to providing us with a bottle of wine, to remembering my wife's name upon arrival. That said, it made for a great small event for my wife. I must give recognition to Sam and Grace at the Check in-desk, Albert the doorman, and Chal at room service. Thank you guys and thank you Shangri-La! Will always be a customer.

This stay was during a soft opening, so not all amenities were open, but the sports club was amazing. Perhaps one of the best gyms I've ever seen -- hotel or not.",Staff:Food
"I was privileged enough to be one of the first customers at this fine hotel. It's a given that everything in a Shangri-La hotel will be upscale and amazing. This one doesn't disappoint. But what I found to be the best feature of the hotel was the hospitality and service which was better than other Shangri-La's that I have stayed in (granted, I stayed there the first day it was open). I stayed there to celebrate an anniversary with my wife and planed to surprise her by decorating the room into which we checked into. I told the staff of my plan and they all helped me with it, whether it was to make it seem like they didn't know me, to offering to decorate my room with me, to providing us with a bottle of wine, to remembering my wife's name upon arrival. That said, it made for a great small event for my wife. I must give recognition to Sam and Grace at the Check in-desk, Albert the doorman, and Chal at room service. Thank you guys and thank you Shangri-La! Will always be a customer.

This stay was during a soft opening, so not all amenities were open, but the sports club was amazing. Perhaps one of the best gyms I've ever seen -- hotel or not.",Staff:Food
"I was privileged enough to be one of the first customers at this fine hotel. It's a given that everything in a Shangri-La hotel will be upscale and amazing. This one doesn't disappoint. But what I found to be the best feature of the hotel was the hospitality and service which was better than other Shangri-La's that I have stayed in (granted, I stayed there the first day it was open). I stayed there to celebrate an anniversary with my wife and planed to surprise her by decorating the room into which we checked into. I told the staff of my plan and they all helped me with it, whether it was to make it seem like they didn't know me, to offering to decorate my room with me, to providing us with a bottle of wine, to remembering my wife's name upon arrival. That said, it made for a great small event for my wife. I must give recognition to Sam and Grace at the Check in-desk, Albert the doorman, and Chal at room service. Thank you guys and thank you Shangri-La! Will always be a customer.

This stay was during a soft opening, so not all amenities were open, but the sports club was amazing. Perhaps one of the best gyms I've ever seen -- hotel or not.",Staff:Food
"Have been staying here and i noticed the staff are warm and more courteous than ever! Breakfast ohoices varied' rooms clean, their teddy bear christmas so cute and lobely but last year was also beautiful",Staff:Food
"Due to change in travel plans, rather than travelling to Singapore, I opted to use the 3 of 5 hotel vouchers I bought during my Credit Card issuer's sale blitz. Room reservation was ably handled by Gel even if I called at 8:40am to say I plan to check-in by 12pm (in accordance with my Jade Golden Circle membership). Front Office Manager Benj was kind enough to assist my check-in and sort out the confusion over the 2 reservations in the system (it slipped my mind I arranged a 2-night stay 5 days ago). Benj efficiently issued my room keys and I was pleasantly surprised to find my amenities in the room despite the short lead time between my phone reservation and 12pm arrival,my sincerest thanks to InRoom Dining team for the quick turnaround. I met a friend in the nearby mall for lunch so I rested in my room thereafter. I visited the Health Club to wash off all the rich food I gorged on for lunch. In my entire 4 -day stay, Jason, Erica and Dax were very helpful. Dax even toured me around the 2nd level gym (it's ironic it was the 1st time I visited the 2nd floor all these years as my exercise routine is confined to jogging and dancing). Anj and Raine were equally helpful with my roommate who misplaced her keys on 2 occasions. Our 3 daily breakfast visits at HEAT were great, thanks to the attentive service from Cecille, Bessie, Noel, Lawrence, Ronel, Lincoln and Alvin. My sister roommate was so impressed by the congenial yet professional service levels we were accorded. Even Tina took time to say Hi despite the steady stream of diners. Our Room Attendants Jenny and Nelson always ensured the spic and span condition of our room, I could have slept in the bathroom floor if not for the cold marble floor. It was an awesome and recharging 4-day prelude to my 50th birthday this month (3 weeks later, I went back to HEAT for my birthday lunch where Chef Hazel regaled me with the well-done steak and Chef JB's scrumptious crepe and refreshing halo-halo). I so made the right choice not waiting for my 50th birthday to indulge myself because everyday can be your birthday. My personal affirmation for self-love was complemented by the consistently caring hospitality I experience every time I stay at Edsa Shangri-La. Thank you for repaying my loyalty in the last 10 years with innately convivial service to me.",Staff:Food:Comfort & Facilities
"Stayed here on October-November nice hotel,nice facilities the only thing that i don’t like is some people specially in housekeeping department the assistant manager name Joyce Gaspar she’s annoying person she change my profile and preference without informing me i don’t know why she wants to follow herself rather than the guest for me she’s not a good example to all the staff in her department,but i would like to thank those people who help me all through out my stay namely Darl Padillo,Princess Manuel,Kenneth Santiago,Nelson Mantile and also their managers Ronald Garcia and Lorna Tumang of housekeeping,for heat department thankyou to all managers Ms.Tina Docallos,Ms.Aileen Aquino,Ms. Avie and the staff Marc,Abel,Renz,Ely,Ronel De Leon,Mike,the hostess Glaiza,Claire,Poolbar staff namely Vince,Mavic,Rhea,Philip the supervisor.i don’t need to ask to those people what i need they give it to me right away,when it comes to food,drinks,amenities i don’t have any problem about that.",Staff:Food
"Heat-very nice and has wide selection of food
Rooms- very nice
Pool-crowded
F.O. -friendly

Stayed in the Hotel 3x - consistent in providing good service.

Going to the area heavy traffic

Malls nearby........",Comfort & Facilities:Location
"It was a good stay. Everyone was courteous & professional. Room was clean and organized. Couldn't entirely close the curtains / blackouts though (we were at the lower floor and renovation/maintenance at the spa(?) was ongoing so we were a bit bothered). BF ordered Indian cuisine and found it a bit salty for his taste. I loved the complimentary tea, and Loccitane soaps & lotion.",Cleanliness:Food:Comfort & Facilities
"Stayed here for 4 weeks... Staff are very polite, friendly and very good at advising places to visit in and around manila and will also arrange all the travel for you if you wish so. The food at 'Heat' was unbelievable every dish made to the highest standard. Will definitely go back again.",Food:Staff
"Stayed here on November 18-20. I love everything about this hotel. The rooms are spacious, super comfortable bed, good buffet breakfast and most of all the staff are very friendly. Didn't get the chance to enjoy their pool but it lools gorgeous though. I like the room design and style of EDSA Shangri-La more than Makati Shangri-La.",Comfort & Facilities:Food
"In spite of Holiday inn or Oakwood in the vicinity, hospitality here is real good. This place mesmerizes me. Special request to get a higher floor with bathtub were also considered promptly. The location is a big thumbs up and security around is also good.",Location:Comfort & Facilities:Food
"There is something joyful about a Shangrila stay. The small details in the restroom, amenities like the suit stand, the instagramable lobby, the ever helpful chamberman, and a hotel lady helping me with my luggage? One feels privileged, gets rested and leaves hoping to return. Its commercial location means traffic but it is a welcome sight. Shangrila, it is!",Comfort & Facilities:Staff
"I chk in here usually 3 to 5 x a year for medical conventions/ conferences and the stay, as expected , is always great- from the no hassle checking in, to the spacious clean rooms with comfortable bed and free coffee/ tea/ drinking water/ fruit / bread, to the very strong wifi signal, to the best breakfast experience in The Heat restaurant. Staff is polite, helpful, very nice. But it is what we expect, from a 5 star hotel, isn’t it?",Food:Staff:Comfort & Facilities
"Mr. Amit Oberoi
General Manager

Mr. Alexander Lim deserves a promotion for his exemplary service. He not only located my lost laptop in Japan, but he secured it and tracked the delivery.

Chevy, HEAT hostess, is charming and always remembers my name. She truly reaches far beyond customer service.

As always, my stay has been beautiful. It’s no wonder EDSA Shangri-La is tops in customer service. Please reach out personally to these gems of human kindness.

Todd",Staff
"My family and I like EDSA ShangriLa Manila for Heat (where they serve the buffet breakfast), the outdoor pool (which incorporates an aqua playground for kids), and the service (which is consistently pleasant, attentive, yet unobtrusive from guards to porters to housekeeping to front desk to the GM).

This is a family favorite.",Food:Comfort & Facilities
"Kaysahe bai,

Greetings! This is Mr. Ryan Phillip Daluraya. The Founder and CEO of Connoisseur Hospitality and Trading.
Im delighted to meet you today as well as experiencing what Edsa Shang has to offer. your associates exceeded my expectation and they were a truly Jem of your Hotel and the entire Shangri-la Enterprise.
the following associates were:
Joshua Cris Calimlim
Chef Peter Billutes
Rhea dela Merced
of Pool restaurant
Eileen Joy Juinio of LOUNGE.
These personnel showcases great attributes that is truly outstanding and commendable.
ill be intouch and be back soon to bring more business.
See you around Mr.Amit.
Thank you and have a great day.

Mr.Ryan Phillip Daluraya
Founder and CEO
Connoisseur Hospitality and Trading",Staff:Food:Value for money
"We spent a week at the Edsa Shangri La in October 2018. The hotel is immaculate, well situated, safe and offering a level of customer service that is the best we have encountered in our years of travel. I would recommend the hotel to anyone visiting Manila.

This was my second visit (stayed in November of 2017) and quality and service remained consistent. At the time of reserving the room full payment was required. This concerned me the first year I traveled as it was not something I had been asked to do in the past but it is their policy. Communications to and from the hotel prior to arrival were very quick and helpful.

Upon arrival your vehicle goes through security then you go throw a scanner and xray system like an airport but it is very quick. Check in and out went smoothly.

The hotel is beautifully appointed and immaculate throughout including the pool area and grounds. The restaurant food is good but certainly more pricey than if you eat outside the hotel.

The room we were given upon check in smelled strongly of mildew. I spent one night then had to ask to be moved due to my allergies. The request was immediately accommodated and the second room we were given had no issues whatsoever.

We stayed in the Tower Wing Horizon Executive Room. The room was exactly as pictured online with some unexpected features that made the stay enjoyable. Complimentary water was provided daily. Toiletries in the bathroom were nice. Coffee making supplies (instant coffee however) included cups and spoons instead of disposable items. Robes and slippers were provided. The shower area was great with a waterfall style shower option that was both hot and had great water pressure. The bathtub was a deep style with a sloped back and very comfortable. Overall the bathroom was spacious. There was lots of closet space with two double closets as well as a row of drawers and an electronic safe. The desk was a good size and had a section for plugging in USB cords and electrical cords. Inside the desk were helpful items such as a ruler, scissors, tape, hole punch. The electrical outlets in the room are 220 v but all accommodate the north American plugs. The bed was very comfortable and the air conditioning worked well. We appreciated the counter found beneath the television as it provided a lot of space for our items. The black out blinds were great. Overall the hotel was very quiet. We were in room 1310 and in the evening you could here a bit of a bass sound from the nightclub next door but it was minor and did not impact our stay.

The Horizon club in my estimation is worth paying for as the food, drinks, service and exclusive lounge area included in the price is great.

The pool area is relaxing with beach towels available at the chairs. I did not care for the lines that were set up in the pool to facilitate lap swimming but those that were doing laps undoubtedly would have felt differently. Pool side drinks and food are available.

The fitness centre is well appointed, spacious and the equipment in good repair. I appreciated having access to television while on the treadmill. However I did not like the fact that if you wished to use the hot tub you could not do so as a couple. The mens and woman's hot tubs are in their respective changing areas so have to be accessed individually rather than as a couple.

Mega mall is just around the corner from the hotel and you can also visit the mall that is adjoined to the hotel via a skywalk. We exchanged our money at the attached mall. Very reasonably priced food options are available in the mega mall as is alcohol if you wish to purchase some for your stay.",Comfort & Facilities:Food:Value for money
"Mr. Amit Oberoi
General Manager
Edsa Shangri-la Hotel

Dear Mr. Oberoi,

Good day!

I am writing to extend my appreciation for the exemplary services rendered by one of your personnel, Mr. Hermie Jestre.

He was our room service attendant for the past 4 days during my PDS convention and he made sure that our stay would be memorable for my child. I appreciate his efforts in doing towel designs everyday and keeping our room really clean. He is a skilled personnel and I commend him for that.

Again, thank you and more power!",Staff:Cleanliness
"great in many aspects ,expensive but worth it ,near to three malls and a variety of good restaurants in area ,I like the rooms ,service and safety ,sleeping is great ,good lobby and cafe shop ,some good shops in area too",Location:Food:Comfort & Facilities
"Had a 12 noon reservation at Heat restaurant, last tuesday for a meeting. Left baguio at 4 am and arrived in Manila at around 11 am. we decided to park at sm megamall and just walk. we entered the driveway leading to edsa shangrila. passed through security and it was breeze, with me emptying my pockets. as i was about to enter the lobby, another security check was implemented. now this is where i was very disappointed. i was a wearing a polo tucked in and raised my hand to be frisked. the guard passed the handheld metal detector and started to touch my front pocket. he stared at me while holding tight to what was inside my pocket and asked ""ano ito"". i brought it out and said cellphone ko yan. he then passed the metal detector between my legs. so i decided to bring out everything out of my pocket just to expedite things, but this guard seems to be unnerved and continued. it was taking awhile considering that i was not entering an airport. i then was about to remove my belt and then he said finally its ok. my point is, guards are frontliners and could have been courteous in doing there thing. i could have been asked, sir, can you please empty your pockets instead of just saying, ano ito?. for a 5 star property, alot is desired from staff at the frontline. i was embarrassed and inconvenienced.. while i understand their security measures and its importance, it could be done in a manner where guests are not offended, embarrassed or inconvenienced. i reported the matter to the duty manager and was entertained and said they will look into the matter. she took my number and said i will be updated. i have not received any until today reason why i decided to write this review.",Staff
"Loved our stay but...
We stayed for two nights at the beginning of our vacation. It was everything we hoped for and beyond. We love the rain shower and looked forward to it at the end of a long hot sticky day. However, when we booked another 3 nights just prior to our return flight, it was disappointing as we were looking forward to the rain shower. The room we were assigned did not have the rain shower, just a handheld shower. The prospect of packing again and moving just didnt appeal, besides, heard that the hotel was full.",Comfort & Facilities
"We celebrated my husband's birthday at this Shangri-la hotel and as always, great customer service and helpful hotel staff. We love their Japanese restaurant, Senju. So worth it.

We love the room and spacious bathroom. Comfortable bed. Toiletries are complete.

Wide selection for breakfast buffet from Filipino, intercontinental, Japanese and Indian food.

A stone's throw away from Shangri-la Mall. Centrally-located in this city.",Food:Location:Comfort & Facilities
"We booked this hotel on our wedding anniversary. It was actually a redemption stay and yet they did not treat us any different. Staff was very accommodating and courteous, and they even gave us small wedding cake and welcome greeting to commemorate the event. There was also complementary parking which is a big plus. Room furnishings are standard for Shangri-la hotels; dimensions are not so big but still quite spacious, and it's clean and tidy which is most important. One of the best experiences we had was the use of the pool--it was huge and beautiful. My son had an excellent time wading through clean waters.

The hotel also has a huge mall with a wide variety of stalls--great for shopping and dining. The mall also has connection to the MRT and bus terminals should you wish to experience commuting in Manila (though I personally do not recommend it--better use Grab). If this isn't enough for you, this hotel is walking distance to the SM Megamall where you can find more shops offering more reasonable prices (as in any shop you want--department store, clothing brands, a variety of restaurants from fastfood to fine dining, barbershops and salon, spas, etc). It is also close to the Ortigas CBD--great for business travellers.",Comfort & Facilities:Location:Food
"For cleanliness of the room , i would give it a 10, the complimentary mango fruit, both fresh and dried plus the mango pastries were a nice welcome treat, id give it a 10, amenities and facilities like the pool and gym 9, the buffet was good for first timer but eating the same set for 3 days is a stretch, id give it an 8, quick check in and check out, it would be 10",Food:Value for money:Comfort & Facilities
"I remember being wide-eyed at the elegance of the place when I was much younger, from the cheery somewhat mandarin scent from the time you get to the lobby to the warm smiles of every staff, and the spacious rooms with luxurious linens that make you want to sleep all day... Until you see the pool,

Now, our kid gets the same first class service and hospitality. The pool then is now a mini water park that kids and grown-ups enjoy. Their banana bread is a classic. Great food selection at HEAT.

Another great thing is they provide Loccitane toiletries, which I hope they won't change.",Comfort & Facilities:Staff:Food
"We stayed there for my sister's honeymoon. From check-in to checkout, everything went well. Hotel staff were helpful and friendly. They gave the couple complimentary wine and chocolate and was so kind enough to reach out if we need anything else. Thank you to all the staff who assisted us, most especially to Vina, the front desk manager!",Staff
Cece and her co workers are so friendly...always with a smiling face greeting guest and very professional. Nicely dressed employees makes the hotel more elegant..this the best place to invite guests...you can surprisingly see some movie stars and popular celebrities like Kyline Alcantara or Chavit Singson at the buffet room.I attribute to the high security the hotel provides...I will recommend this hotel to my friends abroad..5 star service !!!,Staff:Comfort & Facilities
The hotel was very warm and welcoming and made us feel at home immediately. Everywhere was spotless and the staff could not have been more helpful. The gym was to a high standard with plenty of classes to suit everyone. The pool was lovely. Food at HEAT was excellent. Thoroughly enjoyed our stay.,Staff:Food:Comfort & Facilities
"When you arrive you are amazed at the decor and of course the staff are all very friendly.
The room was stunning and very spacious but noise was a real problem, I was there for work and was on night shifts and the room above me had a child that liked to run which seemed to go on all day, even the noise from the hall was distracting.

The breakfast buffet is amazing but lunch and dinner were disappointing with a lot of stuff gone when I got there.

In the first week there was a billing error where my colleagues meals were added to my room, I spoke to reception about this on at least 3 separate occasions and they promised to fix it before check out but when I did check out the error was still there and took a while to resolve.

The location is excellent with lots of shops and food options within a short walking distance",Comfort & Facilities:Food:Staff
"We booked on the same day of our arrival in Manila with Shangrila edsa. We are supposed to stay in other place nearby but something went wrong. So last recourse was to call shangrila if they have available room for us. Fortunately, we got one. When we arrived and check in, they upgraded us to suite room. We were lucky. The room is so big, so spacious and spotlessly clean. Since, we had an event on the same hotel, we really enjoyed the unlimited freebies for a suite guests in their executive lounge, tea, juices , cookies all day, sumptous cocktail food which is i rate it as dinner buffet already, open bar for wine, colas, sodas and many more. The check out is generously at 4 pm. Everything was really superbly wonderful stay.",Staff:Food:Value for money
"Reaffirmation

624862773

I don’t usually make reviews each time I stay particularly if I have done to several times . But to see that it was ranked #2 in TA ? By the way , Legend Villas are #1 . Not even Marco Polo is included in the bracket. You got to be kidding me . Maybe guests of Edsa Shang are so discriminating and discerning, while those of Legend are not so hard to please. . But this Shangrila is not only an awardee in the international hospitality industry , but is indeed a certified deluxe hotel . I won’t elaborate the advantages regards to location , rooms , security , health facilities, pool and the many high end restaurants. Staff services still excel . I had one incident with the hotel before but that was years ago. I am entitled to change my opinion .",Staff:Food:Value for money
"Our company held a ball there and I must say, everything was organized wonderfully. From our room, to the ball and especially to the buffet. The buffet was the best part of our stay there. I really love the hakaw. Hopefully I could come back there again and have a chill weekend.",Comfort & Facilities:Location:Staff
"The people of the Philippines are known for their friendliness - but at this place, they go another level. Perfect service all around. Perhaps not the most efficient, but heat-felt friendliness is everywhere.

The place is safe, clean and classy. From the checkin to the transfer desk on the way out - no beat missed.

I'd give it a perfect score (for an otherwise uninspiring city...) if it wasn't for my room. 1701. right beside the elevators. Somehow, they beep whenever an elevator goes by (not only when it stops on my floor). So in the morning, it 's a bit like a slot machine in vegas...

so stay far from the elevators and you'll be aight!",Comfort & Facilities
