Opinion,Classification
"Like many of the big hotels in Manila, this one has seen better days. Nothing is wrong, but it does need updating. Still has old TVs and could use freshening up in places. There are some vey nice Shangri La's in Asia. This one is more about the name than the image.

Rooms are good, but not swish. Biggest problem is the multitude of people at breakfast. Seems that each room must have had 4 people in it . It is like feeding time at a zoo. Not the crisp white linen table cloths and service you expect from the Shangri La name. I can't see how the hotel could house all the people who were eating breakfast.

Trouble is that the place is not cheap. I would not rate it as a top 5 star hotel. Hard to get in and out off due to construction work and just the volume of people.",Food:Comfort & Facilities:Value for money
"When doing extensive renovations and noisy construction, hotels should really be more transparent about it when reservations are made. I am on day 5 of a 9 night stay for business and I am extremely disappointed in the hotel so far.

When I first arrived they informed me of the noise and asked if I would be in the hotel during the day, to which I replied: YES. They then put me on the 12th floor as opposed to the 14th. I was knocked out of bed the next morning with drilling and hammering.

After a request to be moved they offered me a smoking room, which I rapidly declined. They reluctantly gave me an executive room on the 9th floor. Well, the fabric on the walls is black with mold or grime, as is the lining of the curtains. The furniture is sagging. Everything is threadbare and tired. The noise is still so unbearable that I have to leave the hotel by 9am in order to make calls. My office only opens after midday.

Although the staff are very friendly, their treatment of men or couples if far superior than that of a single women traveling for business.

The gym is very busy in the mornings, and people do not wipe down equipment after use. The treadmill I used had a short in the wiring and sent electric shocks down my headphones. The trainers/attendants did not seem to care that much about it.

In general the hotel lobby, elevator and public space is very tired and tatty. Perhaps they should have shut down shop in order to complete the renovations.

All in all a very expensive 9 day trip in a 5 star hotel, only worthy of 3 stars. The only reason it did not receive an overall rating of 1 is because the breakfast is good, coffee hot and my pillow is very comfortable.",Comfort & Facilities:Staff
"Stayed there recently for 2 nights. A great hotel. I would say it was overpriced for the quality of the room though, but it was clean and had enough space. The employees were very helpful and friendly, and the food from room service was devine(I recommend the Filipino Set Meal for breakfast)! If you want to shop or eat out, it has it's own mall across from the hotel and another big one only a few minutes away. Definitely a good location.

Only problem we experienced was that the hallway carpet leading to our room needed a bit of airing out but they put up a humidifier immediately so it was all good. All in all, we enjoyed our stay.",Food:Staff:Location
"Having stayed at the EDSA Shangri-La for over 6 months in the last 5 years I think I am qualified to review this hotel.
The EDSA Shang is one of the most relaxing hotels in Manila with one of the only formal outside garden spaces this hotel has everything you need.
The hotel is a very comfortable stay the rooms are big and well maintained, the restaurants are excellent quality and the pool / recreational facilities are very good.
In a good location for relaxing and for work this hotel is worth spending a little extra to stay in and if you stay at the Horizon Club you get to use their exclusive lounge which can be very handy between 5:00 and 7:00 where they have free cocktails.",Comfort & Facilities:Food:Location
"Check in easy, despite alot of construction outside. Rooms were ok...somewhat worn out and time for a renovation, but not bad. Bathroom was reasonably large with a standard tub/shower combo...but look around and you'll see lots of sloppy caulking trying to fix damaged tiles, messy paint touchups, and other haphazard repairs. Used room service for breakfast...it was on time and adequate. Ate at Chinese restaurant and it was better than average. Overall, had that Shangri-la look...but not at the same level of others in the chain, or frankly the other one in Manila.",Comfort & Facilities
"Rennovations are always welcome in a hotel but at what expense? This may sound trivial to some of you but this evening at peak hour, i waited in the driveway for around 15 minutes because they only had one guard and one bomb sniffing dog checking what must have been at least 50 backed up cars waiting to be checked and causing traffic. Instead of anger at the security measure, i saw how exhausted the guard and the dog were. They were circling every car. enough to render any decent human or animal dizzy. Then they open the trunk and inhale the exhaust...over and over again...No alternate...just them and this other guard who held a stop and go sign..
I could not help myself from complaining to the duty manager. Before getting to the front desk, i did various quick interviews with the staff i saw on the way to the lobby...dogs can sniff for bombs, i can sniff for mismanagement. All of them said it was cost cutting to pay for the rennovation! The GM ( i have written about him before) is quite notorious for being profit and not service oriented
Finally spoke to the duty manager and he apologized and said he would do something about it.
After an hour and a half, i left the hotel. Drriving out, the cars were still backed up and there was still one guard with one dog doing the car search...fortunately he was being assisted now by at least six security men. Thank you mr. duty manager for trying at least to do something.
Mr. GM, it appears that profit is more important to you than a good working team. it appears that you don;t care about animal rights as long as you can cut corners. At the end of the day, you may have a profitable hotel but the service will be so bad because your team is so tired and un motivated. I used to love this hotel, maybe it is time to find a new home that values both the employees and their helpful animals. hmmmph!",Staff:Value for money
"My friend and I stayed in this hotel for 3 nights in a club room. Check-in was a breeze, the club lounge was cozy and very silent. Complimentary breakfast is included in our room and you can order from their menu and also get some food from the buffet spread, but it has such a limited choice, so I suggest you go for both. Their waffles were great, also their corned beef hash. For club rooms it has a complimetary snacks, cocktails and canapes served daily. For the snacks, they only have a very very limited choice, mostly muffin, cookie, chips; but the cocktails and canapes at night is worth the try. I'm just shocked because I was expecting a little bit more because going from one hotel to another, I could definitely see a huge difference. Our room was cozy, nice and elegant. The pillows we requested were served, great amenities, and very modern electronics. The odd thing about our room is that it doesn't have a separate shower room and bathtub unlike other 5-star hotels. They also didn't have a bedet. For the elevators you have to wait a little bit longer because there's only 2 elevators available.

We tried to have dinner at HEAT and we were very excited because of the raves about it. The buffet has fusions of different kinds of cuisines but overall it was not worth it. It was too expensive and yet they the buffet spread is not that magnificent. They only have 2 carvings, the roast beef and peking duck, that's it. The food was bland and there's actually noting special about them. My only favorite part in this buffet was the crepe station and the ice cream teppanyaki.

Overall, service was awesome and staffs were really nice and helpful. When I'm walking in the hallways, going to the club lounge or calling the phone operator, they all know my name, which is a surprise. The hotel is mostly for business travelers and not for pleasure and family. But I would definitely stay here again in the future.",Food:Comfort & Facilities:Value for money
"I have stayed in Edsa Shanrila for 7 times on my recruiing trips to the philippines and i have to say that they have always exceeded my expectations on each and every occasion. their staff are amazing. they are the most weloming and attentive staff i have ever dealt with. rooms are super clean, security is always making sure that no one gets into your room without your approval and food outlets are amazing.hey ahve senju the authentic Japanese restaurant with a world renowned japanese chef, italian restaurant with an Italian Chef the risotto is to die for. and they have the summer palace chinese were i have tasted one of the best dim sum variety ever. make sure to visit the chi spa and try the ehaling stone massage. it is so relaxing and the masseuse are so properly trained were they really memorize literally your preferences after your first visit in customer log file.i highly recommend this hotel, for business, leisure and vacation.",Staff:Food:Location
"Whenever my wife and I go to Manila we always stay in Shangri-La EDSA. In my opinion it's the best hotel in Manila, and we've stayed in a few! I do not like staying at Shangri-La Makati as in my opinion it's well over priced, the level of service is nowhere near as good as that in the EDSA hotel. The staff can never do enough to help you, and although tipping in the Philippines is an almost expected custom, you never feel like the staff are waiting for you to get your wallet out....other Manila hotels, they almost hang on to you!! Our room is always cleaned spotlessly twice a day. The Italian restaurant serves one of the best steaks I have ever tasted and you cannot stay at the Shangri-La without eating the buffet in Heat. Another advantage of Shang EDSA is that it's directly connected to Shangri-La Plaza (a mall) so there is a good choice of ""normal priced"" restaurants and cafe's to choosed from in there too. The only disadvantage with this hotel is that it can sometimes take a while to get to but that's only because of the famously horrendouds Manila traffic!! I would always recommend this hotel to anyone going to stay in Manila.",Food:Location:Value for money
"I truly enjoyed my stay at this hotel. I was on the last 5 days of a 3 weeks trip, so needless to say I was tired and ready to go home. However, I stayed in the Horizon Club wing and it was just amazing. The entire staff was super friendly and helpful, especially those working in the Horizon Lounge. They would remember that I had ordered an ice coffee the first breakfast and would ask me if I wanted the same each day. To me, that is going the extra mile...

The room was great, bathroom and amenities were great, the gym and pool were... you guessed it, GREAT!",Food:Comfort & Facilities:Staff
"Though it is expensive, it's worth the money....Shangri la is my aunt's favorite hotel, I believe this is the best hotel I've ever been so far...
The best in terms of:
Service, food, rooms and location...

They will not just clean your room once, they'll do it as many times as you want. My aunt was well pampered by the room boy, everything she request... She gets! From fruits to flowers... Name it-- you'll have it! With no extra charge!

For the management... I just hope they will change the carpet, quite old already...
And hope they will include free airport -hotel transport!",Value for money:Staff:Location
"What I love about the Edsa Shangri-la is the ambience of holiday that it creates. I've spent a week in total at the Edsa Shangri-la this year and they never fail to amaze me. The rooms are gorgeous, the lobby as well as the shops inside. Probably one improvement point is the basement space leading to the parking. My point of view is - the colors are off and the paintings should be replaced. Also, the parking - i see it as small. The gym needs some refurbishing and the lobby waiting area needs a facelift.",Comfort & Facilities:Location
"it has been 4 years since i made a negative review about this hotel , and it was only last year until now that we used to frequent the hotel for weekend stays ( the condo unit that we own fronting the hotel and connecting to the mall was now under a leasing/rental agreement for a year ) , and i would claim that much has improved since that time , ..i liked the garden wing room that i booked for my family , airconditioning was very good , lighting and fixtures much complete , i like the piped in sound in the bathroom from the huge lcd television and the very comfortable beds ..even though the bath and shower tub are not separate ,just fine with me. they have a sofa which can be actually converted into a pull out bed...reservation that i had was handled out smoothly this time... a connecting bridgeway comprising of elevator and an escalator to the shangrila mall was actually a nice touch ( how about a bridge way to the sm megamall ?) , many shops and several high end restaurants can be found in the hotel , and there was even a cozy bookstore / mini coffeeshop can be found in the ground floor ... there was an abundance of personnel , and most of them are friendly , .. maybe making elevators accesible by card keys would be much better in terms of security... and lastly, 2 things that i like about this hotel aside from the location and its staff ... FREE wireless internet and the breakfast buffet (one of the best ) ...",Comfort & Facilities:Food:Location
"I've used this hotel on other occasions as well as it is conveniently located to the business district I need to visit. It always amazes me how many employees the hotel has: from about 20 staff outside, a lobby filled with hostesses, door openers, lift attendants, etc. etc. and they all are very friendly and professional. full marks to the staff and the people who train them.

This is a huge hotel, and it is always very busy. Many (many!) restaurants, some sit-down, some buffet style, all with quality food. Well equipped, large fitness centre with dedicated staff.

So why the average rating? Well, first of all, this hotel is expensive, you easily pay PHP9000 a night (around US$215). For that amount, you should expect the best there is in Asia. But the rooms are seriously outdated and disappointing!Your room is where (as a business traveller) you would spend most of your time. If you enter your room, it looks like you are stepping back in time to arrive in the late 80-ties.

Seriously, an old mid-size, non-interactive CRT television in a top-class hotel in 2012? A small kettle with some instant coffee? A desk phone from the 80-ties with such poor quality that conference calls are all but impossible? A shower in your bath which doesn't even reach shoulder level so you need to kneel to wash your hair? Free paper but I would expect the FT and not some local paper.

I understood that they are renovating (parts) of the hotel. I really hope they put in place what many (US/European) hotels already put in place: dedicated showers.(I have *never* met anyone who takes a bath in those hotels) Large LCD TV set with interactivity (movies or radio and/or online account info). Modern phone. A programmable alarm clock. Fresh new carpets in neutral colours (why do they always pick purple?) Maybe put some interesting artwork on the walls?

I hope next year all is better, or I will move to the nearby Crowne Plaza",Comfort & Facilities:Staff:Value for money
"...I wrote a review on this hotel last year, and I sung praises about it then!

As always the hotel facilities are amazing! Beautiful features and scents really compliment the brands ethos. However, on this occasion, service was a little slop. When I got out of my cab, nobody really helped me with my luggage. I carried a 75 ltr back pack, which is almost the size of a teenager! Clearly they noticed the bag but nobody for concierge came to greet me or offer any assistance. It was only until I got to the reception when I placed my backpack down did someone from concierge come and assist me. Check in was smooth and the lovely receptionist was polite and quick.

The room was beautiful and clean. I checked in with a group of lads and therefore got a twin room and an extra bed. I met some relatives for dinner that night who were staying in the same hotel. When I got back to my room, someone had turned down our beds and placed the slippers and matts appropriately next to the foot of our beds: nice touch Shang! :)

Again, I was disappointed with service at breakfast. The boys and myself, three of us, went down to the all you can eat buffet at Heat (which is amazeballs!). I requested that my relatives be seated with us as we would all dine together. The boys and I ordered our teas and coffees and go started on the buffet. When my relatives did join us we were side-lined by the staff. They're coffee orders were brought straight away and fresh fruit/food were placed at their end of the table. My Godfather had to remind the waiter about our tea n coffee orders. I felt that the waiter/esses paid more attention to the VIPs (my relatives) than my group. I didn't take it personally, but it was a bit embarrassing to have to constantly ask for top ups when my relatives had a constant flow of OJ and coffee without any request.

Having said that... the rest of our stay, albeit short, was okay and check out was quick. The pool was great and the ambience around it is so nice. Just remember that the hotel is situated next to busy roads and a construction site of some kind of mall or hotel, so don't expect to get peaceful laze by the pool...

P.s. if you can, take away as many of the toilet amenities as you can, no not the toilet seat, but the lotions, bath gel and soap... they smell great!",Comfort & Facilities:Staff:Food
"I told you ill be back. Stayed at this fabulous hotel last May with my family. Stayed for 3 days and 2 nights. The first night is a bit crowded coz i think they have a mothers day special or something, but the succeeding days we felt like the pool belongs to us. Pool attendant and life savers are always present and very attentive and helpful. Always have clean towels.

The Heat as always... NEVER DISAPPOINTS... fresh, delicious, so many choices, and complete. Though i miss the drink all you can section... hahaha...",Comfort & Facilities:Food:Staff
"Oh my gosh - what a wonderful hotel. My husband and I travelled to Manila to attend a wedding and the Edsa Shangri-la was recommended by the groom as being close to the church and to the wedding reception venue which in Manila traffic seems to be very important,

We were greeted by the Edsa Shangri-la representative at the airport, despite our flight being over an hour late arriving. Our transport was there waiting for us. On arrival at the hotel we were met by a member of the reception staff who had all our details to hand and took us straight to our assigned room and we were checked in there. From the doormen to the porters to the lovely ladies who call the lifts for you we were greeted with large smiles. it was a really nice experience,

The room was large and spacious and well equipped with everything we needed. The bed was huge and so comfortable having spent the last week in mainland China sleeping on rock hard mattresses.

We did not eat at any of the restaurants in the hotel as the Edsa Shangri-la is connected to two of the largest shopping malls in South East Asia. I did however attend the inhouse hairdresser and beauty salon to prepare for the wedding we were attending. The service here was excellent but I would recommend that the hotel invest some money in refurbishment of this area. It was a disappointment which was a letdown from the overall look of the hotel.

Security at the hotel and in the connecting malls is very tight so if you are a nervous traveller you will either feel safe with the obvious presence of the security or even more nervous as all the security (even in individual shops in the malls) are carrying rifles and handguns.

If we were to travel to Manila again, I would definitely book Edsa Shangri-la",Staff:Food:Comfort & Facilities
"Stayed here for 2 weeks during a business trip and left wanting to go back. The hotel room was nice and clean but the staff is what pushed it from good to great. No matter what request I had they handled quickly and to my satisfaction. Everytime I walked the halls or into the hotel I was greated with great enthuisasm. I honestly felt like a celebrity while I was there, it was a bit hard to come back to the US!

Last thing to say is the buffet is amazing. It has every type of food that you can imagine. They also put out both breakfast and dinner food in the morning, which I appreciated since I worked nights while I was there. It is a top notch place to stay for business travelers and vacationers alike.",Food:Staff
"Stayed there for 3 night with my work. Lovely rooms, nice view from windows and lovely pool and garden area. Breakfas consists of every possible combination you could think of... and more. Never had donner , but I imagine it owuld be good. Try using the local restaurants. handy for shpos etc but a bit far from my offices in Eastwood. Hotel run cars were good, though I am told they are about 4 times as expensive as normal taxis. extremely attentive staff I think I said good morning about 20 times before breakfast - the cleaner knew my name as soon as I opened the door. Rooms spotless.did not see much of Manila apart from some walking around the hotel - maybe next time...",Food:Location:Comfort & Facilities
Stay here om business regularly and is always a pleasant and comfortable stay. Nothing is too much trouble for the friendly and courteous staff. Rooms are not luxurious by international standards but very comfortable especially the garden wing. Hotel has great facilities and restaurants. The pool is one of the best in metro Manila. Watch out for the in room services like in room dining and laundry as the prices are steep with all the additional taxes.,Comfort & Facilities:Staff
"Just spent a week at the Edsa-Shang during the worst monsoon rain in years. 86cm of rain within 72 hrs. The hotel handled the crisis well, luckily on high ground, no flooding in the area. Access from the hotel to Mega-Mall was totally covered so you can take a stroll without getting soaked.

Rooms were ok, avg size, a little dated. The breakfast and dinner buffet at Heat were very good.

Walls are thin, could hear the adjoining rooms occasinally.

Overall, A good stay...I will return.",Location:Comfort & Facilities:Food
"i took shelter in Shangri-la when i was prevented by flood and heavy rains to go home. It was exactly how i imagined it to be. The facilities were excellent. and the buffet breakfast was superb. I was kept safe and dry. I checked in on a lean month but the hotel took advantage of the influx of stranded guests that hotel rates suddenly shoot up. I know that this is a business strategy but the hotel should not take advantage of disasters. Rates for lean months should remain as such. Shangrila is truly pricey and is meant to be enjoyed by those who are willing to pay a little more for paradise. As for me, I closed my eyes when I departed with my hard-earned 10,000++ and became a one-day millionaire. I had no choice.",Value for money:Food
"This is my first time to stay at the Chi Room of the hotel. I have to say that it was very pleasant. The hotel is well maintained but quite old, and this room is completely renovated. New beds, new everything. So I definitely recommend it if you're staying at this hotel.",Comfort & Facilities
"Offers everything you & your family may ever need.. Stayed twice a year for 7 years here..just wished it was for a vacation but it was also for work. Nice & friendly staffs, just wish banquet staff doesn't pressure their guest in signing breakfast receipt by always running around while we are eating as if... ;) anyways Shangrila is one of the best Hotel, ever :) of course Shangrila Cebu tops it ;)",Staff:Food:Value for money
