Opinion,Classification
"stayed twice during our 2013 visit to the Philippines. 1st was during our arrival where we stayed in the main wing and 2nd was during christmas day where we stayed in the garden wing. I recommend staying at the garden wing: More private location, better rooms, more room amenities, and a dedicated front desk personnel. Their friendliest and helpful staff, the hotel location, and price value are the reasons why I chose this hotel over all the other hotels in Manila.",Staff:Location
"To celebrate New Year's Day, we decided to have lunch at the HEAT, the Coffee Shop at EDSA Shang Hotel. The buffet was pricey at PHP2600 per person. I started with lobster and shrimps and added SHRIMP SALAD on the side. I am a 70 yr. old Lola and not a big eater. I had some tempura and dimsum. 4 pcs sushi (nothing raw). A little beef and some chicken. Dessert was 2 mini cupcakes. After 4 hours, my stomach started acting up. I had the run 4 times and I vomited 4 times too. I was too weak to check into a hospital so I asked the doctor to do a house call. It was a case of FOOD POISONING. Lesson learned: AVOID THE BUFFET AT THE HEAT COFFEE SHOP OF THE EDSA SHANGRILA HOTEL!",Food:Value for money:Comfort & Facilities
"It's been 3 years since our last stay with this hotel. The only reason we booked again with them was they had a deal we couldn't resist. For 7k nett, we were given a room accommodation with 2k dining credits and buffet breakfast for 2. And recently, they renovated the pool, slide and added an aqua play facility. We arrived early at the hotel. Though our room was not yet ready, they gave us a pass to allow us to use their pool and spa. The kids had lots of fun. Their lifeguards/pool staff were very attentive to my 3 year old. My 3 year old knows how to swim. While I finished putting sunblock on my son, my 3 year old walked by herself to the aqua play area. I saw the lifeguard followed her with his eyes and made sure she was ok. When the pool staff first saw her playing/jumping into the pool, they approached me within 5 minutes and asked if she knew how to swim. Coming from our room, we will go immediatly to empty lounge chairs. Within 5 minutes, an attendant will hand us our towels and registration form. We were given a room in the Garden Wing. Our kids enjoyed the sofa bed. Turn down service was excellent! Enjoyed the great service! I hope they will have more great staycation deals in the future. :)",Staff:Comfort & Facilities
"I thought I might write a review even though my stay was 3 months ago.

This hotel is what you would expect from a typical 5 star hotel in Asia. Grand lobbys are part and parcel. Nothing ultra luxurious but nothing mediocre either. Rooms are warm and cozy . The most endearing quality in the rooms of this hotel is that nothing stands out. It's like walking into an open house and the room could be anything you want it to be. I would definitely recommend this hotel for a good night's rest.
Breakfast at Heat was satisfactory but not what it used to be. It may seem like it has an impressive selection but it used to be bigger and wider...more grand.

We booked 2 connecting rooms at the garden wing.The Tower wing and the pool was under renovations during my stay.",Comfort & Facilities:Food
"I usually come to shang with my family when we get the chance ... like if theres no school , work or whenever we feel like it , so awhile ago , we decided to just go again beforr schook starts on monday... so we had a fast check in, was offered an upgrade and the room was really nice , so at first we were treated well, just as a expected coz i always feel happy and contented everytime we check in here. The problem arose when i asked for an extra set of toiletries and dental kits for my children , they didnt want to give me for we could only get a set each day according to the housekeeper manager named ricky , he even came up to our room , and kind of disrespected my husband with his manners and words , he just denied us our request , so aftrwards aftr calling anf connecting to the front desk , they gave us what we wanted , but it was too late , our day was already spoilt , because of the trouble, the kids werent able to take their bubble bath beforr their swim, and we went to the pool later than planned coz we still had to talk to another manager to express our anger ... for we are a gc member and it was the first time that we had this kind of experience, they tried to make up for it by sending some fruits to our room and a bar of chocolate , which i appreciated , but then it doesnt feel the same anymore , we feel that the standard they have isnt as high as what we used to experience and expect anymore",Staff
"During online check-in, they have warned me through email that the hotel is undergoing renovation and there will be construction noise during my stay. When I arrived, they have upgraded me to a better deluxe room as far away from the noise which made my stay more comfortable. However, I noticed a strong pungent smell coming from the lower floors into our 17th floor and quickly reported this to the service centre. They immediately sent someone and install a dehumidifier to get rid of the toxic smell. Overall stay was very good. You must go to the gym and sauna and Erick and Ray will look after you. My only disappointment at the health club was there was no mini-basketball court to shoot around especially the Filipino loves the sport. Perhaps they will include this and consider during the renovation of the gym area. Erick became my personal trainer during my health visit. He is an asset to the health club team. in the sauna, Ray will ensure that you will not overcooked yourself and was happy to keep an eye on me. Excellent service. I was also very disappointed at the restaurant above - Paparazzi, very poor service, never again and will stick to the HEAT restaurant. Overall stay was quite good and I recommend to ask for assistance and report any issues you encounter as the staff are very attentive and will accommodate your request. You must see Rico at the HEAT for breakfast and try his famous egg omelette. It's a MasterChef.",Comfort & Facilities:Food:Staff
"Edsa Shang was the best, inspite of the full accommodation, requests were taken cared off (room service, housekeeping, etc). Patience is required during check-in but the Hotel Manager saw to it that are needs were met. They also communicated very well and had a pleasant attitude.",Staff
"It was a horrible experience last December 30 that I have to wait for 2hours before my checkin. Majority of the guests that time share the same sentiments. I wasn't really expecting that kind of treatment considering I reserved at the horizon club and was also a GC Gold member which guarantee you express check in and check out.

On the other side, my room was okay. The lounge area is small which I think is overrated. The food at the lounge is fairly okay. Nothing extraordinary. I think you just pay and receive what was deserved.",Value for money:Food:Staff
"As usual, took me a couple of months to read up, evaluate and finally decide on a hotel. This time it is in Manila, Philippines from December 18-20. Many great choices but finally settled for Shangri-la Edsa primarily because of the reviews regarding service, location and breakfast! Although some remarked about the ongoing renovations, an email to them and their quick reply laid my worries aside. So the pluses. Actually, only pluses:
1. They answered my emails- no matter how many I sent - within 12 hours.
2. Check-in. Very quick, efficient, welcoming and friendly. Felt at home right away. Next time I wil see to it to bring mementos for the staff!!!
3. Front desk, doormen, concierge on duty all display same high level service and warm friendliness.
4. Lobby is beautiful. Live lounge music during our after-dinner tea/coffee price of which was surprisingly cheap.
5. Rooms: newly renovated, big, cool, very clean and comfy linens and pillows.
6. Flat screen, wifi, radio and phone, including in the toilet.
7. Toilet and bath: big, good products, clean tub, excellent shower. Plenty of towels and towelettes which still smell new. Hair dryer. Magnifying glass. etc.
8. daily freebies: bottled water, newspaper, fruits etc.
9. Sleep quality. Except in the afternoon (we didnt actualy sleep inspite of the 48-hr travel from Brazil) nights were quiet. So sleeping was no problem.
10. Room service. Quick and discrete.
11. Housekeeping. No complaints. As usual, quick to attend to our needs. My cousin and I asked for extra hair products (both have long tresses) got them no sooner than we hanged the phone up.
12. BREAKFAST - in caps but definitely not because am angry. In caps to emphasize it. It was veeery good! Superb. For us balikbayans the Tapsilog area with local native favorites was truly a big hit. We were even able to order what was not on display like fried bangus!!! There is just no way one can complain about breakfast in Shangri-la. Just ask for it and it shall be given unto you! :) :) :) Check out my pictures later on. Let the images do the speaking. For now I'll say, if you want to treat some people to nice meal. Choose brunch and bring to Shangri-la Edsa.
13. POOL - beautiful area. Surrounded by green. Makes you forget that you are actually right in the middle of the city. Very clever design and landscaping. Was not able to use the pool (with two malls next door, women won't use pools. :) My brother did spend a morning lazing, drinking and swimming. He of course swears that it beats walking through the frenzied throng of mall goers during Christmas season.
Shangrila is so nice that my friends who came over to welcome us spent lots of time picture taking in the hotel lobby, pool area and other snap-and facebook worth corners in and around the property!
Day after tomorrow, it is the turn of my husband and in-laws to arrive in Manila. They will of course stay in Shangri-la Edsa. So, more reviews to come. Let us see if they will have the same review. Right now all I can add is that reservations@shang has been sending me emails confirming their arrival, arranging for pick up, arranging for special rooms considering the long journey of the guests, etc. Impressive service onsite and online. Will certainly be back and will certainly recommend to my friends here and abroad. Thank you Shang for a memorable stay.",Staff:Comfort & Facilities:Food
"This is one of the Philippines most prestigious hotels. The atmosphere suits your dream rest and recreation even though its right at the center of Ortigas business district. Amenities are world-class.

It is also adjacent to 5 malls where you can shop depending on your budget and needs. Many low-key and hole in the wall restaurants are also just 5-10min away if you are the type who travels for food.",Location:Food
I travelled here 5 times in the past year for business and enjoyed my stay at the hotel. I stayed in the garden wing (which I would highly suggest rather than the standard rooms) each time. Also looked at the renovated tower wing rooms which are lovely but have no bath (deal breaker for me). Some things could be better to improve but all in all a good place to stay. Staff are so friendly and helpful and remember your name. Breakfast is great with lots of choice.,Food:Staff:Comfort & Facilities
"The person who received us at reception was nice. But overall, taking into consideration all the staff, a lot can be improved with the way they handle or serve the guests. One example is we had a bad experience with a staff at HEAT. There were a lot of tables available already but we were left to be waited. We were requesting for a seat area but was plainly told that we just had to get what is available. The room service was also a bit slow on our first day. No complimentary water in the room. Had to request for some but it took a while to arrive. By 2pm, our connecting room should have been ready. But found out later that due to miscomunication, they havn't cleaned the room yet. So by 2pm, they had only started cleaning. Also always felt like the bell boy wanting for a tip. Staff at the lounge area was not sure if there are activities lined up for the Christmas Eve when asked. Security was also so obviously monitoring my husband during picture takings. Th staff seems lacking in genuine gestures to make guests feel welcome and happy. Not certainly the way I feel if I stay in 5 star hotel abroad. Sometimes I think it is because we are also Filipinos. This is really a sad reality. Certainly not a 5 star experience when you are in your home country.",Staff:Food:Comfort & Facilities
"I wrote a review 6 months ago and Patrick the general manager usually replies here, which is nice, but would be better if actual improvements are made. Here, I'll make some new observations and won't repeat the ones i made in my earlier review

So, i reluctantly returned here since there was a conference right in the hotel that i had to attend. The ride from the airport took longer than usual (90 instead of 30mins) so some pampering was in order. They do the check-in in the room but they gave me the old room that has not been renovated yet. Would this kind of check-in mean better quality? So i tested it and asked for a copy of wall street journal each morning. She said ok. Because the room was so old, i didn't get the pampering i paid for

The old room still has the deathtrap of a bathtub which i detest very much, no shower stall. The flat screen tv is old with blur images. The phone is not condusive to have business meetings on as there's no speakerphone function

In-room dining delivery and food quality was ok. But when i called to have the table moved out after finishing my food, it took 5 calls and 60 mins before anyone came. It was a pity the contraption was too difficult to manipulate, otherwise i would have rolled it out of the room myself

Breakfast was again something i didn't look forward to as there are simply too many people in the hotel and breakfast area. It feels like a warzone. Or 3 star hotel in china with all 1.4 billion people eating

Oh, and the wall street journal i asked for in the beginning? Never came

I have the same conference next year and i'm seriously considering just not going for the conference anymore",Comfort & Facilities:Staff:Food
"I've stayed in EDSA Shangrila several times in the past and this brand does not disappoint. From their restaurants, to their business meeting rooms and suites, everything is commendable. We held business meetings, Christmas party, simple interview for our staff in Manila and to simply stay there and everything went smoothly with their reliable staff. There were times that I stayed in one of their condo units in St. Francis towers and I had to use internet, all I did was to cross the bridge to the hotel and use their internet in the lobby (no matter what time of day) and the staff just let me do my job and asked if I were okay (few times I arrived there where they were cleaning carpets etc in wee hours and they would find me a seat so I could work properly).

Excellent breakfast, love the toiletries and the bed.",Staff:Comfort & Facilities
"My wife and I just had a 5 night stay. We have stayed in the Makati Shangri La twice before. However, this was our first time to try the Edsa.

Its a large resort type hotel with an amazing newly upgraded pool area. The hotel has great security and staff.

I would recommend you go for Horizon Club benefits. However, get a room in the newly renovated Tower Wing, not the Garden Wing.

The Tower Wing rooms are excellent with amazing facilities, bathrooms etc.

Only 2 negative issues.....very busy hotel and surrounding area and Malls very busy. Maybe more so during our stay due to time of year.

Nevertheless, for sure this is a great hotel to stay in. Very impressive, attentive staff and security is very good.",Comfort & Facilities:Location:Staff
I stayed for three nights at the Shangrila EDSA. The first two nights the hotel was kind enough to upgrade my room to a suite given there was a conference going on and regular rooms were booked. The suite was good though in the older part of the hotel. The staff were courteous and responsive. The breakfast was excellent with some Indian options thrown in. Definitely a plus point for vegetarian Indians.,Food:Staff
"This is our company's national conference venue for the second year in a row and I never had any regrets why this was the hotel thats been chosen. Location is very accessible to two malls, with a new one that's just recently opened. Breakfast at The Heat is great, with good variety of choices. Restaurant staff there are a bit busy and requesting for coffee or water was a little challenging. Food (meals and snacks) served during our conference was also nice. Hotel is very clean and staff are friendly. Used their pool, its well maintained and if you're bringing your family with small kids, I know they'll enjoy the amenities. There was an on going renovation during our stay, but the noise was well kept to a minimum. Hoping to be back again next year.",Comfort & Facilities:Food:Staff
Room was double booked. Staff at first did not even bother to show sincerity in apologizing. They only gave me attention before i checked out the following day which for me is too late. Just because i am not a foreigner. They did not show any importance to me as a client.,Staff
"I've stayed here once before, and remembered it as a first rate hotel. The staff are really friendly, the quality of the food was excellent, and the rooms were clean and very comfortable. This time around it would have been the same but unfortunately they are in the midst of a refurbishment - not having a pool, or the main bar really limited the social areas in the hotel. I'm sure it will be great when done, but definitely restricting it at the minute. If you do go - the Japanese restaurant was very good and worth a try",Food:Comfort & Facilities:Staff
"I have visited the Philippines many times over the past 10 years, and more recently have always chosen to stay at the EDSA Shangri La. Although the other Shangri La in Manila is larger, the EDSA feels more personal. I have usually stayed in the Horizon Club floors, and the facilities, and staff friendliness make the EDSA feel like a home from home. The outside pool and bar area are extremely comfortable, as are are the variety of in hotel restaurants. I would always go back to the EDSA Shangri La when in Manila.",Comfort & Facilities:Food
Terrible service. Un-polite staff. Lazy house keeping staff. Uncleaned room and bath room. our dining experince is not good because of this impolite staff. They ruined my birthday. I will never ever go back here again.,Staff
"We are regular clients of EDSA Shang. Going to Shangrila Plaza which is in close proximity to the hotel is so easy and hazzle-free. An elevator at the Garden Wing connects the hotel to the East wing of Shangrila Plaza. The staff are very friendly and always ready to assist hotel guest. The lobby and the pool are under renovation and we are expecting for a grand and impressive lobby this month. The room service staff are very efficient; they go around twice a day replenishing toiletries, drinking water, coffee, tea and other coffee condiments. Daily newspaper is readily available at the door early in the morning. We heard mass at the St. Francis of Assisi Parish which is a few meters away from the hotel. We passed by the garden wing and the guard at the side gate politely opened the gate for us. HEAT - SUPERB, we enjoyed and loved the food.",Food:Comfort & Facilities:Staff
"We were looking forward to staying in this hotel and spend some time in the pool ... Only to discover that there are major renovations in the property, including the swimming pool! They offered the use of the pool in the near-by condominium though, but it wasn't the same. Anyway, we got the newly-renovated room in the 15th floor - finally, they made the room BRIGHT, with many sockets everywhere for our gadgets. We had a problem with the wifi signal in the room - so they placed a repeater in our room! Great. The breakfast buffet was still good, but the breads and pastries were not as good as we remembered them to be. We will be back here again, but will ask if the renovations are done.",Comfort & Facilities:Food
"This is a true 5 star property in Manila, which is worth every penny spent.

The hotel is located in the shopping hub of Manila and is quite a treat staying there since it's surrounded by 2 very large malls.

Hotel is very neatly maintained though it's old but staff compensates with their service and smile. Rooms are neatly appointed and are large enough with all the amenities required.

The breakfast spread is one of the most lavish one I have seen so far, and one can spend hours sitting at the table trying all the different delicacies.

Would love to come back and stay again,",Staff:Location
"Excellence in everything they do and some of the friendliest people in the world. The Heat restaurant is one of the finest in the city. The room was perfect, well kept and fresh. Check in and out were handled with great courtesy and promptness. Very relaxing stay for a business trip!",Staff:Food:Comfort & Facilities
"I made a function room reservation at HEAT, 1st by phone then after a few days in person at reservations desk. I was hoping to reserve the Fahrenheit Rm. but was told that it was taken so i had to settle for the Celcius & Kelvin RMs. I asked the lady staff at reservation if they would require a down payment for the reservation made and she said ""yes"". I Asked her again when the downpayment is required, she replied ""one week before the reserved date."" I paid the downpayment 8 days before the reserved date with O.R. to prove it. I called reservation again 2 days before the event, but was informed by Ms. Chevy of HEAT that there was still no downpayment made for the Fahrenheit Rm. Ms. Chevy told me that she will text me or return my call and even verified my mobile no. But she did not. I called again and was able to talk Ms. Ro Anne who said she will verify my concern & call me, again she did not call. This is very unfair treatment of customers of the Hotel. HEAT reservation staff are not consistent in treatment of customers. They just want to take customer's money but they have lousy customer service!",Staff:Value for money
Was allocated a room below the renovations. Totally horrible. Called up and was ensure the renovation has stopped at 6pm but at 930pm and the renovations are still going on despite complains made twice. Totally ridiculous by allocating guest to the room below renovation in the first place. And the whole level 6 including the room basically STINKS. Shower amenities was not refilled. Mini bar was not refilled. Poor.,Comfort & Facilities:Value for money
"Stayed a week at Shangrila Edsa for business. We ate sometimes in Heat restaurant and found this very good but our company had set up food during our stay and this was not so good but probably not the fault of Shangri la. I had a room on the 5th floor and it was clean but old. TV old crt but they were doing renovation. One thing i misliked was the noise from the renovation after 6pm. Believe this should have stopped around 5pm so when people came back from work or shopping they could relax and not listen to drilling for an hour before dinner. Very annoying. The layout of the hotel is also a bit tricky with very few signs around the lobby and basement. I have always been a fan of Shangri La and have stayed in their resort in Cebu multiple times and always been very satisfied. Believe that Shangri La Edsa is a more business hotel and cater to that in a good way. Location is both good and bad, close to SM, Shangri La Plaza and Robinson but the area is a big construction lot and you have to be careful walking around. Transportation to Makati is easy with taxi but traffic is terrible in the morning and afternoon even into evening so the short distance takes a long time. LRT is just beside the hotel but it is also very cramped.",Comfort & Facilities:Location:Food
"Stayed here for a few days whilst in Manilla. It's an impressive hotel that is well located close to the business districts and not too far from the airport. Currently in the midst of a refurbishment of the swimming pool area so this was unavailable. Impressive garden area to walk around though.
The hotel is full of staff seemingly 24/7. Service is pretty much excellent throughout and a choice of eating places and restaurants. E's bar was a bit of a strange place, music was dreadful and empty much of the time.
It's close to the main shopping centres of Shangri La plaza (connected by walkway) and the even more impressive SM Mega Mall only a 5 min walk away.
On the whole it's very good if very expensive, but for the army of staff and amenities it's reasonable enough for 5*accommodation.",Location:Food:Comfort & Facilities
"The service here was impeccable. Room was nice and clean despite being an “old” room not yet renovated. Love the proximity to shopping and restaurants, both sitdown and fast food, and also the availability and choices of restaurants at the hotel itself. Was great for me on a business trip with my 11 year old in tow. Only wish pool was completed. Sounds like it will be great fun for both adults and kids.",Comfort & Facilities:Food:Location
"I stayed at the EDSA Shangri-la during a business trip to Manila. From the desk staff helping me during my late night check-in, to the waiters in the restaurants and the managers in the lobby, all were helpful, smiling, and professional. My colleague and I had dinner at the Japanese restaurant and the sashimi was excellent! The room was large and amply supplied, and the bed was very comfortable. I will certainly stay at the Shangri-la on my next visit to Manila.",Staff:Food
