Opinion,Classification
"My family & I stayed for 2 nights and it's the same hotel I stayed in like...10 years ago. It is luxurious and regal. The atmosphere is different from the new boutique hotels who probably offer the same kind of service. But hey, it's Shanri-La. It does need some renovations but they should still maintain the grand & luxurious feel.

We were given the superior room with 2 double beds arranged together and my son would sink in the middle of the 2 beds. I'm not nit-picky with bathrooms, but it was a bit disappointing to pay that kind of money for a bathroom that needs a little maintenance. There were cracks on the tile surrounding the tub and the sink w/c was fixed with some kind of white cement. It made me laugh when my son said ""now that's one rough towel"". It's not a real concern but its something you would't expect from a Shangri-La hotel. Even the TV needs to be replaced I think. It occupies a huge space in the room.

There was a huge construction going on beside the hotel which was an eye sore. Not a concern once again, but not very appealing for tourists. The best part for me was the breakfast at Heat. It was even better than the wide variety served by its predecessor, the garden cafe. Excellent breakfast buffet!",Comfort & Facilities:Value for money:Food
"I was disappointed in the Edsa Shangri-La. The positives are the staff who are very welcoming and friendly but sadly the hotel is past its prime and looks very tired. I understand that the rooms are being refurbished and maybe when that has happened it would be worth a re-visit but for a business traveller there are now better places to stay.

One other issue, it is correct that the Breakfast buffet is magnificent. But the dining area is crowded and noisy - it is very difficult at peak times to get a table to yourself and it is not conducive to business meetings. So a great place if you are on holiday but not for work.",Food:Comfort & Facilities:Staff
"This hotel is busy! Always a lot of people in the lobby and function rooms are full. Checking in was a breeze, concierge and front desk staff were very helpful (as I only had enough time to check In before the meeting started, so they brought my bags to the room). There seems to be a surplus of staff, as there were two girls just helping people at the elevator and another handful of people ferrying the guests at the lobby. You needed a key card to get to the room, which was great. They were doing some renovations while I was there and I was warned that there could be some noise, but I didn't really hear anything (renovations were on the top floor, I was on the 5th). The room was very clean and had the usual amenities. They gave the guests fresh mangoes during the turn down service. This hotel has an adjoining walkway that takes you to the Shangri-la Mall where there are a lot of good restaurants and shops. The hotel's own Heat restaurant was great too. I ate there for dinner and the buffet had a very extensive selection and the wait staff was excellent!",Staff:Comfort & Facilities:Food
"Have stayed here plenty of times but first time we got a suite for our wedding preparations and post wedding stay. Booked a usual room day after the wedding while we got the garden suite for a few days. We actually had a tower suite reservation but due to repairs we had to be moved to a smaller suite. After a few email and arguments, we got upgraded to the Shangri la suite. It was very spacious considering it was just me and my wife there. Though dated, it's still can please you somehow. The garden wing is more quiet but the main hotel lounge where the tower wing is was too busy and lots of people were roaming around. The mall was a few hundred meters away. The bar costs a lot. Service is ok... I loved the valet and i guess they also loved me as they were able to drive A blue Bumble bee camaro everytime i came back or left. Overall it was a great stay.",Comfort & Facilities:Staff
"Stayd in the month of May 2012. This is a very fine hotel. about 45 mins away from the PH airport. Luxury redefined.The lobby is huge and very well done in terms of interiors. The staff are very polite.

very conveniently located, adjacent to a shopping mall, were you can buy sim card to basic amenities to clothing to electronics to gifts. Rooms are very well furnished, and stuffed with all required elements to make it a perfect room.

Did not try breakfast/spa, so cannot comment on it.

Overall a very good hotel, with courteous staff and well connected with taxis.",Location:Staff
"From the door and elevator persons to the concierge they all greet you with ""Have an excellent day."" Excellent, indeed! I arrived at 9 a.m. to attend a black-tie affair in the evening. I was already expecting to be told that check-in is at 2 p.m. and would have to wait until a room is ready. Instead, I was welcomed by charming Charlene at the front desk. She said it's been a while since my last stay (November 2012); she even remembered to note down that I have difficulty sleeping in separate twin beds so she looked for one that had a king size bed. Voila, the room was ready in all of 10 minutes! Needed a 445 a.m. airport transfer the following day. Arranged pronto. She even apologized in advance for the noise coming from the construction of the upper floors (I stayed in the 13th--lucky I guess). As usual, the room was well maintained, housekeeping well beyond polite. By now, everyone has raved about the hotel being sandwiched between two giant malls. Aside from food and shopping, there's cinemas, a bowling alley, a skating rink; entertainment bars and bistros within walking distance. For devout Catholics, the St. Francis church is just a stone's throw away. But wait, the best is yet to come. By the 3rd quarter of 2013, the renovations would have been done and we certainly can't wait. For now, have an excellent day.",Comfort & Facilities:Staff:Location
"Edsa Shangri-la Hotel's location is quite strategic for a business meeting. Situated at the crossroads of EDSA and Shaw Boulevard, you can easily drive to the hotel coming from Quezon City, Ortigas, Makati or even Manila. So, from two different companies, we set a 9:00 a.m. breakfast at the opulent lobby. Upon settling down on the low couch and a nice table in the center, our party of six ordered from the limited menu. Most of the menu selection were simple sandwiches or cereals/muesli for breakfast. It was ideal though for dieters and those who prefer a small breakfast. The coffee mug was big and we had a good fill of well brewed coffee. The Heat sandwich was quite a serving and four people shared it together with potato chips. The eggs benedict looked delicious atop the muffin bread. I love my muesli served with strawberry and blueberry jam. Though the breakfast was simple, it was quite filling that I skipped breakfast.",Food:Comfort & Facilities:Location
"This hotel certainly takes the prize - it is luxury itself! The staff are both professional and humble; the construction is elegant and impeccably clean; the pool and surrounding gardens are so serene; the gym well equipped; the food is exquisite and there's such a wide variety of cuisines! On top of all this a guest is treated like royalty and given full attention. Little touches like the one or two sentence extracts from the Lost Horizon placed on the turned down bed sheets in the evening make all the difference! Complimentary water and fruit every day are also provided and makes one feel at home. The hotel is also centrally located in Manila with easy access to massive shopping malls.

I wouldn't have it any other way! Thank you all at Edsa Shangri-La for making my brief stay a very pleasant one. I would return any time given the opportunity!",Food:Location:Comfort & Facilities
"One of our favorite Shangrila Hotels. Very comfortable and accommodating staffs. We stayed here yearly to celebrate New Year's Eve! Can't wait for their renovated rooms this 2013.

i am a golden circle member and everything that I specify on my choices were all provided. Premier room was spacious and elegant. The location is very convenient just walking distance from the mall. Food was never a problem we ordered at 1130 pm for our media noche and whallla it arrived exactly at 12mn! Very reliable!

We really enjoyed our stay! More years to come!",Location:Comfort & Facilities:Food
"Edsa Shangri-La is the most luxurious, best managed and the friendliest hotel I have ever stayed in. I stayed there for 2 weeks in May 2012 on business. It is located in the very well communicated area. Very close to Manila Metro expressway and MRT-3 overhead rail – station Shaw Boulevard. Very cheap and convenient way to avoid traffic. To say that hotel is clean, shining and service is awesome is needless. Lobby is very spacy with huge brilliant composition of fresh flower in the middle. Changed every few days – what an aroma… Amazing. I would say the room is not standing out as much as the other part of the hotel. It is very good, comfortable with high-speed internet, fresh fruits, nice colonially stylized furniture and comfortable bathroom. The drawback was that room was not very spacy.
Not only the hotel was the best I ever stayed by it also served the best breakfast I have ever eaten. In fact it was combination of breakfast, lunch and dinner. Since Manila is pretty much 24-hrs city at the time of breakfast some guest could have dinner. Variety of food, fruits, snacks, pastries, soups, hot dishes, deserts was just stunning. The you can have a culinary around the world round during just one meal. On the first day I literally could not make my choice. All endlessly fresh and tasty. Yum, yum… This stuff cost a lot – it was also the most expensive breakfast :-) I have not eaten other meals – dinner or lunch in one of the few hotel restaurants but I bet it would be great too. I have visited gym – a lot of spinning and jogging equipment. One thing – especially if you stay on business – you should use outdoor pool. Edsa has two wings with beautifully maintained garden in between – in the heart of the garden between palm trees – there is a pool. Very easy to switch to holiday mode, just few steps from paradise.
Edsa Shangri-La is also conveniently located for shopping freaks. Megamall (really mega) is within 2 mins walk, on the other side of the hotel – Shangri-la Plaza Mall – even closer. You can reach it from the hotel premises thru covered walkway – important to avoid tropical rains.
Last but not least – female part of staff – the collection of ultimate Asian beauties – please watch out not to remain speechless with the mouth wide open… it looks stupid ;-) I cannot recommend this hotel more.",Food:Location:Comfort & Facilities
"This hotel has impeccable service. It truly makes being away for business so much easier and downright decadent. Allergies to down, problems with the construction noise, cigarette smoke wafting in through my vents from another hotel room - I had all these issues during my stay. Luckily all were dealt with quickly (after a couple calls each, which I think would be the same as in the US). Per the construction, I'd recommend asking for a room on the 5th or 6th floor. I at first was on the 12th floor and the sound was deafening. I can only imagine that when there's not construction going on, it is perfection. The rooms are a little old, but still incredibly clean and really lovely. I loved the fresh fruit in the room every day and all the bottled water you want, on demand. And the breakfast is the best one I have ever had in any hotel. It will blow your mind - the have Japanese breakfast and sushi, Chinese dim sum and congee, Indian hot foods and naan and paratha, Western made-to-order omelettes, bacon, etc, and European baked goods (about 15 different kinds, like almond croissants, muffins, danishes, all amazing and better than most American high end bakeries), Filipino, made-to-order fresh smoothies and noodle soups.",Food:Comfort & Facilities
"It must have been one of the best hotels in the area earlier. But rooms are run down now. Although, hotel rooms are under renovation at the time when I visited there in Oct 2012. You may be woken up from your afternoon slumber by the noise of drilling/construction in other hotel rooms. Hotel staff did respond to the change of room easily. Location of the hotel is excellent as it is in the midst of commercial/official district. Close to ADB, if you are a visiter there. Hotel is connected to a nice mall in the next building. Food is good with a large variety of cuisine. We got good service from the Indian cook who took care of special needs of our group. Hotel has good conferencing facilities, which were used for our meeting. If hotel renovation is complete now, this would be a excellent choice for stay in the heart of Manila.",Comfort & Facilities:Food:Location
"Excellent service that is always consistent with every single visit. Located next to SM Mall for hours of superb shopping. Easily accessible for business and leisure spots. Try the tower wing, its even better! Thank you EDSA for keeping your loyal customers very happy! Services that I like:
1. Free wifi in car (can work straight from airport to hotel)
2. Personalized room check in (saves time)
3. Fantastic breakfast and lunch buffet
4. Superb Japanese and Italian restaurant
5. Next to SM Mall
6. Very nice pool and gym",Location:Food:Comfort & Facilities
"Edsa Shang is the best. From the moment you arrive, you are greeted by smiles and the most courteous, friendly staff I've ever come across. The pool is the most beautiful in Manila, a tranquil city oasis (though soon undergoing renovation so be forewarned), and the buffet breakfast (typically included in the rate) gives you an array of choices that can be in the overwhelming category. Edsa Shang is ideally situated next to the Shangri-la and Mega malls and close to several others, so it's a great Manila stop-off if you are traveling elsewhere in the Philippines or are on a business trip and want easy access to restaurants and shops.

I have been going to the hotel for over ten years now and was just back with my family for 3 days before Christmas and 2 days after new year, and it was like going home. Thank you, Shangri-la!",Food:Location
"I stayed here just prior to Xmas and I have to say, regardless of the renovations going on, it is the place to stay. I felt very well looked after and staff were exceptional

I did have sleeping issues as construction noise was going on. I advise to stay in the Garden Wing until construction is complete.",Comfort & Facilities
"Typical of many Shangri-la properties in Asia with expansive lobby and a not to be missed flower arrangement and of course, the world renowned Filipino smile greets you upon checking in. I got a room on the 11th floor and got a room with the view of the nearby SM Megamall and the vast Ortigas neighborhood.

Everything in my room was clean, in order, and in perfect working condition. Although, I see that the rooms would appreciate an updated interior decoration a bit of freshening up.

There is no need to discuss the buffet breakfast as it is one of the best in Manila. I could easily fill up for the rest day from the all the offerings.

Shangri-La mall and the Megamall are both in walking distance to shop, dine, do grocery or even attend mass on Sunday.

I had one of the best dimsum from the Summer Palace.

I have had a treatment at the Chi Spa a couple of years back but unfortunately, I did not find time to do so during this trip.",Location:Food:Comfort & Facilities
"Edsa Shangri-La

I recently stayed here for 2-weeks on business and I must say this was a pleasant experience. Everything was absolutely perfect from the staff to the food. I was a bit concerned when arriving and had called reservations a few times as I had heard there was construction going on in the main Tower wing. As I had to work nights during my stay, I would need to sleep during the days. I was concerned that the noise would be an issue. I was assured they would have me placed away from the construction prior to arriving, however this was not the case and on the first day at 6:30am the jack hammering began. I must say the management was extremely quick to react and immediately moved me to the Garden wing, which was perfect for the remainder of my stay.

STAFF
Truly the best! I have stayed in many hotels, in many locations, and by far the Edsa Shangri-La staff have been one of the best. I was extremely impressed and cannot think of anything to say that would need improvement.

FOOD
I mostly frequented the HEAT restaurant and the buffet, which had a wide variety of foods and all were extremely good. Again, hard to complain about anything and the buffet’s at HEAT were some of the best I have had. I also ate at Paparazzi and found this to be excellent as well. Service again, impeccable!! The in room dining experience was also done very well, with some of the fastest service I have ever seen in a hotel of such size. I was always polity informed that my in room service would be ready within 30-minutes and each time I do not think I waited more than 15 or 20 minutes. The food was always hot and serviced with class by those delivering to the door.

POOL
This was a great escape and a nice oasis from the hustle and bustle of this major city. The landscaping is well down, the pool is very clean and well maintained and the staff are extremely attentive. Everyone remembers your name and is welcoming each time they see you. I was very surprised to see that there were not very many guests at the pool, at least not in the mornings. I frequented the pool each morning after work from 7:30am – 10/11am and on most days had the entire pool to myself.

I did not try the spa, but was told by a colleague that the spa service was exceptional.

ROOMS
As stated above the Tower wing is being renovated, so there is construction going on. I was in a very nice, large King Deluxe room on my arrival, which was a bit dated, but was still well kept. I can however see why they are renovating these rooms. When moved to the Garden wing I was put into a very nicely appointed renovated room. If possible I would recommend requesting a room in the Garden wing, especially if you need to sleep during the day hours. It was extremely quiet and comfortable and made my stay that much more enjoyable. The room Wi-Fi was also very good and I did not have any trouble with connecting and at very good speeds. This was actually noticed throughout the hotel, including the pool area, which I was pleasantly surprised about.

TIPS
If you are an extended stay guest check with the concierge about hotel excursions for extended stay guests. A colleague and I participated in a day of shopping at the famous Green Hills Market, Laser Tag and museum excursion, all put on by the hotel. We had a designated tour guide, security and a private driver and the expense was all taken care of by the hotel. This is a great feature for those who are staying for a few weeks or more and gives a safe way to get out and see the city and culture.

The HEAT Chicken Club sandwich, one of the best! Try it.

There is direct access to the Plaza Mall in the hall connecting to the Garden Wing. Very nice mall with many higher end shops. Also some good places for a quick bite to eat and a large cinema.",Food:Comfort & Facilities:Staff
"I have stayed here several times and am happy to say that this hotel has exceeded my expectations on every occasion. The staff is friendly and courteous and they go ""above and beyond"" with every aspect of their service. I cannot say enough about this property. Whatever the room rate is...pay it and prepare to be impressed. It is also withing walking distance of the mall!",Staff
"I was at EDSA Shangri-La in October 2012 and thoroughly enjoyed the property. It's close to a mega mall and grocery store, the hotel is immaculate on the inside, the staff is friendly as with every Shangri-La property & the restaurants are awesome.

I spent most of my days at work, but my evenings were spent enjoying the hotel & all the amenities it had to offer. The rooms were extremely spacious, offering a good amount of room for a business traveler like myself who came to the Philippines with lots of extras! Make sure to ask for a room in the ""new"" tower, they're much nicer than the old tower.

One thing that I've noticed about many Shangri-La properties is that their breakfast buffet is insanely awesome. They offer a very international breakfast that is fitting to many cultures. In addition to their international breakfast buffet, the staff in the hotel speaks multiple languages making it a very traveler friendly location.

I would definitely recommend EDSA Shangri-La to anyone who is looking to travel to the Philippines.",Food:Comfort & Facilities
"I had my wedding here.
Wonderful hotel, you feel like you are outside of a metropolitan city.
We planned our wedding from another country and the personal at the hotel was always very helpful. The location is very nice and the surrounding area is very nice.
At our arrival, everyone was always trying to help, doing the extra job for you. Our rooms were upgraded to suites and they were magnificent. The quality of the room is outstanding and the quality and warmness of the people is very comforting.
We had minimal stress during the wedding, because the personal at the hotel were available 24/7 via phone call.
The food at the Heat restaurant was great. We had, breakfast and dinner buffet. They had a small representation of a lot of international foods with a great local selection. Filipinos love to eat, ergo they love this buffet. A bit pricey but the quality is outstanding.",Comfort & Facilities:Food:Staff
"I've been here several times, but the room seemed less nice than before. Stay is super helpful and attentive though, and there seems to be many of them just waiting around to help.

My room has a leaky toilet, water on the floor every day. I'm not sure what's going on with the system but it seems too humid and chilly, not very comfortable. I cannot even pull the drapes together properly. I like the hotels with overlapping curtain rods like this one, but the right curtain doesn't pull to the end so there is a gap.

The room doesn't live up to the Club level expectation. I'm disappointed. However the Club lounge is good and the complimentary high speed internet in the room is good. You will need an adaptor as the voltage is not 110 but the hotel will loan a convertor to charge your phone, etc.",Comfort & Facilities
"Love the location, the hospitality, the rooms, the housekeeping, HEAT,(breakfast) you have all the food you want to eat. Meat, Japanese, local, seafood. YUM. I would definitely come back. Connected to Shangri-la mall where you can find a drug store, groceries, food court. Stayed two years ago. Also walking distance to SM Megamall which is one of the biggest malls in Manila. Can`t go wrong staying here.",Location:Food
"Instead of going out of the country to celebrate our anniversary, my husband and I decided to stay at Edsa Shangri-la instead. Being a member of their Club Gourmet i was able to get my room with a huge discount. The stay was as usual, great! Although the check-in process took me for almost an hour. I pity the three staff who was on the front desk at the time of my check-in. The very looong lines and the not so friendly, irritated guest (foreign and local) waiting to be served. i commend Ms. Malen of the front desk for doing her job well and the housekeeping at the 10th flr of Garden Wing (Mr. Mike) All in all, the hotel staff are very friendly, courteous and accommodating. Food was great at Heat restaurant. Definitely, will come back if my time permits.",Staff:Food
"Its a good hotel in Manila or I must say in Phillipines, Best part of my visit to Manila was only hotel stay. Staff is very good, many things to do in hotel itself, rooms are big. The best thing is wine collection in bar, they are having separate wine bar with a very good ambiance.",Food:Location
"More than anything else, this hotel has the most amazing breakfast buffet spread. Literally cuisines from anywhere and everywhere in the world. I would stay there again longer just to spend more time at the buffet! :-)

Other than that, a good hotel, good location (right in the middle of the city, and next to the Asian Development Bank and two huge malls). The lobby area is super crowded all the time though and makes it obvious that this hotel is the place to hang out for a lot of meetings social or professional.

Service is very good, rooms are comfortable, well appointed, and the swimming pool area is a real oasis. I shall stay here again if the occasion ever arises.",Food:Location:Comfort & Facilities
"Only the HEAT restaurant is worth the stay. As others wrote, there is a mold /damp smell in the air which I think made me sick (Garden Wing). Bathrooms are bad, with little hot water. Only old fashioned TV's, with bad cable quality. TOTALLY overpriced. I think I will try the Makati Shang next time.",Comfort & Facilities:Cleanliness
