Opinion,Classification
"For the money we paid to stay in this resort, we expected world class amenities and service and we got them. We upgraded our two suites to the resort's presidential suite for a few hundred dollars more and don't regret it. The suite was over 2000 sq. ft., we availed of the free unlimited laundry (we had 5 days worth of dirty laundry), and we also received complimentary breakfast and dinner. The suite had sweeping views of the resort grounds and the beach.

The facilities and the grounds have all been covered by previous reviewers so there's no point in describing them.

What really pleased us most was the hotel staff's honesty and willingness to go the extra mile to help their guests. My husband forgot his wallet in the suite and realized that it was missing when we were forty minutes to boarding our flight out of Mactan Island to Manila. I called up the front desk in the Ocean Wing of the resort and, without hesitation, asked the front desk personnel to drop what she was doing and help us with our predicament. My husband had about $7000 in his wallet. That's about two years' salary for a housekeeper in the Philippines. After a few anxious minutes, the hotel let us know that they have retrieved the wallet and that they were sending the shuttle to the airport to give us the wallet. Every single dollar and credit card was accounted for! Because of airport security, we didn't get to thank the driver properly and we didn't get the chance to get the employees' names because the gate was about to close. We intend to do something about it, though, and writing this review is just one of them.

Our sincerest thanks to these honest and caring resort employees!",Staff:Value for money
"My family had recently stayed at the Shangri-La Mactan and booked 4 rooms under the Ocean Club package. It gave us an all-day access at the lounge which was great and the staff there was top-notch. My only complaint here was that the website listed ""check-out as late as 6pm"" as an Ocean Club benefit. When I checked in, I was told this was subject to availability. Note to hotel: You might want to put a note on that benefit so as not to mislead people.

The grounds were sprawling. The staff were generally nice. The rooms were like any other Shangri-La - clean and quite nice really. I loved the Adventure Zone for kids and the staff there couldn't have been nicer. As for our room, I had problems with the flusher and the heater took a long time to kick in. My biggest problem was that being in the Ocean Wing, we had the ""privilege"" of being under the Ocean Club lounge which meant we would hear foosteps as early as 6am from upstairs. My sister stayed in the next room and apparently they heard footsteps until late at night.

The beach was something else. It's a marine sanctuary so you could see fish all over the place and even feed them. However, the sand was quite rocky and the water was not that clean. The sand bothered me a lot and turned me off from going to the beach. It's like someone just crushed pebbles, spread them around and pretended they're sand. They were quite painful.

When I checked out, the staff inquired about my stay and I told him of my complaints. The reception manager called me only to say (in so many words) that it was my problem because I never complained the whole time during my stay. (I take care of 2 kids and have no time to complain. In fact, I wouldn't have if I had not been asked during check-out). She eventually toned down her attitude when I made sure she knew that I did not appreciate her attitude. Prior to my stay, I was also given some bad attitude by a reservation officer when I had phoned in to inquire about my reservations. Note to Shangri-La: your hotel staff couldn't have been more wonderful but some of your reservation and reception officers need lessons in dealing with guests. This is after all a service industry and I would have expected more courtesy.

One final note on Cowrie Cove. It's highway robbery! We went to Phuket earlier in the year and for half the price, you can get real mega-sized lobsters rather than crayfish! Acqua was quite reasonable but don't bother with the pizza.",Staff:Food
"Overall, our vacation to Cebu, Philippines was a wonderful one. Shangri-la was great, it appears like their customer-centric organizational culture is consistent across the board (we stayed at 3 Shangri-la hotels in the Philippines). We had our 2.5 year old son in tow so the choice of hotel was extremely important to us -- must be kid-friendly, clean, and safe. Food was great (at the hotel and even those local ""eating establishments""), grounds were well-maintained, comfortable & clean rooms, and equally as important, Shangri-la has a very friendly staff (Cebu, Makati and Ortigas locations).

When we were in Cebu, we practically lounged by the beach and pool for 2-3 days. We've noticed that the staff did not discriminate with their services -- regardless of what nationality the guests were, they gave them the exact same high quality of service. There were a couple of older gentlemen who work there (whose names escape me at this point) and they were extremely nice. They played with my son, checked up on us every half hour or so to check if we needed anything, etc. One worked by the rental shack and the other, taught us how to sail.

I have very fond memories of Cebu mainly because I spent it with my boys (husband and son) -- but fortunately, our stay at Shangri-la was problem-free that our vacation was stress-free.

Surely, we will be back.",Staff:Food
"Stayed here April 14-16, 2007. Check-in was a breeze, they got us in our rooms quite fast and fixed the extra bed (which is actually just the sofa bed) right away. We paid approximately $40 for the extra person per night which turned out to be a steal considering it includes the buffet breakfast which is about $25 per person if you were to pay for it separately. We got a king-sized bed which was so comfy, the bathroom was roomy, and the balcony was a perfect place to hang out if you wanted a quick escape to your very cold hotel room after simmering in the scorching hot summer weather. We got a bayview room which also includes a view of the parking lot and lots of trees and barely, just barely, a vew of... the bay! (It doesn't deserve to be called a bayview room) Ask for the garden view room instead, it's in the newer wing and it's closer to the pool and the beach. Checked out Chi Spa and quickly decided that it really is too expensive for us locals especially when we get spectacular massages in the city for just a tiny fraction of Chi's unbelievable prices. We lounged around at the beach with my 2 year old daughter keeping herself busy playing with the white sand. The sand just isn't as fine as I though it would be, there are a lot of sharp objects like shells and small corals so wearing flip flops at the beach will protect your feet better. We decided to have dinner at Cowrie Cove which turned out to be a big mistake. Selection was limited, servngs too small yet too pricey, and it took forever to come out. You would think that everything would taste great after we were almost starving by the time the food was served but it was just okay. Well maybe more than ok but really not worth what we paid for it.

Breakfast is served in 2 venues and we chose Acqua since we heard there were less people having breakfast there. There were a lot of choices but one can really just eat so much. Although finding out about the price of the buffet, it really isn't worth $25. We took some bread with us to feed the fish which is probably one of the most exciting parts of our stay. You can go to the beach and feed the fishes! Hold on to the bread and you can feel them getting bites from it. It's awesome! There are a lot of activities to choose from, very pricey ofcourse so be prepared to spend, spend, spend. We were content to lounge around the numerous lounge chairs scattered around the beach and just stare out into the clear blue water. After a quick lunch at Tides which was once again just ok we decided to head back to the beach and try some snorkeling. It was low tide by the time we got back but head out to deeper water and you will be rewarded with the sight of corals and fishes. After our disappointing experiences with the food outlets we decided to head into the city to have dinner instead. It's quite a drive heading into the city but there are better choices of restaurants there.

Overall we enjoyed our stay and wish that we could stay longer. Life really IS a beach!",Value for money:Comfort & Facilities:Food
"First of all we love sating at the Shang compare to other hotels, we have stayed at island shang HK, Taipei, Singapore , Edsa, Makati and Cebu. So far all places were well maintain clean and has a courteous staff, With Island Shang, being the best of them all.

My review starts with the plus points of Mactan Shang,

We were here three years ago and the place has improved a lot, the restaurants were all newly renovated. ok Fine
The ground are clean and well maintained as ever, so taking a stroll in the early mornings and evenings will be delightful.
The pool is not really over crowded even at 100% occupancy this holy week
The beach was even better with far less people, We never really had a problem since me and my kids are early risers.
The room was clean when we arrived,
The service was not bad since we are golden circle member, no need for long lines during check in.\

The minus points,
The food in all outlet are really poor especially after seeing the bill. The buffet was more expensive the Edsa or Makati Shang,
The quality was even worse,
Paying 1500 ++ is ok as long as you get quality food that you usually get from other Shang hotel, Ex will be Paparazzi at edsa where you get Sea Bass, lamp , prime rib etc, At Mactan You get roast chicken, and roast pig for the same price.
The Chinese restaurants was the same ,serving was too small that a 5 yr child can consume an order of chicken that was supposed to be for two.
The cowrie grill was the worst, The seafood buffet was the worst, The crab were small and hollow with little meat, the beef was hard as a rock, the fish were not fresh and overcooked, the sashimi was sliced so thing that it looked like it was a cross bet sashimi and carpaccio, cost cutting maybe?, The coconut crab was overdone and also not fresh, At what pissed a lot of people was, it took the a along time to refill the trays,
The only good food service outlet was acqua, food was good and quality was ok.

Whenever we see the chinese and head chef walking around, We tell ourselves these are the reason we are not really enjoying ourselves, When we go on a vacation we view food as an integral
part of our experience, sad to say they disappointed us on the aspect. Which the place had a more convenient location. That's also a problem place was so secluded you need to use the hotel to get anywhere.

Any My kids love the place , just hope they will improve the food service outlets,",Food:Location:Value for money
"Lets get this straight, if you are on a budget don't bother checking out Shangri-la Mactan. For a 2 nights stay (for a local resident) I spent almost 600 dollars. Of course I got moved to the Ocean Wing, which is like the premier wing of the hotel, no its not anything like the Valley Wing. Staying at the Shangri-la requires you that you come in style...never take coach, chances are when you come in you would see those orange/white/blue tags on bags that says ""PRIORITY""...so your bags would be terribly out of place if you don't have it.

Next is the rooms, I heard the main wing still looks the same, my last trip to the hotel was about a year ago, so I'm not sure how extensive their renovation efforts were for the ASEAN summit last January, but the Ocean Wing rooms look good. Unfortunately I was not able to get any Ocean view since I was given a garden view but I'm not complaining. The beds were soft and comfy, I stayed at the Marriot in Cebu last month and their linens were already rough due to age and constant washing.

Aqua, is the hotel outlet at the ground floor of the Ocean Wing, which also serves breakfast, on the main wing you have their main outlet Tides. anyway since you have a view of the ocean with an infinity pool, having breakfast at Aqua is always a nice experience.

I had a very nice lunch at the hotel's Chinese outlet, Tea of Spring and was impressed by variety of teas they offer, I was able to try about 5 out of the 50 different varieties of tea they had during my stay.

Over all its an amazing stay and its something I'd do about once or twice a year...thats if I don't go broke. hahahaha.",Comfort & Facilities:Food:Value for money
"A quick summary if you donâ€™t want to read the rest of this review:

On a 1-5 scale, with 5 being the best, I would rate this resort as follows:
Food â€“ 5
Staff Friendliness â€“ 5
Kid Friendly â€“ 5
Adult Oriented â€“ 2 (do have table 54 dining and Chi Spa for couples)
Pool Service â€“ 1
Restaurant Service â€“ 3 to 5 depending on meal time and restaurant
Room â€“ 3
Overall value for money â€“ 4
End rating â€“ 4 Star, not 5 as is advertised

This resort is very, very kid-friendly! If youâ€™re looking for a couples place with very few toddlers/children, this is probably not going to be the place for you. This resort has a long list of kid-friendly age appropriate activities. They even have a separate play area for 0-2 year olds (must be accompanied by adult). On this trip, we left our 22 month old daughter at home. If we had known how much this place caters to families, we would have brought her along. There were children everywhere. In fact, families are the norm here. In the restaurants, youâ€™ll hear babies crying, kids being kids. Again, if youâ€™re looking for a mostly adult guest resort, this is not the place to come â€“ unless you pick an off peak or non-holiday time. If you have kids 12 and under, this is the place to be!

The clientele here is mixed, Japanese, Korean, Europeans and Australians. Guests are pretty well behaved other than the occasional noisy kids running up and down the hallway slamming doors.

Arrival
We arrived before check in and only waited an hour as the resort put a rush on cleaning our room. This gave us just enough time to book our Chi Spa massages, our reservation for Cowrie Coveâ€™s Table 54 and to have a refreshing drink in the lobby bar.

Service
The service was quite impressive other than poolside. For example, while waiting for our room, when I returned to the line to see if the keys were ready, I was waiting behind a couple who were engaged in a slow moving transaction. After waiting about 5 minutes, a receptionist who was not working at the large check in counter came up behind me and asked if she could help me at a smaller concierge type desk area off to the side. She prepared our keys and away we went. At most resorts, we would have remained in line at the front desk until it was our turn for service.

Another example of their attention to service, I had arrived at the lobby bar with my laptop under my arm. Wireless service is available in the lobby. I was looking around for a place to plug in. One lobby waitress approached me and asked if I was looking for an outlet and directed me to a place where I could plug in. She had noticed me looking around, and was quick to meet my needs without me having to ask. Other little things like this occurred throughout our 5 day stay.

The workers do not pass without a friendly greeting and a warm smile. The food was excellent, whether it was a hamburger in the lobby bar (not on the menu but you can still order), a wonderful Italian dinner at Aqua (husband had the sea bass; I had the â€˜make your ownâ€ penne pasta with white clam sauce. Mmmm, DELISH!!!! Or a pizza poolside. Then of course thereâ€™s the Table 54 experience at Cowrie Cove. This is a do not miss meal! 5 courses, starting out with cold seafood, a split lobster and large crab, mussels, shrimp, scallop and spicy calamari on a noodle bed. Next seared tuna, then chowder soup, surf and turf filet with jumbo prawn (by then I was so full) topped off with dessert platter of delicious treats. And a bottle of sparkling wine tops off this set menu. This one peaceful, romantic table set far apart from the restaurant is a meal we will never forget. And again, the wait service couldnâ€™t have been better.

Needs Improvement
With that said, there are some things that were not in line with â€œ5 Star Standardâ€. For example, the ladies restroom by the game room was out of soap. Two of the three dispensers were broken and the third was empty. One of the toilet paper dispensers was broken as well. I brought it to a workerâ€™s attention, later that day it was still not refilled. The next day though, the one operational dispenser had been filled. As an â€œFYIâ€, the restrooms at the Ocean Club pool are much nicer.

Our room was not very impressive. It seemed a bit tired, the teak furniture on the balcony chipped and peeling, the bathing suit rack on the balcony wall rusty, the furniture in the room marginal. But how much time do you really spend in your room? Shower, change, sleep. The rest of the time youâ€™re outside enjoying the wonderful weather.

Another thing in my mind that makes a resort 5 star is if you can satisfy your customers even during peak season when the resort is fully booked. We visited this resort on Lunar Holiday â€“ of course a busy time of year. The first night we could not get a reservation at a restaurant, thatâ€™s why we had a burger in the lobby bar which was not that big of a deal. The lobby bar has comfortable seating and a great view and was not over crowded. The next day we called around noon to book dinner reservations at Acqua, the Italian Restaurant, but it was already full. We contacted the manager and in the end, they were able to accommodate our extra table for 2. The buffet breakfasts were jammed packed, only one 4-slice toaster for so many people. Three people waiting just for the toaster. Doesnâ€™t take much to add a second toaster. And the egg station, if you wanted eggs, you had to wait in line to place a custom order. Usually buffets will also have a scrambled egg selection that is already in the buffet line. Little things like that which can keep people from waiting. Understanding the need to accommodate a large holiday crowd, the resort had opened a 2nd restaurant, Acqua, to handle the breakfast crowd. But some things could have been set up a bit better to keep people moving through the food service.

Pool Service was way below average. In many resorts, youâ€™ll see wait staff constantly walking the pools taking food/beverage orders. Sometimes theyâ€™ll even offer free chilled water or cold wash cloth towels. Here you had to go get a waiter to place a drink or food order. This was the case every day we were there, and the same for both pools. The 3rd day we were there, the resort ran out of diet pop. For a Shangri-la, this is totally unacceptable. Pool service definitely needs improvement! Also â€œFYIâ€, no swim up bar in either pool.

And of course this resort is no different than any of the others weâ€™ve visited. Better get up early to reserve your poolside chairs. I went down to the pool at 7:00 am to select a good location with much required umbrella covering.

Chi Spa
Wow, what can we say about a 4.5 hour massage? Wonderful, relaxing, top notch and very professional. The private villas were comfortable, and the couples shower and outside bath area very discreet and private. If you can afford the luxury, itâ€™s worth doing at least once in your lifetime!

Would we go back?
If we had children, definitely! If no kids, it would depend. First, if this was the only trip available, then yes, would still come anyway. But if I was traveling without kids and I had other places to choose from, I would not make this my first choice. Unless it was non holiday or non peak season where families would be less inclined to visit.",Comfort & Facilities:Food:Staff
"I am Louie Salva of Manila, Philippines. We are on our Cebu-Boracay tour composed of the students of Bachelor of science in aircraft maintenance technology and bachelor of science in tourism. And we are more than 60 staying at that hotel. We stayed there from the afternoon of January 20, 2007 until noon of the next day. Between that we have some activities that takes our freedom from enjoying the hotel. I think that this is an awesome hotel. I love its scenery. I love its fresh air. I love its fresh look. I love the hotel staff. It's a big hotel that makes it peaceful especially in off-peak seasons because there's a big possibility that other guests will be away from you. In fact, the rooms of our class are isolated from each other, and I like that. I love the lay-out of the hotel. Inside there a lot of trees and plants that is surrounded by the beautiful hotel building. That shape of the hotel is not the usual shape of a hotel like that of a square hotel or a simple shaped hotel. Its shape is distinct from the others.
The room is great.
The rooms are clean and complete with facilities that are convenent. I love the volume control and the speaker inside the lavatory that lets you hear the operating television while inside the lavatory.
There are great facilities like the big childrens indoor playground, daycare center, pool tables, two swimming pools, and many more which unfortunately, we havent tried because of our lack of time. We should have stayed there a lot longer.
The food is so great. It's so fresh. There are a lot of choices of food from different countries. I didnt even bother to get rice because if you combine those foods, a plate is not enough. Being a Filipino, still, I didnt eat rice.
Unfortunately, We only stayed there for one day because we need to go to Boracay according to our etinerary, and we really didnt have enough time to take advantage of the facilities and the amenities of the hotel like the beautiful swimming pool and the beach. Our class really enjoyed Shangri-La Mactan Island Resort in Cebu!!",Comfort & Facilities:Food:Location
"My Family-Hubby and 4 year old son stayed at this beautiful resort for 16 days.First of all my thanks for all the staff working there for their excellent service. We were greeted everyday with courtesy and smile and whichever part of the hotel we went the staff were so accomodating. A FIVE Star service for a five star hotel.The facilites in this resort was excellent.For those with children-they have a 2 storey play-gym where we could leave our son for 2 hours.This gives us-parents time to ourselves.Thank you Flor,Jean,Ziggy &the rest for looking after our son.The swimming pools are quite big and they have kiddies pool area with slide.The view at the ocean view pool was breathtaking.The beach has white sands and we fed the fishes.My husband rented out a jet ski by half hour or hour and he enjoyed it.The food was excellent.They have 5 restaurants -Tides serve excellent buffett catering for all tastebuds such as Filipino, European, Korean,Japanese, Chinese,Western foods.The Buko Grill & bar by the pool will serve you food by the poolside and they are quite efficient.Thanks to Neil and the rest of the staff.Cowrie served excellent seafood-you can even choose it live and fresh on display.Thanks to staff at Cowrie for accomodating my son-fussy eater.The Spring served chinese food.The Italian by the ocean view served pasta and pizza.If we fancied to stay in the room service was fantastic and efficient. The menu had a good variety of choices.They also have the E-zone which has a games room,one can access the internet or even book a karoake room for party of 12.We tried it and it was a wonderful experience.Thanks to roly, philip and the rest of the staff.If the guest fancied a haircut or their nails done they have their own saloon.Next to this was a good size Gym which my husband thoroughly made use of.The rooms were of very good size and cleaned everyday. Thanks to Andrew and the rest of cleaning staff for doing a excellent job. The Chi Spa is their pride and joy and I would recommend every guest to try it.They have cultural shows during the week that presents native Filipino dances whilst enjoying a buffett of Filipino delicacies.At the lobby they have entertainment every night.And if the guests were feeling ill, they have their own 24 hour clinic and will deliver the prescription to the guest room. If you fancy going out of the resort for some serious shoping the shuttle bus(free) will take you to SM then Ayala Mall by the hour. They also have their in-house car service through Avis for safety and convenience. However if you fancy a transport thats cheap & meter you can always use Spider Taxis (2591579)which will collect you at the gate.We had a fantastic time at this resort and will definitely recommend it to our friends and families.The tight security at the resort entrance made us feel more secure as guests in this resort.The next time we come back to this resort we will have to stay for 3 weeks at least.",Staff:Food:Comfort & Facilities
