Opinion,Classification
"We enjoyed very much our four days here. The resort is really beautiful and luxurious. Our room, the one with a garden view, was huge, around 60 square meters.
The hotel has two private beaches that are way more peaceful than the crowded White Sand beach. It also has many different and large infinity pools in the garden.
The shuttle service to and from D'Mall worked well during our stay and we never had to wait long for their van.
Hotel's staff was nice and easygoing and breakfast OK. They really worked hard to serve nothing but the best. Couple of times we saw the head chef walking a around the restaurant. Once he took OJ back to kitchen after he had tasted it.
Only small letdown was the cutlery that felt plastic. And, of course, checking out and leaving the place wasn't that nice either. :) We could had stayed longer, and we can highly recommend to choose this luxurious heaven. This is, no doubt, the best hotel we have been to.",Food:Comfort & Facilities:Location
"We have stayed there for four nights. I've got to say it really is nice resort but i was surprised how crowded it was. Coming here after staying in resorts where you haven't met a person for a whole day time it was kind of unpleasant. The room was quite spacious, nicely furnished, very clean, with great amenities, great amount of tv channels, daily two bottles of water and fresh fruits, daybeds on the balcony. We did not like the toilet - such a small space that even the shorter one of us (173cm) almost did not fit in and we also missed an espresso machine (which i guess is a norm at the hotels of this level). We really loved their breakfasts - enormous amount of choices (anything you can imagine) but it was always really crowded and queueing was not an exception. One thing we didn't like at all - though it's a thing the resort can do nothing about - and that was the amount of food the guests were throwing away (there literally were plates full of food thrown away - I've never seen it done to this extent anywhere else). All the other dining was excellent as well - we went for the philippino buffet which was amazing. On the other hand the lobby bar was quite an unpleasant surprise for us - we were waiting for a long time to get the drinks even though it was almost empty and the drinks were nothing like they should be - no garnish, half empty glass, warm Margarita. Great plus were the free shuttle busses from the resort to the town (but again - crowds and queues). Check in and check out were both really fast, the staff at the restaurants, front desk, beach, spa was extremely nice and helpfull. I would give excellent rating if only it wasn't for the lobby bar and the crowds which kind of spoiled the experience for us.",Comfort & Facilities:Food
"Amazing service, this hotel seems to be the best by far on the island.
A little too busy for my liking but it was Chinese New Year so was expected.
The location is quiet and out of the way which I liked. The beach/water is very nice. Super clear water and you can do some snorkeling off the beach, although not much to see.",Location:Comfort & Facilities
"This is probably the most luxurious and expensive resort on the island, and it is not too hard to understand why. The moment you arrive at Caticlan airport, you do get some kind of a “VIP treatment”. You are whisked away to Shangri-la’s own jetty and waiting lounge on its van, less than 5 minutes’ drive away. There, you wait in comfort for the Shangri-la boat to arrive while everyone else is queuing up for the bumboats only in the next building. Needless to say, the Shangri-la boats are also more comfortable and faster than the other overcrowded-looking bumboats.

The boat ride to Shangri-la resort, which is on the far end of Boracay island, is about 15 minutes long. While slightly bumpy when the sea is choppy, you do feel that you are already much better off than the other people crammed in the bumboats to the island. There you arrive at the jetty in the resort, and there you have a buggy waiting to bring you and your belongings to the lobby.

We stayed in the Seaview Suite, which was very spacious and had its own jacuzzi on the balcony. It faces the sea, and was great for watching the sunset. The only drawback was, however, that the suites are located on the lowest level, so views of the sea and beach are partially obstructed by the trees.

There is the usual Shangri-la level of luxury and comfort in the room—definitely very comfortable with touches of luxury and attention to detail. However, I personally felt it was a little too clinical for a beach resort of its level. Except for the day bed and jacuzzi on the balcony, almost everything else in the room would probably not look out of place in a business hotel in the city. For the price and the location, I was expecting some kind of additional surprises to make it more unique. Perhaps the corporate branding executives had very strong ideas of conformance with the group’s brand identity.

The hotel grounds were well-maintained, and there were some nice touches to ensure people enjoy their holidays. The beaches were great, with beautiful views of the sunset. There was a saltwater infinity pool which also had great views of the sea, especially in the evenings. However, we might not have been able to enjoy this pool if we could not swim, as it was very deep. While the other 2 pools in the resort were larger and had more features like fountains and greenery etc, we thought that the view was best from this one, and naturally we spent the greatest amount of time in this one.

We also appreciated the Entertainment Centre, where guests could enjoy games like foosball, pool, shooting hoops, table tennis, board games etc, use the computer, or watch TV programmes on the projector screen at no extra cost. The Fitness Centre has the standard amenities and equipment that are present in most Shangri-la properties—good enough for regular gym-goers like us. We thought it was nice that they even loaned shoes to guests who did not have suitable shoes with them.

The spa did not disappoint. It occupied an expansive portion of the resort premises, and had its own swimming pool and jacuzzi. The spa treatments were done in little huts in the spa compound—rather cosy with the right touch of privacy. As expected of the Chi Spa in Shangri-la, prices are never cheap. The spa was a very peaceful area in the resort. When we went in the evening, we might have been the only guests in the spa, as we did not see anyone else there. The spa also has its own buggy to transport guests between their rooms and the spa.

In terms of location, Shangri-la is tucked in a corner on the island. It feels very exclusive, as there is not much traffic at this end of the island. The drawback, however, is that it takes some time to travel between the resort to D’Mall, where most of the shops, eateries and activity centres on the island are located. There is also a nice beach with white sand near D’Mall, but we preferred the ones in Shangri-la as these were much less crowded. The resort provides an hourly shuttle to and from D’Mall.

Service was what one would expect from Shangri-la. Staff were well-trained and knew what to do and what to say in almost every situation. There was a good attention to detail. However, again, I felt that this being a beach resort, service was a tad too clinical for my liking again. I wouldn’t be surprised if the staff had scripts to follow for every foreseeable situation during the course of duty. When everyone is there to relax and enjoy a vacation, perhaps staff could be allowed more leeway to be less uptight and be casual, instead of adhering to the SOP in almost every instance?

I had a somewhat disappointing experience though. On one of the afternoons when I was out taking pictures with my wife on the beach, one of the parts of my gorillapod fell off without our realising it. I knew it must have fallen off in the area between the two beaches, as I had last used it at one end of a beach, and realised it had fallen off when I wanted to use it again when I reached the other beach. When we searched the area on our own, it was no longer there, and we figured perhaps the employees who were setting up tables for dinner in that area had thought it was a piece of rubbish and disposed of it promptly. It is otherwise hard to imagine that a large piece of equipment measuring one foot long could disappear within 5 minutes.

I then checked with one of the gentlemen who was there, asking if he or any of his colleagues had picked it up, showing him what it looks like. He promised he would alert everyone working in the area to look out for it, and send it to my room once it was found. A couple of hours later when I called back to check, it appeared that this employee had not bothered to follow up on the matter as no other person was aware of it (maybe this was not in the SOP or service scripts). By then it was dark, and the few people who were sent out to hunt for it could not find it, and the rubbish bags had probably been removed. I never got the item back.

In all, I think this is a good resort, and most people would probably have few complaints. The VIP treatment extends past check out, when staff at the jetty accompany you all the way to the airport and assist with checking in for your flight. There is also a Shangri-la lounge in the Caticlan Airport’s Departure Lounge, which ensures you are comfortable until you board the plane. However, the experience does not come cheap, and whether it is worth the price is open to debate.",Comfort & Facilities:Food:Location
"You could easily spend a day or two just inside the premises of this resort. Beautiful private beach (although the sand isn't as powdery as the one on the main beach at D'Mall area), beautiful pools and beautiful rooms. They also have a free shuttle service to D'Mall which is very convenient. Staff was friendly and service was good. Rooms were very spacious and clean.

Tips: Reserve a cabana at the Solana Restaurant for sunset watching as it gets fully booked fast. Or visit after dinner, like what me and my husband did! (Some photos of how it looks at night: http://bit.ly/11M4f0d) Another tip: during the morning, when they're not as busy, ask if one of the buggy drivers can drive you around the resort and give you a tour! It was nice to see how the different villas looked!

Only complaint (which is a minor one) was how during breakfast, there didn't seem to be enough waiters for everyone. We asked three different waiters for our water to be refilled but nobody came: I guess they were all too busy (so we just went up to the juice bar)

Enjoyed my stay so much, I didn't want to leave!",Comfort & Facilities:Food:Staff
"We stayed for 5 nights at the Shangri-la Boracay. We originally booked a loft villa but we decided to have a look at Villa 13, a 2 bedroom villa with a large pool and private beach access. Once we had seen it, we immediately took it and absolutely loved it.

Shangri-La Boracay is large and there are a lot of guests, however, by staying in Villa 13 we got a totally different experience. It was like we were on a private island with the 5 star service that comes from the Shangri-La.

The food was great. The gym was massive and always very clean. Everything was perfect.

I would highly recommend it and will definitely be back.",Location:Comfort & Facilities:Value for money
Now although i did not stay at this resort I did go looking for some beach and cocktails. We finally got there around 4pm went down to the beach only to be told we could not use it unless we brought a day pass and they close the beach area at 6pm. The day pass was $70 which for 2 hours. They refused to negotiate even though there was a big group of us who were quite willing to buy food and drinks. Not impressed at all,Food:Value for money:Location
"The Boracay Shangri-La is indeed shangri-la. Set on and along a beach hillside and just 4 years old. The accommodation and public areas are excellent and pamper to ones indulgencies. Yes it is expensive but nothing good is cheap. Arrival is partly by small scheduled plane then hotel fast launch to its private jetty. Helpful crew and staff make the transition as easy as it can get. Food of various cost and type is available at several places within the hotel complex. Private beaches and pools unless you want to sample the translucent turquoise sea water. Many water sports are available. As the hotel is set up, although there is free use buggies up and down the hillside and elevators to some parts, this hotel is best suited to the fit and healthy. Of especial note is the remarkable good looks of the very competant youngish staff, enough to gladden anyone's heart.Recommended for honeymoon couples and those of a romantic nature.",Comfort & Facilities:Value for money:Food
"I stayed in one of the treehouse villa (#35), it is on the top of the mountain so you could have a great view of the magnificent beach and the sunset is without words. Their service is excellent. Since I arrived to the airport, they had people waiting for help me. After you go to a small lounge where you wait your speed boat transfer to the hotel. When you arrive it, you will see an spectacular hotel. And all the staff are very nice and kindly people. It is the best hotel to stay in Boracay.",Location:Comfort & Facilities:Staff
"We stayed here for three nights at the end of our Boracay stay, wow what a difference a hotel makes. This is a haven of peace and tranquility, service is top notch and breakfast is great. We had a wonderful sea view, room (Deluxe Sea View)was a little small but fine and pleasant. Restaurants were fairly good, and the grounds and beach are perfect.

One thing that was a little difficult to get my head around, having stayed in the middle of White beach (Station 2 – Don't do it :))) for some nights before, was that on arrival they present you with a voucher for a special price massage, only if you use it within 24 hours of your arrival, this special price was 10 times the normal price of a massage on Boracay, yes the special deal of one for the price of l0!! I think it is unnecessary for Shangri La to try to trick you into getting a massage quickly there before you find out how much they are outside the hotel. I know it might be said that there massages are better than outside, but I seriously doubt it. I didn't find out though :)))

I would recommend anyone thinking of going to Boracay and only staying here for a couple of nights, to make it so they stay her for their last night, the transfer to the airport is incredible (you might want to stay for your first night too:)) it goes like this: I called for someone to get my luggage (I had already settled the bill earlier in the day- I would recommend this as you pass the lobby), two men turned up, collected the luggage and us and escorted us to a golf buggy, which then drove us for two minutes to the private jetty at the hotel beach, to a waiting boat, then a 10 minute pleasant boat ride to the mainland boat terminal for Caticlan airport, we were then escorted 10 steps to the private Shangri La lounge at the boat port, we were asked for our air ticket information in the this lounge, then asked to get into the waiting mini bus for the two minute journey to the airport, the luggage had already been transferred to the mini bus for us, on arrival at the airport security had already been advised of our arrival and given the flight information, we cleared security and another member of Shangri la staff was at the airport desk and the airline was ready to check us in with all information been handed over before our arrival, We had excess baggage, so the Shangri La staff too k the money off me and went and dealt with the payment, then whisked up stairs to the Shangri La private lounge in the airport! Wow what a slick process!! Well done!!! the only criticism I could make about this was that it was so slick that we arrived in the terminal ready for our flight far too early, you literally need twenty minutes from your hotel room to the time you want to be in the Airport. It was fantastic, especially when compared to how one needs to get to the airport from Boracay normally.

Transport around the Island is not so slick I'm afraid, the free shuttle to D Mall is hourly most of the day and every 30 minutes at peak times, but at some peak times this isn't enough and there is a queue (line for the Americans reading this) that fills the mini bus up which make you wait another 30 mins for the next one, they need to work on this! They have enough staff there to do an on demand service I am sure. Also when I booked I was at another hotel, they said they would collect us in 15 minutes, 40 minutes later they still had not arrived, I called and they said it would be another 5-10 minutes, 15 minutes after that the hotel I was at received a phone call saying it would be at least another 15 minutes, this was at dinner time and we were hungry and fed up with waiting so we arranged a trike and made our own way there, I looked out for a Shangri Mini bus the whole way but did not see one coming to get us, when I complained at checkin they said that the mini bus was there to pick us up 2 mins after we left!!!

All in all though this hotel made me like Boracay, it was great.",Staff:Comfort & Facilities:Food
"One of our best holidays ever, and we travel every year somewhere different with 3 kids it tow....resort was awesome, although we did have an issue with the room as I thought we were getting 2 x queens beds plus cot for baby but has to be happy with King bed and fold out and cot (triple check this if you are a family... i double checked before i left so not real happy with room situation) Resort was probably the BEST we have stayed in and the service was lovely. Very friendly and attentive staff ready to cater for all your needs. Kids Club awesome too and my 6 and 4 y.o. Had a ball playing in there or just chilling out watching a movie. Whilst kids in kids club a couple of times, Hubby and I got to do a few adult activities like kayak and dragon boating so we got some precious couple time as well. All food and drinks great, but could be a bit $ but I suppose that's what you get when you stay at a 5xstar hotel. Would highly recommend to make the trek to Boracay and in particular, the Shangri La.",Staff:Comfort & Facilities
"Love this place, the rooms are fabulous and i am really impressed with the service. The staff are very friendly and helpful. From the time we land, greetings to the time we leave, the resort's service was excellent. I love the fact there's a shangri la lounge for guests in the departure hall as well.

The resort is really huge with lots of nice spots to look at the beautiful landscape and beaches. Chilling out at the private beach was nice and security's tight. The breakfast buffet was really sumptuous and it's really family friendly with a low buffet counter for kids. The view from my room was awesome, unlike some beach resorts we didn't have to worry about mosquitoes. Try the mangoes there, really sweet.

Only few feedback would be the gym's bath area needs cleaning, there's a fair bit of green algae and it would be great if the entertainment room could stock up more recent DVDs too.",Comfort & Facilities:Location:Food
I have visited numerous resorts in Boracay and all I can says is Shangri La Boracay is the best! Nice Room with great service! An island within Boracay Island. You will feel you are in paradise when you are in Shangri La Boracay. I enjoy every moment!,Location
"Hospitality of SLBO's staff is topnotch. All of them are well trained.

We checked in January 9. We chose to land at Kalibo since we still prefer big airplanes compared to small airplanes of Caticlan. From the time we landed at Kalibo, there's already a staff from Shangri-la who welcomed us in Kalibo, and escorted s to our van. We paid 3,500php for our van transfer which is good for 8 people. The van is from Southwest and we had it all to ourselves. Then on our arrival at Shangri-la's port their staff greeted us with welcome drinks and fresh towels. The port also has free wifi. Then it didn't take long for us to be escorted to their speedboat. And we enjoyed our ride to the hotel.

Their rooms are clean and basic supplies areavailable. I was very delighted to see hair band available, since i didn't bring one and it's going to be useful during activities. It's also very spacious and wifi is very fast anywhere in the area. Complimentary fruits everyday are also something to look forward to. Each night they visit rooms to fix the sheets and prepare them before the guests sleep. Some supplies are also replenished at night.

Entertainment area is something anyone would enjoy spending time at. Kids would also enjoy adventure room where they can play at. And, the gym is also very neat. Using the gym is free and it is equipped with jacuzzi, sauna, and steambath. Free shuttle to d'mall is also available every 15mins and sometimes even less.

Complimentary breakfast is also delicious. From rice to noodles, american to oriental options are available. Pastries are fresh as well.

At d'mall we tried to arrange for zorb ball and it took us 3 hours just to wait for the ride. We decided to arrange activities at shangri-la and we regret that we wasted 3 hous at d'mall just for the zorb when it actually took minutes for us to arrange this at shangri-la.

Checkout process was also smoothly done. No hassles whatsoever.

We are very happy that we chose Shangri-la Boracay for the whole duration of our stay in the island. Can't find anything to feel bad about :-)",Food:Staff:Comfort & Facilities
"We paid a fortune for our 17 nights in Shangri-La Boracay during Christmas New Year period, but all I can say is every single cent was worth spending.
It took us 18 hours to travel from our home in Melbourne to the resort in Boracay. By the time we got to Kalibo airport we were already exhausted. The welcoming and helpful airport pick up staff put our minds at rest. He collected our luggages and directed us to the hotel mini van, which took us to Shangri-la's private jetty in comfort. The speed boat trip was rocky, however when I saw the resort appeared behind the long busy main beach, I knew we arrived at paradise. Everything was well taken care of and we had our best holiday ever. Trust me, I am not a easy to please traveler.
We were assigned to a top floor corner room which over looked the semi-private beach. We observed beach wedding preparations during the day (December is the wedding month on the island) and learnt how to build sand castles from the professional; and enjoyed the famous Shangri-La sunsets int he evening.
During our stay we spent only a handful of days outside of the resort and we were glad that we had such a piece of heaven to hide away. Besides scuba diving lessons and spa sessions, relaxing on the private beach is our favourite activities. Jeson is the most enthusiastic waiting staff I have ever met. He greeted us everyday with his signature warm smile, and made sure we were serviced. Neil from Alon Bar is the dream bar tender of every hotel. He ran into us in town during his day off and spent an afternoon showing us around the island. His passion and friendliness was definitely hard to resist. Star hospitality staff like them definitely made our trip extra memorable.",Staff
"After a long and harrowing 2012 my family decided to take a break and splurge a bit but because of work restraints we couldn't all go out of the country so we decided to book at the Shangri-La in Boracay, which was a Christmas gift/surprise for us from our parents, LUCKY as it has been quite a while since this has happened. Anyway the resort has its own transfer from the airport in Caticlan and for those wonderful 3 nights and 4 days I decided to forget the world and its was well worth whatever my parents spent. I would spend my own money to go back here any day as it isn't very crowded and you feel the exclusivity of the place.",Comfort & Facilities:Value for money
"The hotel has it all. From great location, great things to do, amazing kids club etc. Most of all very friendly and competent staff. The hotel management team also cares for individual holiday makers and make sure that everything is alright.
One of the best hotels and holidays we have had in the last 10 years.",Staff:Comfort & Facilities
"I stayed in Discovery Suites before and also liked it as it is located right on the main stretch of white sand beach. However, I still feel that Shangri-la Boracay is more comparable to the nice resorts in Bali, Hawaii and Phuket (i.e., Westin, Sheraton, Grand Hyatt). It is well landscaped and very private.

Service at the Chi can be better. I'm not sure if it is because we were the last guests for the day. I was not satisfied with the treatment, attitude and ambiance. Had better experiences in other Chi's.

The check-in and waiting staff do their best to please you. Concierge even contacted someone at D'Mall to physically make a restaurant reservation for us when they couldn't get through their phone line. Buffet breakfast is extensive and dining areas are nice. The health club looks nice as well. If you are coming with children, you will enjoy Shangri-la.

At the beach, you can see school of fishes. They call them ""rock fish"". Water is murkier and beach is not fine white sand. Overall, we enjoyed our stay.",Food:Location
