Opinion,Classification
"UzzYana at the Shangri-La,The food, the room, the staff were all awesome!",Food:Staff
"Superb,Very friendly staff and excellent facilities. Pricey food etc but still worth it.",Staff:Value for money
"Clean, friendly, but pool was dirty and too much fees and charge for facilities for guests,Staff were nice. Nice location and the place was clean. except that the pool was moldy and had algae on the boundaries in between sections of the pool.,I like the location the staffs were friendly but I didn't like the fact that they charge so much with amenities. Like, I had guests that I wanted to treat them at the pool. Just the use of pool would they make me pay 3,500 per person which was outrageous. I booked at the Hyatt in Hawaii and being able to use their pool with my guest would not charge me any fees. I have to pay extra for my 3 yr old son to use the kids facility. I mean, we are guests at the hotel. We paid for our stay. I'm expecting that they would offer amenities for my child to enjoy his stay not just me and my parents. it's like paying for a fee for so we can utilize their facility.",Value for money:Comfort & Facilities
"Exceptional,Everything. Food is great.,None.",Food
"Good,Great gym facilities. Beach front was awesome. The sea beanbags were amazing and love the fact they were free for use. Overall, happy with the overall standard.,The buffet breakfast can be improved (whilst it offered an amazing variety the quality wasn't up to Plantation Bay's standard - particularly from a produce perspective). Another improvement would be to have frequent taxis.",Food:Comfort & Facilities
"Superb,Quite place, cleanness and water activity,The staff at their restaurants not friendly and their service is not worth to pay them that much",Staff:Value for money
"Good,Facilities and grounds and beach are excellent,Pricey food and drink. No service at the buffet",Food:Location
"Exceptional,Wonderful facilities and very friendly staff.,Very few of the facilities are included in the price of the room, for instance you have to pay to rent snorkeling sets and play on the mini golf or pitch and putt courses.",Comfort & Facilities:Value for money
"The best in Cebu.,Luxury hotel.,Expensive.",Food
"Great Family Getaway,I appreciate the fact that everyone at the hotel was friendly and warm. Staff would greet you every single time they pass by. They also took the extra step in ensuring my kids were comfortable with the accommodations.",Staff:Comfort & Facilities
"Will definitely go back!!!,i like most the ambience!😍,i like everything there; foods, amenities, location, and most of all, the staff are very accomodating😊",Location:Food:Staff
"A shame that some small details took away from an overall excellent hotel,!. Great location. 2. Excellent staff. 3. Our suite was excellent 4. Club lounge good,1. Food was OK but seldom excited - some strange anomalies - e.g. bacon sandwiches with no bacon. Much of the food seemed dried out as if it had been prepared well in advance. 2. Many of the activities such as Jet Ski, Pitch and Putt were very over priced and meant we did not use them",Food:Value for money:Location
"Fabulous,A lots of fun on the beach, swimming, fish feeding, kayaking, jet ski...... Comfortable beds. Cozy room. Breakfast for family.,Need double check for fee charged during check-out. Transportation to the airport is expensive and inconvenient.",Value for money:Comfort & Facilities
"I had a wonderful stay! ,The white sand beach",Location
"Exceptional,Almost everything, i guess,More free water in the room please",Comfort & Facilities:Value for money
"You can never go wrong. ,What's not to like?,None.",
"Great resort average food,Great resort for a family with young children,Food needs to be improved, restaurants have great ambience but the quality is lacking and way overpriced for what you get. Similar meals outside the resort are 25% of the price.",Food:Value for money
"Everything is good except the room is too old.,The gym is nice.,Room is too old.",Comfort & Facilities
"Good,Staff are very accomodating.. Facilities are A-okey!,While sleeping, my baby and I got a super itchy insect bites.. My husband told me that we've been bitten by the bedbugs😟",Staff:Cleanliness:Comfort & Facilities
"An amazing hotel and very nice staff,The hotel is amazing and staff are always smiling.. The staff and front disk are professional and they arranged for what I have asked for.",Staff
"Great family vacation at Shangrila Mactan,We travelled with our 7 year old son and stayed for 2 nights. It was our 2nd time to visit the resort but our first time with our son. I was happy to see they had the kiddie splash zone, the adventure zone, timezone. We also observed that t here were new corals planted in the cove which explains why we saw a lot more species of fish this time. We stayed in the main wing and had a room facing the ocean. Our room and facilities were kept spotless. We enjoyed the breakfast buffet a lot and we got to try the Italian restaurant, Dimsum restaurant, as well as the burgers at the bar by the pool. We didn't have to leave the resort to find good food. We would gladly visit again in the future.",Food:Location
"Jet setter,My first time at Shangri-la then we booked in J park and Blue water ,Maribago also. I will definitely will come back to Shangri-La.",Location:Staff
"Musty Old place,It's an old musty hotel that's in dire need of a revamp. The beach is filled with sharp rocks and requires a life vest during high tide even if you're just a few feet away from the shoreline! They have an exclusive pool for some patrons in a certain block which is discriminating at this day and age-- dinner was decent but it came with a high price.. P2,500 per person to be exact. Overall, it's a good one-time experience kind of a resort. Nothing spectacular.",Value for money
"It’s a great place for family with young children.,Hotel offers babysitting services that allows my husband and I get a massage, and they have free playground for toddlers.",Staff
"Exceptional,Loved every minute of our stay here. Our 2 young boys loved the children’s pool and water slides and feeding the fish was a big highlight. The staff were so friendly and helpful from the moment we arrived to the minute we left,as a family this resort had everything we were looking for and we cannot wait to return.",Staff:Comfort & Facilities
"Unbelievable,Words cannot describe how amazing this place is. From the environment to the staff, to the restaurants to the service, it is all that you would want from a 5 star resort. Well worth the money spent. Do not settle for second best, just go for the best.",Food:Value for money:Staff
"Incredibly overpriced for what you get.,It’s a very nice hotel, staff are wonderful, and location is ok, with the exception of a tiny beach area. The issue I had was the cost of the food. Considering that excellent Filipino food can be had anywhere around, the price for a buffet was outrageous. Between that and taxes I ended up paying almost double my room rate for what I consider to be less of a resort and more of a very nice hotel.",Value for money:Food:Location
"Exceptional,Friendly staff, great facilities, love the pastry/ bakery from buffet breakfast & awesome sea view! Definitely value for money....",Food:Value for money
"Overrated,Never prefer Shangrila over other hotel chains. But it was the only 5 star hotel in the area, so we gave it a try. It was a disappointment as expected. We booked a room with sea view, and were given one far from it. Totally not worth it, and it costed USD 350. Suitable for family I guess but not good enough for couples for this price.",Value for money
"Perfection ,Can’t complain! Probably just the location but then again, you can just stay here all day and you won’t be bored at all!",Location
"luxurious!,pricey but a good place for vacation specially with kids...",Location
"Club lounge excellent,Stayed in club, big difference from normal rooms. Very special.",Comfort & Facilities
"Exceptional,Amazing place. Staff was so cordial and welcoming. I love it. Will definitely return here.",Staff
"The best stay ever!,I love every minute of my time spent at Shangri-La Mactan because the place is super clean, quiet and the environment is so relaxing just like i needed for a break from busy city of Kuala Lumpur. The staff are amazing and the food are awesome too. Highly recommended for a quick weekend gateway. You’ll enjoy every minute of it just how i did!",Location:Food:Staff
"I’d love to go back soon!,Although Shangri-La’s Mactan Resort and Spa is huge, the staff made you feel like you were cared for as an individual. There was just a period when it was hard to get poolside service, but the service at all other times was stellar. I loved the blending of indoor and outdoor spaces, which contributed a lot to the tropical resort feels. There’s quite enough space on the property that it didn’t feel crowded even though the hotel was fully booked during our stay. We stayed for two nights and that wasn’t enough time to use all of the amenities. It probably did not help that the room was so restful that you really didn’t want to leave it.",Comfort & Facilities:Staff
"It’s my 4th visit,I’ve been there 4x in the last 5years. The location is perfect since you avoid the city traffic going to the resort. It only takes around 15-20mins coming from airport. Service and food is as expected from a big name hotel chain. In terms of facilities, 90% are still the same from my first visit. I think they need to add new things to see/do... On my recent visit, I tried to request for an early check-in. Reasonably, they werent able to give it since the hotel was fully booked. However, what I didnt like is that my room wasn’t ready until 3PM (an hour after the posted check in time). Hopefully, it will be a better visit next time...",Staff:Location
"We had an amazing experience.,Every one of the staff members that we talked to were very friendly, helpful and nice. Excellent staff! The rooms were very clean and tidy. The food and the drinks in all of the restaurants were delicious. The buffet was always well presented and the food was very fresh and tasty. We were treated so well that my daughter and I felt like princesses. The sport trainers (Zumba, Paddling board, circuit training) were very professional and fun to work out with! We would definitely go back again!",Staff:Food:Comfort & Facilities
"Disappointing. Expected more given price.,Property is well situated. Conveniently located near airport. Beach access and sprawling property were the pluses. However, given room cost over $400+ per night we expected more. Hotel was full, buffet was crowded, water system under repair so we had brown water for a period of time, aircon needed repair, cockroaches, other issues. It's a pity.",Comfort & Facilities:Value for money:Cleanliness
"Great choice for family trip,The staffs in the resort were so nice and kind, and they were always willing to help. The room condition was also great. If somebody is planning for family trip with babies or elderly parent, i will definitely recommend this resort.",Staff
"Good overall, but too expensive for this service,On the first day, the carpet on the floor was too itchy, so we asked for a carpet shampoo. Besides that, the room was clean and the view was amazing. The resort is old, so it is better not to expect modern designs. The staff were all very nice and kind.",Cleanliness:Staff:Value for money
"Always a pleasure!,There were so many things to do at the resort.,Check in took a long time.",Staff
"The Best in Cebu!!,Swimming Pool, the service, the bedroom..,everything is OK just european food not too much available..",Food:Staff:Internet
"Exceptional,The area,Nothing",Comfort & Facilities:Food
"Exceptional,Excellent property and great staff,Some staff can do a better job of providing better service",Staff
"Exceptional,Chinese guests manner",Comfort & Facilities
"enjoyed my stay,i like the hotel location,all staffs need to be better more",Staff:Location:Food
"Exceptional,Excellent breakfast buffet at Acqua. Terrific beach.",Food
"Paradise resort,Nice and friendly staff with the resort being in a great location and well maintained",Location:Staff
"I'm so in love with the beach and its like lying on the clouds because of the mattress,I love the buffet, the beach, the facilities its child friendly. I would stay over and over again. I would invite my family to share my experience and to have a great time.,There's a sea snake in the grotto- it's the venomous type I guess in white and black",Comfort & Facilities:Location
"Employees were so kind and helpful!!,Super kind workers so friendly and awesome!! Beach was incredible definitely best beach in cebu,Price was higher than others but still worth it cuz beach was awesome",Staff
"Good,Beautiful hotel with nice ocean view, we booked the ocean wing room. Clean big room, extra comfy bed. The hotel is isolated so you need taxi and a good 15' drive to the closest restaurants in Lapu lapu city. Inside the hotel there are a lot of restaurants to fulfill every need, some of them a little over prized. One thing you should definitely try is snorkeling as the coral bay in front offers you a wonderful experience.,One thing you should be aware of this hotel is the hidden charges that they apply. For example my husband had a mild headache so we asked for 2 tabs of paracetamol. Upon check out we realized that they charged us for doctor consultation as well without any further notice... Further more we gave 3 t-shirts for laundry and they charged 20 USD...just to inform you, any other laundry in the area charges 2 USD for 1 kilo of clothes. We totally understand that we booked a 5 star hotel for our vacation but come on guys...we already payed more than enough to bear with ridiculous and hidden charges.",Value for money:Location:Food
"Fabulous,Lots of options for restaurants. Large pool and pool side. Nice beach and good beach activity.,Room was bit small. (Couldn't feel luxury feeling)",Comfort & Facilities:Location
"not worth for such high price since old facilities and no activities at hotel,wifi,old facilities, not many activities except kids play pools, not much beach viewing & activity",Value for money:Comfort & Facilities
"Exceptional,Place,Far",Comfort & Facilities:Food
"Choose another Shangri La as this location makes you feel trapped,It's a beautiful hotel. Room was comfortable. The beach is very nice. Water sports are good.,We felt trapped in the hotel. You could not walk along the beach and there was no pavement at the front of the hotel so you couldn't leave on foot to walk anywhere. There must be a huge security problem as there were literally loads of security guards and the hotel owned at least 3 'sniffer' dogs who patrolled the hotel checking cars. It all made us feel like we were in a dangerous place. The hotel was very crowded. The Tides restaurant was closed for most of our stay so food choices were limited. The fish restaurant was only OK - not very good and frankly we were totally fed up with buffets after a few days. Luckily we found on Trip Advisor a much nicer restaurant only 5 mins away by car. Cebu seemed a quite dangerous and boring place to us.",Food:Comfort & Facilities:Location
"you guys should stay at shangrila mactan resort....,I'm speechless....,nothing....",Comfort & Facilities
"Top notch service. Perfect for famliy,Stunning and relaxing beach front. Very comfortable bed and linens,Long queue for breakfast and dinner at Tides restaurant",Food:Comfort & Facilities
"Fabulous,le spa,the sea was not clean ;-(",Cleanliness:Staff
"It's just what I wanted,I liked all the pools. There are pools for all ages. I appreciated the beach most of all.,N/A",Comfort & Facilities
"Fabulous,The staff is very friendly... :)",Staff
"No1 hotel in Cebu.,If you will use business staying, it's expensive. But, you will stay family, it's so good. No1 hotel in Cebu.",Value for money:Food:Location
"Best hotel so far in cebu,good service ! , great foods , great stay ! excellent place to unwind with family",Food:Staff:Location
"Best hotel in Cebu,Everything is the best Price is high but reasonable If I go to Cebu, I'll stay again",Value for money:Location
"best hotel in Mactan Island, Cebu, Philippines,Don't waste your time looking for the best hotel in Mactan island, Cebu, Philiipines. Shangri-La tops it all. Although the price is high since it's a 5 star resort, it's worth it. You get what you pay for.",Value for money
"Good faciities and private beach,This hotel is located a bit far from city área, but if you wish to stay relaxed I would recommend this clean, pleasant hotel with private beach with beautiful corals. There is only one restaurant nearby (which is Spanish), no souvenir shop nor shopping mall within walking distaice. Hotel staff are all nice and greet pleasant. There are some free activities like hotel garden tour, snorkelling camp, etc available. We went to an excursion for snorkelling, and enjoyed it at deeper sea than private beach. However, beauty of corals is just as good as hotel's private beach. It is great that the hotel maintains so beautiful there.",Location:Food
"good,very nice room",Comfort & Facilities
"Hits the Spot,The Shang is not the newest, but it hits a nice combination of great beachfront, large rooms, high standards of service and good food. Highly recommended to those with young kids.",Food
"Aileen from London,The resort and its rooms are beautifully designed and landscaped. It is spacious althroughout. There are massive pools surrounded by an enormous garden that’s been taken care of so well. Although old furniture and corridor carpet could be improved. Staff in the kitchen/restaurant and reception/check-in desk were so helpful, accomodating and polite. Varieties of excellent food but not too many choices for allergy children (dairy and nuts allergy). The beach is nice but not for small children. Other services which demand staff were slightly slow and there’s a bit of waiting time. It's most likely due to the size of the resort and the large number of clients. Taxi’s availability isn’t so great and sometimes there’s a queue. Overall it is a nice resort with great facilities and amenities, however it is quite pricey.",Comfort & Facilities:Staff:Food
"Best hotel in Cebu!,We all enjoyed this hotel especially the pool, beach and Marine Sanctuary!",Comfort & Facilities
"Well maintained,The staff were very attentive to all our needs. Facilities were very well maintained. The atmosphere was relaxed and friendly.",Staff
"Great stay!,Great stay!",Comfort & Facilities
"best staycation so far♥️,very relaxing,it could very pricey though but worth the experience.shoutout to jessa from aqua for very welcoming during our lunch,as well as diane from housekeeping for attending to our concern. see you again shang😌",Staff
"Amazing,Very nice staff and the room is nice and simple. The beach is so close and the pool is great too. We really enjoyed our stay here",Comfort & Facilities:Staff:Location
"Great resort. Staff a little slow generally but it didn’t detract from the whole experience. ,They should restock the minibar.",Staff
"Pricey— but your paying for the name and worth it,My children enjoyed the beach and the pool. Old looking hotel but the location is brilliant and we’ll keep coming back for the beach and if the price will be lesser and @ promo",Value for money:Location
"Great!!!,Best Choice in cebu!!!",Location:Food
"Best Hotel in Cebu,No complain great service and excellent facilities",Comfort & Facilities
"Beautiful beach, beautiful resort,Stayed here for just one night, but man I wish I could've stayed here longer. It is a great resort filled with great facilities and very friendly staff members. I would definitely visit again!!",Staff:Comfort & Facilities
"complain about staff,I complain about staff who was serving at main pool bar printed food f&b, it was yellow t - shirt, he was tall. He was uneasy in refusing to pay cash, and he asked for tip.It was 26, July, 2018. I didn' t imagine this situation my trip at Shangrilla one of the most luxurious hotel in the world. I really let you know this. I really uncomfortable your hotel.",Staff:Value for money
"Exceptional,Good quality stay and everything is fantastic. BUT, expect food and extra activities to be more expansive than usual Cebu.",Food:Location
"Good,I liked the spa, gym, and steam room. The buffet had a nice international variety. The food was tasty. The ambiance was good.,The rooms and bathrooms were smaller than expected. The water pressure was poor.",Comfort & Facilities:Food
"First time and enjoyed!,Accommodating hotel staffs. The beach :),Bit crowded.",Staff:Location
"Too crowded,Staff at the Cowrie Cove, in particular Benedict and Jenny, made dinner for one a very pleasant experience! The live band there on Sat night was excellent! Beachside, the watersports centre and bar services were great.,It's my second time at the Shangri La here. Since I was on my own I booked a basic king room with garden view this time. Compared to the ocean view king room, it was a tad weary and very basic with a view of the entrance/ carpark, but still functional. It's summer holidays so the place is packed with noisy children. Tides is packed, breakfast felt like warfare, so it's not the best dining experience.",Food:Location:Comfort & Facilities
"Exceptional,Absolutely delightful experience. Great service and food. Loads of facilities for kids, would suggest to anyone traveling with children of toddler age.",Staff:Food
"Amazing Experience,Everything!,Food is a bit expensive but very good. There were a lot of choices.",Value for money:Location:Food
"Worth coming back for a 2 or 3 more days stay!!,The room was clean. The beach and the swimming pools were good! I especially love snorkeling!!! Check in service was quick!,The pool near Aqua should have been closed at a later time and not 6 pm..",Location:Comfort & Facilities
"Exceptional,Great service,Nothing",Comfort & Facilities
"Excellent,Facilities are excellent very relaxing👍👍👍👍,N/A",Comfort & Facilities
"Beautiful beach area,Beach and breakfast,None",Comfort & Facilities:Food:Location
"Exceptional,The room are huge,,friendly staff and too many activities ,,buffets great a lot of food choices..definitely coming back to stay☺️Thank you ❤️,Hot foods need more taste ,,specially salt and pepper that's all..I'm a chef too at Sheraton Hotel,Denver Colorado USA..taste of foods it's more important to me..",Food:Staff:Location
"Near perfect experience,It was a perfect get away. If only we could afford this on a regular basis,It was unfortunate we accidentally left 3pcs of garments in our room. Fortunately we had colleagues who were still in the resort grounds after we left for the city Unfortunate that we had to deal with the inconsiderate concierge who was insisting on a written authorization letter for our colleague to present before turning over our items They should learn when to stick to regulations and when to bend them. Legitimacy of who i am was already verified when they made a call back on my phone. I already stated who will claim our items. Our colleague identified herself properly and yet the authorization letter issue was still afloat.",Staff
"Good location, room for that price poor.,The location is great. Nice pools, green garden, the kids enjoyed it. The riff with the corals is okay for Mactan, not outstanding compared other islands. Food was very good.,Very expensive. The room was old fashioned and not to spacious.",Location:Food:Value for money
"Superb,I enjoyed the whole place... The staff and amenities...,Food",Staff:Food
"Blissful break with every need catered to,We loved everything! Nothing was too much trouble for the staff. The resort has excellent facilities and it was truly a wonderful break.,My only possible observation is that the water pressure in the shower was weak - not exactly a negative comment, merely an observation!",Comfort & Facilities:Staff
"1 day vacation,delicious food, excellent service from super friendly staff, relaxing spa, clean rooms, complete amenities like pools, mini golf, gym, sauna, jacuzzi, etc.,Non motorized water sports accessories like snorkels, fins, etc. are available with a fee if not checked in a suite room.",Comfort & Facilities:Staff:Value for money
"Passable,A variety of restaurants,I requested double room with one big bed where I discovered that 2 beds combined tr make one bed. This is totally not accepted.",Comfort & Facilities
"Relaxing place,The staff were all so pleasant. Facilities and beach location excellent,No digital clock so couldnt see time at nightime. Maybe more choice of restaurant without buffets",Comfort & Facilities:Location:Food
"1st place for relaxation,Perfect resort, with lots of things to do. Loved Chi Spa. Enjoyed different restaraunts of the resort. High quality service.,Snorkeling was not very amazing comparing to other destinations of Sebu. Diving is too expensive.",Value for money
"Everything is excellent but one :),Everything except for..,I liked everything except for the extra pillow in the overhead cabinet that has a coffee stain or something. And it smelled old. i think it hasn't been replaced.",Comfort & Facilities:Cleanliness
"magnificent,will come back again very friendly staff",Staff
