Opinion,Classification
"Lack of organization and confirmation follow up,The staff were very friendly and made up for many shortcomings.,Many annoying contradictions even after receiving confirmation emails, like airport transport, then they said it was not available. After raising the tone and speaking to a manager they reconfirmed it. King size bed and a non smoking room were confirmed, then they said we cannot guarantee that for you. Then they tried to charge me for the airport transport even though it was in my package. On the other hand, the hotel needs a major facelift.",Staff:Comfort & Facilities
"Good,The toiletries, they smell bad",Cleanliness
"Good,Quick response of the customer service to any call for attention,Harassment at the front office for payment and deposits",Staff:Value for money
"It's a good place to unwind and to go shopping,We liked the room and the sheets.,The housekeeping were not consistent with the refill of tissues and toiletries.",Cleanliness:Comfort & Facilities:Staff
"Avoid Manila. However, if you have to come to this district, this is a good hotel.,Good hotel. Staff extremely helpful for our needs with a new born child.,The traffic in Manila is awful, and this does impact the hotel. Allow at least 1.5 hours to get anywhere, even the end of the street!",Staff:Location
"Still, there's room for improvement.,The amenities, location, and attention to detail.,The daily service charge, and the breakfast buffet was pretentious- no real value for money. Wifi speed was unremarkable for a 5-star hotel.",Value for money:Food
"good,Cleanliness,Nothing",Location
"Relaxing stay,The staff is very accommodating,Since the hotel is too packed because of the medical convention. Its very hard to get taxi in the hotel",Staff:Comfort & Facilities
"Not worth it!,I had a very disappointing experience during my stay. I raised a complain regarding the dust on their ventilation. They sent a maintenance guy to check the issue, after checking they found out that there's an accumulated dust on the AC. However, after the assesment the guy took a vacuum machine and did the job while we're in the room and absorbing all the dust while he was vacuuming the AC. Is that a right procedure to do for a 5 star hotel? Yes they've offered us to move to another room after complaining what happened but what's the sense of moving after getting all the dust from the execution of the job? management didn't do anything good with the complain and it's very disappointing. Oh maybe they think offering a nurse to check on my allergy due to dust will make me feel better how helpful is that.",Staff:Cleanliness:Comfort & Facilities
"The staff doesn't seem to be welcoming and helpful. ,I like the room. The hotel itself is really nice. The staff, not so much. Service in the restaurant is not good, we went there for late lunch last 27th of October if Im not mistaken and the service is horrible. Food is not well prepared either. Bean sprouts weren't cleaned and our lamb was well done when it's supposed to be medium rare. Bread is cold and No ketchup for fries. The front desk staff wasn't nice when we were extending our stay. Overall, not so good for me. Hopefully the hotel management is aware about this.",Staff:Food
"Above average,For you to send me your rates when asked for an early check-in is so NOT a 5 star hotel trait. Where is the hospitality??? I know we all look for upsell options but what you doing for early check in is cheap- it would make more sense to ask for the check in time rather than just sending your tariff. Your rooms are very very ordinary with new entrants like Okada etc in the market. You got some catching up to do. Also you can learn from Solaire/Okada on how to make things special for guests who come to celebrate in your hotel. Disappointed.",Staff:Value for money
"Crazy security style. People cant walk thru the car exit way. You have to walk like you are driving,I believe final security check in when entering hotel but if you are walking, you have to enter thru car entry entrance instead of short cut from car exit, entry point which is more convenient if you walk from megamall. They force you to walk around with no sidewalk and no covered path. That kind of service with almost 10000 pesos a night",Location:Comfort & Facilities
"In case you missed it..,We stayed here for my sister’s wedding last weekend. In the middle of a video/photo shoot, there was some water leakage from the ceiling. They had to improvised and put a waste basket in the middle of the room just to keep the water off the floor. Edsa Shangri-la, you are not helping!!! We were behind schedule as it is so we had to be extra cautious to prevent any liquid staining the wedding gown. It probably didn’t helped that the weather was blazing hot but the AC in the rooms and facilities (ballrooms) were not working properly. But we were still hoping it would somehow improve. AC was not cool enough (we set it up at the coolest temperature) for all rooms due to ongoing repairs happening in the hotel and they said they would cranked up the AC around 3 am. By the time we came back from Church, we decided to get something from our room – only to find out that our room was flooded from the damaged water line. Apparently, this has been going on for 30 minutes while we were at Church. May I just point out if you were a part of a wedding entourage this is such a waste of time and hassle. Boo Edsa Shangri-la! We couldn’t get inside but luckily our things were spared from the water. Staff had to get our things inside the safe and they had to transfer all of our things to another room. Sad thing was we didn’t get to take any family pictures because I was busy staring at our room filled with water. Management could have done a lot more improvement. I asked around and heard that this was also the same problem last week. Leaking ceiling and broken AC. Based from my experience, this is not a 5-star hotel given the current services and facilities.",Comfort & Facilities:Staff
"Use to be a great hotel,The hotel itself is actually very nice. Rooms are a little dated, but is kept clean. Pillows and bed are all very comfortable. What was disappointing was the staff. When you arrive there is NO ONE to help you with your bags. For the past 2 visits I had to bring my own bags in. Put them into the x ray and lug them to the counter. For some reason the arrival area is just not managed. Checking in can take some time. But once you get through all of that it's a pretty good hotel. Compared to some of the hotels in Makati this one was pretty good value for your money. Just don't expect too much in terms of service. And the food...... very very bad. If you want a comfortable place to just sleep in. Its good and the gym and pool areas are great.",Comfort & Facilities:Value for money
"Not up to standard ,The rooms are starting to show their age . Also it seems that every time I book a room through Agoda, I end up with a mediocre room On the lower level with a terrible view of some rooftop or a parking garage . Its NEVER a nice room upper floor overlooking the gardens or the pool .",Comfort & Facilities
"Edsa Shang - location and service are good!,Edsa Shang - location and service are good! You can never go wrong with hotels that are near the malls and in the center of the business district. That plus being a reputable chain hotel, make them a good choice.",Location:Staff
"They put us in a stinky room. ,Not all rooms are stinky contrary to what the staff told us. When you book here make sure you tell the front desk that you will demand to be transfered when you get a stinky room. The first room that was given to us smelled like old and humid. Like dirty clothes left in the bin for long. The showerhead has mildew and the spare blanket smells bad too. The pillows flatten easily so when i woke up i had a nasty case of stiff neck.",Cleanliness:Comfort & Facilities:Staff
"Disappointing,I am the daughter. My parents celebrated their anniversary spending 2 days and 1 night at EDSA Shangri-La. I was the one who personally chose this hotel because I'm very confident that being one of the well know hotels in the country surely my parents will be taken cared off. But to my disappointment, NO. Me and my sister was already coordinating the said booking right after it was booked in Agoda. Everything was running smoothly and even car service was arranged. We went to EDSA Shangri-La to settle the booking and to our surprise, they told us that there was no booking. Talks here and there until after two to three hours finally they were able to traced the booking. The question is, how on earth we were able to coordinate with this establishment so smoothly thru email and have encountered problems when we went there personally. At the time of checking-in, again problem arises. No confirmed car service well in fact from day number one it was there in the booking, fully paid. There was no hair dryer in the room. At the time of check-out still the receptionist was asking for the payment of the car service, well in fact it is paid already. They have given so much hustles to my parents considering that everything was properly coordinated and paid even before the time of checking in. Such a big disappointment.",Staff:Value for money
"Very far from a 5 star hotel, very disappointing,Parking is a pain. Check-in took an hour! Room carpet is very dirty. Mini bar is empty. Room service / food very poor quality (my wife got food poisoning. Not 5 star at all. This may be due to high occupancy during the holidays but this is NOT an excuse for a 5 star hotel. Very disappointing.",Comfort & Facilities:Staff:Food
"Weekend Escape?,I am sorry, I didn't get the name of the person who checked us in, but he was wonderful. He told us about an upgrade that was available at a discounted price. This was well worth it. When he saw it was my daughter's birthday, he arranged to have a birthday treat sent to the room. While the interior of the room was great, the carpets leading to the suite need replacement:( Dinner at Senju was lovely. But, while I understand it was a Friday night, service at the Lobby Lounge could seriously stand improvement. We tried for half an hour to catch the attention of one of the service crew, but they were otherwise pre-occupied. In the end, my husband had to stand up and go to the bar just to get water for our daughter. Not something one would expect from a 5-star hotel and definitely not from a member of the Shangri-La chain.",Staff:Comfort & Facilities:Value for money
"A very tired shangri la,On arrival the lobby smelt strongly of fish, the next day it was the same. They have a ventilation problem. I booked a club room which cost more than S$400. The club room is old the carpets are dirty, the bathroom has a bath shower which I can never understand why hotels put baths in rooms. No one ever uses them. The amenities are not up to shangri la standard. I am back to the sofitel. The staff were great but I would never stay here again or recommend to any of my associates.",Comfort & Facilities:Cleanliness:Value for money
"Way below 5 Stars! ,A single positive: upon check in I was upgraded to a suite, due to unavailability of my requested room. Sadly this was the only positive experience during my stay.,As a very frequent traveller I must say the experience during this hotel stay was probably my worst ever in a five star hotel in Asia: - When needed, I had to call Guest Services several times from my room. The phone usually rang 20-30 times before answered, if at all answered. - a call to Housekerping to make up my room was ignored. After a reminder call 40 minutes later, I was told they'd come to clean immediately ... A third call, some 20-25 minutes later was required to finally get the job done! - Room Service is slow and unreliable. Was told 30 mins delivery time and waited well over an hour! - I had to extend my hotel stay. Different rates were quoted by different staff. The final quote I received was in my view overpriced. After voicing my disagreement over the price, the quoted rate was immediately adjusted down. i guess less experienced travelers, who may not push back on 'outrageous' pricing, are simply overcharged. - mini bar wasn't re-restocked daily. - the hotel interior is old, the sofa in the suite seems more for decoration as comfortable seating is a challenge. - I had one dinner at Paparazzi, one of the hotel's restaurants, which was disappointing re food quality. The ordered starter wasn't fresh and had to be returned. Service quality in the restaurant is below par. - upon departure I ordered a hotel limo to get me to the airport. The car showed up 10 minutes late. - Lastly, the hotel security is clearly a farce! The focus seems to be on selected people only and is not done professionally at all. While I observed mainly local people being checked (if the performed action can be called a security check), I walked through 'security' twice with large paperbags (containing things I bought outside the hotel) without any checks being performed. I confronted the respective 'security' staff about such lack of diligence, but all I got back was embarrassed smiles. Would I recommend Edsa Shangri-La? Well, you make up your own mind ...",Staff:Value for money:Food
"Buffet brfast feels like queueing in a fast food,except fot the location nothing is else is good,Disappointed. Rooms are still old fashionly equipped. Very small room for such an expensive rate. Queues are incredibly everywhere even at the breakfast buffet, the long queue make me think twice whether I am in a 5-star hotel or just in a fastfood waiting to order. Service is not up to a 5-star hotel standard. Not Shangrila's standard",Food:Value for money:Comfort & Facilities
"Manilla's six star staff,Staff, Staff & Staff,My 3 night stay, from 23 - 26 July 2015, was excellent. I had an evening event to organise on 25/7. Support given before and on event day was fantastic - prompt, attentive and professional. Banquet staff Peter and Executive Lounge Jinnah were the outstanding star performers. They anticipated, remembered and got all requirements in order. The other staff at Executive Lounge were providing v good service in their quiet ways. I loved everything about Edsa Shang. Wish I had spent more time to enjoy the other facilities as well. I will definitely come again.",Staff:Food:Value for money
"Dusty room and function hall,food,My six year old son was having asthma attack when satying inside the function hall or in the room we stayed in. When taken to the pool area, coughing would automaticallly stop. I guess it was on the dusty carpet of the hotel. Imagine your child coughing the whole night, who could sleep well? Not sure if they have cleaned their carpets after the supposed heavy renovation. We have stayed in this same hotel at about the same time last year, but my son didnt have asthma attack that time. Not a good hotel when it comes to cleanliness.",Cleanliness:Comfort & Facilities
"As expected. ,Location, Breakfast, WiFi,As expected. However, upon check-in I was offered a room upgrade of 1,000 pesos. However, I was not told that this was per night a did not include a significant VAT tax and service tax which was meant that I face an unexpectedly larger bill than expected. Such taxes are not familiar to foreign travellers. One should be provided with a breakdown of costs or full disclosure of total costs upfront before being asked to sign at checkout. Quite deceiving.",Value for money
"Nothing special. Not an ""experience"".,Bathtub. Towels. Robe. Pool.,Most Shangri-La properties provide an ""experience"". This one is located amidst construction and is a bit dated. The staff are polite. Breakfast was included, very average and limited selection. I would only stay here again for a very good price.",Food:Location:Cleanliness
"Most overpriced hotel hotel we stayed at,Clean, comfortable room,The dinner buffet was advertised at 950p, but after all the service charges it came to about 5000p for 2 people. A bottle of water we thought was complimentary cost me $13. A burger, salad, and a couple drinks for lunch was $75. Everything was just decent quality, but very overpriced. The charges for everything seemed deceptive and dishonest. You only find out when you are presented the bill. We stayed at five different 5 star hotels on this trip. The Edsa Shangri-La Manila was by far the most disappointing hotel I have stayed in on this trip, or any I can remember in the past few years. I would have filed a complaint with the management if I thought it would do any good. I think the best thing is just to inform as many people as possible to avoid this hotel. I would highly recommend any of the Crimson hotels instead. The Edsa Shangri-La Manila is an overpriced ripoff that can't compete with hotels that cost a quarter as much...",Value for money:Food
"Comfortable, not at par as other Shangri la hotels,Centrally located, convenient, wide spread buffet,Generally good. But not at par with other Shangri la hotel. Check in was fast, but check out was slow. The renovated room doesn't look renovated. Amenities not complete - only one toothbrush for a booking of two person, no vanity kits like cotton, comb - unusual for a 5-star hotel, and for a Shangri hotel name. The complimentary cookies looks like it was just tossed on the table. No turn down service on our first night.",Comfort & Facilities:Food:Value for money
"Good,Great location, great service, great food. I always stay here every time I'm in Manila.,The hotel can get very crowded in the lobby especially during check in hours. Getting into the lobby by car is frustrating because of the slow security check and narrow driveway.",Staff:Location
"Good,clean, good service,room quite small",
"unhappy,the location and the quality of food,luggages were left unattended ny tje personnel in front of the main entrance.",Comfort & Facilities:Location
"Good,i've waited for almost an hour to be attended during check in. the receptionist left before my turn and did not come back... its my birthday tho :(",Staff
"Just overnight,Nice room,Boring area really",Location
"Nice hotel for family, couples and business,We had a great time we will come back again next time.,Not ready for the unexpected. My girlfriend needed tampons, and they didnt have one upon request, and that's the only bad thing i could think of",Staff:Comfort & Facilities
"weekend stay,pool area but very crowded.,pricey",Location
"Relaxing,Upon check in they told us that breakfast is free for kids below 12yo but when we ate breakfast they said it's for 6yo and below only",Food:Staff
"Okay,Staff smile",Staff
"Pleasant,The global group running shangri-la,The supervisor who promised me to arranged the shangri-la makati confirmation but kept me waiting for the entire day. I ended up going to Manila Penn. Not sincere and doesnt understand the hospitality business.",Staff
"Good,Great location, near Shang & Mega Mall.",Location
"Frontline duty staff not so accommodating,Staff at front desk not too flexible in guest requests. Took so long for service to arrive for even simple toilet needs...",Staff
"The surrounding places are good.,I like the pool area and lobby lounge",Comfort & Facilities
"It is a good hotel, breakfast is good.,Lobby, pool area and Breakfast,Staff tricked me about getting taxi. Charged me 500 peso when the cost was only 100",Value for money:Food
"Far to expensive,Bed and wifi perfect and very friendly staff,Club lounge is a joke for the price you pay for the room",Value for money:Staff:Internet
"Great stay,Location swimming pool,Nothing",Comfort & Facilities
"Good,I didn't feel as a valued customer thinking that's it's a first class hotel, I don't think my stay with Shangrila Hotel gives value for my money. I can stay at a 3 or 4 star hotel for ...",Value for money
"Volvería a Filipinas,Lo que más me gusto fue el gimnasio y el restaurante. La comida excelente y muy variada. La atención del personal estupenda, muy amables y dispuestos a ayudar en todo,La climatización se estropeo pero nos solucionaron el problema rápidamente. Quizá el baño un poco pequeño y la habitación un poco antigua",Comfort & Facilities:Food
"Formidable,Croissants et lit parfait.",
"La grande classe!,Personnel très poli et serviable, excellent rapport qualité-prix! J'ai passé 3jours de rêve!",