Opinion,Classification
"Recently spent 6 nights at this heavenly resort and found myself not wanting to leave! From the minute we got off the plane, we were met with the impeccable true 'Asian' service that you'd expect. The private boat ride to the hotel is a particular highlight - offering some of the most stunning views of the island and the beautiful waters that surround it.
Upon arriving the service continued, as they whisked us away in golf buggies to check us in. Relatively smooth check-in, once we had ironed out a few issues with the reservation, but all together quite pleasant as we were given drinks to enjoy whilst waiting.

We initially stayed in a Deluxe Seaview Room - elegant, modern, stylish and comfortable - the bathrooms being a real highlight - as well as your private balcony with daybeds to enjoy the sunset from...what more could you want?! After a few nights we were then upgraded to a Seaview Suite - very spacious and elegant, beautiful design - an even more lavish bathroom and dressing space! - completed with a stunning balcony, with your own jacuzzi looking out to sea. Both rooms were fantastic and would recommend both.

The resort itself is beautiful, aesthetically pleasing everywhere you look! Thank goodness too for the buggy transportation - as whilst you may not notice it whilst there - it's a big resort! But having said that - we were there during low season and even whilst busy, you very rarely see many people around. It felt very private.
The pools are fantastic, the beaches sublime, the clear water that welcomes you even better, and service just right.
However one thing to point out - I did find that the staff had a bit of 'certainly sir' syndrome....in that they would agree to see to anything you asked for (be it food, drinks, towels, etc) - but then soon forget to do it as you're waiting there for it to arrive. A quick reminder soon sends them on their way as they remember again - but it happened a few times and got a little frustrating - but that's being particularly picky!

The restaurants are fantastic - real nice mix of cuisines - I recommend them all, especially the Rima Italian restaurant - a highlight for us! Don't expect them to be particularly busy though (we were there low season), this is where you come to notice that it's a very quiet resort! Found all the menus, both during the day and evening, to be very reasonably priced. Although the only negative is breakfast tends to be very busy and quite loud...doesn't bother most people I'm sure - but if you're not up for that I'd certainly recommend taking breakfast in the room.

Should you fancy something different too - the shuttle service down to the town is frequent and very easy. Provides a change of scenery too, and there are some fantastic restaurants and bars down there.

Before our arrival I also got in touch with Scotty's Dive (their watersports department) as we were keen to do a private island hopping boat trip. I was put in touch with the manager there, Nicholas, who was incredibly attentive and helpful in finding us what we were looking for. He really went to serious lengths in sorting out the most fantastic day for us. As what we were after wasn't yet available on the island, he came through and managed to source a brand new luxury local banca boat in Boracay, and kitted it out with bean bags, mats, there was a new sound system, provided fantastic Shangri-La service on board with drinks, towels and snacks...he really did go the extra mile to ensure we had a memorable day out at sea. I honestly couldn't recommend it enough - and it is down to Nicholas' diligence, and the fantastic team on board that we were able to do it! If you're up for a day out at sea - I suggest you get in touch with him! And again...very reasonable!

I'm whaling on a bit - but that's probably demonstrating just how much of a good time we had at this resort. I honestly couldn't recommend it enough - whether it's quality time with family or loved ones, friends, or just simply needing some time out from a busy work schedule...this is the place to escape to! We'll be going back...",Food:Comfort & Facilities:Staff
"The best choice for ultimate rest & relaxation. Everything was very soothing. From the music to the scent to the view. We didn't go wrong in choosing Shangri-La Boracay for our Honeymoon. The people were warm & anticipated our needs. If you choose to check in here, I assure you that you will feel like queens & kings for the length of your stay.",Location:Comfort & Facilities
"The most expensive resort in Boracay. But really without any special service. And location , even the beach quality at Shangri-La is not as good as the rest of boracay station 1
hotel staff are different, some are nice some are arrogant and not welling to help , too many facilities , also it is not easy to go to the mall, room service is too expansive, and we really have to walk in the hot weather to reach the beach",Location:Staff:Comfort & Facilities
"The amazing service starts the moment your flight arrives in Boracay, and you wait a few minutes in a luxury lounge for your private boat to take you to the hotel. The excitement builds as you whisk past amazing beaches and sail boats on the short ten minute boat ride to the hotel.

The hotel itself is nestled on a small hill, with great views over the clear blue water of the ocean. With 2 private beaches, and the biggest infinity pool in Asia, there is plenty of relaxation going around. The facilities are first class, with the hotel being just 3-4 years old.

And now for the best part. The people. This is what makes this hotel truly great. People are friendly, attentive and anticipate your needs.

Well done Shangri-La.",Comfort & Facilities
"Shangri-la is the best hotel/resort in Boracay. Their customer service has surpassed all best services I have seen and experienced. They're very friendly, courteous and attentive to all your needs. My 8 yr. old daughter lost her sunglasses, she forgot where she left it and they were able to help me find it considering the resort is about 12 hectares big while we were relaxing at their entertainment zone. It's pricey but well worth it! If you want to experience superb treatment this is the right place for you.",Staff:Value for money
We enjoyed our stay especially the children. There were daily activities for adults and kids. Breakfast food was good but not the best. There were plenty of choices though. We left our children in the Adventure Zone for a few hours and they didn't mind it. The staff here were very nice and pleasant.,Food:Staff
"Truly had a 5-star experience during our recent stay in June 2013. Not only is in nestled in the cove of one of the islands in Boracay, it was masterplanned to have a fantastic view, architecturally handsome buildings and villas, with world-class service! Staff was ultra-friendly, always ready to lend a helping hand. Amazed at how they all catered to my mom, who was mobility-impaired...Food in the hotel was good quality, just pricey. Truly enjoyed the breakfast buffet with varying cuisines and this is already included in the room rate. Definitely away from the hustle and bustle of the town, this is a place to relax and just be you... If looking for the crowds and the noise, there is shuttle service to and from D'Mall (town proper) every hour. Shuttle service was ever-ready to accomodate all 20 of us in one big van! Given a 2nd chance, I will definitely go back!",Food:Staff
"I was always biased towards Boracay as a ""party place"" and not much of rest, relaxation and romance. Shangri-La Boracay (SLBO) totally changed all that from the moment we arrived in the Kalibo (KLO) airport when they had a rep to assist us with our baggage and bus transfers. To top it off, we were the only guests of SLBO on our flight. SLBO went out of the way to welcome us.

Everything in SLBO is just absolutely fantastic - the rooms, the electric vehicles, the food and most especially the people. They were very supportive when I shared plans a week earlier that I wanted to propose to my girlfriend here. Even via online, their restaurant/reservations team sent me packages for our special moment.

Truly, I felt the support of the entire SLBO team for ""our"" surprise (I was not alone in the planning and I felt it), from the VIP treatment at the airport to the awesome-ness of the place. Even Rima, where I proposed, had a lovely evening view with delicious food and the perfect ambience. Even the other guests of the resort were fantastic (we were seated beside an Australian couple married for 37 years! who shared their wisdom with us)

So there it was: lovely place, clean air, delicious food, absolutely fantastic people, #TheProposal was planned and executed perfectly. SLBO literally changed my life for the better.

I give SLBO 6 stars out of 5.",Staff:Food:Comfort & Facilities
"Where do I start. I came for a look and experienced service beyond anything I had ever experienced around the world. Everyone was so courteous,warming and friendly and spent quality time with our small group showing us the resort and all it had to offer from restaurants, spa, villa the private beaches I was stunned with it's natural beauty. Can I also thank Franz Completo for the time he spent with us. His phone was very busy but he didn't rush showing everything that Shangri-La had to offer, even down to a courtesy drink and refreshing towel at the end. Everyone needs to come and experience this first class service, you won't be disappointed.",Staff
"My family and I returned recently from a 10-day stay in this beautiful hotel. We knew the ""rainy"" season was starting and indeed the last couple of days were quite grim but nothing can take away from the overwhelmingly positive experience we had at the Shangri-La.
We initially thought we would explore the island a bit but ended up staying at the hotel the whole time as we didn't want to miss out on any relaxing time. Starting with a fantastic breakfast in the morning, we then spent the whole day at the beach where we always had sunbeds available (somehow it seems Asian tourists prefer to go there for max 1 hour to take pictures of themselves there..:-)), great service (Bam, we mean you!), had lunch right there, snorkeled, relaxed, and then ended up the day at the beach trying out the different cocktails offered. Food was best in our opinion at Rima although Sirena was nice as well. Vintana is great for breakfast but dinner there is a bit depressing as quite empty. We tried out the spa (wonderful experience even though expensive), the children spent around an hour every day at the Entertainment Centre when they were tired, my parents-in-law had a massage near the beach as well - it was all lovely. The grounds were beautiful, the rooms very nice and most of all, the service was delivered with warmth and a big smile. Special mentions to Laudito at the pool area, Bam at the beach, Nathaniel at the bar, Lun at breakfast, Tisa and Sianna at Rima. Thanks for making this a special stay for the 6 of us.
The only thing we can fault was the arrival at Caticlan airport as we were made to wait a full hour at the lounge before we could finally take the boat to the hotel and after an overnight flight with children, that wasn't nice. Also, on the way back for some reason, we were again deprioritised vs other guests and had to wait at the lounge (airco not working) before we were finally taken to the airport.
All in all, a wonderful stay - would love to return in the future!",Food:Comfort & Facilities
"I broke one of my own rules with this one - I never left the ""hotel"" from the moment I checked in to the moment I checked out. I normally make sure I explore wherever it is that I am visiting. This place though was just so amazing I neither felt the need nor desire to venture further. That said, I was only there for a weekend and my plan was R&R.

From the moment the staff meet you in the tiny arrivals hall of Caticlan airport until they safely deposit you back in their dedicated lounge for the return flight home you are incredibly well looked after.

6 or 7 family groups all arrived at the hotel at the same time yet each group was greeted immediately by their own hostess to check them in and show them to their respective rooms. I was booked into a standard deluxe room which I think is the lowest tier they offer here. It was absolutely perfect. The bedroom was spacious and had a couch as well as a desk area. The bed was incredibly comfortable. The bathroom was big, with a separate shower and bath as well as his and her sinks. The 2 sliding door options was a nice touch - one opening out into the bedroom area and the other in the more tradition vestibule area.
The balcony had both a table and chairs and a pair of day beds, perfectly secluded. I was on the 3rd floor so my view was the tops of the tropical forest. This made it amazingly atmospheric when we had a downpour on the Saturday evening.

The grounds of this hotel are extensive with 2 private beaches, lots of paths, gardens and forest to wander through. The main pool is a wonderful, interestingly shaped pool with an infinity edge pointing towards the sea. Despite its curious shape it is still possible to swim lengths (not sure of the length, but they definitely felt like more than 25m).

I spent a good few hours on the beach, the one nearest the main pool. The staff that looked after this area were always available and attentive yet also unobtrusive. I also noticed there was always a life guard present.

I made use of the gym. It was on the same spacious scale as everything else in this resort and had a good range of equipment - cardio, resistance machines, free weights, etc. On arrival they had also given me a class schedule. They have a yoga/aerobics studio for those who prefer group exercise activities.

When I wanted to go for dinner at the sea-food restaurant, located on the rocky outcrop that separates the two beaches it was raining. No problem - a golf buggy was almost immediately made available to drive me the short hop so I wouldn't get wet. When I signed the bill after dinner the waiter similarly asked if I wanted a buggy summonsed to collect me. I chose to move outside to the bar and enjoy listening to the sounds of the sea over a cocktail. I just had to ask the barman and he called for a buggy.

The only thing I am not raving about is the breakfast. Don't get me wrong, it was perfectly OK however not comparable to breakfasts in other hotels of this class/scale I have visited.",Comfort & Facilities:Food:Location
Stayed here for 3 nights (June 15 to 18). Service was the best with staff assisting us the moment we arrived at the airport up to the our return flight to Manila. Stayed in the seaview room and the the view was fantastic. A very good choice to rest and escape from a stressful work life.,Staff:Location
"This is the perfect place to get some quiet relaxation and feel like royalty. I think this is the first resort I have ever been into that has the most amenities. Despite the fact that we were a big group travelling together (apart from the 5 other groups who arrived with us), the people in ShangriLa were very organised, they ushered all of us and catered to all of our needs. The way they handled the transactions such as credit card charges, deposits etc. was so unobtrusive and very polite which i really appreciate because most hotel establishments these days lack this. They also handed my other family members brochures and activity sheets while i do the required forms so that they weren't just sitting down bored.

One of the biggest thing that i love about the resort is its divine architecture. It almost feels like the beauty of the resort itself steals the thunder of the natural beauty of the ocean and the beach. I mean, every angle of the resort seems like a majestic place to do some meditation or a landscape for a flickr photo. The interior was tastefully done. I can tell that even the smallest details were taken into consideration such as signs for the elevator that used Capiz shells and each drainage has an artistic twist wherein water that drains down trickles along this metal bell shape rod. You won't be able to resist taking a macro shot of it!

I also appreciate the fact that just a few steps from the lift, there is a nice little hut with a phone wherein when you pick it up someone will automatically be at the other end to assist you to call for a buggy to bring you wherever you want. I didn't know that there was a shortcut from our room to the lobby and the pool which is why we used the buggy so much. It was only on our last day that i got to explore the resort and found out that all of the buildings were interconnected and was fairly near to each other! That really amused me because looking from the outside, it seemed that the resort was made up of different buildings.

The pool was absolutely divine, it was heated which i think a lot of people quite like but personally i like pools that are cooler specially when you take a dip during a hot sunny day. The water temperature was a bit warmer than i expected. If the waves weren't too harsh during my stay i would have preferred to swim in the ocean because i was looking for a cooler swim. The jacuzzi spots that was spread through the pool was really amazing, there were always more than enough for everyone.

The staff by the pool and the beach were the best! They were so friendly and warm and knew what i wanted even before i asked for it! It's like they could read minds! They always made sure that your sun bed was covered with fresh and dry towels and an extra towel at the end of the bed for when you get out after your swim. They came and offer fruit shakes a few minutes after i got back on my sun bed, who knew i was hankering for a Pina Colada at the same exact moment?! Brilliant! Their beach front was fabulous. There were sun beds with umbrellas and 3 round lofts which i loved! I spent most of my time in one of the orange lofts, getting a tan and reading a book. When i asked for drinks, they even had a small wooden table that they brought out so that i can rest my drinks on it. It was a shame that the waves were quite large during my stay, I kept getting swept towards the coral part of the ocean and hurt my feet a little. The sand was fine although the grains were quite bigger compared to the shores of Boracay ""stations"". Relaxing around this area is very serene and quiet which i really liked. Around 5pm, happy hour starts and the acoustic band starts to play only the most perfect and fitting songs for the beach such as Obidiah Parker's rendition of Hey Ya!, John Mayer and Jason Mraz songs. The songs were soft and smooth just the way I wanted it to be. I know one group of 20 somethings were looking for a really loud crazy bar and decided to go out of the resort and find one since Shangri La didn't have it. ShangriLa is perfect for you if you want to escape the hustle, bustle, club scene that you can find in Metro Manila. This is the place to find a really relaxing and serene spot and be spoiled to your toes.

The rooms were fantastic. We were three in one room and it was very comfortable. The bathroom had its separate rain shower, loo and bath tub. All of the soaps were of great quality (L'Occitane) and the provided toiletries were really complete, i regretted bringing my toiletries bag, honestly. They even provided hair ties!

The only comment i have for the rooms are the pillows. I requested for 3 more extra pillows since most of the pillows on my bed were flat and deflated every time i rest my head on it.

The Breakfast at Vintana was pretty good, breakfast was absolutely delicious and they offered good varieties such as the yogurt station, pancake or waffle station, 2 eggs stations and even a corner for asian breakfasts such us dimsum and porridge.

Since we were a group I decided to reserve a table for eleven people but the person who was in charge of the seating discouraged me to wait for a table of twelve and just get a table for the four of us since the buffet was full. I wish they give importance on the fact that we traveled as a group or at least booked a table for us ahead of time. It also took quite some time before we got seated.

Dinner at Vintana was a little underwhelming though, I was expecting more choices of main courses from the buffet and when i asked the chef from the sushi bar to make me a temaki, the temaki that he served me was of bad quality. The Nori seemed old because it was hard to bite on it and the flavour of the sushi rice was a bit unappetising. Also, I was surprised that the chef at the dessert station could not fulfill my request of a small chocolate soufflé with ice cream which i think is called ""Verona"" because apparently, ""it was not served at the buffet"". The first time i went to Vintana (a few months ago), I was able to request this during their lunch buffet and I didn't understand why they would stop serving it. It was really disappointing because I was looking forward to have it again during my stay.

All in all, I felt that i did not get my moneys worth dining at Vintana. The service was not as impressive compared to the other areas of the resort and the food was underwhelming, the room service food was more delicious compared to the meals i had in Vintana buffet. I should have just ordered room service for dinner (. This is what weighs down my review from 5 stars to 4 stars. I was expecting better quality of food and service for the price we paid for their buffet and knowing that Vintana is their main restaurant in the resort.

Leaving ShangriLa wasn't as smooth as i would have expected comparing it to the way they handled our arrival. Our flight was 7am which is why we had to catch the 5am ferry. The night before, we requested our breakfasts to be packed so that we can eat it at the private airport lounge. They packed 2 pieces of pastries each and half a cup of coffee. This was really disappointing, not only were the coffee cold upon arriving at the Mabuhay center, it was half empty. It did feel a bit short changed because we have paid for a buffet breakfast each and all we got were 2 stale pastries and half a cup of cold coffee. I also wish that the Mabuhay center were as accommodating as they were when we arrived, but upon our departure they did not even serve bottles of water or coffee or tea! It would make sense that they would serve hot drinks specially for guests like us that were leaving at 5-7am.

I would highly recommend this resort and spa and would definitely come back again for a vacation, however I will explore their other restaurants and order from room service more.",Comfort & Facilities:Food:Value for money
"The photos of this place do not do it justice. It is the most amazing hotel I have ever seen, yes its pricey but worth every cent.
The staff could not be more polite or helpful if they tried, sneeze and someone will be there with a tissue.
The food was sensational and the rooms luxurious",Staff:Cleanliness:Food
"We stayed in Shangri-La Boracay last November for our honeymoon. It's an outstanding hotel and resort. The food is really good (if expensive), with several restaurants to choose from. Staff are very friendly. We decided to upgrade to a villa on our arrival - this was expensive, and set us back about 1,000 Euro per night (whew! - it was our honeymoon though). Perhaps you can get a better deal if you book in advance. The villas are awesome though - your own private pool, and a butler at your beck and call. We didn't know what to ask the butler to do but it was a a real novelty to have one at our disposal. I couldn't recommend it highly enough - they pick you up from Caticlan airport and wait on you hand and foot until they leave. Really nice place - best hotel/resort I've ever stayed at I think. Really nice breakfast, great private beach",Food:Staff:Value for money
"My Fiance & I stayed on Boracay for 7 nights; 2 of which were at the Shangri La and the other 5 on white beach. Arrival from Catilan was a breeze and they allowed us to check in early and check out late which was great. Highlights were the beautiful beach, comfortable beds, super friendly staff, happy hour drinks, fresh seafood, fresh juice at breakfast, pork adobo, kayaking, snorkeling, and epic sunsets. Having the 5 star resort experience was the prefect compliment to the white beach experience for anyone traveling on budget.",Food:Staff
"excellent in service, has complete amenities very beautiful private beach. powder sand. treat all of us like a vip from the time we landed at caticlan airport. all our luggages are well taken cared of from transfer to their priviate hotel ferry boat up the the hotel counter when we checked in
hotel has shuttle bus to drive you to the boracy strip up to 1am .very good place for family gathering. great feeling of exclusivity. hotel room are big with a choice of beach view or garden view . we were in this hotel from may 29 to june 1 2013 very hospitable and caring staff. really no regrets in staying this a bit expensive hotel but no regret and will still look forward to visit again",Comfort & Facilities:Staff:Location
