Opinion,Classification
"Room was not cleaned properly and late check in,We waited for about 45 minutes past the standard check in time with no freebied after. We had a 10 month old baby with us. The room was not thoroughly cleaned. Our room was dusty and the sheets were a bit dirty. It was very disappointing experience since we expected a lot from this hotel. After about 15 mins of staying inside the room, my family including my little girl kept on sneezing because of the dusty room. I hope the management would have better housekeeping standards.",Cleanliness:Staff
"Lobby staff were not helpful.,No ne will offer to help you with your luggage here.",Staff
"Very Kind Receptionist,I enjoyed 6 holes golf course and everything but the price of the groceries in the convenience store in the ground floor was kind of expensive to buy this and that. I was surprised that the receptionist was very kind. I don't remember his name (it might be Paul) but I would like to thank him to be nice to us. Thanks.",Staff:Value for money
"family vacation,very relaxing and family friendly hotel",Comfort & Facilities:Staff
"Good service and nice beach,プライベートビーチ、プール共に充実しており、ホテルの中だけで完結するリゾート生活を送れる。ビーチは魚なども泳いでいて美しいが、ごつごつした岩が多いので注意。朝食は日本食は少し怪しげだったが種類も多く充実していた。宿泊客は中国人・韓国人が最も多く、その次が日本人。この中にいるとどこの国のリゾートか分からない気分にはなるが、セキュリティも万全で安心して過ごせる。",Staff
"surely be back,glad to be back soon, maybe for a longer time.",
"It could have been better0,The place is wonderful, however the lobby is hot and it is uncomfortable especially if guests are made to wait for check out or check-in. We were made to queue when we were checking out at 12 noon, and the lobby was hot (no air conditioning). We had to call the attention of the supervisor to do something about the long line especially since there was no airconditioning and it was hot. It's a good thing she heeded our request.",Comfort & Facilities:Staff
"Great place to relax,Resort was beautiful and staff was very accommodating. Only cons were the Buko Bar ran out of sweet potato fries during our stay, and the bathroom close to the game room was quite dirty. There was an unpleasant odor and the trash cans were overflowing. Other than that, we had a great stay - avoided that bathroom for the rest of our vacation. I gave cleanliness 4 stars still since the rest of the resort and its facilities were up to par. Food was also easily available within the resort, but they can be pricey. The Chinese restaurant particularly was average and not worth the price you're paying. If you have the time and wouldn't mind taking a cab, would recommend eating outside as there are better options and at more reasonable prices. Note that traffic can get pretty bad in the city itself though.",Food:Comfort & Facilities:Value for money
"Ill have to Save up for my next trip to the Shang,Ill have to Save up for my next trip to the Shang",Location:Value for money
"Beautiful Resort. Wonderful Staff. ,This is my first time in Cebu, and Mactan. The resort is fanstastic with a sincere dedicated staff. The steam room in the gym is one of the best i have wver stepped into. The gym staff anticipates your every need. Our room had a balcony and a separate sun deck overlooking the property and ocean. My only concern is the food is not at 5 star level. In fact its just ok. We ordered butter chicken which was beyond overcooked. In the dining room we ordered calimari which had breading consistent with frozen sefood dinners. But would i go back? YES",Food:Staff:Comfort & Facilities
"Awesome Everything,One of the best vacations we have had. Well worth it if you can afford it even if you have to save up for it. World Class in every category. Awesome location extremely beautiful.",Location:Value for money
"A perfect family trip,The resort was huge and clean well. /@Private beach was peaceful. The resort got a snokeling activity for free and it was awesome. All my family members loved staying this resort!",Location:Comfort & Facilities
"Not a five star service,While restaurant staff are very friendly and attentive, the battalion assigned in the Lobby are the complete opposite. They were too busy chit-chatting. Both on arrival and departure, we have to attend to our luggage. No one ever offered to help unload/load to the car or to push them up to our room. They plainly just don't care. Very disapppointing. A 3* hotel can do a better job.",Staff
"Simply Amazing place,One of the best places Ive stayed in for a long time.",Location
"Fantastic family resort ,Check in & out was a breeze! The room is comfy, facilities are goods. The marine sanctuaries are well kept with abundance of fishes and coral. Beach area is clean and inviting. Pricey, but standard is top notch... shangri-la hospitality! Well done for all the ground staff and we had great time. Hope to be back soon 😋",Staff:Comfort & Facilities:Location
"family resort,The hotel offers everything for every family member, and the staff are really friendly. They even provide catholics an anticipated mass every Saturday in the garden. Beautiful resort!",Staff
"Exceptional,Everything is good. One small problem is pool's floor kinda old and not clean very well.",Comfort & Facilities:Cleanliness
"awesome place,will come back again",Staff
"awesome,view is spectacular. staff are great and courteous. kid friendly. food is so-so and pricey.",Staff:Food
"Great pool, beach and playrooms for young kids and close to the airport,Loved the resort facilities, pool area, staff, and beach with fish swimming around your ankles. The only downside is the rooms are dated and not up to expectations for a Shangri La. The rest of the experience overshadowed the dated design of the rooms though. If you live in Asia and are looking for a long weekend getaway with young children this is a great choice.",Comfort & Facilities:Location
"Superb,The food was really great. The bed is extremely comfy. The bathroom had a complete set of toiletries, including a hair tie! I love the pool & beach, so clean.,It is a bit pricey to stay but I still say that it’s well worth the price.",Comfort & Facilities:Cleanliness:Value for money
"This resort is for families with children. Not good for mature adult couples.,Great staff, fair food, very clean,Too many out of control children and just fair food.",Food:Staff
"A lovely spot.,Very relaxed atmosphere. Attentive staff.,Slow service at restaurants.",Staff:Food
"Thoroughly enjoyed our stay but resort is looking a little tired.,A little dated in places, could certainly do with a freshen up....",
"To me one of the best Hotels in Cebu,This is a very nice resort with a nice garden and a super beach. The rooms are well furnished, clean and the bed is big and comfortable. WiFi works very well in the room. Pools is clean and the water refreshing. Its a pity they close the paying guest swimming pool at 6pm and only let the kids pool open till 9pm. A very silly and unnecessary and Hotel policy that is not justified. The food is impeccable.,although they gave a 20% discount due to low season, US$250 for a seaview double room, is just too much per night!",Comfort & Facilities:Value for money
"Pleasant,The resort has excellent facilities. Pricey but worth it.,The lady I spoke with over the phone regarding my reservation (which I thought was not processed by Booking.com) was not as courteous and not as helpful as the rest.",Staff
"A convenient resort if you are staying with children.,Nice and clean room, overflowing drinking water supply, good facilities, accommodating staff, a perfect place for family bonding and recreation.,No supermarket and restaurants nearby.",Comfort & Facilities:Location:Cleanliness
"A really good relax trip ! ,You have everything there inside . Nice beach is just there, u don't even need to go out of the hotel ! Amazing view Rhein sunset and sunrise , nice staff ! Fine food! Perfect,Nothing",Location:Food:Staff
"Awes me still :D,Everything!,Price of food & rate per night can be improved.",Food:Value for money
"Excellent resort for a get-away,Excellent service of all staff members; friendly, polite and attentive delivering service with a smile. Quality of food is of a high-quality; both breakfast and dinner. The best breakfast spread we have encountered. Although being a large property, we did not feel that this was a disadvantage. The service was still personal and we did not encounter any problems with queue for breakfast or sunbeds not being available. Comfortable sunbeds and beautiful well-maintained beach (although not overly large). Nice touches: personal greeted and welcome drink upon arrival. Airport and city shuttle, although chargeable. Ability to use hotel's facilities prior to official check-in/after official check-out including shower facilities in gym. The distance to the airport is just 15 minutes.,Sometimes difficult to get local taxi at the hotel. Request for king-size bed was not honored. During rush-hours, queue at reception. Could have given a small treat during turn-down service. Called Housekeeping twice for replenishment of water; however, nobody came. Difficult to swim during low-tide. Many families with children; if you're looking for a romantic get-away, take this into consideration.",Staff:Food:Comfort & Facilities
"Very good,that it is a resort hotell",Food:Location
"Brilliant relaxing holiday,The hotel had many things happening to keep the children busy and all the staff were very friendly",Staff
"Disappointing,sea is amazing, location of the hotel is wonderful. Personnel is always ready to help and assist.,Overpriced and quite low quality food in restaurants. When you pay that much, you expect high standard. However is seems like they are really spoiling the good food with their style of cooking. The choice is huge, but in the last days of our stay we were feeling like there is nothing to eat. Choice and quality of wine is also very poor. Getting a seat in the dining areas was challenging, every single day we had to wait in a queue to get our breakfast. We had a strong feeling that the hotel's facilities cannot accommodate that number of guests. Hotel itself is very old, our room wasn't renovated for a long time (e.g. old paint stains on the ceiling), especially the bathroom. Worth noticing, the cold water supply was poorly functioning either, so taking a shower was a disaster. That's a big shame on Shangri-La which positions itself as premium hotel chain. The beach is clean and well maintained, but it was an everyday challenge to get the lounger as the staff is not controlling situation properly (e.g. a lot of guests simply put their stuff on the loungers and leave the beach for several hours). I booked Chi-spa for Shiatsu massage but upon my arrival (not prior) it was discovered that the pool was out of water, they didn't offer any complementary bonus for not receiving the service i booked. If you decide to go for Parasailing or any other water activities the hotel is offering and order the paid photo service be sure to check the settings in their camera. Our parasailing was disappointing as they made photos in lowest quality 640x480 resolution which are not suitable even for uploading to social networks. To sum it up i would say the value you get for the price is totally not worth it. It more corresponds to cheap 4* hotel somewhere in Turkey, but not to Shangri-La premium resort.",Value for money:Food:Comfort & Facilities
"Pleasant,Price !! and everything has to be paid in addition including snorkling equipment at a scandalous fare ! Even standard taxis are not alowed to come in the resort !",Value for money:Staff:Food
"Amazing experience, top end resort,Great hotel, a standout in the Shangri-la family of hotels and resorts. Great staff. Excellent choice and quality of restaurants. Perfect for families.,adding some sailing activities would be a good plus.",Food:Comfort & Facilities:Location
"Beautiful place to visit,Rooms, facilities and grounds are beautiful. Staff were pleasant and very friendly.,We did the snorkeling safari event, but what I didn't like so much was the guide used fish food for a bunch of fish to come. I would have preferred a more natural habitat rather having so much fish come all at once.",Staff:Food
"Wonderful getaway with small kids,Loved the kids facilities and activities. Wonderful snorkeling, esp for beginners. All activities were easily accessible and we felt comfortable with safety and management.",Comfort & Facilities:Staff
"Wonderful resort with brilliant staff,In addition to the beautiful location, the staff made a fantastic impression on my wife and I. Their service throughout our stay was impeccable. Many of the resort guests were families and overall this meant that the evenings were quieter and more relaxed.,One should be aware that the dining options are somewhat limited and can be expensive. The prices were not a great deal cheaper than in Hong Kong while the quality of the food was reasonable but not outstanding for what we were paying.",Food:Value for money:Staff
"Mostly great,Food is quite good, especially relative to other resorts in the area. Service is very good and friendly.,Accommodation was a bit noisy and bar service was very very slow. Not nearly enough seating at the breeze bar area",Comfort & Facilities:Food:Staff
"Perfect for families with young children,breakfast was great! The sea at high tide is nice. Our kids loved to swim around with the tropical fish. A lot to do for kids in the resort. Only 15 minutes ride from the airport. Nice facilities.,Food is overpriced. Breakfast is included in the room rate, but if you want to eat lunch or dinner at one of the restaurants it will cost about EUR 40 per head for buffet (you cannot buy a la carte during lunch or dinner). The sea is only good for swimming during high tide around 11AM. if you go there in the afternoon during low tide, you will most likely cut your feet on the sharp stones",Food:Value for money
"Front desk takes so time for check in guest. Not organized ,Hope they check front desk costumer service",Staff
"Best resort in Cebu ,We are a family with 2 young kids. The resort is family friendly and our kids were well treated and kept occupied with so many fun activities. As halal food is hard to find in Cebu, the resort has an advantage over its competitors: a Muslim Chef de Cuisine at Tides who can prepare halal meals with prior arrangement. We had so much fun here and as club guests, felt very well treated in the ocean wing.",Food:Location
"Aging paradise in mactan,Ground and staff are exceptional. Despite fresh coats of paint and varnish rooms are dated and comforter covers have holes. Breakfast is a zoo 7-9 am not enough tables for size of hotel. Plenty of beach chairs but only 12 workng beach canbans fir sun cocer so most guests dont get sun shade.",Comfort & Facilities:Food:Cleanliness
"A Relaxing Getaway in Mactan,I love the place. The only put off is that bad smell that's somewhere coming from the Ocean wing - a sewer-like smell.",Cleanliness:Comfort & Facilities
"Excellent Hotel,The service is exeptional",Staff
"Great Hotel with Good Facilities,They should improve check in time. Waiting over an hour to check in is not acceptable for 5 star hotel",Staff
"Shang Mactan,accommodating staff",Staff
"Checked off the box for Cebu Mactan,This was the third Shangrla we have stayed in. The other two were in Manila and Chang Mai. First I want to point out that this property is 100% oriented towards couples and families. There is almost nothing of interest at the hotel or the surrounding area for those that come alone. Great free guided snorkeling tour and fair priced jet skis and other water toys. Staff was very nice, efficient and helpful at all times. Especially those working the beach. Security was very tight. Breakfast buffet was excellent. Lunch and dinner were lousy. I believe they have six restaurants all together. Cayree's cove has a very relaxing atmosphere. How they could screw up seafood is beyond me.The one and only alternative to the hotel for dinner is to exit the hotel grounds and walk directly across the street. Hola Espanol was excellent and fair priced. We ate there three out of the four nights of our stay. The rooms are clean and as others have mentioned old and tired. Balcony/sunset views good. $$$$$$$",Food:Location:Staff
"Had a wonderful time ,Staff very attentive. Loved Teresa's French toast was amazing. James was very helpful during checkout. Haven't received a FedEx envelope from Am. Ex. Would love to know if it ever arrived. Mary Hendler room 3009.",Staff
"leisure at it's best,everything is exceptional especially the staff",Staff
"nice resort but some staff lack proper pleasantries,beautiful resort with well manicured gardens. clean beach with nice sand, clear water. can really see fish just a few meters from shore. a bit of turn off though when we checked in early. receptionist said we can already use the facilities while waiting for our room to be ready. while walking around the resort, roving guard questioned us twice if we are registered guests. didn't like the approach. we felt like we weren't welcome. good thing that experience was set aside with the great dinner experience at tea of spring. staff were very accommodating. it was my father's birthday and they surprised him with cake and song.",Staff:Food:Comfort & Facilities
"Always the best,Everything was as it has always been, food was great, and the beach clean. It was unusual for the check-in staff to pressure you into upgrades, however, so am not sure what the new Management was thinking.",Staff:Cleanliness
"Exceptional staff very friendly ,Very friendly and helpful staff",Staff
"Excellent location, facilities and friendly staff.,Room is very clean, food is good and staff are very friendly. Everything is very good including the facilities but the only thing not good are the pillows, they are too soft that even two pillows is making me feel sinking in my bed. Also the extra bed is not good for my son’s back which made him suffer backache as it is made of spring and the mattress that was not firm enough that he sink in the middle of the bed. We travelled as family and requested to have an extra bed but the bed wasn’t good for a five star hotel.",Comfort & Facilities:Staff
"the best hotel!,We book 1 day last mar 25 . We enjoyed every moment there. The sea the food the staff is very accomodating . Nothing to say more but its the best hotel!",Food:Staff
"Exceptional,Love this hotel the best in Cebu in my eyes that is why I chose to have my wedding there 10 yrs ago",Comfort & Facilities
"Lovely experience ,Was in an oceanfront suite, which was very pleasant. Not opulent, but great space, lovely bedroom, great view. My only gripe was that the hot water tap in the shower remained a difficult problem, requiring control at the micron level.",Comfort & Facilities
"Exceptional,One of the best places in Cebu and the country but could be very exclusive and pricey.",Value for money:Location:Food
"Shang Mactan,accommodating and courteous staff",Staff
"Great break,Visited for a weekend break. Shangri La is always luxurious and beautiful and our room was super. Only downside is the rocky beach and soooooooo busy at meal times. Not all the staff were helpful but maybe they were having a bad day.",Staff:Location
"Exceptional,The little treats on the side of our bed before we went to bed. The staff and service/ the personal touch The club lounge and drinks The breakfast, lunch and dinner buffet were great,I had asked for balloons to be put in the room for my husbands birthday. a member of staff told me that it was complimentary. when i emailed again to make sure it was being done, i was told that it would come at a cost.",Staff:Food:Value for money
"Shang Mactan, always a restful vacation.,Property is spacious so even when the hotel is full, it doesn't feel too crowded. The spa is beautiful and staff very courteous.,Breakfasts at TIDES is usually very full. I prefer eating in the other venue in the Ocean Wing even if food selection is smaller.",Food:Comfort & Facilities
"Holyweek getaway!,The effort by shangri-la's staff to surprise me with a super moist chocolate mousse cake for my birthday! ;)",Food:Staff
"Over rated.,Breakfast.,Pool. Beach. Old rooms.",Comfort & Facilities
"Perfect vacation!,Great food!nice place!,A bit pricey!:-)shuttle going to the mall is not free.",Value for money:Location
"Relaxing Time,i like the pillows! I enjoyed the beach with the fish as well....very nice place!",Comfort & Facilities
"A stay in paradise,CHI spa is incredible Great location Great resort Fantastic experience",Location
"Perfect vacation ; no money no happy :),- Breakfast - Atmosphere - Garden - Marine Sanctuary - Breeze Bar by the sea - etc,- Receptionist(s) can be slow and less attentive to you (e.g. checking in & out)",Food:Comfort & Facilities
"Amazing facilities, great for families with kids!,The fresh fruit smoothies in the mornings during our breakfast.,I did not like that we had to come back home and holidays were over.",Comfort & Facilities:Food
"Exceptional,Love the breakfast, good for family who have kids.,The restaurant is a bit too expensive",Food:Value for money
"Exceptional,Wonderful location on the beach, excellent facilities especially for children and outstanding staff.",Location:Comfort & Facilities:Staff
"Fabulous,Room very comfortable, all the staff were exceptionally friendly and helpful and the variety of on-site facilities was great (plenty to do including water sports, golf, tennis, amusement arcade etc). Private resort beach was lovely too and the restaurants were of a very good quality.,Considering the cost of the room, we thought that some of simpler activities (such as mini golf, snorkel hire) could have been included as a complimentary add-on, however every activity (except use of the pools and beach) were an extra cost. Some of the on-site food and drinks were a little expensive however as it is a resort we were not particularly surprised.",Comfort & Facilities:Food:Value for money
"Nice place,It's a perfect place for relaxation. I love the beach area and the cabanas where you can be alone, feel nature, reflect and have time for yourself. We were also given a room with a nice view.",Comfort & Facilities:Location
"A great place to relax away from the city bussle,Staff are very well trained, responsive and gracious. Room was conveniently designed and well equipped. Very comfortable beds.,Be careful about swimming in the sea at low tide. The sandy beach ends at the waterline and I got a bad coral cut.",Location:Comfort & Facilities
"Excellent Hotel but be careful with the deposit,The location, the spa, the sea, the service,When arrived they asked me to pay the room + a deposit (about 1250 Euro). When I left they charged me all the cost (room + spa, about 1500 Euro). It was the 18th of February. After 3 days still the deposit of 1250 Euro is not back on my card and as I am in vacation, this is a big problem because I have to choose between eating or making a gift to my wife (I was out from home for Saint Valentine's Day)",Value for money
"Fun in paradise.,It's paradise. Beautiful scenery and a beach made comfortable by 5 star amenities of the hotel. Staff was always accommodating and so much to do. A bit pricy but worth it.,If not for the rain that cut short some of our activities, I wouldn't change a thing.",Comfort & Facilities:Location
"Excellent stay,All the staffs are very attentive. It's an easy get away for couple days as you can do different water activiies just from the hotel ... kayaking , snorkeling , jet ski , Mimi golfing etc .,Would be nice to have daily morning yoga and aqua aerobic instead of two times a week.",Comfort & Facilities:Staff
"Superb,Very friendly and helpful staff. Accessible beach and activities. Excellent dining options.,Lack of option for a late (half day?) checkout for those catching a late evening flight.",Staff:Location:Food
"As one expects of a 5 star hotel chain,Lovely pool and poolside service. Buffet at Tides generally of good quality. Dinner at The Cowley Cove was very good. The room we had had a good view of the pool and ocean, and had everything one expects of a 5 star luxury hotel chain.,Not ideal if one prefers child-free environments and looking for a quiet place to stay. Due to our very early departure we couldn't enjoy the buffet breakfast that is part of the room rate. The staff offered to pack us a breakfast, which was a nice touch. But we were given only sugary and unhealthy pastries like donuts, when, for the price of the room, we should have had the option of at least a sandwich of our choice.",Food:Value for money:Comfort & Facilities
"Pleasant,The first day we arrived no bellboy helped us carry the luggages! Unbelievable in this grade hotel with this kind of bad service! The last day reception told us would come for carrying the luggages when we checked out, once again, no people came and we went ourselves!",Staff
"Great place to relax,It was a wonderful experience. Buffet restaurant Tides was great for both breakfast and dinner. Private beach is clean. We would like to stay again when we visit cebu next time!",Food:Location
"Great place for relaxation,Friendly staff, suberb service and quality.",Staff
"Exceptional,Excellent lifeguards at pool area",Comfort & Facilities
"NIce experience,Lovely beach",Location
