Opinion,Classification
"Exceptional,Everything,Nothing",Comfort & Facilities
"Really nice hotel in great location,Great hotel, good value, and friendly staff,Nothing to dislike",Staff:Location:Value for money
"Great stay, but pricey.,Rooms not spacious",Comfort & Facilities
"Amazing,The location was perfect and I especially loved the pool area!",Comfort & Facilities:Location
"nice,close to malls",Location
"Very good,Great Ambiance,my daughter got rashes from the pool",Comfort & Facilities:Cleanliness
"One of the best hotels ever seen,Everything was great, they have a great gym, facilities, room is comfy, queit,food is good but not the best , next to it there is Shangri La mall.,The location is somehow far to the airport, it was a rush hour and took us like 1.5 hrs",Location:Comfort & Facilities
"very good,the service,the food,the comfort,especially the bed!!!,i love everything",Comfort & Facilities:Staff
"Nice Location and Comfort,The location and the comfort of this hotel",Location:Comfort & Facilities
"Pure Luxury :),The bed was so comfy! Loved the robe & slippers Shower was spacious Decor was amazing, especially the chandeliers,Nothing",Comfort & Facilities
"Love,Love the overall facility and i hope they maintain the cleanliness of the rooms! Very efficient staffs and well-mannered.",Cleanliness:Staff:Comfort & Facilities
"Exceptional,Nice garden and swimmingpool on manila. And it Is close to megamall for shopping return gifts!",Location
"Superb,Excellent receivers. Front desk people are polite and helpful! World class customer service!,Some of the female workers in the grand lobby at the cafe are snobbish. They have to keep smiling to people and asking them if they need anything.",Staff
"Memorable stay,I liked everything! We used to bring the children when they were still kids . They love the pool! Now they still enjoy it even when they're older...30 and 29 yrs old! I would definitely save up to get to stay in this hotel again and again!",Comfort & Facilities:Value for money
"Superb,The people were so friendly and tried hard to assist me,that I was given a replacement room that is smaller and old for the same price of premier king room that is clean and wider",Comfort & Facilities:Value for money:Staff
"Exceptional,Great pool and restaurants. Close to the mall. Felt safe,Aircon in room would not switch off and room was too cold",Comfort & Facilities
"Exceptional,Very fast wifi Great food at buffet and at horizon club Close to malls",Food:Location:Internet
"Could do better,The service and location,Breakfast was served until 10.30 however they started packing up at least half an hour beforehand and didn't replenish the food. Made to feel intrusive and hurry and finish your breakfast. Also ...",Food:Staff
"Quality and comfortable property in...,Classy hotel pleasant staff,More effective staff training. Eg. coffee served without spoons, etc.",Staff:Food
"One of the best hotel...,Great location Professional staff Great breakfast",Food:Location:Staff
"Comfortable rooms ,Comfortable rooms and enjoyed the gym",Comfort & Facilities
"Very good hotel but stay away from the Italian Restaurant ,The Paparazzi restaurant failed to impress us. It's expensive but not recommended, poor food experience.",Food
"Just great,All good",Food
"Central location. Connected to the mall. ,Always my hotek of preference in this are because of accesibility and proximity to major malls.",Location
"service and location,Horizon staff excell with their personalized service many thanks to Camilla.",Staff
"Excellent place,Great place",Comfort & Facilities
"You get what you pay for.,Breakfast at Heat is the best! Don't miss it.",Value for money:Comfort & Facilities
"Edsa Shang stay,Edsa shang, centrally located, staff are accommodating, rooms are ok.",Location:Staff
"Best location,It is located in the center of Makati. Near malls and restaurants. The staff are always courteous and accomodating. The breakfast buffet is one of the best.",Location:Food
"Weekend staycatiob,Celebrated my youngest bday there. room rate did not include breakfast buffet. but service is exceptional. driveway can be widened so as to avoid queueing. location is perfect",Food:Location:Staff
"Lack personal connection,Needs improvement on the customer service, staff dont have the authencity of connecting with their guests, warmth and accomodation is lacking",Staff:Comfort & Facilities
"Good location, nice staff, clean.,Good location, nice staff, clean.",Staff:Location:Cleanliness
"Very good!,Will definitely book this hotel again.",Cleanliness
"excellent stay,food is great and very comfy.",Comfort & Facilities
"Good Hotel,It was a good hotel. The service is trademark Shangrila.",Staff:Food
"a place to stay ,great place for family",Comfort & Facilities
"Excellent,Food is delicious. The staff is very accomodating and courteous. The place is really nice and clean. Will be staying there again next time I go to Manila",Staff:Cleanliness:Food
"nice hotel,great hotel, nice pool for both children and adult",Comfort & Facilities
"Value for money,Location and value for money",Value for money:Location
"Edsa Shangri-La ,Staff were accommodating; room was spacious and comfortable; centrally located to my business meetings",Location:Comfort & Facilities:Staff
"It fell short of our previous experience last April which brought great delight.,the pool and pool staff,We availed of the Horizon Club because we were extremely pleased by our previous experience last April 2017. Recommended to us as check-in, at that time it lived up to the build-up of the front desk clerk who said the food quantity and choices, though not comparable of course to HEAT, would be more than adequate. Sadly, this time it was far from satisfactory. Upon arrival, the tea provided disappointed. So too did the cocktails and sadly, even breakfast. I'm not sure I will do this again . My daughter even commented that perhaps the Hotel was downsizing or trying to skimp.",Food:Value for money:Staff
"Excellent customer service and leisure amenities but room's hygiene needs to be checked,The top 3 things we liked about the hotel are the location, the staff and the leisure amenities (the gym and the pool in particular). We stayed at EDSA Shangri-la only for a night. The hotel is linked to Shangri-la Plaza mall. This allowed us to do our last-minute shopping before our flight the following day and it allowed myself and partner a movie date night too. The second thing we liked is the customer service. The staff were very helpful and friendly. Lastly, the leisure amenities, particularly the gym and the pool, are impressive. They well-staffed and clean. The gym equipment looks properly maintained and have wide variety of options.,We had several issues with the room that we raised with the manager when we checked out. One of the first things we noticed when we entered our room was that the toilet flush was broken. We had to call for someone to fix it. Second was the old hair dryer. The old thing's cord was pieced together by a black electric tape, which looked like it was done by a 5-yr old. Its strongest power is also as strong as those portable, battery operated, small fans. For a 5-star hotel, I'm pretty sure they could afford replacing this hair dryer to a new one. The major issues we encountered were about cleanliness. We didn't notice them at first since we were only in the room for few minutes after checking in. Coming back from the mall at late in the evening, we noticed the first 2 cleanliness issues - the funky smells in the bathroom and bed area. The bathroom smelled like dried urine and drain next to the toilet bowl was filled with dried hair. The bed area smelled like smelly feet. Then, I woke up at 5:30 am with rashes all over my arms. I took an anti-histamine pill and went back to sleep. They were gone when I woke again an hour later but my fiance and my brother-in-law who visited us could see the traces of the rashes at mid-day. Also, when my fiance woke up, he could not stop sneezing until we left the room for breakfast. The entire time we were not in the room, my fiance didn't sneeze at all. The moment we got back to the room, he sneezed non-stop again. The room clearly had hygiene issues. Other small things that I noticed were the absence of room service menu and the room service in the evening was also not that efficient. At around 10:30 pm, we ordered tea and whiskey for room service. They were delivered in our room after almost 45 minutes. That's pretty long for just drinks.",Staff:Comfort & Facilities:Cleanliness
"Good,Sorry, I don’t eat egg.",Food
"Pleasant,All the staff was friendly.. very accommodating 😊,I wasn’t impressed of my room, the glass was dirty I could hardly see the view! Also, my comforter smells really bad that I can’t sleep. I was looking at it; it was yellowish and smells like molds too. room service around 9pm! I ordered buttered chicken and it was taste funny. I called to tell them about it..they said it’s Indian style they didn’t inform me ☹️ It was spicy and I don’t eat spicy food. The Kare-kare was okey!",Cleanliness:Food:Staff
"Pleasant,I did not expect this hotel so old and it's really less than 3 star",Comfort & Facilities:Staff
"not the nirmsl service from this hotel help ,I was given room key when I got to the room opened door room was occupied by a person who was in bed and not happy had to take myself back to reception stand in que explain what they had done I was not a happy man and neither was the people in the room I had walked into no menu in room so had to settle for crisos and nuts not what was exspected for the money paid",Comfort & Facilities:Staff
"Not value for money. Not a 5 star hotel.,The heat restaurant :- waiter and waitress not proper trained.",Value for money:Food
"Good,Accessibility to the malls,Room carpet should thoroughly clean. Smell of old carpet .",Cleanliness:Comfort & Facilities
"Okay.,Breakfast is good,Bedsheet, air",Comfort & Facilities:Food
"Happy and always makes me come back to shangrila overtime I will be in Philippines,Bed is comfy. Service is very good, some staff are very polite and always smiles, parking is good",Staff:Location:Food
"Good,Eggs was little and bathroom floor flooded",Comfort & Facilities:Cleanliness
"Good,Receptionist - Gie",
"Passable,There is something in the bed that biting us. :( So disappointing for a 5 star hotel. Requested to change the comforter but they just gave us an extra bed sheet.",Comfort & Facilities:Staff:Cleanliness
"Disappointing,Nothing,Customer service",Staff
"Satisfying,concierge,Not being addressed properly as Doctor",Staff
"Great.Will definitely come back.,Thank you so much to Ms. Marilyn (I hope I got her name correctly or I think Me-ann, from the Heat restaurant). She took good care of us during our dinner on Wagyu Night.",Staff:Food
"Pleasant,Staff were friendly, approachable and welcomes with a smile.,Hallway and room doesn't smell that good. Breakfast weren't warm.",Staff:Food
"Passable,buffeet is good.,the air conditioner is bad... woke up dru throat... my allergies to poor air flared up.",Comfort & Facilities:Staff
"Good,Food,Slow room service- it took awhile and had to follow up on our request",Staff
"Pricey but worth it.,Very nice hotel with great location,Little pricey.",Value for money:Location
"Stay at the Edsa Shangri-La,staff were friendly; location is centrally located",Location:Staff
"Great Hotel,Enjoyed my stay",
"Very good location,good location",Location
"you get what you pay for,great location, connected to shangrila plaza, short walk to mega mall. excellent service and food, clean and comfortable",Location:Cleanliness
"Great Stay,Great Staycation",Location
"Excellent,I am pleased with the hotel facilities and service",Staff:Comfort & Facilities
"z,z",Comfort & Facilities
"Great hotel,Great location,Great pool area, best for kids. Room service took long but food was good.",Food:Staff:Location
"The extra bed is a disgust,Pool, breakfast buffet , ambiance,I was disappointed with the extra bes that i paid for. It was just an attachmenr to the sofa",Food:Comfort & Facilities
"superb,edsa shang rila always provides you with superb hospitality. in my opinion is the best hotel in manila",Location
"The room was fantastic,The room beyond my expectation. Very roomy and classy. I would book here again.",Comfort & Facilities
"Best pool for kids in Manila,This is the best pool for kids in Manila plus it bonus for adult because of its 5 star in every way there is mall right across street with so many restaurants and shops the staff are amazing",Location:Staff
"Location service food,Location service food facilities excellent",Location:Staff:Food
"Review ,Rooms, service and food,Great",Staff:Food
"No indoor play area for kids.,No shallow area too for small kids😢",Comfort & Facilities:Location
"staycation,Perfect stay",
"excellent,location, comfort, amenities,lovely",Comfort & Facilities:Location
"5 star hotel,Good service",Value for money:Staff
"Shangrila still one our favorite hotels,Service, Food, Overall amenities,We always have a wonderful stay in shangrila. The service was great. Buffet breakfast in Heat is still really satisfying. Our room was clean and spacious, amenities complete.",Food:Comfort & Facilities
"It is good and silent hotel,Kind employees , facilities, food,Very luxury and nice hotel",Comfort & Facilities
"Good,Room was big, clean and conveniently located,The breakfast buffet felt rushed, the layout of HEAT made me feel like I was eating at a cafeteria rather than a 5 star hotel",Food
"Overall, its really good though it could have been better. Definitely, we would be back.,Cable has disney junior. Swimming pool area/design is beautiful although the slide is not slippery. The kids love the pool area with the playground.,Elevator closed fast-not family with kids friendly. My daughter was left behind and the elevator closed even if we pushed the button outside. The pool dressing room has no locker, small, and a bit smelly. We just changed into dry clothes and showered in our room. I dont like flavored water. Either make it a juice or plain water.covered parking not offerred unless you ask. For first timers, you certainly wouldnt ask. And no bath salt. Maybe my expectation is a bit high but i think if you have a bath tub and you're a five star hotel, you should have bath salt.",Comfort & Facilities:Value for money
"Good,The upgrade to lounge was value for money. The staff were very attentive and helpful.,The rooms at the 14th floor needs a renovation. Though for a 25year old hotel it is not so bad.",Value for money:Comfort & Facilities
"Pleasant,Nice staff. Beautiful pool area.,Too busy hotel groundfloor. Location not as good as makati hotels. Too expansive for its value.",Location:Comfort & Facilities
"Fun Vacation,Comfortable bed and accommodation Office table Breakfast was good Pool was good Ice cream was good,Security discriminates. Doesn't implement the same level of search on all guest. Guest profiling isn't something guests appreciate and hotels should stop implementing this. During breakfast, waiters are slow, our used plates are not removed from our table immediately given the small table we are given. Asked us if we want coffee, we said yes then the coffee never came. One of the waiter is condescending and snob. We had better champorado (favorite) on a different hotel. It is better if the shower is not on the bath tub. Internet can be faster (256mbps average speed)",Food:Comfort & Facilities:Staff
"Old hotel not at.5 hotel level,This is an old hotel. Not at 5 start hotel level,Hotel is old. Elevators very far from front desk. Card for elevator didnt work and I have to walk all the way back.",Comfort & Facilities
"Its all okey,I like the hotel itself i feel so relax.,Lower the price a little.",Value for money
"Pleasant,The staff forgot to take the VAT out from my payment hence made overpayment. So instead of reversing and save all the troubles, the excess was put as credit in my room. However, i did not like the feeling of being in a position of not being able to use that money for other things outside the hotel. I couldve used it somewhere else. The comforter smelled not dried well. It took me til night time to replace it. Busy?",Staff:Comfort & Facilities:Value for money
"Poor customer service ,The locatiob,Poor service on the garden wing side calling on the front desk for 1:30hrs no one is a swering",Staff
"I love this hotel but recently i was discouraged smelling the bad odor of our room.,The site is convenient located near the malls..,The room has bad odor",Cleanliness:Comfort & Facilities:Location
"It was a nice stay, but I was expecting a better experience.,I liked that the staff were attentive to our requests.,I didn't like the fact that the hotel was overbooked. We had to wait until 6pm before we can go inside our room.",Food
"It's a good hotel normally. But ask if there are conventions scheduled. Otherwise you will not e,That it was near my work. My room was clean and spacious. It had good lighting not too dark unlike other hotels.,I booked a garden wing view. I saw no gardens. I was facing office buildings. I had no parking at first. Had to park at the mall good thing it was near the hotel. Then I moved it back at a later time. It was noisy at summer palace considering it to be a fine dining Chinese resto. They could not control their guests from the convention. Food quality at Heat buffet for breakfast was ok but even an omelette could not be given to me correctly. It had blocks of unmelted cheese. Coffee came in non uniform mugs some had a lot some had a little.",Food:Location:Comfort & Facilities
"not worth the money,dirty windows in the room and lobby. Greasy food in the chinese rest. Rushed food service in the same",Food
"Passable,Location,Old furniture",Comfort & Facilities:Location
"Good,Luxury",Food
"I love Shang but their service needs a lot of improvement.,Service of Annie at Senju,Service at Summer Palace was slow. Prior to check in I informed them via email to provide slippers, towel and robe for my kid. Once in the room, I had to call again for them to bring items. Broken aircon in our room. Switch not working. We could not control the temp. Got too cold. My son and I ended up with colds. Had it fixed the next day but it broke again.",Staff:Comfort & Facilities
"A very nice hotel, but when all taxes are included it does work out a very expensive stay,Excellent breakfast if you arrive early. Fitness centre and pool area very good. Concierge & Bell desk staff excellent, friendly and very helpful.,Dinner a la carte menu limited and expensive. Main buffet extensive but very over priced. Pool bar staff very aloof and distant Unlike the main area of the hotel.",Food:Value for money:Comfort & Facilities
"Disappointing,The stink shower curtain in the bath tub really turns me off! The hotel staff should do a better job than just clean the place that' visible.",Cleanliness:Comfort & Facilities
"recommended for family who wants to have a staycation,amenities, very kid friendly,lot's of guest",Staff
"Good,Paint the hotel looks old already,Long line in checking out very thankful for (indian) manager who helped me checked out fast coz my driver is waitjbg outside and the guards were mad at him...",Staff
"Good location, food is so so,Good location, food not great",Location:Food
"nice hotel, rennovated in tower building,location, hospitality",Location:Comfort & Facilities
"Location. Food choices. Comfort,Location. Food choices. Comfort.",Food:Location
"Comfortable and worth it,Comfortable bed, helpful staff and great ambiance,Simply amazing",Staff:Comfort & Facilities
"5 Stars hotel with 6 stars service,Hospitality, spacious room and right next to Mega Mall,My Stay is lovely. People were very friendly and felt like home. Good Security. Its 2 mins walk to Megamall. Will definitely stay there again.",Location
"Nice stay,Location. People Food,The people are very nice and the food great. Swimming area great",Location:Food
"Good location ,Location, Very friendly staff,Very friendly and helpful staff. Very close to SM",Staff:Location
"Good hotel ,Nice, clean and friendly,good time there",Cleanliness:Staff
"worth it,elegant, clean, affordable,Great. Enjoyed the stay.",Cleanliness:Value for money
"Relaxing stay,Pool food room,It was very relaxing and had fun with the pool",Comfort & Facilities:Food
"Shangri-La,Friendly Staff, New Guest Rooms, Good Location,Staff knows me very well. Guest rooms newly renovated. I feel like I'm at home especially with the excellent service.",Staff:Comfort & Facilities
"would like to stay here again...,location, staff, amenities,Very nice hotel for a vacation. Near to shopping malls too. staff were pleasant and accommodating.",Staff:Location
"Wonderful visit Hotel,Location, hotel style and choices of food!,The stay was good I agreed with the questions above and I loved every thing about the visit there!",Staff:Location
"Cozy and luxury room ,Clen",Comfort & Facilities
"Expensive but safe and reliable,Staff, airport transfer, facilities,please see my other review for the same stay which was on two separate bookings",Staff:Location:Value for money
"Shangri-la always delivers! ,Accomodating staff; fantastic food and very clean rooms,Staff was great, my 2 year old fell down and hit her head near the pool and a staff was there in an instant offering ice for the bump on her head. Good job for being watchful and alert!",Staff:Cleanliness
"fantastic old school hotel,location amenities food,great place with great service and classic furnishings",Comfort & Facilities:Staff
"Excellent,place, service and pool",Comfort & Facilities:Staff
"great 5 star hotel,location staff and resturants,you have to check out the japanese resturant, its azaming food nice hotel doing some upgrades so spa not in use.",Food:Staff:Location
"Relaxing weekend,Comfort, service, & location.,The room was comfortable and staffs are great. Internet acess was fast. The kids enjoy the pool.",Staff:Comfort & Facilities:Internet
"For the restaurant staff they need to be fair in treating the guest,We liked the food, Our Room and the room attendant he's very nice :),the staff in the heat restaurant me and my partner is also working in hotel industry so I notice that they are not welcoming there not attentive only for the foreign guest. I hope they will have a fair treatment to everybody we are all guest. thankyou :)",Staff:Food
"Good,room was not available when we get there. We were able to get to our room at 7pm. The hotel gave us a late check out though to compensate",Staff:Comfort & Facilities
"Good,Requested for a small cake for my boy and they did send us one which made his birthday more memorable. Plus they upgraded us to a bigger room as their gift for Zach. Thank you Edsa Shang,We had to wait for almost 2 hours to check in. I was asking the 2 attendants if we could check in, in the Horizon club since we are booked in the premier suite, they didn't know. after 2 hours I asked the front desk and she said I should have gone to the 14th floor to check in =(. Staff needs more coordination.",Staff
"Good stay but carpet has an old smell,Great Gym, Service was superb.,I booked a newly renovated room but sadly the carpet smells and I have to ask the staff to clean it every night, it smells very old",Cleanliness:Comfort & Facilities:Staff
"Good for accomodation .. Poor for the breakfast..,There are ques to the breakfast saloon. It is a shame that the hotel manager can not see it.. It is nonsense to keep guests on the que just for checking the room no. and surname, then waiting for someone to show a table.. I have counted 35 people on the que for a while .. What for? Just the poor management of the hotel.. I never seen something like this in other Shangri-La hotels (I am a regular customer for the chain). This mentality can kill the Shangri - La image..",Food:Staff:Value for money
"Good,Clean room,Valet parking was not offered free. You need to pay a fixed parking rate. They've check us in at 6pm as the room was not yet available eventhough its already 4pm.",Value for money
"relaxing,Swimming pool and gym,difficult parking",Comfort & Facilities
"We had fun.,Lobby is Nice. Helpful and courteous front desk Just beside Shangrila Mall,Life guard , just a little arrogant. Room is average",Staff:Comfort & Facilities
"Good,i love the breakfast, the facility is not that modern, but its good.,crowded.",Food:Comfort & Facilities
"Over Rated.,Pool area was nice. The breakfast is exceptional with more selections than I good eat in a week. The gym is the best I've seen in hotel with choices available for all kinds of fitness programs including classes. Beds very comfortable and rooms a good size though old decor.,I made changes to my booking because my daughter travelled and so needed two single beds. They acknowledged and okayed the change but when I arrived the staff had no records. To fit us in we had to use the older rooms that are not worth what I paid for. No reductions or any extras offered as compensation. The dining room couldn't cope with all the guests in hotel. The overflow bfast area didn't have anywhere near the choices available and some of the food was cold.",Comfort & Facilities:Food:Staff
"We support the brand, but this hotel was expensive and not good value.,Food and facilities very good. Location to malls very good. Can use public transport. Close to MRT.,Room described as ""newly renovated"". It was small and well used! We paid a high price and complained to the hotel about the room,but were not offered anything. We will not return!",Comfort & Facilities:Value for money:Location
"Relaxed stay.,There was an extra pillow available that we can borrow, very comfortable bed. Fast internet.,No bidet spray on the toilet bowl, few channels to watch.",Comfort & Facilities
"Pleasant,Consierge taxi/Uber service is not good",Staff:Internet
