Opinion,Classification
"Best way to end our Philippines Vacation!!,Staff and everything at the resort were more than polite and very clean and you can tell the people loved what they did there.",Staff:Location
"Good,Friendly staff and good food except the sea food restaurant,Room offered limited sea view. Noisy in the hallways.",Food:Staff:Location
"Exceptional,The facilities,The check-in and check-out process. There should be assigned counters for check-in only and counters for check-out only especially at noon time.",Staff
"Exceptional,Amenities and facilities",Comfort & Facilities
"Exceptional,Location was excellent with fantastic beach and amazing diving.,I have absolutely no negative comments",Comfort & Facilities:Location:Staff
"Great for some relaxing days,- beach & sea - activities - food & service ( very polite ) - pools,- european pricing, sometimes a little too expensive for what is given ( even for a german like us) - hidden cost - crowded buffet room ( have to get up early to get a table, after an hour the mangoes were out of stuck )",Value for money:Food
"Fell in love with the beach,The beach is very nice and well-maintained. The kids enjoyed the aquaplay but I think it already needs renovation.,I booked 2 rooms and was really upset that the other one was not yet ready upon our check-in. Dinner buffet for my kid (age 5) worth almost 1300 (50% of the adult meal) is way too pricey. The hotel should have a separate menu for kids.",Food:Value for money:Location
"It was great, I woul love to go back!,The beach,The noise",Comfort & Facilities
"Relaxing and enjoyable,The facilities are very accommodating. The place is very relaxing and nice.,The hotel price.",Comfort & Facilities:Food
"10,Every thing",
"a very happy stay at the shangri-la,all the staff were very friendly and very efficient",Staff