Opinion,Classification
"Pleasant,Food in restaurants not good and was never hot",Food
"Dont stay here-go to Makati Shangri-la,Leaving.,Went to the buffet called Heat, the food was totally disappointing. Will never stay here again because of food and poor service throughout the hotel. I came from Makati Shangri-la, 1000% better place to stay, rooms nicer, staff are friendly,I ate at the buffet every night there and also breakfast. Dont waste your money at EDSA stay at Makati.",Food:Staff:Value for money
"Very poor,Not flexible even if special circumstance",Comfort & Facilities
"Good,Rooms are nice but its a bit old.,convenient location to megamall & shangrila mall..courteous staff,I booked in advance afraid it might br fully book since its feb10( vday) at booking.com since its cheaper compare to hotel rate..but feb4 come & i founf out much cheaper hotel rate bec of promo (cheaper price na yun room tapos free breakfast pa!)..we asked for reconsideration if we can avail promo rate and asked if can late checkout since we came from zmboanga delayed/traffic we checkin at almost 6:30pm so we ask for late checkout but they did not considered to give us extra hour stay..",Value for money:Food:Staff
"Good,Staff emailed after booking asking if it was for a special occasion. It was my birthday and I got a birthday cake and free upgrade,Hotel felt a little dated for the price Had to Q to get into the breakfast buffet",Food:Staff:Value for money
"great location,great location, many shops and resteruants nearby clean and comfort bed,noisy and crowd at lobby take a long waiting for check-in and check-out swimming pool is very small and crowd with children",Location:Comfort & Facilities:Staff
"No too good experience,Pool was perfect for the kids,Room was noisy. Aircon hot. When we requested for toothbrush it never came. Asked for it 3x. Never came",Comfort & Facilities
"Great hotel but expensive!,accessability to nearby malls, hospitals and convention center; clean, comfy rooms and helpful staffs.",Comfort & Facilities:Cleanliness:Staff
"Friendly staff,Good service, Friendly staff and good location,Excellent!",Staff:Location
"Fantastic Staff,Good location, friendly Staff and Nice Pool,We have a very pleasant stay at the hotel. Full of good friendly Staff and fantastic service.",Staff:Location
"nice hotel,location, breakfast, pillows,it's nice but all the nearby attractions close very early at night during weekdays. it's like being in the states.",Location:Food
"Oasis in Manila,rooms, breakfast pool,Quite nice. would go back again",Food:Location:Comfort & Facilities
"Top quality elegance,Staff comfort service,I've stayed several times here, as well as the equally elegant Shangri-La in Manila nearby. Great service, and great location for Makati business trips.",Staff:Location
"Friendly staff wonderful breakfast nice pools,sauna breakfast staff,Paid for the upgrade which was worth it nice cocktails and snacks. Would stay again this hotel if in that area. But little far for manila. Staff friendly and helpful. Nice pools and great gym.",Staff:Food:Location
"Ideal for a business traveller,location, food, service,Ideal for a business traveller",Food:Location:Value for money
"Great place to relax in the city. ,Great pool. Excellent spa. Comfortable place to relax.,Excellent place to relax in the midst of a busy city. Great for families. Loved the pool and the spa! Will definitely go back again.",Comfort & Facilities
"Great staff, helpful and understanding,staff, service anf value for money,Except for a slightly long check in time the rest of my stay was wonderful with all my special requests being attended to efficiently and with a smile",Staff
"Great hotel,Breakfast buffet, clean rooms, good for business meetings,Breakfast buffet, clean rooms, good for business meetings. A shopping mall is just beside this hotel.",Food:Cleanliness:Value for money
"Lovely, relaxing, comfortable...,food, room and location,quite pricey to be honest, but it's all worth it... we were secluded in horizon club. free-flowing drinks and snacks. great breakfast. parts of the hotel was being renovated though",Food:Comfort & Facilities:Location
"great stay,room, staff, pool,we stayed at the newly renovated room. it is big but no bathtubs. the room is big and clean",Comfort & Facilities:Cleanliness:Staff
"perfect hotel for vacation,nice food, ideal location for shopping, big rooms",Location:Comfort & Facilities:Food
"great hotel in a nice location,restaurants , shops , location,This is a really top class hotel. I will be going back.",Location
"Always a pleasure to stay at Shangra-La,Very nice, clean rooms. The restuartants are outstanding. Internet is fast which is great if you have business to do too.,Our stay at Edsa Shangri-La is always a treat and something we look forward to.",Staff:Location
"nice, clean and comfort, accessible to restaurants,clean, accessible, nice hotel,it was comfortable, big hotel, likewise clean, very near to shopping mall, restaurants and accessible to all transportations.",Location:Cleanliness:Comfort & Facilities
"Good business hotel ,Staff, Food, Clean,Walking distance to SM Megamall and Shangrila Plaza. Staff were really friendly and helpful. Renovations were going on during my stay though",Staff:Location:Food
"Excellent quality,Ambience, quality, amaneities",
"Excellent and it is very good 5 stars hotel ,Connect to shopping mall, safe and easy to get different type of cousines,The hotel is excellent but the rate is expensive around the ortigas city. If looking for good service and quality hotel, this will be the one i will choose.",Location:Value for money:Staff
"Staff are prejudice and rude.I will not recommend this hotel,It was a quiet place,One of the staff approached my husband if my husband ask permission from the other guests who are wearing suit and tie if it was ok to sit in the same waiting area.that staff is so idiot to even show prejudice .we paid for our room.we don't need to ask anyone if it is ok to sit in the common area..I will never book with Edsa Shangri-la again.I prefer the one in Makati. Staff in Edsa are rude and no class",Staff:Food
"Very poor wifi networking,Charges on local calls",Internet:Staff
"Very poor wifi networking,Charges on local calls",Internet:Staff
"Stay away from big hotels. When they are busy, you have to wait a long time for service.,Facilities are very old. My booking said it was for a newly renovated room. I ended up with an old room. Not pleasant.,Service. I guess too many people. Too long check in and too long check out. I cut short my stay. Not happy.",Comfort & Facilities:Staff
"Stay away from big hotels. When they are busy, you have to wait a long time for service.,Facilities are very old. My booking said it was for a newly renovated room. I ended up with an old room. Not pleasant.,Service. I guess too many people. Too long check in and too long check out. I cut short my stay. Not happy.",Comfort & Facilities:Staff
"Comfortable just because of the beddings,Food ag the heat.. comfy pillows n beddings,My expectation was bigger. Room was small compared to the picture. No glasses in the comfort room.",Comfort & Facilities
"Comfortable just because of the beddings,Food ag the heat.. comfy pillows n beddings,My expectation was bigger. Room was small compared to the picture. No glasses in the comfort room.",Comfort & Facilities
"Lovely hotel but Front Staff are rude!,The location was great !,The RECEPTIONIST! They are very stiff! they need to send to the training room Asap! They didnt even smile, not accomodating and thinking that their Job is too superior!",Staff
"Lovely hotel but Front Staff are rude!,The location was great !,The RECEPTIONIST! They are very stiff! they need to send to the training room Asap! They didnt even smile, not accomodating and thinking that their Job is too superior!",Staff
"Good,The bed and pillows were comfy. The vibe was nice,I didn't feel that we weren't able to get our money's worth",Comfort & Facilities:Value for money
"Good,The bed and pillows were comfy. The vibe was nice,I didn't feel that we weren't able to get our money's worth",Comfort & Facilities:Value for money
"Long queue at the check-in counter and valet parking,Was gracious to extend check-out time,Valet parking took more than 30 minutes and receptionist informed me that they are fully booked hence, long queue at the check-in counter and valet parking",Staff
"Long queue at the check-in counter and valet parking,Was gracious to extend check-out time,Valet parking took more than 30 minutes and receptionist informed me that they are fully booked hence, long queue at the check-in counter and valet parking",Staff
"NEVER AGAIN .,The location was excellent bec the hotel is walking distance to malls and accessible to other areas.,I reserved for a room with two queen size however when we checked in we we're told that the room reserved to us was twin double bed. It was a big disappoinment. The reason given to us by the front desk staff was no one from booking.com coordinated with Edsa Shangrila Hotel re: your bookings.",Staff:Comfort & Facilities
"NEVER AGAIN .,The location was excellent bec the hotel is walking distance to malls and accessible to other areas.,I reserved for a room with two queen size however when we checked in we we're told that the room reserved to us was twin double bed. It was a big disappoinment. The reason given to us by the front desk staff was no one from booking.com coordinated with Edsa Shangrila Hotel re: your bookings.",Staff:Comfort & Facilities
"Good,Conveniently located to Shangri-la Mall, SM Megamall and St. Francis Parish Church.",Location
"Good,Conveniently located to Shangri-la Mall, SM Megamall and St. Francis Parish Church.",Location
"Great stay with friends!,My kids and I liked the pool so much,Guven the number of guests, an order from the pool bar was provided late. They compensated by giving us a 20% food discount",Comfort & Facilities:Staff:Food
"Great stay with friends!,My kids and I liked the pool so much,Guven the number of guests, an order from the pool bar was provided late. They compensated by giving us a 20% food discount",Comfort & Facilities:Staff:Food
"Terrible service,The location was convenient for shopping, not for sightseeing,Terrible service at check in and check out. Bad attitude at check in was a little preview of how hostile and lazy the service was going to be the rest of our stay. Run down hotel rooms. Terrible front desk staff-Edsa Shang has changed a lot for the worse since I was here 8 years ago. Used to sing praises for this place. Not anymore. Stay at Marco Polo Ortigas instead.",Staff:Location
"Luxury hotel at its finest. Great service.,Food, service and location",Staff:Location
"Fair enough,Near business centre",Location:Value for money
"We really enjoyed ours stay nice ambiance:),Good location, very accessible to a public transport and close to the shopping area:)",Location
"World class experience,location, design and comfortable room",Comfort & Facilities:Location
"great hotel...nice people... great location...,the rooms in the upper levels were fantastic big and beautiful and very clean...,thank you to all the staff for a wonderful stay,the food was great and the wine was even better hope to see you all soon...thank you..",Food:Staff:Location
"Good location and great service,Great service from hotel staff,We stayed in a superior room. Hotel staff were very accommodating and gave excellent service. Our kids enjoyed their swim in the pool area. The facilities in the hotel are well maintained.",Staff:Comfort & Facilities
"Resort-type hotel in great location,Location is excellent, around business centers.,Too crowded when I checked in, the lobby ressembled a busy market!",Location:Comfort & Facilities
"Very Good Hotel,Staff,My 5 days at Shangri La was great and very good. Especially the staff service",Staff:Food:Value for money
"Top notch,Best hotel,The best hotel ever in manila. Thats all that can be said.",
"nice location near shopping mall,nice facility and good bed matress,i will love to stay there again because great location near shopping mall and have a very good access to shopingg mall. so it is very easy to find food and everything",Location
"Nice rooms and friendly staff,Location and hotel facilities,Highly recommended for business trips. Located between two major business district areas of Manila.",Location:Staff:Comfort & Facilities
"Awesome hotel! I would love to come back again.,All facilities you need are in the hotel! Near SM Megamall, SM Cinema!,Wonderful staff and friendly. The pool was fabulous especially that it is a summer time! Would really recommend this to all! Value for money as well!",Comfort & Facilities:Staff
"Well Maintained 5 star hotel,Great staff, comfortable bed, clean hotel,an escape from the busy city life... delicious breakfast buffet",Food:Location
"Great hotel, excellent service!,close to a lot of malls, big parking space with valet, wifi is good,We will definitely stay in this hotel again next time!",Location
"Nice hotel w/ clean rooms comfortable pillows bed,Amenities like the gym pools and clubs,the hotel has great location for shopping facilities excellent comfortable bed and pillows",Comfort & Facilities:Location:Cleanliness
"Very nice hotel,close to shopping amenities and ortigas cbd,comfortable beds, good service. all amenities are very much top class. would recommend to fuzzy travellers.",Staff:Comfort & Facilities
"Lovely Hotel,location,location and very good service staff. rate include wifi and breakfast which is very good",Staff:Food:Internet
"Great hotel,friendly staff - near go shopping locations,i only stay 2 night but my stay was very comfortable",Location:Staff:Comfort & Facilities
"Service with a smile :),location and ambiance,Hotel staff were very accommodating and they were able to answer most of our queries and provide for our requests.",Staff
"great location,walking distance to malls,none,had a wonderful stay. nice rooms and very accessible to a lot of places",Location:Comfort & Facilities
"Terrible service,The location was convenient for shopping, not for sightseeing,Terrible service at check in and check out. Bad attitude at check in was a little preview of how hostile and lazy the service was going to be the rest of our stay. Run down hotel rooms. Terrible front desk staff-Edsa Shang has changed a lot for the worse since I was here 8 years ago. Used to sing praises for this place. Not anymore. Stay at Marco Polo Ortigas instead.",Staff:Location
"Pleasant,The hotel was nice and the staff was polite. The pool was clean and life guards were very attentive. The hotel's location is a plus.,The hallway (to the room) was hot (no aircon). Kids 12 and below should be free of breakfast.",Cleanliness:Food:Staff
"Promises are meant to be broken,They did not give me what they promised, an adjoining room and twin beds. They instead gave me the opposite. 2 separate rooms, with single king sized beds.",Comfort & Facilities
"Good hotel but the rates should be cheaper due to a lower area compared to Makati,All was good and comfortable,Tooooo much trafic all around the hotel. The rates are high as compared to other 5 star hotels that I have stayed in Makati area",Value for money
"Pricey for what it is,Bed incredibly comfortable.,More like staying in a shopping centre than a hotel. Very pricey for everything. Considering what it is, it is not vfm",Value for money
"not a shangri-la experience,staff were really trying their best,it was really very crowded , like a zoo. My fridge did not have mini bar items- think they forgot. Slight dirt on the beddings. They key card kept malfunctioning , that was a hassle.",Staff:Comfort & Facilities
"Surprised that I was Dissappointed!,The staff at the buffet during breakfast were marvelous!,The staff at the buffet during dinner time NEVER SMILED! Room amenities like teaspoon and workdesk had coffee stain and food stains that didn't get cleaned prior to our check-in.",Food:Staff:Cleanliness
"Pleasant,the swimmingpool is beautiful, and my daughters like the water of the pool because its warm not so cold...,The hotel is small compare to the other 5 star hotel,",Comfort & Facilities
"Overall good,Good ambience and quality in food is also ok,Smell of fish all around. I think the airbalancing is not correct or the exhaust system in coocking area is not proper",Food
"Eww,None,Theres alot of insect inside our room",Cleanliness:Comfort & Facilities
"expansive for what ???,room no have somthing drink in frigobar toilette no confortable no bidet and no for clear water",Comfort & Facilities:Cleanliness
"Well go again this christmas vacation,your free brekfast in ""heat"" , staff are courteous, we've been going to your hotel 23 years already.",Comfort & Facilities:Staff
"Great hotel but watch out for unexpected room rate increases during your stay.,Good amenities. The bake shop in the foyer is a nice touch, although a little pricey but the baked goods were excellent. Staff are faultless and in good supply around the hotel. Busy check in was well managed with extra staff support speeding you on your way to your room.,Beware!!! They have what they called a ""dynamic rate"" which increases the price according to hotel occupancy. I was just told it was because I use booking.com. I use booking.com a lot and this has never happened before. I stayed for 8 nights on business and was charged extra for 3 nights. The extra taxes mount up too.....3 different types but that is something I'm familiar with. A disappointment to an otherwise great stay as I expected to be billed according to the amount displayed by booking.com. By the way.....watch out for the breakfast queues which weave back into the foyer at times. Worth the wait...lovely breakfast.",Value for money:Food:Staff
"Good,Good bed. Club horizon is great.,The smell of the room.",Comfort & Facilities:Cleanliness
"Don't expect much its just an average hotel,nice food,Small and narrow room Front desk staff only good in sales talk No value of upgrading in horizon lounge as no added benefit except late check out",Staff:Value for money
"Short biz trip,location, restaurant, amentities,dirty bed sheets in my first room so I had to change it, unpolite service at front office",Staff:Cleanliness
"Not worth it,nice buffet restaurant but very expensive and not including drinks not even some juice,Room was not cleaned properly! Did not even check the sheets which previously had some stains on. Food for room service was of very bad quality and very expensive. Overall i feel this hotel is not worth the money and the reputation they have. Better of at staying at Marco Polo Ortigas which is 10 mins away, much cheaper, great service and very friendly staff",Value for money:Food:Staff
"Good,Open swiming pool,3 towers",Comfort & Facilities
"Good,room appears not renovated? Vague damp smell, no bathtub",Comfort & Facilities:Cleanliness
"Passable,- Clean room, Good breakfast, Nice gym,- Unhelpful / unresponsive staff - Booking price is much more expensive that Corporate rate (which I couldn't get despite it being granted to my work colleagues)",Staff:Value for money:Food
"family reunion,outstanding breakfast and lunch buffets, vast food selection and quality is maintained. Spa was the best so far,none,I treated my family to some treatment in the ChI spa within the hotel. It is the best service/treatment thus far and the facility is out of this world. I totally recommend this one.",Food:Location:Staff
"Needs renovation,Pros: pool area is nice Cons: room needs renovation, old rustic smell",Comfort & Facilities:Cleanliness
"Very good,Perhaps it was just the timing but Shangri-la was fully booked when we got there such that check in was really late. we were given a room after 330PM and was allowed to check out by 1pm.",Staff
"Great Stuff,Great Place, Fun Times",Comfort & Facilities
"Staff Staff Staff!!!!,Hotel is clean and Luxurious BUT your staff makes all the difference in the WORLD! well done. thanks",Staff:Cleanliness
"Exceptional,Close to shopping centers walking distance from the hotel.",Location
"Business Address,Great location for meetings.",Location:Staff
"Exceptional,i booked with free breakfast but the hotel said NO free breakfast????",Food:Value for money
"Enjoyable experience at a great price,We were upgraded to a newly renovated tower. The bed was HUGE. The room was nice also. Really great for couples who want to relax and have fun.",Comfort & Facilities
"Relaxing and fun stay,We loved the pool area! Rooms are spacious too. Buffet breakfast was also good.",Comfort & Facilities:Food
"Exceptional,Stayed at the Tower Wing Deluxe. Shower only but their toilet has a built-in bidet and rear wash. Not available in their Garden Wing Deluxe as i recall.",Comfort & Facilities
"Very good hotel,Everything well organized",Staff:Cleanliness
"Great Hotel,Very friendly staff",Staff
"Great NY Eve and Weekend,This is still one of the good hotels in Manila and it still delivers, room service was good....",Staff:Food
"Awesome,Pool is great kids love the kiddie pool and the room is clean",Cleanliness:Comfort & Facilities
"Excellent service.,Better if there are special Christmas shows.",Staff
"Great,Staff are excellent..we are even suprise with the welcome brownies we received when we get back to our room. Overall, we all had fun especially the kids!",Staff:Food
"great location and great facilities,only rhe breakfast buffet is too pricey",Food:Location:Value for money
"Exceptional,I attended the Alpha Phi Omega dinner party on September 3, 2017 at the Isla Ballroom. We also hanged out at The Lounge for after party drinks and snacks.",Food:Comfort & Facilities:Staff
"Good,We checked in for the 3rd year straight for my sons birthday. The last 2 years i informed them it was my son birthday and they sent up a cake as a small token for my son to enjoy. This time around, i informed the receptionist upon check in we were there for my sons birthday and he said they send a little something to the room later on in the evening. They must've forgotten because when we arrived to the room the room had been cleaned but no cake or brownies. I called the reception to find out if they were still sending the cake over. They said, what for? I explained to them and had to call 4 different times when finally they sent up a cake at 11pm. The last 2 years we stayed the weekend there for our sons birthday it was already there when we walked in from dinner. This time they forgot. We've stayed at a couple Shangrila resorts and this is probably the first time we didn't feel very special. Last, i found a sock under the bench in the shower. It probably belonged to the guest that stayed in the room before us. The room wasn't as clean as it use to be either. My son loves Edsa Shangrila because of their kids slide and kiddie pool amenities but i'll probably need to insist on staying at the Shangrila at the Fort next year.",Staff:Food
"ENJOYED OUR STAY ESP IN SAUNA. QUITE INTIMIDATING BEC STAFF ARE STIFF,AMENITIES & ROOM,STAFF NOT SO ACCOMMODATING",Staff:Comfort & Facilities
"Our stay is quite pleasant,The service is good.... The service is very hospitable.,Pool bar has a poor service..... We waited for more than 1 hour for our food.....the staffs at the pool bar failed to replenish the sauces, condiments and side orders.... And the price is very enpensives",Staff:Food:Value for money
"Disappointed,Simple requests were not done properly. No welcome fruit or anything. Breakfast at The Heat was chaotic. Checked in for 2 rooms and still a second deposit was needed.",Food:Staff
"Good,Unorganized que on the check in counter",Staff
"paging HR department of Edsa Shabng--- retrain RO an or get rid of her,as always excellent bedroom,staff at entrance of heat resto named ROAn shes rude and discriminatory",Staff
"None,The Hotel Interiors and the Garden,The Trafic due to the Location especially if we have flight to catch we have to leave very early",Location
"Perfect family staycation,The pool grounds are perfect for kids.. Unlike other hotels with just a lapping pool, this one really kept the kids entertained",Comfort & Facilities
"Good without being great,The hotel had a sound location with two very good shopping malls right outside the front door. The hotel was always very clean and modern. The staff were welcoming and warm. The range of restaurants available in the hotel was good as it offers different cuisines which most hotels don't offer.,Although we found the hotel seeming to lack the luxury tag of a 5-star luxury hotel that is to be a Shangrila. The pool area was nice but nothing wonderful, the buffet breakfast restaurant was full each of the 3 mornings i was there forcing us to a make-shift buffet which wasn't as good, yet we still had to pay the same money. I understand in a hotel like Shangrila that prices of food and drinks will be significantly more expensive than outside, but in terms of value for money, 700 pesos for very plain vegetarian spring rolls around the pool just simply isn't worth it, this also extended to other food and beverage items throughout our stay. The hotel is good but didn't completely live up the the Shangrila 5 star luxury expectations.",Food:Value for money
"Surprisingly wasn't up to the usual Shangrila standards. Makati version much better quality of s,Location, design, room size,Unattentive when I checked in by also answering queries from people behind me in the queue. Door person gave wrong directions to taxi driver and I was late to my meeting.",Staff
"Pleasant,The location is good if you are interested just to shop.,I supposed to have a tub and the receptionist said it's under renovation. When I booked the room it says shower and tub. The websites needs update . It's quite expensive Hotel not to have a tub available for a customer.",Comfort & Facilities:Cleanliness:Value for money
"Disappointing,Evening staff not helpful!",Staff
