Review ID,Review Content,Review Score,Review Time
12053140,"The first thing I noticed was the negative vibes at the reception during check in. This Sheryl or Sherry who is a supervisor according to her name tag couldn't maintain her customer service attitude to save her life. This girl was condescending AF. She kept interrupting me, spoke so fast and kept giving abrupt answers. She had a funny look on her face when I told her I don't have a credit card when she ask for a cc to charge a deposit. I gave her my debit card and she declined it in a condescending way then proceeded to tell me I can use cash. this B could have offered that as an option in the first place. Also, she has this funny look when she gave me my key. I should've known there was something wrong with thr room. I found a leaf on the dresser?! it seems they only do light cleaning. the baby keeps sneezing as the room seems a bit dusty. the air-conditioning was worse than a fan as it couldn't keep the room cool and it keeps making noises. We tried calling the service center and we were on indefinite wait until the line drops. we kept calling till we gave up and resumed in the morning. we finally got someone when we tried calling housekeeping line and the promised to send us someone. we waited for more than an hour for that person to arrive then confirm that the AC is busted and we had to transfer rooms. which was totally useless as we had somewhere to go and had to check out early. the hotel refused to compensate for this because its an online booking. also there was a ball and a lot of people was there to party which caused traffic in the elevators. they had 2 areas with 4 elevators and only 3 out 4 elevators are functioning. we asked if we could take the stairs going to the 3rd floor, they don't have it. I feel like the hotel is overrated. what I find satisfactory: the bellhop, all people at the restaurant when I had my breakfast, the breakfast buffet offerings and the girl greeting at the door was super polite and pleasant.",1.0,2024-05-29
12001664,"The Check In and Check out process was a nightmare. With only 2 staffs in the reception counter, it took a very very long time to check in and out. Never coming back. ",1.0,2024-05-21
10841398,"nice experience very wonderful, commendeble. i would book again in the future 😘 and klook is very helpful and convenient ",5.0,2024-05-19
10734488,"over-all stay is great. because hotel is a little older, it has to upgrade it's TV to Smart TV. [for those who are on staycation]",5.0,2024-05-01
10604256,"This is an old, but price quality, very good hotel.
Excellent staff and service.The breakfast buffet is superb.",5.0,2024-04-12
10511846,"I recently had the pleasure of staying at your hotel, and I must say it was a fantastic experience from start to finish. The staff were incredibly friendly and accommodating, making me feel welcome from the moment I arrived",5.0,2024-04-01
10262085,"Very helpful and kind staff. Good service. Nice and clean accomodations. Highly recommendable hotel. ... Extremely clean room. We loved the contemporary design.
",5.0,2024-02-27
10136765,it was memorable as we attend also my sister's wedding. i love the place! will definitely go back and we had a smooth transaction with klook.,5.0,2024-02-10
9765784,Perfect for big events and parties but the hotel room needs upgrading or renovation perhaps. We stayed overnight for a friend’s year-end party however the air-conditioning unit was not working properly. Had someone checked the unit but was told that they had issues with their tower (idk) and all and should work eventually but it didn’t.,2.0,2023-12-18
9502513,"We were not able to continue our stay because we felt discriminated. The security followed us wherever we go, we felt like we are suspected of something. Visitors were required to pay Php 1000 just to visit you. So we moved to another hotel. Worst policy ever! No wonder why their hotel is becoming overshadowed by other hotel despite its grandeuristic looks!",2.5,2023-11-06
9478955,"The staff are very accommodating. The location is near to IT park. The place looks outdated, pool is old, and the room is dusty. But still, we had a good experience. Thank you",3.5,2023-11-03
9364687,Totally recommended hotel! I had my birthday celebration and they gave me a complimentary yummy cake! We attended the A1 concert so it was a blast too!🌹,5.0,2023-10-15
9335757,Great place to stay. Would really recommend this hotel.,4.8,2023-10-10
9103410,"Book at waterfront for my parents, it was convenient way of booking. Thanks Klook",5.0,2023-09-01
9086746,polite staff and clean area. Also the buffet was great,5.0,2023-08-29
9001954,Good for a staycation or getaway. In the heart of cebu so you can wine and dine at a variety of restaurants near by. Service was good. Facility were clean. Overall a good place to stay!,5.0,2023-08-14
9001930,"Pleasant staff, good location but wifi needs upgrade. Nonetheless pleasurable stay!",5.0,2023-08-14
8882889,"It was a nice experience. We celebrated my cousin’s bday there. It was fun. But one thing , the internet connection was so slow, if you’re planning to bring laptop it won’t work.",4.3,2023-07-25
8874741,All good and room was clean. Smooth check in process. The only problem was wifi is too slow!,5.0,2023-07-24
8874113,We had an amazing time here. It’s a good idea to spend the holiday’s in this hotel. They have misa de galó and fireworks after.,5.0,2023-07-23
8687137,"superb accommodation! casino, uno restaurant, etc. almost complete! staffs are great!",5.0,2023-06-24
8687129,amazing hotel! almost complete. ambiance is good. near cebu it park.,5.0,2023-06-24
8620619,The check in process took long as they were having a system update. you can hear the staffs complaining on the side. thanks for the upgrade from deluxe to superio. uno foods was impecable. the pool was nice.,4.8,2023-06-13
8579575,"Highly recommend.
Easy to use as always.
Klook never fail me.",5.0,2023-06-07
8526547,Very good accomodation but the AC in the room we had wasn't working well.,4.5,2023-05-28
8459859,"The rooms are clean and great. The bat essentials are complete. However, we gad trouble with the aircon and the overlooking is not that nice. But the facilities, with the pool and the gym, it was all nice and clean. And the buffet was really worthit.",4.3,2023-05-15
8456144,"The room was super clean and refreshing, you will definitely relax and also the price is so cheap",5.0,2023-05-14
7910838,"We had an enjoyable stay in the hotel. Although the interior of the room was a bit dated, it’s still comfortable and spacious. Buffet breakfast was a big big plus!",4.8,2023-01-30
7815964,"The Location is Ideal as it is near IT Park, staff are very friendly and approchaeble.",4.3,2023-01-08
7787906,"Check-in was a breeze considering that it was peak season. Love the Christmas vibe everywhere. The hotel and its facilities may be outdated but the food in their restaurants and room service has still remained delicious all these years. Hotel is conveniently located near the malls, hospitals and restaurants.",4.5,2023-01-02
7711923,"We had a great stay, and the breakfast was so good.",5.0,2022-12-18
7664138,Thw check-in and check out was very smooth and the room was available right away. Didn't even have to wait.,5.0,2022-12-08
7599547,"Great stay experience. Great place, accomodation and staff.",5.0,2022-11-23
7466433,"This place is very good! Very accommodating staff. Food in the buffet is just okay, we got it on promo since we booked our stay online. The only downside is that the Superior Rooms is that they don’t have bidet (which is a must!) overall experience, it’s 9/10.",4.8,2022-10-17
7375602,"I like how the safety measures for covid-19 were strictly being implemented. I also love the food and the proximity of the hotel to malls, atm machine and banks.",5.0,2022-09-24
7268299,"Great hotel! Convenient location (near IT park & Verified lounge), breakfast buffet has a great selection of food. Will def stay here again.",5.0,2022-08-16
7122771,"We stayed for a company event in Cebu which was also held in Waterfront. The room is clean and has an 80s/90s vibe but still posh and luxurious. I love the view from our room (mountain side). The staff are all very friendly and accommodating, from the housekeeping staff, reception and guards. Breakfast buffet selection is great. Waterfront Cebu felt like a home in Cebu. Excited to be back!",5.0,2022-07-01
