Review Provider,Review ID,Review Content,Review Score,Review Time,normalized_score,Hotel,cleaned_content,label
Agoda,831739565,"Our stay us awesome i will definitely recommends it , thanks SEDA Ayala Cebu 
 
 ",8.4,2024-07-16T10:58:00+07:00,0.8,seda_ayala_center_cebu,stay u awesome definitely recommends thanks seda ayala cebu,2
Agoda,830491273,"If you’re looking for a hotel near the visa center,

 
 ",8.4,2024-07-13T01:53:00+07:00,0.8,seda_ayala_center_cebu,youre looking hotel near visa center,2
Agoda,830421830,"Hoping to receive discount in the future
 
 ",10.0,2024-07-12T04:13:00+07:00,1.0,seda_ayala_center_cebu,,2
Agoda,830363373,"Booked room for 2 guests. When we arrived, hotel claimed booking was for 1 and demanded increased payment for 2. I was able to resolve, but no explanation pricided
 
 ",6.4,2024-07-11T09:53:00+07:00,0.55,seda_ayala_center_cebu,booked room guest arrived hotel claimed booking demanded increased payment able resolve explanation pricided,1
Agoda,830265888,"Great location
 
 ",10.0,2024-07-10T04:25:00+07:00,1.0,seda_ayala_center_cebu,,2
Agoda,830218277,"Good location  clean and nice
 
 ",10.0,2024-07-09T11:32:00+07:00,1.0,seda_ayala_center_cebu,,2
Agoda,803242686,"GOOD
 
 ",10.0,2024-07-09T07:31:00+07:00,1.0,seda_ayala_center_cebu,,2
Agoda,830170735,"Everything is OK. Just need to replace the towels.
 
 ",9.2,2024-07-08T11:40:00+07:00,0.8999999999999999,seda_ayala_center_cebu,,2
Agoda,830042839,"+ just beside ayala mall
+ great staff always 
+ great bfast

- hallway carpet is moldy all the way and smelly too :(
- room is also smelly coming from either the ac or from the hallway
- towels are not crisp white
- stains on the lounge sofa
 
 ",9.2,2024-07-07T11:40:00+07:00,0.8999999999999999,seda_ayala_center_cebu,beside ayala mall great staff always great bfast hallway carpet moldy way smelly room also smelly coming either ac hallway towel crisp white stain lounge sofa,2
Agoda,829967158,"I was here during a business visit and choosed it since the location is good in the business district and Ayala.  Plus for excellent breakfast with good coffe and quality. Helpful staff and clean functional rooms. Little pricey depending on when booked. 
 
 ",8.4,2024-07-06T01:23:00+07:00,0.8,seda_ayala_center_cebu,business visit choosed since location good business district ayala plus excellent breakfast good coffe quality helpful staff clean functional room little pricey depending booked,2
Agoda,829889426,"Location is very convinient. Easy access to ayala mall.  Downside towels need to be replaced old already. 
 
 ",9.2,2024-07-05T12:04:00+07:00,0.8999999999999999,seda_ayala_center_cebu,location convinient easy access ayala mall downside towel need replaced old already,2
Agoda,829619152,"Staff was friendly, breakfast was filling and had variety. It was also nice that there's an entrance/walkway directly to Ayala, which was very helpful since it rained on that day & we didn't have an umbrella. Very recommended!
 
 ",10.0,2024-07-05T03:16:00+07:00,1.0,seda_ayala_center_cebu,staff friendly breakfast filling variety also nice there entrancewalkway directly ayala helpful since rained day didnt umbrella recommended,2
Agoda,829563359,"Would be back again 
 
 ",10.0,2024-07-05T01:04:00+07:00,1.0,seda_ayala_center_cebu,,2
Agoda,827458020,"We recently stayed at Seda Ayala Center Cebu and had a pleasant experience overall. The location is perfect, situated right beside Ayala Mall, which made it incredibly convenient for shopping, dining, and entertainment. Having the mall so close by added a lot of convenience to our stay.

The room was clean and well-maintained, providing a comfortable environment for relaxation. In terms of value for money, Seda Ayala Center Cebu is an excellent choice. The rates are reasonable, especially considering the prime location and the quality of the accommodations.

However, there is one area that could use improvement: the buffet breakfast. While the food itself was good, the breakfast area can get quite crowded, making it a bit chaotic. It would be great if the hotel could find a way to better manage the crowd during breakfast hours.

Overall, Seda Ayala Center Cebu is a great option for anyone visiting Cebu. The unbeatable location next to Ayala Mall, clean rooms, and good value for money make it a solid choice. If they can address the breakfast crowd issue, it would make the stay even better.
 
 ",9.6,2024-07-03T05:34:00+07:00,0.95,seda_ayala_center_cebu,recently stayed seda ayala center cebu pleasant experience overall location perfect situated right beside ayala mall made incredibly convenient shopping dining entertainment mall close added lot convenience stay room clean wellmaintained providing comfortable environment relaxation term value money seda ayala center cebu excellent choice rate reasonable especially considering prime location quality accommodation however one area could use improvement buffet breakfast food good breakfast area get quite crowded making bit chaotic would great hotel could find way better manage crowd breakfast hour overall seda ayala center cebu great option anyone visiting cebu unbeatable location next ayala mall clean room good value money make solid choice address breakfast crowd issue would make stay even better,2
Agoda,827029784,"It always puzzle me why their Bacons aren’t put on display during breakfast buffet., unlike other hotels. You should specifically request for it.  It’s quite a hassle actually.  Rating only 2 stars for food!
 
 ",8.0,2024-07-02T03:44:00+07:00,0.75,seda_ayala_center_cebu,always puzzle bacon arent put display breakfast buffet unlike hotel specifically request quite hassle actually rating star food,2
Agoda,823946880,"We were impressed by the service and quality of the accomodations.

The staff was smilling and professional, there was some water leaking at our arrival and some technician was dispatched immeditately, as we left the room he also left to call the security as he informed us he couldn't work without supervision.

The hotel is very well place at the heart of the Ayala center providing easy access to shoping and restaurants. Would definitively consider coming back. 
 
 ",9.2,2024-06-29T03:36:00+07:00,0.8999999999999999,seda_ayala_center_cebu,impressed service quality accomodations staff smilling professional water leaking arrival technician dispatched immeditately left room also left call security informed u couldnt work without supervision hotel well place heart ayala center providing easy access shoping restaurant would definitively consider coming back,2
Agoda,823735353,"Great location attached to Ayala, staff lovely and the club room was pleasant, great stay would recommend! 
 
 ",8.8,2024-06-28T05:08:00+07:00,0.8500000000000001,seda_ayala_center_cebu,great location attached ayala staff lovely club room pleasant great stay would recommend,2
Agoda,823622179,"If you plan to spend some time at the mall its the most convenient there is. Just walk out the hotel restaurant back door entrance/exit and you are on the Terraces of the Ayala Mall. We liked the breakfast buffet. Hotel is very clean, room was clean and modern but nothing memorable 
or fancy. It is nice enough for a modern hotel room though. The staff were all friendly. I'd stay here again if wanting to visit Ayala Center. 
 
 ",9.2,2024-06-26T03:12:00+07:00,0.8999999999999999,seda_ayala_center_cebu,plan spend time mall convenient walk hotel restaurant back door entranceexit terrace ayala mall liked breakfast buffet hotel clean room clean modern nothing memorable fancy nice enough modern hotel room though staff friendly id stay wanting visit ayala center,2
Agoda,823526714,"Location is a big factor
 
 ",8.0,2024-06-25T10:28:00+07:00,0.75,seda_ayala_center_cebu,,2
Agoda,823485398,"Great place to stay right next to the mall.  Nice central location. Highly recommend!
 
 ",10.0,2024-06-24T10:33:00+07:00,1.0,seda_ayala_center_cebu,great place stay right next mall nice central location highly recommend,2
Agoda,823361664,"Location is great.  
Just a suggestion, I hope they’ll change some of their menus for breakfast. 
Carpets in the hallway has seen better days but the hotel overall is clean. 
 
 ",8.0,2024-06-23T12:08:00+07:00,0.75,seda_ayala_center_cebu,location great suggestion hope theyll change menu breakfast carpet hallway seen better day hotel overall clean,2
Agoda,823397447,"We love our stay in Seda.
Wide selection for breakfast.
Great location , Ayala mall is just few steps away.
 
 ",10.0,2024-06-23T11:13:00+07:00,1.0,seda_ayala_center_cebu,love stay seda wide selection breakfast great location ayala mall step away,2
Agoda,823287043,"Very nice and comfy place to stay, Ayala Mall is just beside the hotel, fast access to all you need and want.  Great place to dine and chill and very accommodating and helpful staff.   
 
 ",10.0,2024-06-22T02:03:00+07:00,1.0,seda_ayala_center_cebu,nice comfy place stay ayala mall beside hotel fast access need want great place dine chill accommodating helpful staff,2
Agoda,822834857,"Great value for money and location is unbeatable! 
 
 ",9.2,2024-06-21T12:50:00+07:00,0.8999999999999999,seda_ayala_center_cebu,,2
Agoda,822906336,"Shower low pressure 
 
 ",9.2,2024-06-21T02:54:00+07:00,0.8999999999999999,seda_ayala_center_cebu,,2
Agoda,820507083,"Had a great night stay here, only thing wrong is all the tiles around the outdoor pool are mega slippery once they’re wet and of course, because it’s a pool, they are always wet and quite treacherous to walk on.
 
 ",8.8,2024-06-19T01:00:00+07:00,0.8500000000000001,seda_ayala_center_cebu,great night stay thing wrong tile around outdoor pool mega slippery theyre wet course pool always wet quite treacherous walk,2
Agoda,820239212,"It is located at the heart of a business district and is very near to a major shopping center. Their staffs are very friendly and accommodating.
 
 ",10.0,2024-06-18T09:04:00+07:00,1.0,seda_ayala_center_cebu,located heart business district near major shopping center staff friendly accommodating,2
Agoda,818786207,"Highly recommend this hotel. Staff are exceptionally well trained and kind. They treat you like a VIP. Hotel is very clean. Breakfast buffet offers variety of food. Excellent hotel.
 
 ",10.0,2024-06-17T09:16:00+07:00,1.0,seda_ayala_center_cebu,highly recommend hotel staff exceptionally well trained kind treat like vip hotel clean breakfast buffet offer variety food excellent hotel,2
Agoda,818970118,"I’m happy with this hotel. That’s why I stayed here multiple times. It’s close to the mall just walking distance to restaurants and shops. I’ll definitely book to this hotel when I’m in Cebu. 
 
 ",8.4,2024-06-17T03:00:00+07:00,0.8,seda_ayala_center_cebu,im happy hotel thats stayed multiple time close mall walking distance restaurant shop ill definitely book hotel im cebu,2
Agoda,817518558,"Clean rooms.
Best location when in Cebu.
Accessible to the mall.
 
 ",9.2,2024-06-16T07:13:00+07:00,0.8999999999999999,seda_ayala_center_cebu,clean room best location cebu accessible mall,2
Agoda,816496011,"Seda Ayala Cebu has been my second home every time I travel to Cebu. Everything is easy from check in to check out. I always enjoy my stay in this hotel. Highly recommended to business travellers like me. 
 
 ",10.0,2024-06-13T01:32:00+07:00,1.0,seda_ayala_center_cebu,seda ayala cebu second home every time travel cebu everything easy check check always enjoy stay hotel highly recommended business traveller like,2
Agoda,816153525,"I’ve been staying here since it was Marriott and the staff are unbelievably fantastic.  From the front desk to the security/front door men to the wait staff, every staff went above and beyond.  I cannot say enough but the place needs an overhaul renovation. The wallpaper on the ceiling in the reception area are peeling, the rooms have a musky old smell to the shabby carpets on each elevator bank to name a few. I’ve stayed at the IT Bloc and this place has a newer modern ambiance. Overall Seda Ayala Center gets three stars. One for the fantastic staff, two for the location, and three convenience being the center point to every where.  
 
 ",8.4,2024-06-09T12:50:00+07:00,0.8,seda_ayala_center_cebu,ive staying since marriott staff unbelievably fantastic front desk securityfront door men wait staff every staff went beyond say enough place need overhaul renovation wallpaper ceiling reception area peeling room musky old smell shabby carpet elevator bank name ive stayed bloc place newer modern ambiance overall seda ayala center get three star one fantastic staff two location three convenience center point every,2
Agoda,816237110,"I have stayed in Seda's many times and this is one of my favorites.  Get a club room and it will give you access to snacks, foods and beverages on the upper floor of the hotel. Very nice! Great access to Ayala Mall. Staff is always amazing. 
 
 ",9.6,2024-06-09T10:00:00+07:00,0.95,seda_ayala_center_cebu,stayed sedas many time one favorite get club room give access snack food beverage upper floor hotel nice great access ayala mall staff always amazing,2
Agoda,816131555,"Good place to stay for couples or even families.
 
 ",9.6,2024-06-08T02:48:00+07:00,0.95,seda_ayala_center_cebu,,2
Agoda,816073596,"I like that that they are near mall, but if it would rain they dont have a walkway to mall
 
 ",10.0,2024-06-07T08:55:00+07:00,1.0,seda_ayala_center_cebu,like near mall would rain dont walkway mall,2
Agoda,815909697,"Had a nice stay
 
 ",10.0,2024-06-05T05:31:00+07:00,1.0,seda_ayala_center_cebu,,2
Agoda,815898596,"Hotel is conveniently located in the city
 
 ",10.0,2024-06-05T02:24:00+07:00,1.0,seda_ayala_center_cebu,,2
Agoda,815898549,"Good place to stay in the city! 
 
 ",10.0,2024-06-05T02:23:00+07:00,1.0,seda_ayala_center_cebu,,2
Agoda,813979554,"Nice
 
 ",10.0,2024-06-02T01:40:00+07:00,1.0,seda_ayala_center_cebu,,2
Agoda,813038177,"Full gym with sauna was amazing
 
 ",10.0,2024-06-01T09:01:00+07:00,1.0,seda_ayala_center_cebu,,2
Agoda,813038081,"Full gym with sauna was amazing
 
 ",10.0,2024-06-01T09:00:00+07:00,1.0,seda_ayala_center_cebu,,2
Agoda,812239715,"Very good. Near to everything. Quick response to all needs. Non smoking rooms are a plus. 
 
 ",10.0,2024-05-31T11:27:00+07:00,1.0,seda_ayala_center_cebu,good near everything quick response need non smoking room plus,2
Agoda,812226758,"Excellent Hotel loved everything about it cleanliness the food the staff the comfort some of the most comfortable beds of every slept in we definitely will make this a stop each time we're back to the Philippines
 
 ",10.0,2024-05-31T10:59:00+07:00,1.0,seda_ayala_center_cebu,excellent hotel loved everything cleanliness food staff comfort comfortable bed every slept definitely make stop time back philippine,2
Agoda,810804478,"Perfect location if you are planning to explore the city. 
 
 ",9.2,2024-05-30T12:21:00+07:00,0.8999999999999999,seda_ayala_center_cebu,perfect location planning explore city,2
Agoda,811268105,"We used to stay here atleast once a month. Super fab and accessible in all. Kudos to all! 🙏🤗
 
 ",10.0,2024-05-30T11:02:00+07:00,1.0,seda_ayala_center_cebu,used stay atleast month super fab accessible kudos,2
Agoda,811201929,"Beside Ayala Mall is an edge.
 
 ",8.0,2024-05-30T09:10:00+07:00,0.75,seda_ayala_center_cebu,,2
Agoda,810403087,"The hotel room is spacious. Breakfast is included which is a plus. The hotel is located beside the Ayala Mall which is of great convenience for travellers who likes to relax and shop. 
 
 ",9.6,2024-05-29T12:46:00+07:00,0.95,seda_ayala_center_cebu,hotel room spacious breakfast included plus hotel located beside ayala mall great convenience traveller like relax shop,2
Agoda,810404918,"Staff courteous & polite.
Location perfect for shopping & eating & touring city.
Bfast is ok.
T.y.
 
 ",8.8,2024-05-29T01:26:00+07:00,0.8500000000000001,seda_ayala_center_cebu,staff courteous polite location perfect shopping eating touring city bfast ok ty,2
Agoda,810337849,"Great Staff, clean rooms, comfortable rooms.  Would stay here again any time.  well worth it. 
 
 ",9.0,2024-05-28T05:20:00+07:00,0.875,seda_ayala_center_cebu,great staff clean room comfortable room would stay time well worth,2
Agoda,810160864,"The only pro for this hotel is it is a few steps away from Ayala Mall. That’s it. 
 
 ",7.6,2024-05-26T06:06:00+07:00,0.7,seda_ayala_center_cebu,pro hotel step away ayala mall thats,1
Agoda,810151256,"Nice & clean & comfy room.
Staff are very friendly  & helpful  
 
 ",9.6,2024-05-26T02:43:00+07:00,0.95,seda_ayala_center_cebu,nice clean comfy room staff friendly helpful,2
Agoda,810041360,"Stayed for 2 nights! Loved the vicinity to the mall, restaurants. Staff were exceptional from security to workers inside the hotel. Filipino hospitality at its best.
Room is clean and tidy, and they have a better process of seeking privacy or room tidy service. Would stay here again if I ever visit Cebu again
 
 ",9.6,2024-05-24T01:39:00+07:00,0.95,seda_ayala_center_cebu,stayed night loved vicinity mall restaurant staff exceptional security worker inside hotel filipino hospitality best room clean tidy better process seeking privacy room tidy service would stay ever visit cebu,2
Agoda,809954542,"Great hotel. Had a great stay. Awesome breakfast buffet. Attentive staff.
 
 ",10.0,2024-05-23T11:11:00+07:00,1.0,seda_ayala_center_cebu,great hotel great stay awesome breakfast buffet attentive staff,2
Agoda,809947398,"Everything is very good  except that your buffet has limited choices . 

 
 ",9.2,2024-05-23T10:12:00+07:00,0.8999999999999999,seda_ayala_center_cebu,everything good except buffet limited choice,2
Agoda,809910041,"All staff always smiling, always quick to respond, rooms are very clean, food  are very delicious, hotel have a very good location and the beds are like sleeping on a cloud soft and comfy. 
 
 ",10.0,2024-05-22T09:54:00+07:00,1.0,seda_ayala_center_cebu,staff always smiling always quick respond room clean food delicious hotel good location bed like sleeping cloud soft comfy,2
Agoda,809846448,"I’ve previously  heard bad things about this hotel but still decided to book it because of proximity to places I wanted to go. I was pleasantly surprised and happy with my choice. 
 
 ",10.0,2024-05-22T03:59:00+07:00,1.0,seda_ayala_center_cebu,ive previously heard bad thing hotel still decided book proximity place wanted go pleasantly surprised happy choice,2
Agoda,807828909,"staff is commendable, very clean rooms, not to mention the perks, amazing! we really had a wonderful & memorable stay. we promise to come back, SEDA!
 
 ",10.0,2024-05-19T12:35:00+07:00,1.0,seda_ayala_center_cebu,staff commendable clean room mention perk amazing really wonderful memorable stay promise come back seda,2
Agoda,805496796,"The place is nice and clean. Very accommodating staff also.
 
 ",10.0,2024-05-17T12:21:00+07:00,1.0,seda_ayala_center_cebu,place nice clean accommodating staff also,2
Agoda,803796852,"This hotel is very convenient to the mall and the Port. The included breakfast buffet was exceptional! Great selection and value for the money. The staff were friendly and helpful. 
 
 ",9.6,2024-05-15T08:20:00+07:00,0.95,seda_ayala_center_cebu,hotel convenient mall port included breakfast buffet exceptional great selection value money staff friendly helpful,2
Agoda,803784344,"Staff are super helpful, Stephen at Front Desk for lightning speed check ins!
 
 ",10.0,2024-05-15T05:12:00+07:00,1.0,seda_ayala_center_cebu,staff super helpful stephen front desk lightning speed check in,2
Agoda,803784311,"Favorite place to stay in Cebu
 
 ",10.0,2024-05-15T05:11:00+07:00,1.0,seda_ayala_center_cebu,,2
Agoda,803709346,"Super convenient 
 
 ",9.2,2024-05-14T04:06:00+07:00,0.8999999999999999,seda_ayala_center_cebu,,2
Agoda,803750607,"Clean and the internet is stable.
 
 ",9.2,2024-05-14T02:18:00+07:00,0.8999999999999999,seda_ayala_center_cebu,,2
Agoda,803644529,"Always very professional and courteous. That's why I stay here all the time!
 
 ",9.6,2024-05-13T07:35:00+07:00,0.95,seda_ayala_center_cebu,always professional courteous thats stay time,2
Agoda,803564026,"the place is near everywhere. if your looking for a place to stay when in business trip this place is perfect !
 
 ",10.0,2024-05-12T09:01:00+07:00,1.0,seda_ayala_center_cebu,place near everywhere looking place stay business trip place perfect,2
Agoda,803543403,"Staff were all accommodating. The stay provided satisfaction and comfort. 
 
 ",8.0,2024-05-12T04:55:00+07:00,0.75,seda_ayala_center_cebu,staff accommodating stay provided satisfaction comfort,2
Agoda,803485443,"Great place, Good food and  friendly staff! 
 
 ",10.0,2024-05-11T07:34:00+07:00,1.0,seda_ayala_center_cebu,,2
Agoda,803469319,"Everything were ok from Room, Facilities and well trained staff.
 
 ",10.0,2024-05-11T01:49:00+07:00,1.0,seda_ayala_center_cebu,everything ok room facility well trained staff,2
Agoda,803469289,"The room and facilities are all good
 
 ",10.0,2024-05-11T01:47:00+07:00,1.0,seda_ayala_center_cebu,,2
Agoda,803356867,"Excellent
 
 ",10.0,2024-05-09T10:14:00+07:00,1.0,seda_ayala_center_cebu,,2
Agoda,803151549,"Excellent staff… but food was lackluster… food was hit or miss.. but other than that the experience was great.
 
 ",8.8,2024-05-07T12:18:00+07:00,0.8500000000000001,seda_ayala_center_cebu,excellent staff food lackluster food hit miss experience great,2
Agoda,803207605,"We had a great stay. The location was excellent, right in the heart of the city. The staff was friendly and accommodating, always ready to assist us. The rooms were spacious and clean, ensuring a comfortable stay. Althought the pool could have been better, the overall facilities were satisfactory. Considering the value for money, we highly recommend this property for anyone visiting the area.
 
 ",9.2,2024-05-07T01:38:00+07:00,0.8999999999999999,seda_ayala_center_cebu,great stay location excellent right heart city staff friendly accommodating always ready assist u room spacious clean ensuring comfortable stay althought pool could better overall facility satisfactory considering value money highly recommend property anyone visiting area,2
Agoda,801884233,"If you want to be in Cebu city the location is great, next to the mall. If you have a special diet, i am a vegan. The hotel ia not great. They have me steamed vegetables for breakfast and there was nothing vegan in the executive lounge. The good thing is that there are restaurants nearby in the mall and in the city. They do have soy milk for coffee.
 
 ",8.8,2024-05-04T12:44:00+07:00,0.8500000000000001,seda_ayala_center_cebu,want cebu city location great next mall special diet vegan hotel ia great steamed vegetable breakfast nothing vegan executive lounge good thing restaurant nearby mall city soy milk coffee,2
Agoda,801049687,"Everything  was good overall. Great location, value for money, and front desk help. The restaurant staff at breakfast for some reason refused to refill water and coffee but cleared the tables well.  The omelette bar cook seldom had premade eggs ready for the customers.  The hotel laundry service lost a garment but found it after a thorough search. The maid service didn't provide adequate bath tissue or clean the bathroom  well. 
 
 ",6.8,2024-05-03T03:43:00+07:00,0.6,seda_ayala_center_cebu,everything good overall great location value money front desk help restaurant staff breakfast reason refused refill water coffee cleared table well omelette bar cook seldom premade egg ready customer hotel laundry service lost garment found thorough search maid service didnt provide adequate bath tissue clean bathroom well,1
Agoda,800623464,"Don’t make the mistake as I did of finding out there are 2 Seda hotels and going to the wrong one. It’s overall fine but nothing fantastic or memorable
 
 ",6.8,2024-05-02T10:18:00+07:00,0.6,seda_ayala_center_cebu,dont make mistake finding seda hotel going wrong one overall fine nothing fantastic memorable,1
Agoda,799802770,"We had a bit of trouble looking for parking spots in cebu ayala, the hotel allowed our car to park in their parking area.. check in and check out were done smoothly and no trouble.  Had a great breakfast before leaving...
 
 ",10.0,2024-05-01T07:33:00+07:00,1.0,seda_ayala_center_cebu,bit trouble looking parking spot cebu ayala hotel allowed car park parking area check check done smoothly trouble great breakfast leaving,2
Agoda,800180436,"We stayed at this place when it was Marriott’s . I was shocked the room looks exactly like 1999 ..  hallway carpets so old . Room so old. We came in , fridge not working no welcome note or something. Towels so old  and hard. I was so excited coz it’s expensive and over rated but to my dismay it looks like I traveled in time 1999.  Seda Bloc is 5x better in everything
 
 ",4.4,2024-05-01T06:13:00+07:00,0.30000000000000004,seda_ayala_center_cebu,stayed place marriotts shocked room look exactly like hallway carpet old room old came fridge working welcome note something towel old hard excited coz expensive rated dismay look like traveled time seda bloc x better everything,1
Agoda,798031507,"Exceptional service.
Will definitely be back again.
 
 ",10.0,2024-04-28T10:57:00+07:00,1.0,seda_ayala_center_cebu,,2
Agoda,797986995,"Will stay with Seda Ayala Center again.
 
 ",9.2,2024-04-27T11:18:00+07:00,0.8999999999999999,seda_ayala_center_cebu,,2
Agoda,797885612,"Great hotel, which is almost part of the shopping centre. The staff were all very friendly and helpful. The room was large and clean. Would stay again.
 
 ",8.8,2024-04-26T11:02:00+07:00,0.8500000000000001,seda_ayala_center_cebu,great hotel almost part shopping centre staff friendly helpful room large clean would stay,2
