Review Provider,Review ID,Review Content,Review Score,Review Time,normalized_score,Hotel,cleaned_content,label
Agoda,637098325,"Everything is good. Location is perfect. Breakfast buffet is good. Very clean. Approachable staff.
 
 ",10.0,2023-04-23T05:54:00+07:00,1.0,seda_ayala_center_cebu,everything good location perfect breakfast buffet good clean approachable staff,2
Agoda,636413427,"Friendly staff and accomodating
 
 ",10.0,2023-04-22T08:59:00+07:00,1.0,seda_ayala_center_cebu,,2
Agoda,636028694,"Good option for business traveller
 
 ",9.2,2023-04-21T04:04:00+07:00,0.8999999999999999,seda_ayala_center_cebu,,2
Agoda,635872413,"Dated one Star  hotel at 5 star price
False advertising; I booked junior suite, it is not a suite, just mediocre room.
I would left hotel , but my reservation for 3 night @ 32,000 PHP was non refundable.
Do not walk away from hotel ; RUN
 
 ",4.4,2023-04-20T10:26:00+07:00,0.30000000000000004,seda_ayala_center_cebu,dated one star hotel star price false advertising booked junior suite suite mediocre room would left hotel reservation night php non refundable walk away hotel run,1
Agoda,635863417,"Best place to stay within the city
 
 ",10.0,2023-04-20T07:47:00+07:00,1.0,seda_ayala_center_cebu,,2
Agoda,635346674,"Love this hotel whenever we have to “layover” in Cebu City on to our next destination. Walking distance to Ayala Mall which means we can go for quick shopping.
 
 ",8.0,2023-04-19T06:08:00+07:00,0.75,seda_ayala_center_cebu,love hotel whenever layover cebu city next destination walking distance ayala mall mean go quick shopping,2
Agoda,635441426,"The best part of the this hotel is it’s location. Located right next to the Ayala shopping mall, it’s super convenient to just hop, skip and jump to the mall. The rooms are nice and comfortable. Truly recommend! 
P.S: You can do better with the breakfast buffet. 
 
 ",8.8,2023-04-19T02:01:00+07:00,0.8500000000000001,seda_ayala_center_cebu,best part hotel location located right next ayala shopping mall super convenient hop skip jump mall room nice comfortable truly recommend p better breakfast buffet,2
Agoda,633603353,"This hotel gives you relaxing stay for everything you need is at your back (AYALA MALL CENTER)
 
 ",9.6,2023-04-17T11:20:00+07:00,0.95,seda_ayala_center_cebu,hotel give relaxing stay everything need back ayala mall center,2
Agoda,633409768,"Staff was excellent, breakfast was done very well staff very attentive.
Pool not as large an area no umbrellas for the chairs.
 
 ",8.4,2023-04-17T07:05:00+07:00,0.8,seda_ayala_center_cebu,staff excellent breakfast done well staff attentive pool large area umbrella chair,2
Agoda,633355145,"Location is the winner. The buffet breakfast was a champion too
 
 ",8.8,2023-04-17T06:08:00+07:00,0.8500000000000001,seda_ayala_center_cebu,location winner buffet breakfast champion,2
Agoda,631349811,"Superfriendly Front Desk.
I have checked in at past 11pm and the people who were working the Front Desk were still all smiles! 
Only in Cebu!
 
 ",10.0,2023-04-15T09:29:00+07:00,1.0,seda_ayala_center_cebu,superfriendly front desk checked past pm people working front desk still smile cebu,2
Agoda,630948703,"Courteous staff, helpful. 
B’fast Buffett could use some newer ideas if you’re staying a week. 
 
 ",8.4,2023-04-14T08:08:00+07:00,0.8,seda_ayala_center_cebu,courteous staff helpful bfast buffett could use newer idea youre staying week,2
Agoda,630927543,"SEDA has been my favorite hotel for some time now. Courteous staff, gorgeous facility. 
Buffet breakfast is super popular even the locals go to SEDA to enjoy their breakfast.
 
 ",10.0,2023-04-14T01:15:00+07:00,1.0,seda_ayala_center_cebu,seda favorite hotel time courteous staff gorgeous facility buffet breakfast super popular even local go seda enjoy breakfast,2
Agoda,630879853,"good
 
 ",9.6,2023-04-13T07:38:00+07:00,0.95,seda_ayala_center_cebu,,2
Agoda,630911534,"I enjoyed my stay , everything was organized and good, from car transportation to airport, thanks to every one specially to Gina the laundry service lady and the sweet jomangy for his in-dine service. 
The food was great and delicious.
I recommend this hotel to everyone . 
I loved the mall next the hotel which there is a short way to go to the mall.
 
 ",10.0,2023-04-13T04:54:00+07:00,1.0,seda_ayala_center_cebu,enjoyed stay everything organized good car transportation airport thanks every one specially gina laundry service lady sweet jomangy indine service food great delicious recommend hotel everyone loved mall next hotel short way go mall,2
Agoda,630864067,"Good location when visiting cebu,staff was extra nice,food was good and its different every few choices too.desk staff were very helpful...would definitely come back...
 
 ",8.8,2023-04-13T02:47:00+07:00,0.8500000000000001,seda_ayala_center_cebu,good location visiting cebustaff extra nicefood good different every choice toodesk staff helpfulwould definitely come back,2
Agoda,630013204,"Friendly staff and clean room
 
 ",10.0,2023-04-11T08:42:00+07:00,1.0,seda_ayala_center_cebu,,2
Agoda,630179922,"Quiet, spacious, and clean room. Staff were good hosts.
 
 ",9.6,2023-04-11T04:10:00+07:00,0.95,seda_ayala_center_cebu,,2
Agoda,629502195,"GOOD
 
 ",3.2,2023-04-10T01:57:00+07:00,0.15000000000000002,seda_ayala_center_cebu,,0
Agoda,629320066,"Great Hotel!!!
 
 ",10.0,2023-04-09T11:20:00+07:00,1.0,seda_ayala_center_cebu,,2
Agoda,629319759,"Walking distance from Ayala Mall
 
 ",10.0,2023-04-09T11:14:00+07:00,1.0,seda_ayala_center_cebu,,2
Agoda,629104671,"location, cleanliness, service is good. And staffs are courteous, helpful... Value for money. I recommend this hotel!
 
 ",10.0,2023-04-09T09:16:00+07:00,1.0,seda_ayala_center_cebu,location cleanliness service good staff courteous helpful value money recommend hotel,2
Agoda,629085517,"From the staff to the cleanliness of the room…it’s simply two thumbs up!!!
 
 ",10.0,2023-04-09T04:39:00+07:00,1.0,seda_ayala_center_cebu,staff cleanliness roomits simply two thumb,2
Agoda,628310547,"Location is good but toilet is small 
 
 ",6.0,2023-04-07T01:34:00+07:00,0.5,seda_ayala_center_cebu,,1
Agoda,626435206,"Very nice room, good breakfast
Strong WiFi
Walking to ayala
Nice pool under the sun all day 
Highly recommend 
 
 ",9.6,2023-04-04T02:52:00+07:00,0.95,seda_ayala_center_cebu,nice room good breakfast strong wifi walking ayala nice pool sun day highly recommend,2
Agoda,626358923,"Great location, professional staff and very good breakfast!
 
 ",10.0,2023-04-03T05:12:00+07:00,1.0,seda_ayala_center_cebu,,2
Agoda,626401186,"Room and bathroom were very spacious.
Staffs were very friendly and helpful.
We were allowed early check in and late checkout.
Location was just beside ayala center
 
 ",10.0,2023-04-03T02:31:00+07:00,1.0,seda_ayala_center_cebu,room bathroom spacious staff friendly helpful allowed early check late checkout location beside ayala center,2
Agoda,626290667,"Great hotel.  Beside Ayala center.  Great breakfast buffet. Good service.
 
 ",10.0,2023-04-02T09:00:00+07:00,1.0,seda_ayala_center_cebu,great hotel beside ayala center great breakfast buffet good service,2
Agoda,626288349,"This hotel is next to the mall.very convenient to buy anything you need.the staffs are very friendly and  pleasant.will stay when We go to Cebu again
 
 ",7.2,2023-04-02T08:28:00+07:00,0.65,seda_ayala_center_cebu,hotel next mallvery convenient buy anything needthe staff friendly pleasantwill stay go cebu,1
Agoda,626224228,"The hotel is decent. A little outdated. 
 
 ",8.0,2023-04-01T11:00:00+07:00,0.75,seda_ayala_center_cebu,,2
Agoda,626198081,"My all-time fave hotel!
A couple of minutes walk to the mall.
Courteous staff. Superb breakfast. 
 
 ",10.0,2023-04-01T03:07:00+07:00,1.0,seda_ayala_center_cebu,alltime fave hotel couple minute walk mall courteous staff superb breakfast,2
Agoda,626231641,"Excellent facilities,  rooms.
My go to hotel whenever I'm in Cebu.
 
 ",10.0,2023-04-01T01:18:00+07:00,1.0,seda_ayala_center_cebu,excellent facility room go hotel whenever im cebu,2
Agoda,626231549,"Very good location.
Nice clean rooms.
Yummy breakfast. 
 
 ",10.0,2023-04-01T01:16:00+07:00,1.0,seda_ayala_center_cebu,,2
Agoda,626164179,"A very good place to stay in Cebu. Ayala mall is right next to the hotel. Staffs are very helpful, friendly, courteous... Overall service is excellent. 
 
 ",10.0,2023-03-31T12:49:00+07:00,1.0,seda_ayala_center_cebu,good place stay cebu ayala mall right next hotel staff helpful friendly courteous overall service excellent,2
Agoda,626158127,"If you want to maximize your stay in Cebu, Seda Ayala Center has the best location with easy access to the mall and lots of taxis and transportation options. Breakfast is always great -- well stocked with international and local options. Room is big and well decorated, a great staycation option.
 
 ",10.0,2023-03-31T10:48:00+07:00,1.0,seda_ayala_center_cebu,want maximize stay cebu seda ayala center best location easy access mall lot taxi transportation option breakfast always great well stocked international local option room big well decorated great staycation option,2
Agoda,626134221,"housekeeping was really great, location is the best part since the hotel have a specific entrance going to the mall
 
 ",8.4,2023-03-31T03:56:00+07:00,0.8,seda_ayala_center_cebu,housekeeping really great location best part since hotel specific entrance going mall,2
Agoda,626133798,"late email responses, does not coordinate our airport transfers.
 
 ",8.0,2023-03-31T03:54:00+07:00,0.75,seda_ayala_center_cebu,,2
Agoda,626173355,"I commend the staff of Cebu for the warmest accommodation and competent staff from their security reception, bellmen, restaurant personnel.  We will definitely come back. 
 
 ",10.0,2023-03-31T03:26:00+07:00,1.0,seda_ayala_center_cebu,commend staff cebu warmest accommodation competent staff security reception bellman restaurant personnel definitely come back,2
Agoda,626130918,"Everything was perfect :) 
 
 ",10.0,2023-03-31T02:48:00+07:00,1.0,seda_ayala_center_cebu,,2
Agoda,626079982,"I recommend this hotel, the restaurant is amazing and the hotel is next to a mall, clean and have everything I requested 
 
 ",10.0,2023-03-30T07:56:00+07:00,1.0,seda_ayala_center_cebu,recommend hotel restaurant amazing hotel next mall clean everything requested,2
Agoda,626051928,"I love the hotel! From the location to the room cleanliness. Housekeeping did a very good job on maintaining the hotel cleanliness. The security guards and the bellman John are very helpful! 

The guy from the bar lobby is very accommodating but i forgot his name i think it was Rey ( I’m not sure)

Great food selection in their breakfast buffet. Attentive staffs from Misto restaurant.

We appreciate the hotel gestures as we are celebrating our 3rd year civil wedding anniversary they had prepared a bed set up in the room with a cake. 

Check in was ok. I just had a small issue. The FDA had enrolled me in their Loyalty program without my knowledge. I was a bit upset as she had enrolled my personal email without letting me know. Already spoke to the Duty Manager Karen Ng and she was very accommodating.

If only the FDA introduced their Loyalty program to me properly i would have not say no to it and gave a different email for it. Its just upsetting that she did it without my permission.

The check out was smooth and Stephen was really approachable and smiling. (They’re wearing face mask but i can tell from his eyes)

 
 ",8.4,2023-03-29T08:48:00+07:00,0.8,seda_ayala_center_cebu,love hotel location room cleanliness housekeeping good job maintaining hotel cleanliness security guard bellman john helpful guy bar lobby accommodating forgot name think rey im sure great food selection breakfast buffet attentive staff misto restaurant appreciate hotel gesture celebrating rd year civil wedding anniversary prepared bed set room cake check ok small issue fda enrolled loyalty program without knowledge bit upset enrolled personal email without letting know already spoke duty manager karen ng accommodating fda introduced loyalty program properly would say gave different email upsetting without permission check smooth stephen really approachable smiling theyre wearing face mask tell eye,2
Agoda,626051739,"I love the hotel! From the location to the room cleanliness. Housekeeping did a very good job on maintaining the hotel cleanliness. The security guards and the bellman John are very helpful! 

The guy from the bar lobby is very accommodating but i forgot his name i think it was Rey ( I’m not sure)

Great food selection in their breakfast buffet. Attentive staffs from Misto restaurant.

We appreciate the hotel gestures as we are celebrating our 3rd year civil wedding anniversary they had prepared a bed set up in the room with a cake. 

Check in was ok. I just had a small issue. The FDA had enrolled me in their Loyalty program without my knowledge. I was a bit upset as she had enrolled my personal email without letting me know. Already spoke to the Duty Manager Karen Ng and she was very accommodating.

If only the FDA introduced their Loyalty program to me properly i would have not say no to it and gave a different email for it. Its just upsetting that she did it without my permission.

The check out was smooth and Stephen was really approachable and smiling. (They’re wearing face mask but i can tell from his eyes)

 
 ",8.8,2023-03-29T08:47:00+07:00,0.8500000000000001,seda_ayala_center_cebu,love hotel location room cleanliness housekeeping good job maintaining hotel cleanliness security guard bellman john helpful guy bar lobby accommodating forgot name think rey im sure great food selection breakfast buffet attentive staff misto restaurant appreciate hotel gesture celebrating rd year civil wedding anniversary prepared bed set room cake check ok small issue fda enrolled loyalty program without knowledge bit upset enrolled personal email without letting know already spoke duty manager karen ng accommodating fda introduced loyalty program properly would say gave different email upsetting without permission check smooth stephen really approachable smiling theyre wearing face mask tell eye,2
Agoda,625997490,"Located at the Cebu Business Center, this hotel is right next to Ayala Mall where everything is. WATSONS, restaurants and coffee shops, hair salons etc are all walking distance, you get your steps as a bonus vs the great alternative that of being stuck in traffic 
 
 ",10.0,2023-03-29T03:56:00+07:00,1.0,seda_ayala_center_cebu,located cebu business center hotel right next ayala mall everything watson restaurant coffee shop hair salon etc walking distance get step bonus v great alternative stuck traffic,2
Agoda,625905164,"Everything here is superb 👌🏻👌🏻👌🏻
 
 ",10.0,2023-03-27T11:28:00+07:00,1.0,seda_ayala_center_cebu,,2
Agoda,625782150,"Excellent stuff and good location, enjoy the two weeks’ business trip in Cebu city.
 
 ",10.0,2023-03-27T03:42:00+07:00,1.0,seda_ayala_center_cebu,excellent stuff good location enjoy two week business trip cebu city,2
Agoda,625768007,"I have lived in many hotels in Cebu city, this is the best one I have tried. Not because of the facilities, just for the stuff. They will accept all ur reasonable suggestions, give u the response immediately. Besides, this hotel near the Ayala mall, actually just beside the mall, u can easily go to the mall, try any restaurants there.
 
 ",10.0,2023-03-26T11:44:00+07:00,1.0,seda_ayala_center_cebu,lived many hotel cebu city best one tried facility stuff accept ur reasonable suggestion give u response immediately besides hotel near ayala mall actually beside mall u easily go mall try restaurant,2
Agoda,625138171,"The hotel is in need of some updating.  The room hallways seem dark and dingy.  Breakfast is ok but very crowded.  I had to eat in the lobby.  Only one treadmill was working in the gym.
 
 ",7.3,2023-03-26T06:55:00+07:00,0.6625,seda_ayala_center_cebu,hotel need updating room hallway seem dark dingy breakfast ok crowded eat lobby one treadmill working gym,1
Agoda,622818135,"happy with our stay as we were upgraded to a  1bedroom apartment suite. staff were friendy.
 
 ",10.0,2023-03-24T10:46:00+07:00,1.0,seda_ayala_center_cebu,happy stay upgraded bedroom apartment suite staff friendy,2
Agoda,622752671,"5+ in every category. Finest hotel experience in 10 years. Best breakfast also.
 
 ",10.0,2023-03-24T09:24:00+07:00,1.0,seda_ayala_center_cebu,every category finest hotel experience year best breakfast also,2
Agoda,622589725,"My favorite hotel in the Philippines is the Manila Marriott; this is my Second Favorite. It would be nice to have a few non-guest at the pool bar. 
 
 ",10.0,2023-03-24T06:01:00+07:00,1.0,seda_ayala_center_cebu,favorite hotel philippine manila marriott second favorite would nice nonguest pool bar,2
Agoda,622466221,"I would recommend staying here because it is conveniently located to many hot spots, very clean, and the staff from doorman to upper management are very helpful and friendly professionals. 
 
 ",10.0,2023-03-24T03:32:00+07:00,1.0,seda_ayala_center_cebu,would recommend staying conveniently located many hot spot clean staff doorman upper management helpful friendly professional,2
Agoda,621303326,"Comfortable rooms, quiet air conditioning. 
 
 ",8.8,2023-03-23T07:51:00+07:00,0.8500000000000001,seda_ayala_center_cebu,,2
Agoda,620665519,"Nice hotel great location
Room service cheese burger (late arrivals) burger meat smelt off 
Great breakfast friendly staff
Cocktail staff could do with a bit of retraining  in customer service
All in all we enjoyed our stay and fantastic location  
Would stay again 
 
 ",8.8,2023-03-22T08:27:00+07:00,0.8500000000000001,seda_ayala_center_cebu,nice hotel great location room service cheese burger late arrival burger meat smelt great breakfast friendly staff cocktail staff could bit retraining customer service enjoyed stay fantastic location would stay,2
Agoda,618581739,"even your agoda vip there was no special treatment no early check in.
long queue for check in.
swimming pool is small.
no freezer
no bath tab 
city view is not as nice in 5th floor
no silk comforter
no sturdy  table for luggage
 
 ",4.8,2023-03-21T05:28:00+07:00,0.35,seda_ayala_center_cebu,even agoda vip special treatment early check long queue check swimming pool small freezer bath tab city view nice th floor silk comforter sturdy table luggage,1
Agoda,614679062,"Everything good except housekeeping 
 
 ",8.8,2023-03-18T11:14:00+07:00,0.8500000000000001,seda_ayala_center_cebu,,2
Agoda,614240294,"Awesome stay! Would definitely come back!
 
 ",10.0,2023-03-18T03:32:00+07:00,1.0,seda_ayala_center_cebu,,2
Agoda,613207437,"Clean, helpful staff and an excellent location in doing business.
 
 ",10.0,2023-03-17T03:28:00+07:00,1.0,seda_ayala_center_cebu,clean helpful staff excellent location business,2
Agoda,609131292,"it is a good location for people who are on the go
 
 ",10.0,2023-03-14T12:57:00+07:00,1.0,seda_ayala_center_cebu,good location people go,2
Agoda,608561696,"All good!
 
 ",10.0,2023-03-13T09:30:00+07:00,1.0,seda_ayala_center_cebu,,2
Agoda,608869520,"Lovely hotel, clean, great location & staff has very good customer service. Would love to come back again
 
 ",8.4,2023-03-13T06:04:00+07:00,0.8,seda_ayala_center_cebu,lovely hotel clean great location staff good customer service would love come back,2
Agoda,607591164,"Great food and staff and next to mall . 
 
 ",10.0,2023-03-12T08:04:00+07:00,1.0,seda_ayala_center_cebu,,2
Agoda,606917845,"Positive: room size, location, cleanliness, safety, lounge for club room

Negative: shower water not warm enough, no available room at 5pm upon check in. 
 
 ",8.0,2023-03-11T08:03:00+07:00,0.75,seda_ayala_center_cebu,positive room size location cleanliness safety lounge club room negative shower water warm enough available room pm upon check,2
Agoda,605822755,"We have a wonderful stay at Seda Ayala Center Cebu. Staff are great, food was delicious, room was super clean and beds are comfy 😍. Thank you Seda... 
 
 ",10.0,2023-03-11T01:57:00+07:00,1.0,seda_ayala_center_cebu,wonderful stay seda ayala center cebu staff great food delicious room super clean bed comfy thank seda,2
Agoda,604928727,"Amazing Stay!
 
 ",10.0,2023-03-10T06:19:00+07:00,1.0,seda_ayala_center_cebu,,2
Agoda,604529958,"Conveniently located in Ayala Center close to businesses and nice restaurants and mall. The hotel is very clean and probably the best Seda Hotel we have stayed at. Service is 5⭐️

 
 ",10.0,2023-03-09T02:10:00+07:00,1.0,seda_ayala_center_cebu,conveniently located ayala center close business nice restaurant mall hotel clean probably best seda hotel stayed service,2
Agoda,603473115,"Old Marriott hotel replaced to this hotel . Connected to the mall
Which is very nice 
 
 ",8.0,2023-03-08T12:02:00+07:00,0.75,seda_ayala_center_cebu,old marriott hotel replaced hotel connected mall nice,2
Agoda,604197224,"Good location,
Shower poor
 
 ",8.8,2023-03-08T11:26:00+07:00,0.8500000000000001,seda_ayala_center_cebu,,2
Agoda,602814807,"A warm welcome was given as we enter the hotel. They have the best staff we could ever wish for. Room is also super even though we don't have the best view outside our window as we were just in the 3rd floor. Though the view doesn't really matter to us as long as the room is clean and and all appliances are working fine. Thank you so much! 
 
 ",10.0,2023-03-07T01:49:00+07:00,1.0,seda_ayala_center_cebu,warm welcome given enter hotel best staff could ever wish room also super even though dont best view outside window rd floor though view doesnt really matter u long room clean appliance working fine thank much,2
Agoda,602738632,"Had a short work trip to Cebu. We came in quite early due to our morning flight and unfortunately they had no available room yet as the hotel is fully booked. They did get me my room by 1130 though, so that is appreciated.

Room was large, clean and well appointed. Staff is fantastic from front desk to bellhops. Breakfast buffet was good as well. 

All in all an excellent stay.
 
 ",9.2,2023-03-06T12:20:00+07:00,0.8999999999999999,seda_ayala_center_cebu,short work trip cebu came quite early due morning flight unfortunately available room yet hotel fully booked get room though appreciated room large clean well appointed staff fantastic front desk bellhop breakfast buffet good well excellent stay,2
Agoda,602706414,"Very convenient location, just a few steps from the Ayala Mall. There’s no need to cross a street or even commute to go to the Mall.  And centrally located in the City Of Cebu, everything is near the hotel: restaurants, bars & even a few tourist attractions. With world class facilities. With amiable & friendly staff. Perfect hotel to wind & relax in Cebu City. 
 
 ",9.2,2023-03-06T08:53:00+07:00,0.8999999999999999,seda_ayala_center_cebu,convenient location step ayala mall there need cross street even commute go mall centrally located city cebu everything near hotel restaurant bar even tourist attraction world class facility amiable friendly staff perfect hotel wind relax cebu city,2
Agoda,602663442,"Staff, location, and amenities were great. The internet did cut off and on lots of times but we managed ok. 
 
 ",10.0,2023-03-06T02:04:00+07:00,1.0,seda_ayala_center_cebu,staff location amenity great internet cut lot time managed ok,2
Agoda,602397805,"Very convenient. Hotel is literally beside Ayala mall and to other business places. Breakfast buffet is ok - not much to choose but ok.
 
 ",8.8,2023-03-05T08:38:00+07:00,0.8500000000000001,seda_ayala_center_cebu,convenient hotel literally beside ayala mall business place breakfast buffet ok much choose ok,2
Agoda,602395587,"If you are looking for perfect location for comfort and close to all the shops, Seda Ayala is the right hotel to choose
 
 ",10.0,2023-03-05T08:08:00+07:00,1.0,seda_ayala_center_cebu,looking perfect location comfort close shop seda ayala right hotel choose,2
Agoda,602381773,"Stay was so awesome.
 
 ",10.0,2023-03-05T03:59:00+07:00,1.0,seda_ayala_center_cebu,,2
Agoda,602371691,"My stay in this hotel is very satisfactory: 
 
 ",8.4,2023-03-04T11:47:00+07:00,0.8,seda_ayala_center_cebu,,2
Agoda,602185179,"place is nice and  clean. accessible too
 
 ",8.0,2023-03-04T03:04:00+07:00,0.75,seda_ayala_center_cebu,,2
Agoda,601514898,"I would definitely come back to this hotel for its location being next to a mall, tasty breakfast. 
 We did find a bug and the hotel gym was rather disappointing.. 
but  on our last day as we were hopping into the taxi to the airport , the hotel guard handed us a piece of paper which had the taxis plate number, taxi company destination and the time.  This little piece of paper made me fall in love with the Philippines all over again !!! 
 
 ",10.0,2023-03-02T09:54:00+07:00,1.0,seda_ayala_center_cebu,would definitely come back hotel location next mall tasty breakfast find bug hotel gym rather disappointing last day hopping taxi airport hotel guard handed u piece paper taxi plate number taxi company destination time little piece paper made fall love philippine,2
Agoda,600972606,"Very accommodating,  fast, and reliable service. A friendly staff and a pleasant place to stay with my family. Thank you and keep up the good work.
 
 ",10.0,2023-02-27T11:30:00+07:00,1.0,seda_ayala_center_cebu,accommodating fast reliable service friendly staff pleasant place stay family thank keep good work,2
Agoda,600759043,"Always love to stay at this hotel. I like it when the staff make way for your convenience. Friendly housekeeping staff. Free parking. A couple of minutes walk to the mall.
 
 ",10.0,2023-02-27T02:08:00+07:00,1.0,seda_ayala_center_cebu,always love stay hotel like staff make way convenience friendly housekeeping staff free parking couple minute walk mall,2
