Review Provider,Review ID,Review Content,Review Score,Review Time,normalized_score,Hotel,cleaned_content,label
,911574603,"First and foremost - The staff of Seda - from security to reception to housekeeping to maintenance to the Misto Restaurant have all been exceptional!  Smiles and greetings everyday!

We stayed long term (two weeks) - I normally try to book directly with hotels, but the Seda price was $2,976 (AUD) - so I ended up booking through Agoda for $2,283 (AUD) - a saving of $700 (AUD).

We stayed in room 429 - with a view of the street front of the hotel just over the roof line of the entry.  (Last year in November we stayed for 3 nights on the 6th floor with a view of the Ayala Center Terraces and it was a great view especially since Ayala was decorated for Christmas).  It would have been nice to have a room on the Ayala side since we were staying so long, but probably ended up on the other side since we booked through Agoda.

The room was nicely decorated and the bed comfortable - the pillows were so-so.  Linens and towels were nice.  The TV channel list was not correct - and missing quite a few channels (I noticed this last year, but no updates were done to the list).  I scrolled through all channels, updated the list and provided it to Reception.  There was a sewer smell around the toilet in the bathroom - probably a wax seal gone bad over the years - to which we reported during our stay, but declined the offer of maintenance replacing (or moving rooms) as it wasn't too bad - but I confirmed with Reception when we checked out to have maintenance resolve before they put any other guests in the room.

The fridge (what they refer to as a ""chiller"") was warm - even on the coldest setting.  I reported it to Reception - they sent up maintenance to check.  They tried to tell me that it's only a ""bar fridge chiller"" - but there was no ""mini-bar"" offerings in it  - and since it was not operating correctly (chilling anything less than the room temperature) they replaced it with a proper small fridge since we'd be staying for two weeks and wanted to store drinks and snacks during our stay.  Additionally, maintenance also replaced the A/C filter in the room at my request since it looked like it needed changing.

Housekeeping staff (Grace and Mike) were great!  We didn't need daily service, but we did get towel replacements and fresh water every day.

We dined daily in the Misto Restaurant for the buffet breakfast.  It was nice to see a smiling Sofia (hostess) every morning.  Servers Rhea, Ivy and Ryann were very attentive and were friendly every day. 
Chef Aldie walked around the restaurant greeting guests and sharing special desserts on several of the mornings.
The food selection was really good - but as is with most buffets in the Philippines... The temperature of the food was warm at best - and some items (hash browns/potatoes at the start of line) were always cold.  Lower temps mean more bacterial issues with food.
** Special note for guests - get down there early (before 7:30am especially on the weekends) to get inside seating otherwise you'll be in the overflow area in the lobby or outside on the terrace overlooking the pool.

We got to meet Hayden Kho and his wife Vivian Belo in the lift one morning going down to breakfast.  I didn't know who they were when we entered the lift but my fiance was speechless and starstruck at the same time.

The location is perfect being located next to Ayala Center.  We visited the Metro Grocery store several times to stock our room fridge.  We also dined at Army Navy Burger (awesome ""California Burger"" - just like ""In-Out Burger"" in the USA), Gerry's, Casa Verde, Burger Haus (great German beer on tap) and TGI Fridays).

Pro's
 - Staff - by far just awesome! 
 - Location - Location - Location  
 - Room was nice and comfortable 
 - Morning Buffet selection and Chef Aldie visiting guests tables 
 - Security at every entry - and very friendly

Challenges 
 - Room fridges/""chillers"" - if they are not working properly and cooling items to at least 4c they need to be replaced as they are inefficient and wasting electricity. 
 - TV channel list / channel availability - needs to be updated when changes occur to programming. 
 - Morning Buffet food temperature

Will we stay again? - Absolutely! - We really enjoyed staying here for a second time and look forward to returning.
The staff really make this place shine!",4.0,2023-08-19,0.75,seda_ayala_center_cebu,first foremost staff seda security reception housekeeping maintenance misto restaurant exceptional smile greeting everyday stayed long term two week normally try book directly hotel seda price aud ended booking agoda aud saving aud stayed room view street front hotel roof line entry last year november stayed night th floor view ayala center terrace great view especially since ayala decorated christmas would nice room ayala side since staying long probably ended side since booked agoda room nicely decorated bed comfortable pillow soso linen towel nice tv channel list correct missing quite channel noticed last year update done list scrolled channel updated list provided reception sewer smell around toilet bathroom probably wax seal gone bad year reported stay declined offer maintenance replacing moving room wasnt bad confirmed reception checked maintenance resolve put guest room fridge refer chiller warm even coldest setting reported reception sent maintenance check tried tell bar fridge chiller minibar offering since operating correctly chilling anything le room temperature replaced proper small fridge since wed staying two week wanted store drink snack stay additionally maintenance also replaced ac filter room request since looked like needed changing housekeeping staff grace mike great didnt need daily service get towel replacement fresh water every day dined daily misto restaurant buffet breakfast nice see smiling sofia hostess every morning server rhea ivy ryann attentive friendly every day chef aldie walked around restaurant greeting guest sharing special dessert several morning food selection really good buffet philippine temperature food warm best item hash brownspotatoes start line always cold lower temp mean bacterial issue food special note guest get early especially weekend get inside seating otherwise youll overflow area lobby outside terrace overlooking pool got meet hayden kho wife vivian belo lift one morning going breakfast didnt know entered lift fiance speechless starstruck time location perfect located next ayala center visited metro grocery store several time stock room fridge also dined army navy burger awesome california burger like inout burger usa gerrys casa verde burger haus great german beer tap tgi friday pro staff far awesome location location location room nice comfortable morning buffet selection chef aldie visiting guest table security every entry friendly challenge room fridgeschillers working properly cooling item least c need replaced inefficient wasting electricity tv channel list channel availability need updated change occur programming morning buffet food temperature stay absolutely really enjoyed staying second time look forward returning staff really make place shine,2
,909159603,"This was our first stay at the Seda brand, although we have stayed at this location when it was a Marriott.  We were quite  impressed with the quality of the rooms, the polite and very attentive staff, food, value, and overall atmosphere of this excellent hotel.  The hotel's proximity to an excellent mall, variety of food offerings, and atmosphere, were all excellent.  We look forward to our return trips.",5.0,2023-08-09,1.0,seda_ayala_center_cebu,first stay seda brand although stayed location marriott quite impressed quality room polite attentive staff food value overall atmosphere excellent hotel hotel proximity excellent mall variety food offering atmosphere excellent look forward return trip,2
,908926150,"The service is great - efficient staff esp at the buffet room, in particular staff named Ivy and Angeline!  Our room is always nicely made up by our cleaners Rafgi and Julu!
Food needs improvement though.   
The congee is inconsistent, sometimes watery n sometimes thick.  There need to be a better toaster for breads that couldn't fit on slice bread slots. Attended the Seafood Friday, the service catering on servicing the lobster  was not only slow, it was chaotic such that our individual lobsters got mixed up at our table, some of which we didn't even order!  And the lobsters were not fresh - they were mushy rather than tangy.  Orange juice was too watered down. ",4.0,2023-08-08,0.75,seda_ayala_center_cebu,service great efficient staff esp buffet room particular staff named ivy angeline room always nicely made cleaner rafgi julu food need improvement though congee inconsistent sometimes watery n sometimes thick need better toaster bread couldnt fit slice bread slot attended seafood friday service catering servicing lobster slow chaotic individual lobster got mixed table didnt even order lobster fresh mushy rather tangy orange juice watered,2
,908671447,"Really nice hotel. The breakfast and dinner buffets were amazing, especially the seafood buffet on Friday’s.
Special mention to Angelica on the day shift in the restaurant. Very friendly and made me feel very welcome. ",5.0,2023-08-07,1.0,seda_ayala_center_cebu,really nice hotel breakfast dinner buffet amazing especially seafood buffet friday special mention angelica day shift restaurant friendly made feel welcome,2
,907539739,"It was so nice as a hotel located next to Ayala Mall, shopping and dining were so convenient, and the hotel breakfast was satisfactory. I was impressed by the fact that the staff were friendly and tried to help.",5.0,2023-08-03,1.0,seda_ayala_center_cebu,nice hotel located next ayala mall shopping dining convenient hotel breakfast satisfactory impressed fact staff friendly tried help,2
,907525298,I have always love seda. Theres no question to it. I know i always get a good sleep at seda. Clean sheets and towels.  The staff were very courteous and friendly. Although some needs to greet and acknowledge the guest at all time. For the past two weeks of my trip i have been to few hotels and greeting a guest on the hallways or anywhere in the establishment is a plus.  ,4.0,2023-08-03,0.75,seda_ayala_center_cebu,always love seda there question know always get good sleep seda clean sheet towel staff courteous friendly although need greet acknowledge guest time past two week trip hotel greeting guest hallway anywhere establishment plus,2
,906915018,"As always when we travel to the Philippines we stay at Seda Ayala Center Cebu. We stayed in a Junior Suite, which had a small anteroom with a sofa, table, closet and TV. I knew this suite and everything was as expected. When making the reservation I had ordered an extra bed, this was shown on the reservation with a one-time 2,000 peso. In the hotel I should pay this amount then daily, we have then waived it and used the sofa as a sleeping accommodation.

The room cleaning was sometimes very slow, we have made with the employee partly a cleaning appointment, which was then also times not kept. We also had to call after the room cleaning because the soap or toilet paper was not refilled. 

We had booked the room with breakfast, the rich breakfast internationally oriented and everyone should find something for his taste. Unfortunately, you had to regularly queue and wait until a place has become free. This was not so in previous years, one was then if necessary placed in the lobby, which dan rather reminded of a company canteen. We preferred to have breakfast outside on the terrace. When it rained, however, the water gradually penetrated the ceiling and breakfast was over. It seems that during the renovation a few years ago, the roofs over the terraces were not repaired, one has the feeling that the hotel has saved at the wrong end.

As a conclusion I can say that I will stay again in the hotel, it is still very good standard. However, one has the feeling that as a foreigner married to a Filipina, you have a somewhat heavier stand overall, which you become aware of through many little things, but which can also only be coincidental. ",4.0,2023-07-31,0.75,seda_ayala_center_cebu,always travel philippine stay seda ayala center cebu stayed junior suite small anteroom sofa table closet tv knew suite everything expected making reservation ordered extra bed shown reservation onetime peso hotel pay amount daily waived used sofa sleeping accommodation room cleaning sometimes slow made employee partly cleaning appointment also time kept also call room cleaning soap toilet paper refilled booked room breakfast rich breakfast internationally oriented everyone find something taste unfortunately regularly queue wait place become free previous year one necessary placed lobby dan rather reminded company canteen preferred breakfast outside terrace rained however water gradually penetrated ceiling breakfast seems renovation year ago roof terrace repaired one feeling hotel saved wrong end conclusion say stay hotel still good standard however one feeling foreigner married filipina somewhat heavier stand overall become aware many little thing also coincidental,2
,906422884,"Location is superb. Staff are great. Easy to deal with and guests were well taken care of with simple requests,even there are lots of guests during our  stay.we will consider to stay here again.i just hope the lobby will ne more modern feels  just like here in manila.pls replace the  bathroom towels with new one.i think its too old to use.  ",4.0,2023-07-29,0.75,seda_ayala_center_cebu,location superb staff great easy deal guest well taken care simple requestseven lot guest staywe consider stay againi hope lobby ne modern feel like manilapls replace bathroom towel new onei think old use,2
,906334617,"The location of this hotel makes it great for travelers, who do not want to travel far to find decent food. The DJ near the pool every evening add some ambience. The employees are always kind in engaging with visitors. The breakfast is better than most the hotel is getting Older but it’s still comfortable and clean generally.",4.0,2023-07-28,0.75,seda_ayala_center_cebu,location hotel make great traveler want travel far find decent food dj near pool every evening add ambience employee always kind engaging visitor breakfast better hotel getting older still comfortable clean generally,2
,905599190,"I have been staying at this property for many years now even before it became SEDA. It is a very convenient place being just beside a mall and highly secure, the kind most travelers are looking for in a hotel.",4.0,2023-07-25,0.75,seda_ayala_center_cebu,staying property many year even became seda convenient place beside mall highly secure kind traveler looking hotel,2
,904684695,"Overall my review is great,  room is always made by Ericson (our attendant) my check in was prompt thru the help of Stephen.  The whole housekeeping team under the supervision of Darvey Demicillo was excellent.  I can't thank everybody enough, it made my stay a very pleasant 3 days.",4.0,2023-07-22,0.75,seda_ayala_center_cebu,overall review great room always made ericson attendant check prompt thru help stephen whole housekeeping team supervision darvey demicillo excellent cant thank everybody enough made stay pleasant day,2
,904084449,One of the better Seda Hotels. Very clean and comfortable rooms. The couch in our room is soft and the pillows are very soft. Quality and variety of breakfast food is also excellent. Would definitely recommend this hotel to friends.,5.0,2023-07-19,1.0,seda_ayala_center_cebu,one better seda hotel clean comfortable room couch room soft pillow soft quality variety breakfast food also excellent would definitely recommend hotel friend,2
,903937890,"What can I say about Seda Ayala Center Cebu and Seda IT Bloc. The staff went above and beyond to make our stay safe and stress free. We've enjoyed everyone hospitality and the securities made us feel valued. The people in Seda are beautiful and kind. I would recommend anyone to consider staying here. It has all the amenities since the mall is right next door. Thank you, Seda for the warm and amazing stay! ",5.0,2023-07-18,1.0,seda_ayala_center_cebu,say seda ayala center cebu seda bloc staff went beyond make stay safe stress free weve enjoyed everyone hospitality security made u feel valued people seda beautiful kind would recommend anyone consider staying amenity since mall right next door thank seda warm amazing stay,2
,903806987,"The junior is very basic and bland. No iron and bathroom door won’t close. The toiletries provided were too tiny. The closet had no iron and was open with no cover. It did not look like a four star hotel room. 
The staff were very courteous and nice! 
",3.0,2023-07-17,0.5,seda_ayala_center_cebu,junior basic bland iron bathroom door wont close toiletry provided tiny closet iron open cover look like four star hotel room staff courteous nice,1
,903789250,"As much as I wanted to give a perfect score, I decided not to because I believe that there’s always a room for improvement.  This used to Marriot hotel and I stayed once before with my husband. I tried to refresh my memory on comparing everything. But i guess, there’s only a couple of things that’s make it different. Anyway, I would like to applaud all the staff for doing their job so well. They are very friendly, accommodating, hospitable, courteous, respectful and very warm. The location of this hotel is very accessible and it’s very safe. The buffet was really good. Overall, this hotel is a great place to stay. Truly, great staff and great service…",4.0,2023-07-17,0.75,seda_ayala_center_cebu,much wanted give perfect score decided believe there always room improvement used marriot hotel stayed husband tried refresh memory comparing everything guess there couple thing thats make different anyway would like applaud staff job well friendly accommodating hospitable courteous respectful warm location hotel accessible safe buffet really good overall hotel great place stay truly great staff great service,2
,903148206,"Not the hotels fault but we stayed in the gumamela room for several hours due to availability, but when we were checked in everything was perfect, the staff was friendly and accommodating, keep it up guys!! Y’all are the best!!",5.0,2023-07-15,1.0,seda_ayala_center_cebu,hotel fault stayed gumamela room several hour due availability checked everything perfect staff friendly accommodating keep guy yall best,2
,902945055,Our experience in SEDA Ayala Cebu is very good. The staff are very welcoming and helpful. The room is very comfortable and connectivity is fast. The location of the hotel is just right for us to experience Cebu City. The overall experience is very satisfactory. ,4.0,2023-07-14,0.75,seda_ayala_center_cebu,experience seda ayala cebu good staff welcoming helpful room comfortable connectivity fast location hotel right u experience cebu city overall experience satisfactory,2
,902567869,"The staff  were wonderful and attentive and  the location of the hotel is excellent.  BUT one negative aspect I experienced   and observed is :  NO DRESS  CODE  posted in the dining room.  As a returning guest, I have seen a male hotel guest coming in for breakfast (July 12, 2023 )  wearing sleeveless T-Shirt exposing his hairy  underarms when grabbing for food served during breakfast buffet hours and this compromises sanitation and safety of the food served to  other guest.  Plus, I also saw a hotel guest ( teenager)  today (July 13, 2023) wearing pajamas and having her breakfast.  It appears that it is an extension of her home living room.  For a top rated hotel, management really needs to address this issue for the safety and sanitation of other guess in the hotel.   Will I be back as a guest?  It remains to be seen! ",3.0,2023-07-12,0.5,seda_ayala_center_cebu,staff wonderful attentive location hotel excellent one negative aspect experienced observed dress code posted dining room returning guest seen male hotel guest coming breakfast july wearing sleeveless tshirt exposing hairy underarms grabbing food served breakfast buffet hour compromise sanitation safety food served guest plus also saw hotel guest teenager today july wearing pajama breakfast appears extension home living room top rated hotel management really need address issue safety sanitation guess hotel back guest remains seen,1
,902086517,"I stayed for overnight stay. The check in process was smooth except that during the time of check in, there were a lot of guest an only 2 receptionist are catering the check in process. I was given a good room but quite far from the elevator. The request for bigger bed was granted.. Perfect locations when going to ayala malls and nearby places in the business district. Food is great. the Lobby is perfect to stay with. Wifi is good.  The staff were helpful.",4.0,2023-07-11,0.75,seda_ayala_center_cebu,stayed overnight stay check process smooth except time check lot guest receptionist catering check process given good room quite far elevator request bigger bed granted perfect location going ayala mall nearby place business district food great lobby perfect stay wifi good staff helpful,2
,901145485,"This is a great hotel!  The location is perfect-a short 1 minute walk to the mall.  It is close to everything: parks, laundromats, gyms, restaurants, and shopping!

 The food is fantastic!  The staff is accommodating and very professional. Even when overwhelmed with many customers, the staff is outsanding.

 The hotel staff is helpful-thanks again Chad!  They are helpful with everything you can think of: room service, luggage, directions, even advice!",5.0,2023-07-07,1.0,seda_ayala_center_cebu,great hotel location perfecta short minute walk mall close everything park laundromat gym restaurant shopping food fantastic staff accommodating professional even overwhelmed many customer staff outsanding hotel staff helpfulthanks chad helpful everything think room service luggage direction even advice,2
,900486866,"Sharing a the sense of urgency of the Hotels Emergency Response team that seems normal in other countries but experienced here in Seda Cebu.

Incident / emergency situation :

I called in if they had a house doctor or on call doctor. 

From the phone call acknowledging the emergency for an in house doctor required , 2 minutes later doctor was on the phone for consultation on other allergies I had and information for the hospital I was being brought to for convenience. A+++++ for immediate action on this. 

They took me on a Wheelchair from the room, and access back of house elevator to the lobby with their service vehicle ready to bring me to the nearest hospital as the ambulance Will take time, a decision they made on spot , they had a full emergency kit on standby with them. 

The front office had a security personnel also with me to  check on me while they paid  the bills and bught the  medicine in the hospital pharmacy 🌟 🌟 🌟 🌟 🌟 

They also updated my wife how my condition was . A+++++ extra professional concern.

Their team waited  and brought me back to the hotel, similar to how they pulled me out, radio on the way and updated the need for the wheelchair, as I went to the lobby at pass 1am, the supervisor asked how I was, the same one that finished her shift responsibility at 11pm, inspite of me appreciation and thanking them, team, she confidently said they finish what they start usually and they are sincerely worried for each guest, emengency or not.

Sincere services and handling the situation, I give them 5 stars. ",5.0,2023-07-04,1.0,seda_ayala_center_cebu,sharing sense urgency hotel emergency response team seems normal country experienced seda cebu incident emergency situation called house doctor call doctor phone call acknowledging emergency house doctor required minute later doctor phone consultation allergy information hospital brought convenience immediate action took wheelchair room access back house elevator lobby service vehicle ready bring nearest hospital ambulance take time decision made spot full emergency kit standby front office security personnel also check paid bill bught medicine hospital pharmacy also updated wife condition extra professional concern team waited brought back hotel similar pulled radio way updated need wheelchair went lobby pas supervisor asked one finished shift responsibility pm inspite appreciation thanking team confidently said finish start usually sincerely worried guest emengency sincere service handling situation give star,2
,900086749,"I usually stay at Seda in my business trips to Cebu. Good location, excellent service, good amenities, very clean. Staff very accommodating. Rooms are on the small side if traveling with family. Closet space is very limited. ",4.0,2023-07-03,0.75,seda_ayala_center_cebu,usually stay seda business trip cebu good location excellent service good amenity clean staff accommodating room small side traveling family closet space limited,2
,899788391,I always stay in Seda when I visit Cebu but this time - December 2022 the place was a bit sad. The parking lot smelled like piss and the walkway towards ayala was not kept clean. The buffet breakfast also had a lot of waiting as they could not accommodate . I suggest you schedule the timings of each floor to help guest plan their time rather than waiting for 30 mins in the lobby to be seated for breakfast.,3.0,2023-07-02,0.5,seda_ayala_center_cebu,always stay seda visit cebu time december place bit sad parking lot smelled like piss walkway towards ayala kept clean buffet breakfast also lot waiting could accommodate suggest schedule timing floor help guest plan time rather waiting min lobby seated breakfast,1
